id,parent_id,post_id,subreddit,tone,text,created_utc,score,author,scraped_utc,query_used,query_category
mqj22p5,t3_1kega3o,1kega3o,collapse,skeptical,"> The attack was reportedly triggered by a deepfake audio recording of a Druze cleric insulting the prophet Muhammad, spread on social media. 

Suddenly, EVERY SINGLE MINORITIES ON EARTH are now in danger, as all it takes is one deepfake audio of their leader shitting on majorities for the extremists portion of the majorities to perform and justify massacres on them.",1746363430.0,39,Nazirul_Takashi,1746700494.142942,climate science,scientific
mqj765q,t3_1kega3o,1kega3o,collapse,skeptical,Thanks for all you do 💙,1746365374.0,25,WernerHerzogWasRight,1746700494.1446242,climate science,scientific
mqjup2g,t3_1kega3o,1kega3o,collapse,skeptical,Thank you for your work on this.,1746373057.0,16,PushyTom,1746700494.14537,climate science,scientific
mql4qrl,t3_1kega3o,1kega3o,collapse,skeptical,"Thanks for the compilation, appreciated as always. 

Enshittification is undoubtedly happening, within and around us. Out not with a bang, but with a whimper.",1746387170.0,10,Old_galadriell,1746700494.146074,climate science,scientific
mr3ocv6,t3_1kega3o,1kega3o,collapse,skeptical,"On the last section, the paragraph about bees hit home. I've seen exactly one bee this spring. And that was a dead one on a snow bank in March. 

What makes it even worse, my neighbor has (had) ten hives on his property. All dead.",1746639618.0,2,znirmik,1746700494.147085,climate science,scientific
mqyl8y1,t3_1kega3o,1kega3o,collapse,skeptical,"As always, great job! Do you use AI to summarize? Wondered about all the EM dashes sprinkled throughout, which are typically a telltale sign ",1746567912.0,1,CampfireHeadphase,1746700494.14797,climate science,scientific
mqmmtiz,t3_1kega3o,1kega3o,collapse,skeptical,Germany banned the Opposition Party. Some Democracy.,1746405205.0,-9,Substantial_Impact69,1746700494.148641,climate science,scientific
mqcftfz,t3_1kdp0tf,1kdp0tf,collapse,skeptical,"Ok I gotta write a submission statement. Uh,

Submission Statement:

Just tried to reason my way around what fucking dork-ass losers are destroying the world. The losers and the one lucky sub discipline of computer science that is worth like a literal trillion dollars right now. Why are they so lame? It baffles the mind, truly they live in some alternate reality made of ketamine and hiring a big 4 consultancy to wipe your ass.

edit: So ya know just normal grieving over the loss of the future and worrying about if I hit the length requirement of this before going to sleepy sleep. Uh thank you if you made it this far!",1746264844.0,2,freedcreativity,1746700495.631619,climate science,scientific
