"id","parent_id","post_id","subreddit","tone","text","created_utc","score","author","scraped_utc","query_used","query_category"
"emncgqz","t3_blcb7i","blcb7i","climatechange","action-oriented","There are some studies looking at seeding oceans with iron to increase plankton and absorb CO2. 

&#x200B;

 [https://en.wikipedia.org/wiki/Iron\_fertilization](https://en.wikipedia.org/wiki/Iron_fertilization) 

Its a pretty grey area in terms of efficacy and unexpected impacts.","2019-05-06 14:23:53","4","[deleted]","1747908231.690526","carbon capture","manual"
"emnbjuo","t3_blcb7i","blcb7i","climatechange","action-oriented","I’m not sure about mechanical carbon capture but in water but I know a lot of people are funding seaweed farms. [Greenwave](https://www.greenwave.org/) being one example","2019-05-06 14:13:32","2","Harpo1999","1747908231.6943738","carbon capture","manual"
"emosjtv","t3_blcb7i","blcb7i","climatechange","action-oriented","Ocean water is already a huge carbon sink. Co2 sits in the atmosphere for about 120 years, and the carbon falls back to Earth. Most of the earth is ocean.","2019-05-06 23:01:31","2","joyhammerpants","1747908231.696707","carbon capture","manual"
