id,subreddit,tone,title,text,created_utc,score,num_comments,upvote_ratio,url,is_self,author,scraped_utc,query_used,query_category,source_file,entry_type,parent_id,post_id,type,created_date,scraped_date,cleaned_text,content_words,climate_terms,climate_term_count,twitter_compatible
d35n02i,collapse,skeptical,,All of the above.,2016-05-14 21:22:46,1,,,,,ThunderPreacha,1747920632.923372,climate alarmism,manual,reddit_comments_2016_05.csv,comment,t3_4jbigy,4jbigy,comment,,2025-05-22 13:30:32.923372030,all of the above.,[],[],0,True
csmll9n,collapse,skeptical,,It will play out over you lifetime,2015-06-29 17:51:17,2,,,,,Dyslexicinsomniac,1747902675.961332,climate alarmism,manual,reddit_comments_2015_06.csv,comment,t3_3biw92,3biw92,comment,,2025-05-22 08:31:15.961332083,it will play out over you lifetime,"['play', 'lifetime']",[],0,True
cp96abg,environment,emotional,,How is he now?,2015-03-09 15:25:51,1,,,,,[deleted],1747895843.204714,climate alarmism,manual,reddit_comments_2015_03.csv,comment,t3_2s9z7i,2s9z7i,comment,,2025-05-22 06:37:23.204714060,how is he now?,[],[],0,True
ey54m1p,collapse,skeptical,,This will be forgotten in a week,2019-08-26 12:13:26,3,,,,,ATOMIC_ACE_PUGG,1747913362.430498,CO2 is good,manual,reddit_comments_2019_08.csv,comment,t3_cvfrp0,cvfrp0,comment,,2025-05-22 11:29:22.430497885,this will be forgotten in a week,"['forgotten', 'week']",[],0,True
dbf23od,climate,scientific,,[This should do it](https://www.youtube.com/watch?v=oqWfN3Zl8AM&t=210s),2016-12-20 09:59:59,2,,,,,mulgs,1747881296.119044,CO2 is good,manual,reddit_comments_2016_12.csv,comment,t3_5j9rkq,5j9rkq,comment,,2025-05-22 02:34:56.119044065,this should do it,[],[],0,True
dar19n8,environment,emotional,,I'll be there.,2016-12-03 22:19:26,44,,,,,Frilly_pom-pom,1747881318.9640856,CO2 is good,manual,reddit_comments_2016_12.csv,comment,t3_5gb9wg,5gb9wg,comment,,2025-05-22 02:35:18.964085579,i ll be there.,[],[],0,True
dard5ck,environment,emotional,,I'm there.,2016-12-04 03:20:52,2,,,,,whoisjavier,1747881318.9885972,CO2 is good,manual,reddit_comments_2016_12.csv,comment,t3_5gb9wg,5gb9wg,comment,,2025-05-22 02:35:18.988597155,i m there.,[],[],0,True
d3rdxzx,collapse,skeptical,,This is why we will have cannibalism,2016-06-01 05:11:33,10,,,,,[deleted],1747876440.6056914,CO2 is good,manual,reddit_comments_2016_06.csv,comment,t3_4lza8q,4lza8q,comment,,2025-05-22 01:14:00.605691433,this is why we will have cannibalism,['cannibalism'],[],0,True
d8694d7,collapse,skeptical,,I'm just here for the cannibalism.,2016-09-29 00:03:42,19,,,,,MyMomSaysImKeen,1747879034.1697278,CO2 is good,manual,reddit_comments_2016_09.csv,comment,t3_54yoz7,54yoz7,comment,,2025-05-22 01:57:14.169727802,i m just here for the cannibalism.,['cannibalism'],[],0,True
csmll9n,collapse,skeptical,,It will play out over you lifetime,2015-06-29 17:51:17,2,,,,,Dyslexicinsomniac,1747865431.608469,CO2 is good,manual,reddit_comments_2015_06.csv,comment,t3_3biw92,3biw92,comment,,2025-05-21 22:10:31.608469009,it will play out over you lifetime,"['play', 'lifetime']",[],0,True
eseaaqn,collapse,skeptical,,You are SO full of yourself,2019-06-30 10:17:02,-4,,,,,[deleted],1747911610.0036626,CO2 is good,manual,reddit_comments_2019_06.csv,comment,t3_c71yg0,c71yg0,comment,,2025-05-22 11:00:10.003662586,you are so full of yourself,['full'],[],0,True
et79yfo,climatechange,action-oriented,," [https://www.globalcarbonproject.org/carbonbudget/18/presentation.htm](https://www.globalcarbonproject.org/carbonbudget/18/presentation.htm) 

Some of what you are looking for will be here. But its global not national.",2019-07-07 19:26:42,2,,,,,[deleted],1747911891.543651,CO2 is good,manual,reddit_comments_2019_07.csv,comment,t3_caaebk,caaebk,comment,,2025-05-22 11:04:51.543651104,some of what you are looking for will be here. but its global not national.,"['looking', 'global', 'national']",['global'],1,True
ehx87ch,collapse,skeptical,,So do you think it's inevitable or not?,2019-03-06 15:48:55,2,,,,,climate_throwaway234,1747909153.5204754,CO2 is good,manual,reddit_comments_2019_03.csv,comment,t3_ay080w,ay080w,comment,,2025-05-22 10:19:13.520475388,so do you think it s inevitable or not?,"['think', 'inevitable']",[],0,True
dar19n8,environment,emotional,,I'll be there.,2016-12-03 22:19:26,45,,,,,Frilly_pom-pom,1747831392.681298,climate protest,manual,reddit_comments_2016_12.csv,comment,t3_5gb9wg,5gb9wg,comment,,2025-05-21 12:43:12.681298018,i ll be there.,[],[],0,True
dard5ck,environment,emotional,,I'm there.,2016-12-04 03:20:52,2,,,,,whoisjavier,1747831392.699454,climate protest,manual,reddit_comments_2016_12.csv,comment,t3_5gb9wg,5gb9wg,comment,,2025-05-21 12:43:12.699454069,i m there.,[],[],0,True
dlw3ne6,science,scientific,,Will you be doing any lectures at TukU while you're there?,2017-08-20 18:51:15,2,,,,,Rex_Digsdale,1747863717.4960043,sea level projections,manual,reddit_comments_2017_08.csv,comment,t3_6uviip,6uviip,comment,,2025-05-21 21:41:57.496004343,will you be doing any lectures at tuku while you re there?,"['lectures', 'tuku']",[],0,True
dar19n8,environment,emotional,,I'll be there.,2016-12-03 22:19:26,45,,,,,Frilly_pom-pom,1747856248.512673,sea level projections,manual,reddit_comments_2016_12.csv,comment,t3_5gb9wg,5gb9wg,comment,,2025-05-21 19:37:28.512672900,i ll be there.,[],[],0,True
dard5ck,environment,emotional,,I'm there.,2016-12-04 03:20:52,2,,,,,whoisjavier,1747856248.5477798,sea level projections,manual,reddit_comments_2016_12.csv,comment,t3_5gb9wg,5gb9wg,comment,,2025-05-21 19:37:28.547779799,i m there.,[],[],0,True
d2tow07,science,scientific,,Are there any instruments out there that would be crucial to your research but that you just can't get your hands on?,2016-05-05 12:17:06,7,,,,,Shredder13,1747850088.7260194,sea level projections,manual,reddit_comments_2016_05.csv,comment,t3_4hzfx2,4hzfx2,comment,,2025-05-21 17:54:48.726019382,are there any instruments out there that would be crucial to your research but that you just can t get your hands on?,"['instruments', 'would', 'crucial', 'research', 'get', 'hands']",[],0,True
ed29syi,sustainability,action-oriented,,thank you for doing this,2019-01-02 05:37:21,2,,,,,[deleted],1747879707.1431754,sea level projections,manual,reddit_comments_2019_01.csv,comment,t3_abicrb,abicrb,comment,,2025-05-22 02:08:27.143175364,thank you for doing this,['thank'],[],0,True
e7r457u,collapse,skeptical,,"[this is for you guys](https://www.youtube.com/watch?v=Ed-5Zzdbx0E).
",2018-10-14 16:01:21,0,,,,,tsoldrin,1747719032.737211,CO2 emissions,scientific,reddit_comments_2018_10.csv,comment,t3_9o26mu,9o26mu,comment,,2025-05-20 05:30:32.737210989,this is for you guys,['guys'],[],0,True
eue0fe9,collapse,skeptical,,What if we add ourselves to the massive die off,2019-07-21 18:02:11,1,,,,,lininkasi,1747818517.804533,climate data,scientific,reddit_comments_2019_07.csv,comment,t3_cfy5wh,cfy5wh,comment,,2025-05-21 09:08:37.804533005,what if we add ourselves to the massive die off,"['add', 'massive', 'die']",[],0,True
ed29syi,sustainability,action-oriented,,thank you for doing this,2019-01-02 05:37:21,2,,,,,[deleted],1747721323.5019069,CO2 emissions,scientific,reddit_comments_2019_01.csv,comment,t3_abicrb,abicrb,comment,,2025-05-20 06:08:43.501906871,thank you for doing this,['thank'],[],0,True
e7jcmwa,climatechange,action-oriented,,Do it you are a hero,2018-10-10 21:14:25,1,,,,,hunoro1,1747901265.822807,renewables now,manual,reddit_comments_2018_10.csv,comment,t3_9mzouo,9mzouo,comment,,2025-05-22 08:07:45.822807074,do it you are a hero,['hero'],[],0,True
e7g7e0j,collapse,skeptical,,There is no plan A,2018-10-09 13:27:00,10,,,,,unsynched,1747902438.480855,renewables now,manual,reddit_comments_2018_10.csv,comment,t3_9mnwte,9mnwte,comment,,2025-05-22 08:27:18.480854988,there is no plan a,['plan'],[],0,True
dvll2fv,collapse,skeptical,,or am i ∴ not there there depending what is is,2018-03-12 22:31:30,1,,,,,TheLegionsOfHell,1747887870.340605,renewables now,manual,reddit_comments_2018_03.csv,comment,t3_83u1el,83u1el,comment,,2025-05-22 04:24:30.340605021,or am i not there there depending what is is,['depending'],[],0,True
csmll9n,collapse,skeptical,,It will play out over you lifetime,2015-06-29 17:51:17,2,,,,,Dyslexicinsomniac,1747827147.6470668,renewables now,manual,reddit_comments_2015_06.csv,comment,t3_3biw92,3biw92,comment,,2025-05-21 11:32:27.647066832,it will play out over you lifetime,"['play', 'lifetime']",[],0,True
eljsopu,collapse,skeptical,,this is our lament,2019-04-23 04:06:01,8,,,,,queenmachine7753,1747913385.2636778,renewables now,manual,reddit_comments_2019_04.csv,comment,t3_bg947z,bg947z,comment,,2025-05-22 11:29:45.263677835,this is our lament,['lament'],[],0,True
ed29syi,sustainability,action-oriented,,thank you for doing this,2019-01-02 05:37:21,2,,,,,[deleted],1747908829.696267,renewables now,manual,reddit_comments_2019_01.csv,comment,t3_abicrb,abicrb,comment,,2025-05-22 10:13:49.696266890,thank you for doing this,['thank'],[],0,True
ey304cz,NoStupidQuestions,unknown,,No and no.,2019-08-25 16:56:26,1,,,,,[deleted],1747929397.4801211,climate crisis,manual,reddit_comments_2019_08.csv,comment,t3_cvaxo8,cvaxo8,comment,,2025-05-22 15:56:37.480121136,no and no.,[],[],0,True
e2k5zby,environment,emotional,,It's over.,2018-07-17 19:33:05,16,,,,,[deleted],1747910181.945224,climate crisis,manual,reddit_comments_2018_07.csv,comment,t3_8zlf7b,8zlf7b,comment,,2025-05-22 10:36:21.945224047,it s over.,[],[],0,True
e2lpyeg,environment,emotional,,This is largely why I will not be having children.,2018-07-18 14:03:20,7,,,,,workymcwork,1747910181.965523,climate crisis,manual,reddit_comments_2018_07.csv,comment,t3_8zlf7b,8zlf7b,comment,,2025-05-22 10:36:21.965523005,this is largely why i will not be having children.,"['largely', 'children']",[],0,True
ecwiunr,NoStupidQuestions,unknown,,"Because its not real


r/s",2018-12-30 22:36:20,-1,,,,,dowN_thE_r4bbiT_holE,1747917802.437614,climate crisis,manual,reddit_comments_2018_12.csv,comment,t3_ab0nkd,ab0nkd,comment,,2025-05-22 12:43:22.437613964,because its not real r s,['real'],[],0,True
d9snlp9,environment,emotional,,THIS IS SO IMPORTANT ,2016-11-09 10:36:03,2,,,,,xFuimus,1747881822.475065,climate crisis,manual,reddit_comments_2016_11.csv,comment,t3_5byi0k,5byi0k,comment,,2025-05-22 02:43:42.475064993,this is so important,['important'],[],0,True
esj4vbs,zerowaste,unknown,,">Hi [/r/LateStageCapitalism](https://www.reddit.com/r/LateStageCapitalism/),

I'm out.",2019-07-02 00:07:47,4,,,,,[deleted],1747928277.1465302,climate crisis,manual,reddit_comments_2019_07.csv,comment,t3_c80459,c80459,comment,,2025-05-22 15:37:57.146530151,hi r latestagecapitalism i m out.,['latestagecapitalism'],[],0,True
css98iv,science,scientific,,"I don't really have any questions for you, but I just want to say thank you so much for doing what you are doing.",2015-07-04 20:46:21,1,,,,,gingerdg,1747857864.803993,climate crisis,manual,reddit_comments_2015_07.csv,comment,t3_3bzhjn,3bzhjn,comment,,2025-05-21 20:04:24.803992987,"i don t really have any questions for you, but i just want to say thank you so much for doing what you are doing.","['really', 'questions', 'want', 'say', 'thank', 'much']",[],0,True
f7y99y7,Conservative,unknown,,Now that’s thorough,2019-11-18 15:10:40,4,,,,,[deleted],1747934011.581843,climate crisis,manual,reddit_comments_2019_11.csv,comment,t3_dy0xxb,dy0xxb,comment,,2025-05-22 17:13:31.581842899,now that s thorough,['thorough'],[],0,True
f7ommus,vegan,unknown,,You can also be vegan because you don’t want to have slaughterhouse workers do what they have to do (there are many reasons why we shouldn’t want slaughterhouse workers to have to do what they do).,2019-11-16 18:46:28,1,,,,,jepapilex,1747934138.768739,climate crisis,manual,reddit_comments_2019_11.csv,comment,t3_dwdmys,dwdmys,comment,,2025-05-22 17:15:38.768738985,you can also be vegan because you don t want to have slaughterhouse workers do what they have to do there are many reasons why we shouldn t want slaughterhouse workers to have to do what they do .,"['also', 'vegan', 'want', 'slaughterhouse', 'workers', 'many', 'reasons', 'want', 'slaughterhouse', 'workers']",[],0,True
f2oavv5,conspiracy,unknown,,Doing what you can is all you can do. I’m very similar,2019-10-06 01:29:46,1,,,,,artpoint_paradox,1747932967.831881,climate crisis,manual,reddit_comments_2019_10.csv,comment,t3_ddn0rd,ddn0rd,comment,,2025-05-22 16:56:07.831881046,doing what you can is all you can do. i m very similar,['similar'],[],0,True
ed29syi,sustainability,action-oriented,,thank you for doing this,2019-01-02 05:37:21,2,,,,,[deleted],1747919024.889867,climate crisis,manual,reddit_comments_2019_01.csv,comment,t3_abicrb,abicrb,comment,,2025-05-22 13:03:44.889867067,thank you for doing this,['thank'],[],0,True
ejgt0fd,climatechange,action-oriented,,I want to be interviewed for this ,2019-03-27 02:02:23,1,,,,,[deleted],1747921635.016528,climate crisis,manual,reddit_comments_2019_03.csv,comment,t3_b5qeq8,b5qeq8,comment,,2025-05-22 13:47:15.016527891,i want to be interviewed for this,"['want', 'interviewed']",[],0,True
d35n02i,collapse,skeptical,,All of the above.,2016-05-14 21:22:46,1,,,,,ThunderPreacha,1747763594.813796,global warming myth,manual,reddit_comments_2016_05.csv,comment,t3_4jbigy,4jbigy,comment,,2025-05-20 17:53:14.813796043,all of the above.,[],[],0,True
csmll9n,collapse,skeptical,,It will play out over you lifetime,2015-06-29 17:51:17,2,,,,,Dyslexicinsomniac,1747754032.734134,global warming myth,manual,reddit_comments_2015_06.csv,comment,t3_3biw92,3biw92,comment,,2025-05-20 15:13:52.734133959,it will play out over you lifetime,"['play', 'lifetime']",[],0,True
ed29syi,sustainability,action-oriented,,thank you for doing this,2019-01-02 05:37:21,2,,,,,[deleted],1747798458.320866,global warming myth,manual,reddit_comments_2019_01.csv,comment,t3_abicrb,abicrb,comment,,2025-05-21 03:34:18.320866108,thank you for doing this,['thank'],[],0,True
f8s269f,collapse,skeptical,,"The short answer is No and here is why:

 [https://www.youtube.com/watch?v=BhNfOZ6YLbc](https://www.youtube.com/watch?v=BhNfOZ6YLbc)",2019-11-26 10:50:51,3,,,,,Yodyood,1747909106.0858135,global temperature rise,manual,reddit_comments_2019_11.csv,comment,t3_e1v9ot,e1v9ot,comment,,2025-05-22 10:18:26.085813522,the short answer is no and here is why:,"['short', 'answer']",[],0,True
ed29syi,sustainability,action-oriented,,thank you for doing this,2019-01-02 05:37:21,2,,,,,[deleted],1747895765.59574,global temperature rise,manual,reddit_comments_2019_01.csv,comment,t3_abicrb,abicrb,comment,,2025-05-22 06:36:05.595740080,thank you for doing this,['thank'],[],0,True
f0txaeq,collapse,skeptical,,I don’t have the patience for this can we hurry it up already!,2019-09-19 22:02:49,1,,,,,FREE-AOL-CDS,1747945219.732688,fossil fuels aren't bad,manual,reddit_comments_2019_09.csv,comment,t3_d6i6y0,d6i6y0,comment,,2025-05-22 20:20:19.732687950,i don t have the patience for this can we hurry it up already!,"['patience', 'hurry', 'already']",[],0,True
d9e15qu,collapse,skeptical,,Not unless the atmosphere is in on it,2016-10-30 15:54:19,13,,,,,malariadandelion,1747919922.256056,fossil fuels aren't bad,manual,reddit_comments_2016_10.csv,comment,t3_5a6gr0,5a6gr0,comment,,2025-05-22 13:18:42.256056070,not unless the atmosphere is in on it,"['unless', 'atmosphere']",[],0,True
etcyvtg,collapse,skeptical,,It’s easier to be up to date on what Cardi B is doing and what race a mermaid is than a future,2019-07-09 18:05:43,7,,,,,TristanIsSpiffy,1747900246.007497,climate doom,manual,reddit_comments_2019_07.csv,comment,t3_cb032g,cb032g,comment,,2025-05-22 07:50:46.007497072,it s easier to be up to date on what cardi b is doing and what race a mermaid is than a future,"['easier', 'date', 'cardi', 'race', 'mermaid', 'future']",[],0,True
ed29syi,sustainability,action-oriented,,thank you for doing this,2019-01-02 05:37:21,2,,,,,[deleted],1747894543.287575,climate doom,manual,reddit_comments_2019_01.csv,comment,t3_abicrb,abicrb,comment,,2025-05-22 06:15:43.287575006,thank you for doing this,['thank'],[],0,True
mqj765q,collapse,skeptical,,Thanks for all you do 💙,1746365374.0,24,,,,,WernerHerzogWasRight,1746547362.0583549,global temperature rise,scientific,reddit_comments_20250506_180254.csv,comment,t3_1kega3o,1kega3o,comment,2025-05-04 13:29:34,2025-05-06 16:02:42.058354855,thanks for all you do,['thanks'],[],0,True
mqj765q,collapse,skeptical,,Thanks for all you do 💙,1746365374.0,26,,,,,WernerHerzogWasRight,1746700239.8820622,sea level projections,scientific,reddit_comments_20250508_123053.csv,comment,t3_1kega3o,1kega3o,comment,2025-05-04 13:29:34,2025-05-08 10:30:39.882062197,thanks for all you do,['thanks'],[],0,True
mqj765q,collapse,skeptical,,Thanks for all you do 💙,1746365374.0,24,,,,,WernerHerzogWasRight,1746547800.085919,Fridays for Future,action_oriented,reddit_comments_20250506_181010.csv,comment,t3_1kega3o,1kega3o,comment,2025-05-04 13:29:34,2025-05-06 16:10:00.085918903,thanks for all you do,['thanks'],[],0,True
mqj765q,collapse,skeptical,,Thanks for all you do 💙,1746365374.0,25,,,,,WernerHerzogWasRight,1746700494.1446242,climate science,scientific,reddit_comments_20250508_123508.csv,comment,t3_1kega3o,1kega3o,comment,2025-05-04 13:29:34,2025-05-08 10:34:54.144624233,thanks for all you do,['thanks'],[],0,True
mqj765q,collapse,skeptical,,Thanks for all you do 💙,1746365374.0,24,,,,,WernerHerzogWasRight,1746547681.505137,climate crisis,emotional,reddit_comments_20250506_180814.csv,comment,t3_1kega3o,1kega3o,comment,2025-05-04 13:29:34,2025-05-06 16:08:01.505136967,thanks for all you do,['thanks'],[],0,True
mqj765q,collapse,skeptical,,Thanks for all you do 💙,1746365374.0,24,,,,,WernerHerzogWasRight,1746547874.364836,green energy transition,action_oriented,reddit_comments_20250506_181129.csv,comment,t3_1kega3o,1kega3o,comment,2025-05-04 13:29:34,2025-05-06 16:11:14.364835978,thanks for all you do,['thanks'],[],0,True
mqj765q,collapse,skeptical,,Thanks for all you do 💙,1746365374.0,24,,,,,WernerHerzogWasRight,1746547193.9757109,climate science,scientific,reddit_comments_20250506_180008.csv,comment,t3_1kega3o,1kega3o,comment,2025-05-04 13:29:34,2025-05-06 15:59:53.975710869,thanks for all you do,['thanks'],[],0,True
mqj765q,collapse,skeptical,,Thanks for all you do 💙,1746365374.0,27,,,,,WernerHerzogWasRight,1746700152.002929,climate data,scientific,reddit_comments_20250508_122924.csv,comment,t3_1kega3o,1kega3o,comment,2025-05-04 13:29:34,2025-05-08 10:29:12.002928972,thanks for all you do,['thanks'],[],0,True
mqkuraj,collapse,skeptical,,There is no question about it...,1746384020.0,5,,,,,loco500,1746548002.192876,global warming myth,skeptical,reddit_comments_20250506_181336.csv,comment,t3_1kejf1y,1kejf1y,comment,2025-05-04 18:40:20,2025-05-06 16:13:22.192876101,there is no question about it...,"['question', '...']",[],0,True
mqj765q,collapse,skeptical,,Thanks for all you do 💙,1746365374.0,24,,,,,WernerHerzogWasRight,1746548003.760512,global warming myth,skeptical,reddit_comments_20250506_181336.csv,comment,t3_1kega3o,1kega3o,comment,2025-05-04 13:29:34,2025-05-06 16:13:23.760512114,thanks for all you do,['thanks'],[],0,True
mqj765q,collapse,skeptical,,Thanks for all you do 💙,1746365374.0,26,,,,,WernerHerzogWasRight,1746700028.116962,climate science,scientific,reddit_comments_20250508_122719.csv,comment,t3_1kega3o,1kega3o,comment,2025-05-04 13:29:34,2025-05-08 10:27:08.116961956,thanks for all you do,['thanks'],[],0,True
mqj765q,collapse,skeptical,,Thanks for all you do 💙,1746365374.0,26,,,,,WernerHerzogWasRight,1746700663.616375,global temperature rise,scientific,reddit_comments_20250508_123758.csv,comment,t3_1kega3o,1kega3o,comment,2025-05-04 13:29:34,2025-05-08 10:37:43.616374969,thanks for all you do,['thanks'],[],0,True
mqj765q,collapse,skeptical,,Thanks for all you do 💙,1746365374.0,27,,,,,WernerHerzogWasRight,1746700702.50348,sea level projections,scientific,reddit_comments_20250508_123834.csv,comment,t3_1kega3o,1kega3o,comment,2025-05-04 13:29:34,2025-05-08 10:38:22.503479958,thanks for all you do,['thanks'],[],0,True
mqj765q,collapse,skeptical,,Thanks for all you do 💙,1746365374.0,24,,,,,WernerHerzogWasRight,1746548225.511478,how to go green,solutions,reddit_comments_20250506_181718.csv,comment,t3_1kega3o,1kega3o,comment,2025-05-04 13:29:34,2025-05-06 16:17:05.511477947,thanks for all you do,['thanks'],[],0,True
mqj765q,collapse,skeptical,,Thanks for all you do 💙,1746365374.0,27,,,,,WernerHerzogWasRight,1746700196.364193,global temperature rise,scientific,reddit_comments_20250508_123010.csv,comment,t3_1kega3o,1kega3o,comment,2025-05-04 13:29:34,2025-05-08 10:29:56.364192963,thanks for all you do,['thanks'],[],0,True
mqj765q,collapse,skeptical,,Thanks for all you do 💙,1746365374.0,23,,,,,WernerHerzogWasRight,1746547313.139796,climate data,scientific,reddit_comments_20250506_180207.csv,comment,t3_1kega3o,1kega3o,comment,2025-05-04 13:29:34,2025-05-06 16:01:53.139796019,thanks for all you do,['thanks'],[],0,True
mqj765q,collapse,skeptical,,Thanks for all you do 💙,1746365374.0,24,,,,,WernerHerzogWasRight,1746547763.13499,climate strike,action_oriented,reddit_comments_20250506_180936.csv,comment,t3_1kega3o,1kega3o,comment,2025-05-04 13:29:34,2025-05-06 16:09:23.134989977,thanks for all you do,['thanks'],[],0,True
mqj765q,collapse,skeptical,,Thanks for all you do 💙,1746365374.0,26,,,,,WernerHerzogWasRight,1746700617.080621,climate data,scientific,reddit_comments_20250508_123710.csv,comment,t3_1kega3o,1kega3o,comment,2025-05-04 13:29:34,2025-05-08 10:36:57.080621004,thanks for all you do,['thanks'],[],0,True
mqj765q,collapse,skeptical,,Thanks for all you do 💙,1746365374.0,25,,,,,WernerHerzogWasRight,1746547404.503266,sea level projections,scientific,reddit_comments_20250506_180338.csv,comment,t3_1kega3o,1kega3o,comment,2025-05-04 13:29:34,2025-05-06 16:03:24.503266096,thanks for all you do,['thanks'],[],0,True
mqj765q,collapse,skeptical,,Thanks for all you do 💙,1746365374.0,24,,,,,WernerHerzogWasRight,1746547598.039366,our planet is dying,emotional,reddit_comments_20250506_180648.csv,comment,t3_1kega3o,1kega3o,comment,2025-05-04 13:29:34,2025-05-06 16:06:38.039366007,thanks for all you do,['thanks'],[],0,True
mqj765q,collapse,skeptical,,Thanks for all you do 💙,1746365374.0,24,,,,,WernerHerzogWasRight,1746547721.299424,climate protest,action_oriented,reddit_comments_20250506_180852.csv,comment,t3_1kega3o,1kega3o,comment,2025-05-04 13:29:34,2025-05-06 16:08:41.299423933,thanks for all you do,['thanks'],[],0,True
f1odtvt,collapse,skeptical,,It will be,2019-09-28 03:40:53,1,,,,,boob123456789,1747770565.1111932,climate hoax,manual,reddit_comments_2019_09.csv,comment,t3_da0d22,da0d22,comment,,2025-05-20 19:49:25.111193180,it will be,[],[],0,True
d35n02i,collapse,skeptical,,All of the above.,2016-05-14 21:22:46,1,,,,,ThunderPreacha,1747755333.562504,climate hoax,manual,reddit_comments_2016_05.csv,comment,t3_4jbigy,4jbigy,comment,,2025-05-20 15:35:33.562504053,all of the above.,[],[],0,True
da8pto4,environment,emotional,,Is there a reason he doesn't believe it?  ,2016-11-20 22:32:19,3,,,,,[deleted],1747757398.657341,climate hoax,manual,reddit_comments_2016_11.csv,comment,t3_5e066c,5e066c,comment,,2025-05-20 16:09:58.657341003,is there a reason he doesn t believe it?,"['reason', 'believe']",[],0,True
ez8n11a,conspiracy,unknown,,I can dig this,2019-09-06 05:56:54,10,,,,,[deleted],1747936268.946545,our planet is dying,manual,reddit_comments_2019_09.csv,comment,t3_d06go5,d06go5,comment,,2025-05-22 17:51:08.946544886,i can dig this,['dig'],[],0,True
ctwslr6,AskReddit,unknown,,Those who like pineapples on their pizza and those who don't,2015-08-09 11:46:28,4,,,,,KnightOfPineapple,1747848002.995938,our planet is dying,manual,reddit_comments_2015_08.csv,comment,t3_3gcbo4,3gcbo4,comment,,2025-05-21 17:20:02.995938063,those who like pineapples on their pizza and those who don t,"['like', 'pineapples', 'pizza']",[],0,True
dysanjm,vegan,unknown,,Will be doing this from now on!,2018-05-11 00:41:32,1,,,,,WinterSkyWolf,1747908672.260986,our planet is dying,manual,reddit_comments_2018_05.csv,comment,t3_8gyh6j,8gyh6j,comment,,2025-05-22 10:11:12.260986090,will be doing this from now on!,[],[],0,True
dfe4o5c,collapse,skeptical,,I'm going to enjoy the fuck out of it,2017-03-25 14:29:15,3,,,,,Ballsy12,1747881398.183252,our planet is dying,manual,reddit_comments_2017_03.csv,comment,t3_61e639,61e639,comment,,2025-05-22 02:36:38.183252096,i m going to enjoy the fuck out of it,"['going', 'enjoy', 'fuck']",[],0,True
eue0fe9,collapse,skeptical,,What if we add ourselves to the massive die off,2019-07-21 18:02:11,1,,,,,lininkasi,1747931607.07879,our planet is dying,manual,reddit_comments_2019_07.csv,comment,t3_cfy5wh,cfy5wh,comment,,2025-05-22 16:33:27.078789949,what if we add ourselves to the massive die off,"['add', 'massive', 'die']",[],0,True
f69rfph,conspiracy,unknown,,Then don't do it?,2019-11-03 01:54:34,7,,,,,undeadlemur420,1747939852.995253,our planet is dying,manual,reddit_comments_2019_11.csv,comment,t3_dqu4lk,dqu4lk,comment,,2025-05-22 18:50:52.995253086,then don t do it?,[],[],0,True
ei1gjyi,conspiracy,unknown,,It’s more of a slow burn,2019-03-08 01:50:11,5,,,,,JerkyMyTurkey,1747925874.287692,our planet is dying,manual,reddit_comments_2019_03.csv,comment,t3_ayiwpk,ayiwpk,comment,,2025-05-22 14:57:54.287692070,it s more of a slow burn,"['slow', 'burn']",[],0,True
ei2hoxd,conspiracy,unknown,,This is why I don’t try too hard at life,2019-03-08 13:51:49,2,,,,,[deleted],1747925874.317914,our planet is dying,manual,reddit_comments_2019_03.csv,comment,t3_ayiwpk,ayiwpk,comment,,2025-05-22 14:57:54.317914009,this is why i don t try too hard at life,"['try', 'hard', 'life']",[],0,True
