id,subreddit,tone,title,text,created_utc,score,num_comments,upvote_ratio,url,is_self,author,scraped_utc,query_used,query_category,source_file,entry_type,parent_id,post_id,type,created_date,scraped_date,cleaned_text,content_words,climate_terms,climate_term_count,twitter_compatible
ekjpkzn,environment,emotional,,Why not both?,2019-04-10 13:56:14,3,,,,,xtivhpbpj,1747888625.009789,zero waste,manual,reddit_comments_2019_04.csv,comment,t3_bbikiz,bbikiz,comment,,2025-05-22 04:37:05.009788990,why not both?,[],[],0,True
eypxe34,climatechange,action-oriented,,it is for me unfortunately,2019-09-01 05:15:30,1,,,,,bantha-fodder12,1747792429.132689,climate anxiety,manual,reddit_comments_2019_09.csv,comment,t3_cxzswj,cxzswj,comment,,2025-05-21 01:53:49.132688999,it is for me unfortunately,['unfortunately'],[],0,True
elmljho,collapse,skeptical,,r/Collapsesupport is there for you.,2019-04-24 02:55:33,2,,,,,[deleted],1747788993.0999238,climate anxiety,manual,reddit_comments_2019_04.csv,comment,t3_bgp6qf,bgp6qf,comment,,2025-05-21 00:56:33.099923849,r collapsesupport is there for you.,['collapsesupport'],[],0,True
ejgt0fd,climatechange,action-oriented,,I want to be interviewed for this ,2019-03-27 02:02:23,1,,,,,[deleted],1747787618.200274,climate anxiety,manual,reddit_comments_2019_03.csv,comment,t3_b5qeq8,b5qeq8,comment,,2025-05-21 00:33:38.200273991,i want to be interviewed for this,"['want', 'interviewed']",[],0,True
f1odtvt,collapse,skeptical,,It will be,2019-09-28 03:40:53,1,,,,,boob123456789,1747923977.667406,carbon footprint,manual,reddit_comments_2019_09.csv,comment,t3_da0d22,da0d22,comment,,2025-05-22 14:26:17.667406082,it will be,[],[],0,True
ea1wjdh,collapse,skeptical,,I'm not sure we'd all fit on the taskbar,2018-11-19 19:36:27,6,,,,,mogsington,1747902920.624088,carbon footprint,manual,reddit_comments_2018_11.csv,comment,t3_9yjhzb,9yjhzb,comment,,2025-05-22 08:35:20.624088049,i m not sure we d all fit on the taskbar,"['sure', 'fit', 'taskbar']",[],0,True
e8xie6s,collapse,skeptical,,Not with our population,2018-11-02 19:10:31,1,,,,,happygloaming,1747903027.673589,carbon footprint,manual,reddit_comments_2018_11.csv,comment,t3_9tlk0k,9tlk0k,comment,,2025-05-22 08:37:07.673588991,not with our population,['population'],[],0,True
e3gg3iu,collapse,skeptical,,"I'm doing my part, any more than that I have no idea.",2018-08-02 04:45:52,1,,,,,[deleted],1747894516.698992,carbon footprint,manual,reddit_comments_2018_08.csv,comment,t3_93tm5r,93tm5r,comment,,2025-05-22 06:15:16.698992014,"i m doing my part, any more than that i have no idea.","['part', 'idea']",[],0,True
et2z5rs,collapse,skeptical,,Yes I have and if I ever decide I want to be a dad that's what I'll do. Me and my partner both agree on that,2019-07-06 15:02:59,26,,,,,dprophet32,1747921138.3375108,carbon footprint,manual,reddit_comments_2019_07.csv,comment,t3_c9sxkg,c9sxkg,comment,,2025-05-22 13:38:58.337510824,yes i have and if i ever decide i want to be a dad that s what i ll do. me and my partner both agree on that,"['yes', 'ever', 'decide', 'want', 'dad', 'partner', 'agree']",[],0,True
f6s14i7,climatechange,action-oriented,,That’s an idea I wished I had thought of,2019-11-07 11:01:05,2,,,,,[deleted],1747926161.105222,carbon footprint,manual,reddit_comments_2019_11.csv,comment,t3_dsvqbi,dsvqbi,comment,,2025-05-22 15:02:41.105221987,that s an idea i wished i had thought of,"['idea', 'wished', 'thought']",[],0,True
dlw3ne6,science,scientific,,Will you be doing any lectures at TukU while you're there?,2017-08-20 18:51:15,2,,,,,Rex_Digsdale,1747624607.5870872,climate science,scientific,reddit_comments_2017_08.csv,comment,t3_6uviip,6uviip,comment,,2025-05-19 03:16:47.587087154,will you be doing any lectures at tuku while you re there?,"['lectures', 'tuku']",[],0,True
d0uq3cy,science,scientific,,Do you enjoy what you are doing ?,2016-03-10 14:54:16,2,,,,,DDekker,1747608672.130869,climate science,scientific,reddit_comments_2016_03.csv,comment,t3_49t5gf,49t5gf,comment,,2025-05-18 22:51:12.130868912,do you enjoy what you are doing ?,['enjoy'],[],0,True
dar19n8,environment,emotional,,I'll be there.,2016-12-03 22:19:26,44,,,,,Frilly_pom-pom,1747616972.277963,climate science,scientific,reddit_comments_2016_12.csv,comment,t3_5gb9wg,5gb9wg,comment,,2025-05-19 01:09:32.277962923,i ll be there.,[],[],0,True
dard5ck,environment,emotional,,I'm there.,2016-12-04 03:20:52,2,,,,,whoisjavier,1747616972.2936351,climate science,scientific,reddit_comments_2016_12.csv,comment,t3_5gb9wg,5gb9wg,comment,,2025-05-19 01:09:32.293635130,i m there.,[],[],0,True
dfnb1id,science,scientific,,What can I do here and now to work for a better environment?,2017-03-31 12:32:39,14,,,,,something54322,1747619970.153588,climate science,scientific,reddit_comments_2017_03.csv,comment,t3_62kss7,62kss7,comment,,2025-05-19 01:59:30.153588057,what can i do here and now to work for a better environment?,"['work', 'better', 'environment']",['environment'],1,True
dfnm4pa,science,scientific,,"What is your opinion on the [Nature Jobs blog](http://blogs.nature.com/naturejobs/2017/03/27/why-i-will-not-be-marching-for-science/?WT.mc_id=EMX_NJOBS_0330_NATUREJOBSNEWSLETTER_A&WT.ec_id=EXTERNAL) on why scientists should not march for science? I know it isn't a full article and is just an opinion piece, but was pretty aggressively pushed in the email subject line (""Why you should find more biomarkers, and why you shouldn't march for science""). ",2017-03-31 16:25:39,5,,,,,estradiolbenzoate,1747619970.172321,climate science,scientific,reddit_comments_2017_03.csv,comment,t3_62kss7,62kss7,comment,,2025-05-19 01:59:30.172321081,what is your opinion on the .,['opinion'],[],0,True
ed29syi,sustainability,action-oriented,,thank you for doing this,2019-01-02 05:37:21,2,,,,,[deleted],1747643217.4220622,climate science,scientific,reddit_comments_2019_01.csv,comment,t3_abicrb,abicrb,comment,,2025-05-19 08:26:57.422062159,thank you for doing this,['thank'],[],0,True
dikth9w,science,scientific,,Have you been to Australia ,2017-06-07 13:53:45,1,,,,,WonderPutty,1747622886.741906,climate science,scientific,reddit_comments_2017_06.csv,comment,t3_6fsur0,6fsur0,comment,,2025-05-19 02:48:06.741905928,have you been to australia,['australia'],[],0,True
f0txaeq,collapse,skeptical,,I don’t have the patience for this can we hurry it up already!,2019-09-19 22:02:49,1,,,,,FREE-AOL-CDS,1747983750.2938628,green energy transition,manual,reddit_comments_2019_09.csv,comment,t3_d6i6y0,d6i6y0,comment,,2025-05-23 07:02:30.293862820,i don t have the patience for this can we hurry it up already!,"['patience', 'hurry', 'already']",[],0,True
e7jcmwa,climatechange,action-oriented,,Do it you are a hero,2018-10-10 21:14:25,1,,,,,hunoro1,1747971416.424397,green energy transition,manual,reddit_comments_2018_10.csv,comment,t3_9mzouo,9mzouo,comment,,2025-05-23 03:36:56.424396992,do it you are a hero,['hero'],[],0,True
dspovi9,collapse,skeptical,,Who is we? Aren't you a Canadian?,2018-01-15 14:33:59,2,,,,,[deleted],1747962211.728698,green energy transition,manual,reddit_comments_2018_01.csv,comment,t3_7qjijg,7qjijg,comment,,2025-05-23 01:03:31.728698015,who is we? aren t you a canadian?,['canadian'],[],0,True
ed29syi,sustainability,action-oriented,,thank you for doing this,2019-01-02 05:37:21,2,,,,,[deleted],1747975442.498296,green energy transition,manual,reddit_comments_2019_01.csv,comment,t3_abicrb,abicrb,comment,,2025-05-23 04:44:02.498296022,thank you for doing this,['thank'],[],0,True
dc1b8r1,science,scientific,,It's great that you are doing this! Where do you get your funds from?,2017-01-05 16:27:31,1,,,,,kerloom,1747844630.428849,Fridays for Future,manual,reddit_comments_2017_01.csv,comment,t3_5m66l0,5m66l0,comment,,2025-05-21 16:23:50.428848982,it s great that you are doing this! where do you get your funds from?,"['great', 'get', 'funds']",[],0,True
d3rdxzx,collapse,skeptical,,This is why we will have cannibalism,2016-06-01 05:11:33,6,,,,,[deleted],1747869567.527848,carbon capture,manual,reddit_comments_2016_06.csv,comment,t3_4lza8q,4lza8q,comment,,2025-05-21 23:19:27.527848004,this is why we will have cannibalism,['cannibalism'],[],0,True
csmll9n,collapse,skeptical,,It will play out over you lifetime,2015-06-29 17:51:17,2,,,,,Dyslexicinsomniac,1747846977.1849868,carbon capture,manual,reddit_comments_2015_06.csv,comment,t3_3biw92,3biw92,comment,,2025-05-21 17:02:57.184986830,it will play out over you lifetime,"['play', 'lifetime']",[],0,True
eseaaqn,collapse,skeptical,,You are SO full of yourself,2019-06-30 10:17:02,-5,,,,,[deleted],1747909857.135387,carbon capture,manual,reddit_comments_2019_06.csv,comment,t3_c71yg0,c71yg0,comment,,2025-05-22 10:30:57.135386944,you are so full of yourself,['full'],[],0,True
f4cplld,climatechange,action-oriented,,Maybe if it has https://en.wikipedia.org/wiki/Biochar in it.,2019-10-20 00:44:16,1,,,,,technologyisnatural,1747913901.565307,carbon capture,manual,reddit_comments_2019_10.csv,comment,t3_dju3mi,dju3mi,comment,,2025-05-22 11:38:21.565306902,maybe if it has in it.,['maybe'],[],0,True
ed29syi,sustainability,action-oriented,,thank you for doing this,2019-01-02 05:37:21,2,,,,,[deleted],1747822717.2305112,climate strike,manual,reddit_comments_2019_01.csv,comment,t3_abicrb,abicrb,comment,,2025-05-21 10:18:37.230511189,thank you for doing this,['thank'],[],0,True
