"id","parent_id","post_id","subreddit","tone","text","created_utc","score","author","scraped_utc","query_used","query_category"
"eu0y996","t3_ce91o0","ce91o0","climatechange","action-oriented","The obvious critique here is that these two pieces of evidence, alone, just offer evidence of correlation. And most correlations aren't evidence of *causation*, which I think is usually what people want to argue about on the topic of climate change.

And causation is extremely difficult to pin down in very complex systems where the effects of individual influences are very hard to isolate and examine. To establish causation, you really need to conduct and extensively replicate hypothesis tests under controlled conditions.

We can't currently control the planetary climate sufficiently to conduct hypothesis tests involving human influences only. Our climate observations are always ""contaminated"" by natural influences — some of which operate at colossal scales. 

The problem with relying on correlations in complex systems is that it's very hard to know how stable they are. This is a classic problem in finance, especially when you look at complex phenomena like an entire market or an entire economy. Even very strong correlations are considered rough and approximate, and multi-decade assumptions about correlations are often a weak point in predictive models. 

The correlation problem in climate is especially acute because atmospheric CO2 concentrations increase relatively steadily, while global temp increases are not at all steady when examined annually. Smoothing is an important part of establishing correlations in global-temp data — but smoothing can be a weak point too. 

TL;DR: Your data provide a beginning of an argument that a correlation exists. But proving that the correlation will be stable for decades or centuries into the future, and that it constitutes causation, requires a much more full-featured analysis. An analysis that really needs to include hypothesis tests under controlled conditions someday, although for now that day remains very far off.","2019-07-17 09:50:51","4","DocHarford","1747927284.520798","climate crisis","manual"
"eu154pl","t3_ce91o0","ce91o0","climatechange","action-oriented","A paragraph on wikipedia, and a comic. ROTFL.","2019-07-17 10:52:26","5","etzpcm","1747927284.521947","climate crisis","manual"
"eu1fj1v","t3_ce91o0","ce91o0","climatechange","action-oriented","Cause that stuff ain't real, it's fake science, I know cuz I went to hishcool an I rimember that God made everthin 6000 year ago, yer chart starts like 100 thousand years before that - so fake! Covfefe.","2019-07-17 12:21:27","2","CleanEnergyFunding","1747927284.522985","climate crisis","manual"
"eu1ku43","t3_ce91o0","ce91o0","climatechange","action-oriented","Two thoughts occur:

 - The ""acceleration"" is totally normal if you change your temperature axis so as to not exaggerate readings......the trend is *barely* above a straight line, and completely in keeping with Earth's past.  Add to that a tendency by researchers who ought to know better to ""round up"" measurements and ""tweak"" sensors and it's easy to be stampeded into fear.
 - Wikipedia is not in any way a reliable source for something of this weight, part because of those afore-mentioned manipulated and cherry-picked data sets.

That's with a couple of moments of consideration.","2019-07-17 13:07:25","2","TheFerretman","1747927284.524322","climate crisis","manual"
"eu1l78w","t3_ce91o0","ce91o0","climatechange","action-oriented","Dude, don't rely on cartoons for data. There's a lot Randall got wrong in that.","2019-07-17 13:12:18","2","Will_Power","1747927284.525454","climate crisis","manual"
"eu0z9am","t3_ce91o0","ce91o0","climatechange","action-oriented","I think you want /r/climateskeptics/","2019-07-17 09:59:50","1","bigfig","1747927284.52663","climate crisis","manual"
"eu31yty","t3_ce91o0","ce91o0","climatechange","action-oriented","Both are representative of Mann’s hockey stick.","2019-07-17 22:43:22","1","NewyBluey","1747927284.5277388","climate crisis","manual"
"eu0kzuo","t3_ce91o0","ce91o0","climatechange","action-oriented","Well, let's just play Devil's advocate here: the xkcd image is wrong because based on forged data, and the great acceleration proves really nothing in itself?

That wasn't too hard.","2019-07-17 07:52:29","0","raarts","1747927284.528781","climate crisis","manual"
"eu1fzzd","t3_ce91o0","ce91o0","climatechange","action-oriented","I've absolutely given up trying to convince people who have decided that a) we're in a crisis, and b) expanding government control is the only way out of the crisis.  If you want to know what influences my lack of panic, here are some things to note.

&#x200B;

The planet is at 288 kelvin, within the margins of error.  The sun is a variable star with a 0.1% variation.  0.1% of 288 is 2.88°C.  It is well known that deviations in magnetic flux affects cloudiness, and clouds GREATLY affect the albedo of the earth.  Clouds are classified in the GCMs poorly, if at all, and are considered a positive feedback.  Clouds are more complex than this, and the relationship between increased solar influx, changes in solar magnetic flux, changes in terrestrial magnetic flux, cosmic rays, increased GHG effect, increased evaporation rate, increased humidity, increased convection, increasing levels of cloudiness and albedo are not well understood or modeled.

We know (not suspect, know) that there are alternating periods of warming and cooling. These warm periods have names: the Holocene Climactic Optimum, the Older Peron period, the Minoan Warm Period, the Roman Warm Period, the  Medieval Warm Period.  We have cold periods, the Younger Dryas, the Middle Bronze Age Cold Epoch, the  Bond event with the Iron Age Cold Epoch, the Dark Age, the Little Ice Age.  As these warm and cold periods oscillate, we get much warmer or much colder, and it is not clear that the northern and southern hemispheres react at the same amount during the same times in any of them.

Almost all of today's claimed warmth is in the northern hemisphere, and most of it is confined to the high latitudes.   When ""global warming"" is mainly about 30% of the planet, but the climate scientists dismiss the LIA because they don't want to admit that it was 100% global, we have bad science.

Nearly all of the current warm anomaly in the last 30 years has been due to data manipulation (adjustments) and not due to actual readings.  The data manipulation has ""smoothed the curve"" to show a better correlation to the increase in atmospheric CO2, or even just to human emissions.  In fact, t[he adjustments, the current curve minus the raw observations,](http://climateilluminated.com/media/data_tampering/Slide13.JPG) tells this story better than anything. 

&#x200B;

It is clear to me that we have warmed, and it is probable that humans have influenced the temperature.  It is NOT clear that the warming will accelerate out of control, that we're warmer than we have ever been, or that there is any sort of crisis.  What does seem to be clear is that the whole global warming scare is designed to scare people into giving more control to unelected bureaucrats and [allowing them to reshape the socioeconomic landscape of the planet](https://www.washingtonexaminer.com/opinion/editorials/the-green-new-deal-was-never-about-climate-change-its-just-alexandria-ocasio-cortezs-excuse-to-destroy-americas-economy).","2019-07-17 12:24:42","0","deck_hand","1747927284.532094","climate crisis","manual"
"esip1c9","t3_c802l1","c802l1","sustainability","action-oriented","Bless you for putting this together. I'm currently studying Renewable Energy and Sustainability Systems via Penn State's Master's program. I've got 2 semesters after this one and I'm hoping it's not too late to land a position with some clout enough to make meaningful change. I work in recycling right now, and it's largely just a light bandage against the broken limbs that are our regard to waste unfortunately. 

Here's to the good fight!","2019-07-01 21:46:32","35","goldeN4CER","1747927695.3978581","climate crisis","manual"
"esixnpp","t3_c802l1","c802l1","sustainability","action-oriented","This is truly horrific to behold all in one place, but I have a lot of respect for those who can look this in the face every day and still fight to take action instead of escaping to a mental state in which choosing a political party gives you the perceived ability to dispute science by matter of opinion.","2019-07-01 23:03:17","22","nonchristiankristian","1747927695.398933","climate crisis","manual"
"esj0kxs","t3_c802l1","c802l1","sustainability","action-oriented","Dave you glorious bastard how's it going?","2019-07-01 23:29:09","8","[deleted]","1747927695.4005928","climate crisis","manual"
"esizh7l","t3_c802l1","c802l1","sustainability","action-oriented","If more people would actually see research and findings like this, presented to them and shown in real life scenarios, perhaps the world would take action. Most of those who turn a blind eye don’t truly know the problem, it doesn’t effect them. If this information and the reliability of so many of these resources and ecosystems was presented to mankind showing how it sustains human life it would become more important. Mankind truly destroys all it comes in contact with, it’s a sad reality, but it’s the truth. There is more potential in the world. I’ve had it told to me many times that Homo sapiens are the only species that can think about long term future gains. The example is with the study on chimpanzees, I believe. Researchers have placed food inside a basket (something a monkey would want to eat, obviously) and let the monkey try to get it out through the gaps and openings in the basket. Monkeys apparently only think of the now rather than the long term sustainability of not eating whatever’s in the basket for the sake of using your hand to its full potential. I think even as a human species our long term processing only goes so far and in the long run decisions are made that benefit us in the now as opposed to long term sustainability of the very resources keeping us alive.","2019-07-01 23:19:24","3","ashleybrantner","1747927695.402677","climate crisis","manual"
"esk90qr","t3_c802l1","c802l1","sustainability","action-oriented","Unfortunately we humans tend to switch off our awareness of long term risks to focus on immediate concerns.

 I'm working on a startup that will probably have a significant influence on the public and its awareness on climate change. We're looking to recruit data scientists and climate scientists. Let me know if you're interested.","2019-07-02 08:21:19","4","serendipity7777","1747927695.403997","climate crisis","manual"
"esj7hml","t3_c802l1","c802l1","sustainability","action-oriented","More lists on bugs. 

The insect population is [declining at a rate of 2.5% per year](https://www.theguardian.com/environment/2019/feb/10/plummeting-insect-numbers-threaten-collapse-of-nature). That means by 2100 over half the total world's insect population will be gone. Which is bad news for every species higher on the food chain.","2019-07-02 00:31:55","3","bertiebees","1747927695.40499","climate crisis","manual"
"esl4kwo","t3_c802l1","c802l1","sustainability","action-oriented","Well done!! I really appreciate you putting this together!!","2019-07-02 14:51:28","2","ConcernedCitizen13","1747927695.406404","climate crisis","manual"
"et8ytx2","t3_c802l1","c802l1","sustainability","action-oriented","Lots of whales beaching themselves too. The arctic ice extent is heading for a lowest record beating 2012 - BOE is only a few years off.

&#x200B;

Go outside, enjoy nature and be kind to each other while we can.","2019-07-08 09:15:58","1","[deleted]","1747927695.4072802","climate crisis","manual"
"evj2s2d","t3_ck4eg3","ck4eg3","NoStupidQuestions","unknown","Mayor Pete: surprisingly has a shot? Didn’t let that cop shooting tear his campaign down. Also they’re saying “Gay JFK”.  Huh. Who knew?

Warren: “I’m the super lefty old person!”

Bernie: “no I’M the super lefty old person!” 

Bernie/Warren: “there can be only one!” 

(Highlander theme by Queen starts playing) 

Beto: “hey guys... remember when I raised enough money to finance a rap music video and used the money to lose to Ted Cruise?” 

Also Beto: *builds an Wile E. Coyote ACME rocket, straps it to his back, points it at the ground* “I guess I’m the gun control candidate now? Please respond. I was in a punk band once.” 

Literally everyone else: “oh nooooo!! It’s the campaign grim reaper! He has come for the rest of us! QUICK! take as many shots at Bernie and Warren before death spreads its blackened wings over our hopes of having a chaaaaance!” *diss track level shots fired into the night, emptying their clips before being swallowed by the darkness.*

This shit will come down to Bernie, Warren and Mayor Pete. 

Biden has a history of fucking up his own chances and it’s just a matter of time before he steps on his own dick so hard that it falls off and he has to coil it up like a embarrassing link of sausages and go home.

Also: I’m a Canadian. Got no skin in the game. I’m looking at this like a sports tournament.","2019-07-31 06:26:40","0","inward_outbound","1747927925.9415019","climate crisis","manual"
"euei7qu","t3_cg34gg","cg34gg","TrueOffMyChest","unknown","Im a conservative libertarian, and I love you.","2019-07-21 21:36:57","21","VentyMcVenterton","1747927953.361268","climate crisis","manual"
"euehzdo","t3_cg34gg","cg34gg","TrueOffMyChest","unknown","I love this. I feel like we’ve lost the ability to really discuss and try to solve problems for fear, as you say, of of saying the wrong thing or saying it the wrong way. We get so far in the weeds we lose site of what we’re really trying to accomplish. Or should be trying to accomplish. Sometimes I wonder what the goal is. It seems it’s to divide not come together. Also we don’t seems to focus big to small. It seems it matters who pees where over actual human rights being violated. ( right there I’d be shouted down for dismissing gender issues as not a human right violation. It may be but not over starvation, death, violence, etc.) Plastic straws are an environment problem, but really? Aren’t there much much bigger factors in the issues with our environment? I’m a libertarian which means, or should mean, that I believe in freedom with a responsibility to protect it for all. That means protecting and taking care of those who cannot for themselves. From big to small.","2019-07-21 21:34:16","16","inmycherryspot","1747927953.3633358","climate crisis","manual"
"euemmtp","t3_cg34gg","cg34gg","TrueOffMyChest","unknown","This needs to be upvoted to infinity and beyond! It’s like you are reading a page out of my diary. I live in the suburb’s of a fairly large city now, but grew up in east bumfuck nowhere. If the left wants nothing more than hammer people for using incorrect pronouns we are going to lose the battle! Focus on the shit that maters to the masses.","2019-07-21 22:30:19","7","99Orange","1747927953.364375","climate crisis","manual"
"eueiwvr","t3_cg34gg","cg34gg","TrueOffMyChest","unknown","I know how you feel, I consider myself center-right and went to a very leftist college (as most are in the US). I didn't vote for trump (or at all actually) and am hoping that at least one of the parties can get a decent candidate as primary. That being said, I knew a fair share of people in college who were center-left/right who felt they couldn't say anything slightly controversial without getting shouted at. I've met people who've said they can't be friends with anyone who is conservative. A lot of the student run orgs would run rampant with cardboard taped everywhere (without permission, but good luck getting admin to do anything), both inside and outside, about stuff like rape culture, cultural appropriation, ""undocumented"" immigrants, etc. We have a diversity center and the president tried forcing professors to allow students to skip class up to a week after trump was elected because it was too traumatic. My group of friends aren't super political, but we are all open to debating whatever topic without yelling or getting angry and some people would say ""it's so nice to talk to people who are willing to listen and then debate instead of trying to shut down any conversation that isn't in agreement with what they believe."" I feel like everyday, both sides are getting more and more polarized and are listening less and less. It's frightening.","2019-07-21 21:45:05","10","power602","1747927953.366772","climate crisis","manual"
"euez78x","t3_cg34gg","cg34gg","TrueOffMyChest","unknown","Omar showed leniency to a member of Isis...... just putting it out there.","2019-07-22 01:14:11","3","[deleted]","1747927953.367542","climate crisis","manual"
"eufq5sy","t3_cg34gg","cg34gg","TrueOffMyChest","unknown","Cultural appropriation is one of the dumbest SJW topics. Like, seriously. I worked at a Chinese restaurant where both of my owners were white (as in they were like actually white with no Chinese in their background). At one point, they decided to open a Chinese Sichuan-style restaurant.

By today's SJW standards, they're probably guilty of cultural appropriation. Fuck this notion. Culture is meant to be SHARED with others.","2019-07-22 09:00:00","5","[deleted]","1747927953.368803","climate crisis","manual"
"euf7xss","t3_cg34gg","cg34gg","TrueOffMyChest","unknown","I voted Obama in 2012 and trump in 2016 for pretty much these reasons. It looks like trump 2020 now because of how fucked up the left has become.","2019-07-22 03:13:25","3","Jesse0016","1747927953.3698392","climate crisis","manual"
"euejeqd","t3_cg34gg","cg34gg","TrueOffMyChest","unknown","Politics doesn't really exist on a 1 dimensional spectrum.  Every issue your position on which isn't logically necessitated by all the logical implications of your position on some other issue is another dimension.  Morality is what seperate these.  Math and logic connect many of them.  Often liberals have beliefs that logically contradict each other, as we have finite minds.  This is why we have logical calculus.","2019-07-21 21:51:01","0","HillaryKlingon","1747927953.370987","climate crisis","manual"
"eueqdz0","t3_cg34gg","cg34gg","TrueOffMyChest","unknown","[I mean this as a compliment. You sound a lot like Tim Pool.](https://www.google.com/url?sa=t&source=web&rct=j&url=https://m.youtube.com/watch%3Fv%3D02ux1dKNPXo&ved=2ahUKEwjQjceoksfjAhUJ26wKHVaTC3QQwqsBMAB6BAgEEAU&usg=AOvVaw1SwtDyrqceYjHSPIZ1YVrF)","2019-07-21 23:17:42","2","Airman_Skippy","1747927953.372632","climate crisis","manual"
"euf4rcd","t3_cg34gg","cg34gg","TrueOffMyChest","unknown","The Left / right / centre is not a blob in which every ""member"" of said group agrees on everything , that's like saying everyone with brown hair agrees unanimously with each other. You are a liberal because that is the ticked box that is applied to you because of the overlap of opinion of policy and where it fits onto the political chart","2019-07-22 02:28:58","2","Enderhans","1747927953.373664","climate crisis","manual"
"eufn3xo","t3_cg34gg","cg34gg","TrueOffMyChest","unknown","I agree, it’s getting out of hand, even from a liberal perspective","2019-07-22 07:47:25","2","yeehawmilktea","1747927953.374902","climate crisis","manual"
"eufy6r9","t3_cg34gg","cg34gg","TrueOffMyChest","unknown","This is great news for Trump. lol. Love it.","2019-07-22 11:27:03","2","[deleted]","1747927953.375842","climate crisis","manual"
"eug9l4p","t3_cg34gg","cg34gg","TrueOffMyChest","unknown","I agree with literally everything you said","2019-07-22 13:48:14","2","JamirBlumenfeldwitz","1747927953.3768692","climate crisis","manual"
"euffa6z","t3_cg34gg","cg34gg","TrueOffMyChest","unknown","Takes guts to go against the grain, great job OP!","2019-07-22 05:09:17","1","oversized_kaiju","1747927953.3782332","climate crisis","manual"
"eufn3f0","t3_cg34gg","cg34gg","TrueOffMyChest","unknown","excuse you how fucking dare you AOC IS MY IDOL you’re just a racist bigot like Trump you’re probably a rapist too and as a NON-racist caucasian polydemihexifluorogender panharmonicgemini i am personally offended.
/s","2019-07-22 07:47:05","1","yeehawmilktea","1747927953.38094","climate crisis","manual"
"eufwns6","t3_cg34gg","cg34gg","TrueOffMyChest","unknown","As a right-ish of center person, I gotta say this to ya mah dude: you are on point. I totally get it, and I agree with you.  


At job I used to work, I would have these great conversations with the location manager who was a left of center type, and while there was a LOT we agreed on (Elon Musk is gonna save the whole world, just you watch!) and more than a few things we didn't agree on (he loathes Trump, and I'm... still undecided on the final ""product"" since I like some things he does and hate others and don't care about the rest) but one thing we both 100% agreed on after hours and hours of shootin the shit was this: the hyper extreme fringe of both sides are fucking nuts, and shouting down literally everyone else to the point that reasonable conversation is practically impossible, and mostly this is due to and found upon social media. It's so bad that ""middle of the road"" right v left members can't avoid being sucked into the rampant stupidity that the hyper insane fringe is wallowing in. And for people in and around the middle ground? We get double fucked both coming and going. 

Like literally we are quadruple fucked every time we try to open our mouths in public because socially speaking, our culture has forgotten what nuance is.  


Anyways, I feel ya mah dude.","2019-07-22 11:02:47","1","The_Caleb_Mac","1747927953.383184","climate crisis","manual"
"eughvvo","t3_cg34gg","cg34gg","TrueOffMyChest","unknown","You give far to much credence to the power of the people who gate keep what is and isn't considered right. They have a loud voice because the internet allows them to have a loud voice.  


...but that's it, they have a loud voice.

  
The latest episode of The Detour deals with them very well, and that is written by Samantha Bee and you don't get much more liberal than her.","2019-07-22 15:09:45","1","Gasgit_Greengate","1747927953.384178","climate crisis","manual"
"eugrhpv","t3_cg34gg","cg34gg","TrueOffMyChest","unknown","I truly hate the term ""flyover country."" As if anything in the middle doesn't count because of various stupid stereotypical reasons. It is demeaning and insulting to use that term. Yes, I grew up in the midwest; yes, I'm mixed race; yes, I was a left winger and am now firmly in the conservative camp. Why the change to conservatism? Because liberals are condescending and dismissive of any opinions that differ from their own. They are at best childish and at worst bullies bordering on fascist.","2019-07-22 16:38:35","1","[deleted]","1747927953.38534","climate crisis","manual"
"eui4xfr","t3_cg34gg","cg34gg","TrueOffMyChest","unknown","This is why the fringe far left should be disregarded in this country. They have no real aim, no goals, no ambition or plan to better society. They just create a miserable void, dragging them down with them.","2019-07-23 00:08:10","1","themadladkabar","1747927953.386431","climate crisis","manual"
"eufal6y","t3_cg34gg","cg34gg","TrueOffMyChest","unknown","Americans don't even get how diverse and better they are with race compared to Europe and even third world countries. I love europe and love many things there compared to here, but you go to many Europeans countries, especially eastern european, the diversity is very forthtelling. You go to France and I hear the stigma against Africans or Muslims or how conservative Europeans think. 

   But with the left, I think I am neutral, but I admit I tend to think a little more conservative. I still believe we should have change and respect left ideas. It is so complicated but the left  need to improve 
it's methods. They are just too extreme and it is just not easy to expect many conervatives or older generation of Americans to buy into your ideals if you attack their traditions and vouch for extreme change. LIke I just believe we always should respect some ways of living in the past. Like with guns, listen most people are sane to own a gun. It sucks we have some crazy tradtion of mass shootings, but that is not all on our gun laws. A lot is selfish culture on mental health, terrible policing on obtaining guns, and school culture that do not avoid people from breaking out. The left need to stop acting like self righteous divas and try to unite America.","2019-07-22 03:52:30","0","Kandahar511","1747927953.388441","climate crisis","manual"
"eueijp5","t3_cg34gg","cg34gg","TrueOffMyChest","unknown","I've never had a debate with a conservative person who just agrees to disagree. Most of the issues you've listed with liberals are literally only internet phenomenon","2019-07-21 21:40:47","-2","[deleted]","1747927953.389675","climate crisis","manual"
"euejkjw","t3_cg34gg","cg34gg","TrueOffMyChest","unknown","Good job, Mr. Liberal, you've got right wingers applauding you in the comments. I sure hope you feel proud.","2019-07-21 21:52:57","-12","this_immortal","1747927953.391927","climate crisis","manual"
