"id","parent_id","post_id","subreddit","tone","text","created_utc","score","author","scraped_utc","query_used","query_category"
"evhakf6","t3_cjylj7","cjylj7","TrueOffMyChest","unknown","This isn’t entirely helpful, but pretty much everything you said is a major reason I didn’t want to go to school to become an MD. I’m about to start a Medical Assisting program at my local community college and then hopefully go on to PA in a few years once I get my bachelors at a local university. 
We’ll see what happens, but I’m the same boat. Not enough/too much money and no scholarships. 
Eventually, we’ll get our debt paid off. Even if it takes 20 years. But it’ll happen. 
If you really want to be an MD, then keep trucking. You’ll be okay. Debt isn’t the end of the world if you’re smart about it. Just know that you’re not alone.","2019-07-30 21:49:36","3","pickleblanket","1747928011.4029188","climate crisis","manual"
"eviap37","t3_cjylj7","cjylj7","TrueOffMyChest","unknown","I’m just getting my bachelors and then moving to Germany to study over there lol tuition fees are hundreds if not thousands of times more cheaper than here in America","2019-07-31 02:20:25","2","[deleted]","1747928011.404214","climate crisis","manual"
"evihth5","t3_cjylj7","cjylj7","TrueOffMyChest","unknown","I'm right there with you. I have heard though, the path you are following often leads to good positions with pretty good pay? So maybe once you do your ""due diligence"" you'll be able to pay off your debt and live kinda comfortably?","2019-07-31 03:14:48","1","allthelemmonz","1747928011.405281","climate crisis","manual"
"evivds7","t3_cjylj7","cjylj7","TrueOffMyChest","unknown","Laughs in free education","2019-07-31 05:16:02","1","[deleted]","1747928011.40644","climate crisis","manual"
"evjge0h","t3_cjylj7","cjylj7","TrueOffMyChest","unknown","I want to feel bad for you, but it really irritates me when I hear people say they ""didnt really know"" what they were getting into with their loans. Its honestly not complicated, you borrow then repay, and I dont see how someone could be surprised by the amount of a loan they signed themselves up for.","2019-07-31 08:32:44","1","123noodle","1747928011.407391","climate crisis","manual"
"eu4drpf","t3_cencf9","cencf9","zerowaste","unknown","How sad it is when people bring such a gesture down instead of applauding it; I don’t think everyone in here is 100% zero waste and it’s impossible to bring yourself to such a level instantly. 

In Jaden’s case it should be applauded at least the fact that he used said connections and fame to bring awareness over a real issue. Not the typical celebrity attention whoring like not having a big enough butt..","2019-07-18 11:47:54","217","blacktulipsarefine","1747928256.736285","climate crisis","manual"
"eu4hthl","t3_cencf9","cencf9","zerowaste","unknown","He didn't remove plastic bottles. His company replaced them with unnecessary cartons.

I've run plenty of races, including the New York City marathon and many 5ks, with big tubs of water and paper cups. While we could reduce the cups, at least a standard exists with less waste than Jaden's cartons.

I compare his cartons with the minimum waste we could use, not the maximum.

I would make a headline: ""Jaden Smith increases unnecessary packaging, claims reduction.""","2019-07-18 12:52:15","55","spodek","1747928256.737661","climate crisis","manual"
"eu4iztd","t3_cencf9","cencf9","zerowaste","unknown","He’s a good kid with a big heart. It’s really bothered me when the internet made fun of him with the “I’m 13 and this is deep” memes. Most of us had the privilege of living our embarrassing adolescent moments in the relative privacy of our little lives. He’s just still growing up! And 16,000 bottles removed is quite an accomplishment. Go Jaden!","2019-07-18 13:08:52","45","pebble554","1747928256.739029","climate crisis","manual"
"eu4gvmi","t3_cencf9","cencf9","zerowaste","unknown","Do you work for LiveKindly because you only post their articles and always in the exact same format?","2019-07-18 12:38:25","22","Moikee","1747928256.740078","climate crisis","manual"
"eu4r8bq","t3_cencf9","cencf9","zerowaste","unknown","I don’t want to be a hater, but isn’t this Just Water sells 16,000 single use compostable bottles to London 10K?  
  
Is Just Water going to be actively composting these? Otherwise they will still end up in a landfill or contaminating regular recycling. Without the proper conditions these still take a very long time to degrade in a landfill.","2019-07-18 14:49:00","9","Unlockabear","1747928256.741368","climate crisis","manual"
"eu46l31","t3_cencf9","cencf9","zerowaste","unknown","It's nice to see the young man grow and mature into a less shitty person.","2019-07-18 09:11:31","10","piyokochan","1747928256.742342","climate crisis","manual"
"eu4u0hg","t3_cencf9","cencf9","zerowaste","unknown","Because he's already been in enough end of the world films to know something has to be done, we wouldn't make so many if there wasn't a real concern. Humans have a habit of entertaining ourselves out of issues.","2019-07-18 15:19:30","3","seniorscrolls","1747928256.743805","climate crisis","manual"
"eu58uj4","t3_cencf9","cencf9","zerowaste","unknown","This person works for LiveKindly. It’s very obvious. I feel like if you’re profiting from people clicking the links you’re sharing you should mention it. And you should contribute to the subreddit other than just posting links so you can make money.","2019-07-18 17:52:23","3","decentwriter","1747928256.7451148","climate crisis","manual"
"eu597lw","t3_cencf9","cencf9","zerowaste","unknown","I think a lot of young people are exposed to exactly is happening in the planet, thanks to the internet. The older generation are more naive either because they are so used to their old ways and they don’t want to change  or because they don’t have time to see exactly what’s happening out there. I think In the next years lots of changes are going to happen. I’m excited about it. The older generations are going to have to adopt either by laws or by exposing them online.","2019-07-18 17:56:02","2","betabandzz","1747928256.746473","climate crisis","manual"
"eu7do42","t3_cencf9","cencf9","zerowaste","unknown","just another reason to love the Smith family even more","2019-07-19 09:12:11","2","thatyogagirl1","1747928256.7473862","climate crisis","manual"
"eu5aet6","t3_cencf9","cencf9","zerowaste","unknown","Jaden Smith has almost nothing to do with this.

I know people are pointing out the issue of running a company and making money off this race while looking like a charity, as well as replacing the plastic with a different kind of plastic instead of paper. But the bigger problem with the headline is Jaden. Will Smith has 1000 times more money than jaden, and what money Jaden does have came from Will spending his money to prop Jaden up. When ""Will and Jaden Smith"" do something, it's Will that is doing it. and all Will SMith is doing is owning a company that someone else manages because he has a shitton of money.

Jaden is just their in the headline to grab attention because nobody would click on ""Norm Middleman, actually does the work of selling water, and some celebrities get part of his profit""","2019-07-18 18:08:28","1","BackslidingAlt","1747928256.749156","climate crisis","manual"
"eu3tw0j","t3_cencf9","cencf9","zerowaste","unknown","Jaden Smith isnt going to happen. Please accept this. Will has.","2019-07-18 04:47:29","-21","[deleted]","1747928256.750069","climate crisis","manual"
"esj4vbs","t3_c80459","c80459","zerowaste","unknown",">Hi [/r/LateStageCapitalism](https://www.reddit.com/r/LateStageCapitalism/),

I'm out.","2019-07-02 00:07:47","4","[deleted]","1747928277.1465302","climate crisis","manual"
"esijw71","t3_c80459","c80459","zerowaste","unknown","Hello, everyone!

[/r/ZeroWaste has passed 150,000 subscribers and is looking for more moderators! Please consider applying.](https://www.reddit.com/r/ZeroWaste/comments/c34110/rzerowaste_has_passed_150000_subscribers_and_is/)

*I am a bot, and this action was performed automatically. Please [contact the moderators of this subreddit](/message/compose/?to=/r/ZeroWaste) if you have any questions or concerns.*","2019-07-01 21:03:24","1","AutoModerator","1747928277.148013","climate crisis","manual"
"eva27ph","t3_civmx9","civmx9","vegan","unknown","everybody should watch the true,not only know,but watch,

i'd be more than happy to give my life if this would obly all people in the world to watch in example ""earthlings"",

i don't think manking is naturally bad,mankind is naturally lazy and prefer to avoid problems as bullets if they can,

so blessed be vegan activism.

good luck dudes.","2019-07-28 18:03:20","6","[deleted]","1747928315.034935","climate crisis","manual"
"ev9f5qf","t3_civmx9","civmx9","vegan","unknown","Great!","2019-07-28 13:14:59","6","eldaftbro","1747928315.0371552","climate crisis","manual"
"eva2hfk","t3_civmx9","civmx9","vegan","unknown","I'll start spreading word in Florida, let the Vegan revolution begin ✊","2019-07-28 18:06:39","4","Fluffiest_Boi","1747928315.04922","climate crisis","manual"
"evbq4e9","t3_civmx9","civmx9","vegan","unknown","I mean it sounds great but I have some serious doubts here. People already have problems with changing their consumer habits and lifestyle even though they support climate activists and know their impact.
It also sounds a lot like you want to force people when you say you will turn the world vegan. I know it's not how you plan to do it but again this will not go well with public opinion.
Another concern I have is that your partnership with extinction rebellion is too obvious. People will now think that you and ER are the same group and will thus use arguments against veganism also against ER. Again this might turn people away.
I think it would be better to use a different symbol. There are already a lot of hard working animal right groups out there that basically want a vegan world, join forces with them and try to use the climate movement as a catalysator to get people interested in veganism. But please be careful to not hinder or slow down the work of ER. The climate movement has enough enemies and hardships as it is.
Good luck to you though and thanks for being an activist.  I hope we live in a vegan world one day.","2019-07-29 08:25:06","2","Griffonguy","1747928315.063738","climate crisis","manual"
"ev9fy30","t3_civmx9","civmx9","vegan","unknown","Do you want to help build a more compassionate world? Please visit [VeganActivism.org](https://veganactivism.org) and subscribe to our community over at /r/VeganActivism to begin your journey in spreading compassion through activism. Thank you so much!","2019-07-28 13:27:30","1","veganactivismbot","1747928315.067934","climate crisis","manual"
"eva3jrm","t3_civmx9","civmx9","vegan","unknown","Animal eaters are gonna counterpoint and say we should fight and lobby against corporations responsible for creating most of our planets co2. They'll say  the entire u.s. population could go vegan and have less impact than billionaires that need to be held accountable.","2019-07-28 18:19:14","0","AaronEnEspanol","1747928315.069448","climate crisis","manual"
"eva3f6t","t3_civmx9","civmx9","vegan","unknown","I like the idea, but...not gonna work.","2019-07-28 18:17:49","-2","QueenCheshireWolf","1747928315.0709078","climate crisis","manual"
"ev9rcxm","t3_civmx9","civmx9","vegan","unknown","This is a nobel cause but unfortunatly I think that this kind of activism is the reason why vegans are preceived so badly. What about suggesting a diet with less meat instead of telling people to go vegan on the spot?","2019-07-28 15:55:12","-10","[deleted]","1747928315.072149","climate crisis","manual"
"eupyw34","t3_cgxvsy","cgxvsy","vegan","unknown"," “The current methods of meat production are absolutely unacceptable from  an environmental and animal welfare standpoint, but that doesn’t  logically lead us to the conclusion that we should get rid of meat,” 

&#x200B;

Yes, it does, you fucking idiot!... those pseudosience articles really grinds my gear.","2019-07-24 11:20:34","2","dlouhan_","1747928370.868983","climate crisis","manual"
