"id","parent_id","post_id","subreddit","tone","text","created_utc","score","author","scraped_utc","query_used","query_category"
"elzuvub","t3_bibzcw","bibzcw","climate","scientific","This is part of what leads people to conclude that there is an ownership class, which owns companies and property, but does little actual work, and a working class, which owns nothing but sells their labor to survive. The working class is told that they get ""one person one vote"" yet we see companies pouring money into politics effectively voting millions of times by 1) manufacturing people's consent towards voting for people they otherwise wouldn't (see Noam Chomsky), and 2) flat out changing politicians' stances from what they originally claimed. These energy companies are doing exactly this. Once you see that these politicians' generally don't *actually* believe the garbage they're saying, you can tell that our politics are essentially just the corporations governing us. I do hope you see the possible ineffectiveness of ""VOTE"" in the face of how fake the democratic parts of our society are - it's the reason why MLK was part of a (widely disliked) movement, not a campaign to get out the vote, and it's the reason why a group like Extinction Rebellion is similarly causing economic disruption by blocking traffic etc. and making demands.  

  

Still vote though.","2019-04-28 17:40:04","19","[deleted]","1747912618.68197","renewables now","manual"
"elzos89","t3_bibzcw","bibzcw","climate","scientific","Just realized that anyone can actually download the entire database of money's influence on US politics:

https://www.opensecrets.org/bulk-data/

CAUTION: Although it's nothing anybody doesn't already know, going down this rabbit hole *will* require multiple visits to r\MindBleach","2019-04-28 16:29:15","8","realestnwah","1747912618.684766","renewables now","manual"
"em1mvmp","t3_bibzcw","bibzcw","climate","scientific","I feel like this post should be pinned, maybe.

Know your congress. Know who's beholden to the people who are killing our planet Earth.","2019-04-29 08:27:48","3","RadioMelon","1747912618.686929","renewables now","manual"
"em0jrhz","t3_bibzcw","bibzcw","climate","scientific","When I picture the relation between earth and humanity I always see the frog (earth) with the scorpion (humanity) on its back waiting for that deadly sting that kills them both.

Humanity hasn't done a single thing to improve the conditions of the planet, the only thing we does is try to further ourselves in futility. You can only drill so many holes in the boat you're sitting in before you both sink...","2019-04-28 22:31:05","2","stickybud_bkk","1747912618.688658","renewables now","manual"
"em0kdxt","t3_bibzcw","bibzcw","climate","scientific","If I was Arya from Game of Thrones. these people would be on my list...

**The list of people I'd have a firm discussion with, of course! Don't throw me in jail please.**","2019-04-28 22:38:55","2","Nemo_K","1747912618.6903849","renewables now","manual"
"em0xubr","t3_bibzcw","bibzcw","climate","scientific","Great work. Thank you very much. 

Oh. By the way. Don't trust Mo Brooks (Alabama) For one, single, second.

https://www.skepticalscience.com/skepticquotes.php?s=71","2019-04-29 01:41:12","2","Toadfinger","1747912618.6923652","renewables now","manual"
"em0xpt2","t3_bibzcw","bibzcw","climate","scientific","I’d love for you to look at Gov Sununu from NH. Consistently votes the utility company line, pro massive transmission projects and anti solar and wind. Apparently the states biggest utility is a big campaign contributor.","2019-04-29 01:39:20","1","snowman603","1747912618.702524","renewables now","manual"
"elzg22e","t3_bibtg0","bibtg0","environment","emotional","cue Star Spangled Banner ...","2019-04-28 14:45:49","3","squizzy1961","1747912867.210538","renewables now","manual"
"elzqg5c","t3_bibtg0","bibtg0","environment","emotional","What is beyond incomprehensible is that a small number of pesticide companies literally own the DNA of a huge chunk of the world's food supply:

https://www.google.com/amp/s/philhoward.net/2018/12/31/global-seed-industry-changes-since-2013/amp/

... and that only ten companies own all virtually all brands of processed food:

https://www.oxfamamerica.org/explore/stories/these-10-companies-make-a-lot-of-the-food-we-buy-heres-how-we-made-them-better/

u\BloodyJourno any thoughts on doing a version 2.0 of this list in, say, early October?","2019-04-28 16:48:46","2","realestnwah","1747912867.21271","renewables now","manual"
"em1f0vu","t3_bibtg0","bibtg0","environment","emotional","Holy legwork Batman! I wish I could upvote this more than once","2019-04-29 05:28:34","1","[deleted]","1747912867.214797","renewables now","manual"
"em4zg4e","t3_bj3fpd","bj3fpd","science","scientific","How much better can a chemical battery be than what we use today?  What principle limits the ultimate performance?  Is there hope to improve energy density by 2x, 10x, 100x?","2019-04-30 14:00:08","850","plorraine","1747912893.5400121","renewables now","manual"
"em50dq8","t3_bj3fpd","bj3fpd","science","scientific","What would you consider ""cutting edge"" technology in the battery world at the moment? Or technology that is RIGHT within grasp we just need some slight tweaks to get there.

Thanks! -Somebody who knows nothing about batteries","2019-04-30 14:11:06","397","Willster328","1747912893.541339","renewables now","manual"
"em4y2nw","t3_bj3fpd","bj3fpd","science","scientific","Where do you stand on the renewables vs nuclear debate?","2019-04-30 13:43:51","324","abcde9999","1747912893.542667","renewables now","manual"
"em4zq53","t3_bj3fpd","bj3fpd","science","scientific","It seems like a lot of renewable energy sources aren't considered as viable options in many places because they can't react to peak usage. Batteries are supposed to be one method of energy storage to mitigate that issue, however with today's battery technology I'm afraid the materials needed to create batteries needed to power whole towns and cities is unsustainable.

Do you expect the battery technology to power the conversation from fossil fuels to renewables will be some material that hasn't been discovered, hasn't been mass produced, or is some alternate energy storage system like using renewables to fill a reservoir for hydro?","2019-04-30 14:03:31","237","duckduckohno","1747912893.544053","renewables now","manual"
"em4zsir","t3_bj3fpd","bj3fpd","science","scientific","Are there limits to the amount of natural resources for battery storage? Are we pinning our future hopes of solving climate change via battery storage + solar...a fantasy? What are some things you wish people had a better understanding of in terms of battery technology and where things are going with autonomous cars etc","2019-04-30 14:04:17","202","fcb2019","1747912893.5450492","renewables now","manual"
"em50kk7","t3_bj3fpd","bj3fpd","science","scientific","Should [John Goodenough](https://en.wikipedia.org/wiki/John_B._Goodenough), the inventor of the lithium-ion battery, be considered for a Nobel Prize?","2019-04-30 14:13:19","78","shiruken","1747912893.5458932","renewables now","manual"
"em4zvc4","t3_bj3fpd","bj3fpd","science","scientific","Hello, thanks for the taking the time do this discussion. Couple of quick questions:

1. What are the main challenges to making current lithium-ion batteries better in terms of energy and power densities? Is it a chemistry problem? Or maybe a manufacturing problem?
2. How cheap do batteries need to be before they truly can be widely used for applications such as battery electric vehicles and stationary energy storage?","2019-04-30 14:05:10","66","edwinksl","1747912893.547116","renewables now","manual"
"em4zgjc","t3_bj3fpd","bj3fpd","science","scientific","Years ago there was a lot of government investment by the DOE in hydrogen storage with the idea of using fuel cells to power things.  Clearly that never made it past the R&D phase, but are there areas that fuel cells still make sense for in place of batteries or have lithium ion batteries progressed to the point at which it's the solution for everything below MW storage?","2019-04-30 14:00:17","60","nate","1747912893.5479949","renewables now","manual"
"em4z7j2","t3_bj3fpd","bj3fpd","science","scientific","How many years until we have affordable home batteries that could hold enough charge to allow people to realistically go off-grid using solar or wind as their sole source of energy? That is assuming the same rate of energy consumption.","2019-04-30 13:57:26","52","[deleted]","1747912893.5488372","renewables now","manual"
"em5k8dm","t3_bj3fpd","bj3fpd","science","scientific","At current and forecasted production rates how long can we continue producing lithium batteries, obviously it's a finite resource and production has exploded in the last 10 years, how sustainable is it?","2019-04-30 17:38:34","44","JimminnyBillyBob","1747912893.549897","renewables now","manual"
"em4yp2x","t3_bj3fpd","bj3fpd","science","scientific","This AMA is being permanently archived by *The Winnower*, a publishing platform that offers traditional scholarly publishing tools to traditional *and* non-traditional scholarly outputs—because scholarly communication doesn’t just happen in journals.

To cite this AMA please use: [https://doi.org/10.15200/winn.155663.32266](https://www.thewinnower.com/papers/19852-science-discussion-series-batteries-seem-to-power-everything-today-cell-phones-cars-homes-even-airplanes-we-are-a-team-of-scientists-and-engineers-working-on-batteries-and-energy-storage-let-s-discuss)

You can learn more and start contributing at [*authorea.com*](https://authorea.com)","2019-04-30 13:51:25","31","redditWinnower","1747912893.550879","renewables now","manual"
"em4z7i8","t3_bj3fpd","bj3fpd","science","scientific","Hi, welcome to today's [r/science](https://www.reddit.com/r/science) discussion panel! Like AMAs, the goal of discussion panels is to bring exciting, timely topics in science to reddit and have discussions led by subject area experts.

The difference between AMAs and discussions is that discussions will happen much less frequently and will always be led by a team of scientists so that we can hear multiple expert perspectives and answer many more questions. As with our AMAs, discussion posts will be posted in the morning to allow topics and questions for the panel to come in ahead of the panelists arriving to participate. Also, similarly to our AMAs our moderation of these events will be extremely strict, so please make sure you read and follow our rules in the sidebar. Thanks, and we hope you enjoy this new series!

If you have scientific expertise, please verify this with our moderators by getting your account flaired with the appropriate title. Instructions for obtaining flair are here: [reddit Science Flair Instructions](https://www.reddit.com/r/science/comments/5ivw50/do_you_have_a_college_degree_or_higher_in_science/) (Flair is automatically synced with [/r/EverythingScience](https://www.reddit.com/r/EverythingScience) as well).","2019-04-30 13:57:25","1","p1percub","1747912893.552433","renewables now","manual"
"em513y2","t3_bj3fpd","bj3fpd","science","scientific","Is there an upper limit to the energy density for supercapacitors? Is moving away from chemical batteries and towards capacitor energy storage a viable option, or a pipe dream?","2019-04-30 14:19:22","29","Sirbeastian","1747912893.553597","renewables now","manual"
"em4y3hp","t3_bj3fpd","bj3fpd","science","scientific","What are the biggest obsticles when designing a long lasting battery?","2019-04-30 13:44:08","30","thee_average_joe","1747912893.554419","renewables now","manual"
"em4zsef","t3_bj3fpd","bj3fpd","science","scientific","Thanks for taking the time to answer our questions today.

My question is after a lithium battery, like the ones found in laptops and electric cars, is beyond it's useful life how effectively can it be recycled if it can be at all.","2019-04-30 14:04:15","24","HuskingENGR","1747912893.555386","renewables now","manual"
"em50h09","t3_bj3fpd","bj3fpd","science","scientific","What does the future of battery disposal or recycling look like?  That's a major concern of many","2019-04-30 14:12:12","21","HighOnGoofballs","1747912893.556118","renewables now","manual"
"em50tg9","t3_bj3fpd","bj3fpd","science","scientific","Thanks for doing this AMA! Are there any developments which might reduce our dependence on cobalt usage in the cathodes of batteries? Does there appear to be a technology on the horizon which can challenge lithium batteries utilization for ZEVs?","2019-04-30 14:16:04","18","Weebl72","1747912893.556917","renewables now","manual"
"em502qe","t3_bj3fpd","bj3fpd","science","scientific","Will any battery ever show up in a phone or car the general consumer might buy that will outperform Lithium Ion?  I've heard about advances for decades yet the Lithium Ion battery still seems to be the best performing.  Can we squeeze further performance enhancements out of Lithium Ion batteries?","2019-04-30 14:07:34","16","EEcav","1747912893.557994","renewables now","manual"
"em5i11u","t3_bj3fpd","bj3fpd","science","scientific","There's lots of headlines out there about new battery chemistries that are ""close"" to being viable, but it seems we've been using lithium ion or some improved derivative for a very very long time.. is there actually a different battery chemistry with notably higher energy density anywhere near being commercially viable in the next decade?","2019-04-30 17:16:23","17","cvonhew","1747912893.558817","renewables now","manual"
"em4y8dn","t3_bj3fpd","bj3fpd","science","scientific","I have a question
1) why do battery tend to work only for a given number of charge discharge and loose capacity ? I get that It have something to do eith tbe reversibility of the reaction but why ? What prevent the process from working an infinite amount of time ? Thanks for your repply.","2019-04-30 13:45:48","14","nathmo","1747912893.559623","renewables now","manual"
"em506k9","t3_bj3fpd","bj3fpd","science","scientific","Is there any development for a bio type of battery going on right now? using bacteria, or plant structures to try and do anything with it?","2019-04-30 14:08:47","12","Mushwoo","1747912893.560339","renewables now","manual"
"em50qfz","t3_bj3fpd","bj3fpd","science","scientific","What are your views on using hydrogen from electrolysis as a form of energy storage, made by renewable energy when it is not needed?
Like during peak hours of production but low usage of electricity.","2019-04-30 14:15:08","11","azarour","1747912893.561356","renewables now","manual"
"em52lop","t3_bj3fpd","bj3fpd","science","scientific","I have few questions:  
1- There are solid alternative to Li-ions batteries?  
2- Which is the future to lithium battery?  
3- Which is the environmental impact of mining it?","2019-04-30 14:36:19","11","FuMarco","1747912893.562193","renewables now","manual"
"em5h8az","t3_bj3fpd","bj3fpd","science","scientific","What is a solid state battery and how far away are we from having them?","2019-04-30 17:08:26","10","AndypandyO","1747912893.562985","renewables now","manual"
"em5j8qc","t3_bj3fpd","bj3fpd","science","scientific","What is the environmental impact of making batteries from mining raw materials to manufacturing and waste? With the rise of ""green"" devices using batteries, are they truly green or misleading?","2019-04-30 17:28:26","10","Jesus-chan","1747912893.563863","renewables now","manual"
"em54f3p","t3_bj3fpd","bj3fpd","science","scientific","How good of a solution do you believe vanadium redox batteries are for energy storage?","2019-04-30 14:56:13","10","ibmwatsonson","1747912893.5650501","renewables now","manual"
"em50407","t3_bj3fpd","bj3fpd","science","scientific","It seems that batteries alone might not be enough for our energy needs at the moment but I've been seeing movement towards using super capacitors with batteries to get the best of both worlds. The capacitors offer the quick charge and discharge rates while the batteries can offer a larger capacity.

Do you see this as viable and what would be the impact on our electric energy generation and consumption?","2019-04-30 14:07:59","9","HeadBoy","1747912893.566002","renewables now","manual"
"em5j4lz","t3_bj3fpd","bj3fpd","science","scientific","Where do the chemicals/metal go in the recycling and disposal process?","2019-04-30 17:27:19","9","becauseyousaid","1747912893.5670059","renewables now","manual"
"em5j9d9","t3_bj3fpd","bj3fpd","science","scientific","My understanding is that we need to radically increase the capacity of batterits relative to their current size for them to be a viable replacement for diesel engines.  

How close are we to that?","2019-04-30 17:28:38","9","[deleted]","1747912893.567831","renewables now","manual"
"em5k7h0","t3_bj3fpd","bj3fpd","science","scientific","Hi guys,  
I would be highly interested in your thoughts on silicon-air-batteries / aluminium-air-batteries and whether you think that this technology could be sufficiently scalable to supercede lithium-based batteries in supporting larger capacities and for instance power small electric aircraft.

Cheers","2019-04-30 17:38:18","8","KamikazeKauz","1747912893.568683","renewables now","manual"
"em522no","t3_bj3fpd","bj3fpd","science","scientific","Thanks for doing this!

&#x200B;

1. Could you please explain the feasibility of recycling lithium-ion batteries? I hear a lot of discussion around the idea, but what percentage of material can realistically be recycled? And how much of which components? Will batteries create a major waste problem?

&#x200B;

2) A German think tank recently released a report claiming that diesels produce fewer emissions than EVs in Germany ([http://www.cesifo-group.de/ifoHome/presse/Pressemitteilungen/Pressemitteilungen-Archiv/2019/Q2/pm\_20190417\_sd08-Elektroautos.html](http://www.cesifo-group.de/ifoHome/presse/Pressemitteilungen/Pressemitteilungen-Archiv/2019/Q2/pm_20190417_sd08-Elektroautos.html)). There are a lot of issues with this study, but the most important piece is  their assumption on tons of CO2 per kwh of battery production (it seems high). Do you have good numbers from a manufacturer on tons of CO2 per kwh of battery produced?","2019-04-30 14:30:19","7","[deleted]","1747912893.569762","renewables now","manual"
"em524y6","t3_bj3fpd","bj3fpd","science","scientific","A group at my university was looking at materials for sodium ion batteries. Do you think sodium ion batteries will ever replace lithium ion batteries, or is there a better alternative?

&#x200B;

Also, do you think fuel cells will eventually overtake batteries in the majority of applications, or do batteries have more potential (excuse the pun) than that?","2019-04-30 14:31:04","7","Scrapheaper","1747912893.570751","renewables now","manual"
"em52iho","t3_bj3fpd","bj3fpd","science","scientific","Hi guys, I'm hoping you can solve a little mystery for me!

Years ago, my dad hypothesized that one of the reasons technologies like solar power came around decades ago but didn't really take off until recently was a sudden, unexplained slowing in the research and development of improved battery technology.

Why would you invest in solar if there's no way to effectively store the energy? Was basically the idea.

Tell me: Was he close to the mark?","2019-04-30 14:35:18","7","ender_wiggin1988","1747912893.571651","renewables now","manual"
"em5k6hg","t3_bj3fpd","bj3fpd","science","scientific","Hi there, and thank you for the AMA. I'm a primary school teacher, and my kids are currently studying forces, electricity and gravity. They have done investigating on these phenomena, and tried to come up with a solution to a real life problem that relates to them. We then try to solve that problem in theory by studying the science behind it, and build an imaginary business model around it.

A group of girls were interested about a potato battery experiment they saw on a YouTube-video as they were doing their research. I've tried to help them as much as I can, but a question I can't answer them yet is as follows; How many potatoes would it take to produce enough power to power up a household, or even a fully fledged potato powered power plant (that's their company)? This is the question they are trying to answer with their research. On Friday we'll see what kinds of readings can we get from a potato if we hook it up with copper and zinc plates. I know we could probably do the math based on the readings we get, but it'd be also be a cool experience to get an answer from a real scientist. Thank you!","2019-04-30 17:38:00","7","iFius","1747912893.572959","renewables now","manual"
"em5kl98","t3_bj3fpd","bj3fpd","science","scientific","Seems like this panel is loaded! 

Would be really curious what are the current trends in terms of increasing capacity / performance and how close are we till we reach the limit with the current technology.  Also would love to hear what are we currently experimenting with (materials/technology) 

Thanks!","2019-04-30 17:42:18","7","Tonychosen1","1747912893.5737011","renewables now","manual"
"em5kop6","t3_bj3fpd","bj3fpd","science","scientific","Once electric cars become widely available, the general consensus is that they will be charged at night when people are home and asleep and with their own charger. How much more difficult will it be to provide storage when that goes exactly against the productive time of solar power? Do we have any assumptions for how our current energy usage will change and how capable battery storage can handle that?","2019-04-30 17:43:20","6","cited","1747912893.574481","renewables now","manual"
"em5ktdg","t3_bj3fpd","bj3fpd","science","scientific","How close are we to the next big breakthrough in battery power? Will graphene ever be used as a possible material for batteries?","2019-04-30 17:44:43","7","strife26","1747912893.5753589","renewables now","manual"
"em50rpj","t3_bj3fpd","bj3fpd","science","scientific","I am with you guys in noticing that batteries seem to power everything we do. I have a bachelors degree in mechanical/Aerospace engineering. What are ways I and others can get involved in the battery industry?","2019-04-30 14:15:32","6","Ky1arStern","1747912893.576288","renewables now","manual"
"em510i9","t3_bj3fpd","bj3fpd","science","scientific","Has there been any developments toward graphene battery technology and if so, how close do you believe we are to commerical use of the tech?","2019-04-30 14:18:16","5","SickenedVendetta","1747912893.576908","renewables now","manual"
"em51ci3","t3_bj3fpd","bj3fpd","science","scientific","For larger scale energy storage, are mechanical storage devices competitive? For storing excess energy from a wind/solar farm, are batteries far better than say elevating water (or a different mechanism-lifting weights, spring compression, idk) then letting it drain to recoup the energy?","2019-04-30 14:22:09","7","Surro","1747912893.577973","renewables now","manual"
"em51iyl","t3_bj3fpd","bj3fpd","science","scientific","What do you think about super capacitors? Do you think they will be able to replace ""traditional"" batteries in some markets?","2019-04-30 14:24:10","5","clever_cuttlefish","1747912893.578791","renewables now","manual"
"em5k0l5","t3_bj3fpd","bj3fpd","science","scientific","Hi guys, sorry if this maybe crosses over some content already covered. My view is that large scale energy storage implemented specifically for the purpose of grid management for renewable energy ie saving excess production for when production slows, these storage solutions should be as 'green' as the sources themselves.  

My understanding is that ion batteries deteriorate, become waste, and can pollute, and processes involved, such as those for the mining of the materials, can also have negative impact on the environment. 

Is there a big enough push for alternatives such as pumped hydro? Hydraulic hydro? Compressed air storage? Are there drawbacks, specifically with concerns to their being 'green', that are being overlooked?

Do you think ion batteries will one day be made redundant or do you think they will always prevail at the portable/small scale at least?

Cheers!","2019-04-30 17:36:20","7","[deleted]","1747912893.5799801","renewables now","manual"
"em50btw","t3_bj3fpd","bj3fpd","science","scientific","how close are we to carbon battery techbology?","2019-04-30 14:10:29","5","usparrow1","1747912893.5809221","renewables now","manual"
"em50hvz","t3_bj3fpd","bj3fpd","science","scientific","I read an analysis of the automotive industry suggesting that EVs will rival IC engines for range within 3 years and prices will drop well below IC vehicles due to cost reductions in EV components and battery technology. 

Are we really that close in range and cost for EV batteries, or were the authors leaning forward a bit in those projections?","2019-04-30 14:12:29","4","The_Write_Stuff","1747912893.581816","renewables now","manual"
"em50l1a","t3_bj3fpd","bj3fpd","science","scientific","Why hasn't John Goodenough won the Nobel prize yet?","2019-04-30 14:13:27","5","mrcchapman","1747912893.582637","renewables now","manual"
"em51bnk","t3_bj3fpd","bj3fpd","science","scientific","I know there are a variety of processes being worked on to increase energy density in batteries. A team working with John Goodenough, and (another, who I can't seem to place at the moment) have both made claims that their process will be able to produce big gains in batteries in the next decade. How do you see these claims in general / how should we set our realistic expectations for the next decade of commercially available batteries? Do you have any specific comments on which research groups seem to show the most promise?","2019-04-30 14:21:52","5","jesseaknight","1747912893.5835872","renewables now","manual"
