"id","parent_id","post_id","subreddit","tone","text","created_utc","score","author","scraped_utc","query_used","query_category"
"em5242i","t3_bj3fpd","bj3fpd","science","scientific","How long does it take to go from a scientific breakthrough in battery technology to that tech being used in our phones and cars? My (maybe incorrect) feeling is that it's quite long, so I was also wondering why it might be so long (if it is). 

Also, how many of those scientific breakthroughs turn out to be impractical for industrial scale production? What are the usual reasons? 

Thanks!","2019-04-30 14:30:46","5","Raktatata","1747912893.584476","renewables now","manual"
"eldozkn","t3_bffoat","bffoat","collapse","skeptical","Nihilist anarchists have been embracing our fuckedness and theorising about how to live despite it for a while now.

&#x200B;

for example, readdesert.org","2019-04-20 21:49:38","23","witchid","1747913319.752343","renewables now","manual"
"eldho3l","t3_bffoat","bffoat","collapse","skeptical","Wow, I suppose this kind of posts is why I still come to this sub. Thank you for your clear reasoning, honesty, and good spelling. I feel like printing this out and sharing with other people.

You pretty much summed up my opinion on ER, geoengineering, and populism, but articulated it better. I am somewhat less optimistic about the future of the "" inhabitable parts of the northern hemisphere"" as a lifeboat. But for the rest, spot on.

What is your website?","2019-04-20 20:25:51","21","disc_writes","1747913319.754266","renewables now","manual"
"elemkg3","t3_bffoat","bffoat","collapse","skeptical","Look, doing something is better than doing nothing.  Does anybody know exactly what's going to happen with the climate in the next few years?  No.  


Does it make any sense to keep polluting the Earth the way we have been for so long?  Fuck no.

&#x200B;

Is it better to have less emissions and pollution than we have now?  Fuck yes.

&#x200B;

It's really that simple.","2019-04-21 05:52:18","9","drbootup","1747913319.756125","renewables now","manual"
"eldeg7y","t3_bffoat","bffoat","collapse","skeptical","This is a great post. Thank you.

&#x200B;

I more or less agree with many things you've said. One thing I would add is that I think they have already been geo-engineering covertly, however not enough impact while hidden, it's merely slowing things down a bit (or perhaps it's just futile too and they know it, so maybe they know that's all they can do and already are doing - slowing it down)

&#x200B;

Maybe there are more extreme measures that could be taken in that regard, remains to be seen.

&#x200B;

I gotta agree that even XR is too behind on pertinent information to recognize that their demands cannot accomplish their fundamental goals - but add that their presence alone could lead to real, productive conversation about other things you've mentioned.

&#x200B;

I'm not sure whether to be for or against geo-engineering, but lean pretty heavily towards against.","2019-04-20 19:50:56","6","[deleted]","1747913319.758516","renewables now","manual"
"eldhkpv","t3_bffoat","bffoat","collapse","skeptical",">So there is now a stark choice before us. There is only one risky and remote chance to stop climate change now, and that is geo-engineering. Regardless of the fact it might have catastrophic unexpected side-effects, it is the only way. It is one of the options available. We may end up taking it, but that can only happen after a widespread acceptance of the true severity of the crisis. The other option is to simply accept we are in the early stages of an unstoppable mass extinction of species and a major die-off of humans, due both to catastrophic and irreversible climate change and a plethora of other human-created ecological disasters.

Great post, and I agree with the overall analysis. But I believe it is more likely we are going to end up with [A third option.](https://imgur.com/nV0Kgzz) (Pretend it doesn't say Mars though. More like the deserts of Ontario or something.)

We'll likely try geoengineering once we experience the loss of control in earnest, but how long can we keep it up with a civilization that is crumbling even without climate change?

I think the ecosystem, the climate and current civilization are all doomed. Doing anything effective on a planetary scale may simply be beyond our capacity.","2019-04-20 20:24:54","7","1-800-Henchman","1747913319.7609348","renewables now","manual"
"elefria","t3_bffoat","bffoat","collapse","skeptical",">But mostly because of a problem referred to as “The Tragedy of the Commons”. The global environment, including the climate, is a shared resource. It is in nobody's interest to use that resource in a sustainable way unless everybody else does too. And how the hell is that ever going to happen? It would require global co-operation on an unprecedented and unimaginable scale.

I learned this shocking fact just recently. The ""**Tragedy of the** **Commons**"" is widely taught and a bedrock concept for environmentalists. But did you know the man who wrote the landmark essay was a racist, eugenicist, nativist and Islamaphobe? -- plus his argument was wrong.

[https://blogs.scientificamerican.com/voices/the-tragedy-of-the-tragedy-of-the-commons/](https://blogs.scientificamerican.com/voices/the-tragedy-of-the-tragedy-of-the-commons/)

Centuries of capitalism have destroyed the communal respect that societies once had for the environment and the land once shared by everyone. You can read about that degradation here: [https://www.weforum.org/agenda/2018/01/we-have-plundered-the-commons/](https://www.weforum.org/agenda/2018/01/we-have-plundered-the-commons/)

All across the world, white colonizers commodified not only the environment (resources) and the land but also the indigenous people. As an example, [Australia](https://reason.com/2007/10/17/aboriginal-revisionism):

>*Before white settlers arrived, Australia’s indigenous peoples lived in houses and villages, and used surprisingly sophisticated architecture and design methods to build their shelters, new research has found….*  
>  
>*The findings, by the anthropologist and architect Dr Paul Memmott, of the University of Queensland, discredits a commonly held view in Australia that Aborigines were completely nomadic before the arrival of Europeans 200 years ago.*  
>  
>*The belief was part of the argument used by white settlers to claim that Australia was terra nullius – the Latin term for land that belonged to nobody.*  
>  
>*Few of the original buildings remain, because “local authorities burned or bulldozed the structures in the belief they were health hazards.*

There is another common delusion and that is that humans will get a second chance. Four of the last five mass extinctions were preceded by a disruption in the carbon cycle. What makes humans think they can outrun this one, especially when it’s happening at a rate 10 times faster than the Great Dying and in many more novel, human-forced ways? The only resource humans have that does not seem to have a limit is our ability to deny reality.","2019-04-21 03:48:44","8","xrm67","1747913319.7647429","renewables now","manual"
"elf58pp","t3_bffoat","bffoat","collapse","skeptical","Great Post

The XR people I know are not polyannas. 

Most would agree that we are almost certainly fucked. 

They tend to believe one or both of:

- the sooner people wake up, the less thoroughly fucked we will be, and/or
- as a matter of personal dignity, they would rather go down fighting than become one of those saying ""we are doomed, enjoy yourself to the max while you still can""

Naive optimism is not something I have ever seen in XR","2019-04-21 13:27:38","6","aparimana","1747913319.766284","renewables now","manual"
"eldh3i7","t3_bffoat","bffoat","collapse","skeptical","It is however much too confusing of a title","2019-04-20 20:19:40","5","ogretronz","1747913319.767008","renewables now","manual"
"eldl3j0","t3_bffoat","bffoat","collapse","skeptical",">The inhabitable parts of the northern hemisphere will become something of a lifeboat, which will sink if its borders are not ruthlessly controlled. There will be no room for political correctness when the reality of this hits home. The fact that the ancestors of white Europeans are disproportionately responsible for causing climate change is not going to justify allowing that lifeboat to sink.

So this is advocacy for The Wall?  


Anyway, there will be plenty of white European climate refugees: the Floridians, the Dutch, etc, etc.","2019-04-20 21:03:15","3","pietkuip","1747913319.7685828","renewables now","manual"
"eleelng","t3_bffoat","bffoat","collapse","skeptical","IT DOESN'T MATTER WHAT ANYONE THINKS.  ALL 3 POINTS WERE ABOUT WHAT PEOPLE THINK... IT'S TOO LATE FOR THIS CHARADE

WE HAVE TO DO 10 YEARS IN 50... STARTING NOW

DO IT NOW","2019-04-21 03:30:01","5","systemrename","1747913319.7699578","renewables now","manual"
"ele0nh1","t3_bffoat","bffoat","collapse","skeptical","This was well-written and a pleasure to read. I'm assuming that since you're in your 50's but came to these conclusions in your 20's, you never had children right?","2019-04-21 00:12:02","3","KeepGettingBannedSMH","1747913319.7712471","renewables now","manual"
"elfq01a","t3_bffoat","bffoat","collapse","skeptical",">I was forced to admit to myself that climate change was not going to be stopped, because there was never going to be sufficient political will to stop it. Why? Partly because of the psychology of the electorate: of ordinary human beings, including most of those who call themselves environmentalists. We just aren't willing to give up our modern standard of living.

To add to this -- it's actually impossible for many people to *keep living at all* without modern society.  

If I wanted to reduce my carbon footprint to as close to 0 as possible, I could buy a small homestead, grow my own food, and generate the tiny bit of electricity needed for heating and cooking with solar panels.  However, how many people can actually afford to buy a homestead, start a farm, and buy the equipment needed?  Most people are struggling just to pay bills month to month.   And if everyone did this, the land wouldn't support it.  Industrial agriculture and a dependence on fossil fuels for everything from fertilizer to transportation to support that industry, is what keeps everyone fed.  

People are born into a system up which they are dependent.  There is no practical way to disconnect.  It is a Matrix from which there is no escape, but the Matrix is also taking down the ecosystem that underpins all life on Earth.","2019-04-21 17:26:55","3","[deleted]","1747913319.773411","renewables now","manual"
"eldoqu7","t3_bffoat","bffoat","collapse","skeptical","So what career field would be good to enter for the foreseeable future to prepare? I'm currently in the military and looking at what to do when I get out. It's hard to decide with the futility of it, so now I'm thinking just do something to set myself up for the end.

Any advice?","2019-04-20 21:46:38","2","[deleted]","1747913319.774457","renewables now","manual"
"ele8fb0","t3_bffoat","bffoat","collapse","skeptical","The word lifeboat immediately brings to mind Linkola's lifeboat ""ethics"". I wouldn't necessarily call them ethics, just being realistic about the fact that people will be only looking after themselves once the chips are down.

But I agree with your assessment that the root problem is the way our society and politics are built. However, there definitely are solutions - or at least were, probably is a bit too late to try and implement them for any orderly societal transition.

Firstly, our states and politicians have failed to educate us. I'm talking about the necessity to have a totalitarian state levels of propaganda (though in this case it would be facts and science) flooding every nook and cranny of our lives.

Secondly - totalitarian states are necessary - or at least states where enlightened citizens determine the course of the future. Green parties have failed because they suck at politics.","2019-04-21 01:53:38","2","ChampionOfMediocrity","1747913319.776324","renewables now","manual"
"elemctk","t3_bffoat","bffoat","collapse","skeptical","1) geography is destiny  

2) energy is life  

willpower and ""culture"" are overrated.  These are the only things that actually matter.  Your behavior and culture is preset by geography.  

When energy exists, something will eventually use it.  If you leave chicken outside, bacteria will eventually digest it.  Until it's all gone and the germs are 99% dead.  If you leave fossil fuels underground, humans will eventually use them.  Until it's all gone and humans are 99% dead.","2019-04-21 05:47:43","2","kkokk","1747913319.777716","renewables now","manual"
"eles6gl","t3_bffoat","bffoat","collapse","skeptical","It's always kinda funny to me when people coming from either a reactionary or ""realist"" perspective take Europeans being _able_ to keep out massive-scale northern immigration as a given.

In our current political climate, most refugees are politically disenfranchised lower-to-middle class people from relatively poor countries in the global south, and it's true that at the moment, governments could exercise a high degree of control over their movement if they were able to muster the political will to do so. But the middle east, Africa, and the Indian subcontinent is also home to a bunch of very wealthy countries with large and powerful upper-classes, some of which are nuclear powers, and many of which are likely to _become_ nuclear powers in the not-too-distant future.

If things get bad enough that they want to get in, they will get in. Taking a hard line approach to immigration and ""political correctness"" - as you put it - rather than trying our absolute hardest to make sure the region remains to _some_ extent sustainable will, rather than being pragmatic, only ensure that global civilization ends a lot more swiftly and sharply.","2019-04-21 08:13:18","2","myopicmaid","1747913319.7795699","renewables now","manual"
"elesjng","t3_bffoat","bffoat","collapse","skeptical","The only thing that matters is energy density. The problem is one of energy density. Either we reduce every human activity by 90% or it's over. 

That's a mathematical fact.

Surprise: the only way to do that is nuclear or some fictional fusion future. And those solutions are far from perfect.

Solar & wind will.not.work.period.


ps.

I know a few people in ER, some of them have been racking up air miles like there is no tomorrow & have cabinets filled with clothing and than proceed to tell someone who's studies electrical engineering & environmental science what's what.

Shut your polluting face.","2019-04-21 08:23:58","2","[deleted]","1747913319.780908","renewables now","manual"
"eletk01","t3_bffoat","bffoat","collapse","skeptical","If people can't see it then they can't feel it! That's the main problem with Climate Change, because you look out the window and everything is he same...","2019-04-21 08:53:55","2","ruiseixas","1747913319.781853","renewables now","manual"
"elnacqi","t3_bffoat","bffoat","collapse","skeptical",">Shout it from the rooftops, my friends. We're fucked. Our civilisation is going down. The Holocene is over. Welcome to the Anthropocene.

Is it time to give up yet and party like it's all over?

That's not a joke question... 

I mean I sit here in London and watch another group punt the same shit, I did 25 years ago, about greenhouse gases and human extinction and get ignored. or make at best slow change. being unwilling or unable to do what would need to be done to force the issue. 

So can we face the fact the human race is doomed and enjoy what little time we have left. 

I think of throwing a monthly ""we are still here!"" party till we are not... it beats shouting into the void and hoping it will change a thing and not piss everyone off and push them further away from the environmentalists. As is happening in London. 

So why not dance and drink and screw, living each day as it's our last as some day it's gonna be for all of us...","2019-04-24 10:58:56","2","Drxero1xero","1747913319.7833989","renewables now","manual"
"eldn07o","t3_bffoat","bffoat","collapse","skeptical",">convince everybody to go vegetarian

This would not help. Vegetarians consume billions of animals per year and are a major part of the animal agriculture problem.

Everyone would have to go vegan to make a difference.","2019-04-20 21:26:34","2","Bandelay","1747913319.7856581","renewables now","manual"
"eldxc9p","t3_bffoat","bffoat","collapse","skeptical","Get rid if the 'even' from your title, it just doesn't sound right.","2019-04-20 23:31:37","1","[deleted]","1747913319.787018","renewables now","manual"
"eletj6b","t3_bffoat","bffoat","collapse","skeptical","Look, yes in all probability it is too late. We're already starting to see extreme effects of climate change and emmissions are at an all time high when we haven't seen the cumulative effects of all emissions to this point.

BUT that doesn't mean the right thing to do is just wallow in despair. We have to at least try, no matter the odds. I won't simply give up and say that all that makes this planet beautiful isn't even worth it. We have to try even it if seems impossible.","2019-04-21 08:53:15","1","33papers","1747913319.7883651","renewables now","manual"
"elf084t","t3_bffoat","bffoat","collapse","skeptical","> The point in admitting that techno-industrial civilisation is going to collapse is this: that is what the future actually holds, and the sooner we start preparing for it, the better. We need to prepare as individuals, as families, as communities and as nations.

...I guess delusion spares no one.","2019-04-21 12:02:35","1","gbb-86","1747913319.7894971","renewables now","manual"
"elgchd1","t3_bffoat","bffoat","collapse","skeptical","The XR is at least a *start* to what we need. Yes what they're asking for is ""too little"", but to get public support for the idea of peaceful rebellion you can't come out with the full truth of what's coming without shutting off most of the public. 

So in essence it's a demonstration that is attempting to show that withdrawing support from and actively resisting the current political/corporate system can have positive effects in both education of the public, and produce results.

We are definitely coming in for a very hard landing in the next handful of decades, and more and more people are going to begin to revolt in various ways to help their immediate circumstances (where it's easy to turn violent). XR again attempting to show that peaceful rebellion ahead of time can possibly get things done, although this remains to be seen. But with peaceful rebellion, we might get a say or choice in where to put our efforts. The choices are in how or if we choose to mitigate the damages coming. The collapse of society is going to be brutal, but the collapse of the biosphere is going to be unlivable... so we'd better start trying really hard to mitigate the 'unlivable'.

Society as it is now is definitely going away soon. Getting people to see this is hard, then getting them to really care is even harder. Because both steps are directly opposed to their interests. The brain has plenty of tricks to pull you into alignment with it's desires.","2019-04-21 22:03:13","1","TheMonkeyOfNow","1747913319.79131","renewables now","manual"
"elgsc25","t3_bffoat","bffoat","collapse","skeptical",">	I came out the other side of that process a changed person — somebody who had effectively given up on my own future. There is much more I could say about this, and how the course of my life was affected, but this article is not supposed to be about me.

Would you consider writing more about the ""personal"" dimensions of this? I'd be interested in reading that. I'm relatively new to all of this and I'm starting to feel as though it should change the course of my life more or less immediately. But I'm not yet sure how. Meanwhile, most people around me seem unaware or are dismissive.

So I imagine it would be useful (for me and also others in a similar position) to hear the overall arc of your 30-year experience and where you've ended up, what changed for you and what didn't, etc. If you are willing.

Either way, thanks for this post!","2019-04-22 01:43:47","1","[deleted]","1747913319.792566","renewables now","manual"
"ele5d18","t3_bffoat","bffoat","collapse","skeptical","We as a race will survive regardless. We always survive. Sure, billions may die, but people die every day. The point of this is that, come what may, humanity will likely survive because we evolved to survive in a world that was trying very hard to kill us. While it is true that apex predators are generally done in by nature, there have never been apex predators like us.","2019-04-21 01:12:33","-2","[deleted]","1747913319.793707","renewables now","manual"
"eles4cj","t3_bffoat","bffoat","collapse","skeptical","Shitpost. The truth of the matter is that the “Its too late” crowd wouldn't lift a finger to help the environment/stop self-destructing even if it wasn't too late. Excuses shmexcuses!","2019-04-21 08:11:35","-3","eyeandtail","1747913319.794645","renewables now","manual"
"eljd0mk","t3_bg947z","bg947z","collapse","skeptical","> We put them in zoos and they all go insane. We think we are helping them.

This is also a description of human civilization.","2019-04-23 00:38:58","109","AArgot","1747913385.2290602","renewables now","manual"
"elj9vf1","t3_bg947z","bg947z","collapse","skeptical","I hear you loud and clear. Intrested to know where you live? Yes we fucked it up with our big brains, and we're beginning to pay the price.  I live remotely in Australia and still see the night sky, insects, birds and life. But it's on the decline and fast. 

It's so hard to get people to understand the interconnected symbiosis of life, let alone an economic and political system that adheres to that truth. Only collapse will bring the change we need, but we may not survive it.","2019-04-22 23:57:05","46","happygloaming","1747913385.238354","renewables now","manual"
"eljat4o","t3_bg947z","bg947z","collapse","skeptical","“...we are going to die...”

Soon, by crop failure/famine brought about by a whacked out jet stream distorted in its flow by a melted arctic ice cap which will cause flooding or drying out in the American corn belt.","2019-04-23 00:09:20","24","[deleted]","1747913385.240364","renewables now","manual"
"eljtvis","t3_bg947z","bg947z","collapse","skeptical","I miss lightning bugs. :c","2019-04-23 04:24:48","19","Mediocre_Silhouette","1747913385.246346","renewables now","manual"
"eljd98a","t3_bg947z","bg947z","collapse","skeptical","The town I live in is so full of pollen it is hard to breath.  There was a thick paste on our car windshield making it hard to see.  It occurred to me that pollen is the male plant and it is trying to have sex.  Is this a type of sexual assault?  

I have seen at least four species of wasp in the last 24 hours.  2 species were exploiting the tulips in the community garden at the same time. There was a bumble bee and what looked like a honey bee or something related.  

This morning there was a cacophany of chattering bird outside my window at 5:00 a.m. I had been hoping to sleep in on my day off.  I think they are nesting in the mulberry tree again.  I am not sure which species they are.  They are the little gangsters that beat up hawks and crows.  Little song birds have a higher angle of attack. It looks like they pull out the tail feathers.  Sometimes they dive directly at the back.  I did see a hawk today but it was 10 miles away from here.  I think the raptors know to avoid my neighborhood.","2019-04-23 00:42:09","11","NearABE","1747913385.248582","renewables now","manual"
"eljo9hd","t3_bg947z","bg947z","collapse","skeptical","I've seen it here with the insects. We had a plague of wasps two or three years ago, they were everywhere, it wasn't just a local nest. Makes me wonder why. I think the wasps attack bee hives, but they also eat insect pests, not that it made much difference to our cherry slug problem.

Bumble bees were common here eight years ago, they were introduced and thrived, but they are now few and far between. Honey bee numbers are very low. I had one hive that lasted until the hot weather last year, it was a very aggressive hive. No hives now, I don't have time and I haven't seen much gum blossom anyway, I think it has been too dry.

I do know they spray monoculture forests here but I don't know what with or how often, I did read that spraying was mainly in response to beetle outbreaks. I know the heat and dryness is killing trees - when the trees get stressed the borers set in, so they probably ramp up spraying as a result. Less rain falls to wash it all away, so the river life probably gets hit.

Outside the Hobart estuary they have allowed yet more salmon farms. I saw a doco that said a medium-sized salmon farm produces the sewage of a city of 50,000 people. Dunno if this is true, but if it is, yeezuz ...

In the northern hemisphere seabirds have disappeared where they they are hoovering up all the sand eels for fish-feed meal. Bit of a coincidence.

It's all a perfect storm upon nature.

Dinosaurs survived 180 million years before being hit by a comet. Industrial civilisation, in 300 years, became the comet.

Nonetheless, one must retain some hope. People have to have jobs or a means to pay their bills. Any solution to the anthropocene must take this into account.","2019-04-23 03:02:40","12","[deleted]","1747913385.251651","renewables now","manual"
