"id","parent_id","post_id","subreddit","tone","text","created_utc","score","author","scraped_utc","query_used","query_category"
"dbm6q35","t3_5k8txw","5k8txw","collapse","skeptical","There is no should have and no purpose to either evolution or the universe. You're pretty fucking arrogant and stupid (human) to suggest that humans, the species destroying their stable biosphere for ever more consumer goodies, has  evolved to overcome anything. Humans are a primitive reward seeking lifeform. There is no evidence for any purpose. Hell just going by their actions, I would say the humans evolved to mindlessly degrade energy. No meaning. No purpose. Not stopping or slowing and not going to be around at 2100. Merry Fucking Christmas","2016-12-25 16:43:43","24","[deleted]","1747864603.27217","renewables now","manual"
"dbm7st7","t3_5k8txw","5k8txw","collapse","skeptical",">No matter how beautiful the creations of nature have been in the past, their struggles for survival have always been in vain. Something was always going to wipe them out eventually, and there was nothing they could do about it.

If survival of extinction level events is a measure of success, there are some organisms that have us beat hands down. I'd put my money on tardigrades over humans.

Evolution happens by a roll of the dice. Random mutations in DNA. A mutant that has increased chance of survival is more likely to survive. Somewhere, a proto monkey mutated resulting in a larger brain, and it had access to the omega 3 fatty acids (DHA) required to build out that brain. This boost of intelligence granted that monkey a better chance of survival and it's DNA propagated. Every successful mutation increases the chances of DNA propagation. The turtle has it's shell, the lion it's claws, the cheetah it's speed, the human monkey it's brains. At first glance, it seems that intelligence is the ultimate roll of the dice, the trump card of humanity; and yet the lowly tardigrade has a better chance of propagating it's DNA for longer than the human. We have the same purpose as any animal, which is to propagate our DNA. The thing that sets us apart is our intelligence. We are here to exploit our gigantic noggins in order to procreate and propagate our DNA. We are animals. Whether we have evolved to survive the next extinction level event remains to be seen.

Plants and algae both generate and consume oxygen. When it's dark, they switch from producing oxygen, to consuming it. I don't know the ratio off the top of my head, but I'm idly wondering if a supervolcano or large asteroid pushed enough ash into the atmosphere, if oxygen levels would drop drastically as plants and algae became net consumers of oxygen. 

My wife has brought me a meal, I must go, but I always enjoy your posts.","2016-12-25 17:16:09","13","humanefly","1747864603.277141","renewables now","manual"
"dbml8u6","t3_5k8txw","5k8txw","collapse","skeptical","I hope that we can survive but I'm afraid that exponential function will catch us off guard but even if we do I doubt we will be able to reboot industrial civilization to reach other planets.","2016-12-25 23:38:55","7","oskosan","1747864603.279375","renewables now","manual"
"dbmq3sd","t3_5k8txw","5k8txw","collapse","skeptical","But, you as a human are an animal. 

Forgetting that got us into this mess. ","2016-12-26 02:02:01","3","[deleted]","1747864603.281465","renewables now","manual"
"dbmtrze","t3_5k8txw","5k8txw","collapse","skeptical","Unfortunately I don't think evolution alone can ever evolve a truly sustainable lifeform on its own. We are intelligent enough to exploit our resources, but not intelligent enough to have limits on it. I'll say that human civilisation will survive (as opposed to human species) when we get sustainable. Till then, all known communities consisting of all known animals are NOT survivors. Individual animals may survive, but that's no fun at all.","2016-12-26 03:51:23","3","huttimine","1747864603.284034","renewables now","manual"
"dbn1m2y","t3_5k8txw","5k8txw","collapse","skeptical","To take the devil's advocate,

The Dodo's purpose as a species was to survive as well.

Tell me again what their global population is?","2016-12-26 08:57:52","3","Milkyway_Squid","1747864603.2855942","renewables now","manual"
"dbmdyvg","t3_5k8txw","5k8txw","collapse","skeptical","I stand with you.  It's not arrogance to claim we can survive.  It's a call to action.

I think many areas on earth will be suitable for shelters as long as they have solar irradiance and reliable water.  DIY oxygen production may be possible with a greenhouse.  Reversible CO2 sorbents and O2 sorbents (functioning like artificial hemoglobin) may be able to buffer the air.  Oxygen gear will be needed for emergencies and wiring outside the stabilized enclosure.

Food is a problem. It can be stored to get a head start.  It can be grown but meeting the caloric needs of contemporary humans at photosynthetic efficiency within an enclosure will very challenging.  There should be ways to convert electrical energy directly (""electrosynthetically"") into food.

The lower the tech level the better, and the more deployable the better, as that will allow more humans to survive.

Do you see ocean eunixia as inevitable?","2016-12-25 20:13:48","2","Whereigohereiam","1747864603.2879648","renewables now","manual"
"dbmws5n","t3_5k8txw","5k8txw","collapse","skeptical","I don't subscribe to either side of this debate, or the debate itself, really. 

A lot of edgy thinkers on here like to courageously spit venom at the entire human race, presumably including themselves, in defense of perhaps Gaia the earth mother or something.  I guess it's really intellectual and evolved to denounce your own species.  I'm not really sure how the accounting works.  How many human babies is a kangaroo worth?  Couldn't tell you, but to me the solution is simple.  Go bury yourself in a composte heap in the backyard and blow your brains out.  No?  Okay, I guess you're just along for the ride with the rest of us.

On the other hand, I couldn't care less about the long term survival of the species.  Like any other human, I care about myself and the people in my little tribe.  I try to do right by others.  I like to understand things and explore the nature of existance and it's cool to think about what may or may not happen in the future, but deep down do I really care if some group of people survive in a bubble 300 years from now?  Nah.  I mean, it's kind of cool to think about some possible future of space faring humans and all that, but I don't feel any deep, meaningful imperative to ensure the continued evolution of the species.  

I think it's certainly good to at least try and reduce your impact on the environment, not have a kid, or multiple kids at least, not drive a car, not eat beef, etc.  And I think it's certainly good to think about the well being of people far in the future.  I just think these philosophical exercises purporting to explain the rightful place of human beings in the universe are a load of bull crap.","2016-12-26 05:20:06","2","8footpenguin","1747864603.290996","renewables now","manual"
"dbne8fp","t3_5k8txw","5k8txw","collapse","skeptical","**You To Still Die One Day

Did You Forget About That For A Minute?**

.....

""WASHINGTON—Saying that despite the possibility you may have briefly been able to distract yourself from the incontrovertible fact by browsing the internet, hanging out with friends, reading, working out, or via some other diversion, sources confirmed Friday that you are still going to die one day and there is nothing you can do to prevent it.

Experts wondered if perhaps you had momentarily forgotten about that—forgotten that one day, you will be dead for all of eternity.

“At some point, you—the person reading this article right now—will simply cease to exist,” said numerous sources, who repeatedly emphasized that whether or not you’re considering your own death at any given moment has no bearing on its inevitability. “It could be today; it could be 70 years from now. The fact remains that one minute, you will be a living, breathing, conscious being with ideas and feelings and opinions and sensations, and the next, you will be nothing. Quite literally nothing.”

“And then that’s it,” experts continued. “Forever.”

At this point, sources asked if you had actually considered how long, exactly, forever is.

Numerous experts also explained to reporters how, after you have died, it will require only the most infinitesimally negligible portion of the ensuing span of time before everything you’ve ever accomplished, said, experienced, or felt is entirely forgotten—completely eradicated without even the smallest trace left behind.

Sources hastened to add that such a state of nonexistence is irreversible and will continue on infinitely, and questioned whether that was something you were currently contemplating.

“Just think—no matter how big or small or good or bad you perceive them to be, all of the choices you make during your life are, in the overall scheme of things, utterly meaningless,” sources said. “Because someday, your heart will stop beating, and blood and oxygen will no longer reach your brain, and every single memory and thought you’ve ever had will disappear and never, ever come back. That will happen to you.”

The same sources went on to question whether you fully perceived the inevitability of your own death, and not simply as a mere abstraction, but rather as the concrete, unavoidable, steadily approaching reality that it is. Indeed, these sources urged you to stop and look at your hands for a moment—really look at them, right now—and consider how they will one day rot away entirely—flesh, blood, cartilage, bone; all of it, completely gone—in the days and months and years and millennia after you have been fully and eternally extinguished from existence.

Expressing concern that you may have somehow been able to forget that you’re careening ever closer toward your own demise even while reading this sentence, sources reconfirmed that one day, you will be nothing and there will be nothing, and you will not even be aware that there is nothing.

“Are you thinking about that now?” experts asked. “Like, right now?”

Furthermore, sources added that even if you stopped reading well before this paragraph and never acknowledged the truths affirmed in this article, this would not, as if by magic, prevent you from one day being dead until the end of all time.

“It should also be noted that everyone you’ve ever known and loved is going to die, too,” experts continued. “Your mother will die; your father will die; your friends will die; your significant other will die; and so will every person you have ever seen or spoken to, or will ever meet—or never meet, for that matter. Just like you, they’ll all be gone, insensate unendingly forever and ever afterward. Have you thought about that recently?”

Experts concluded by noting that this will continue to be the case tomorrow, the next day, and every day after that until a particular day—which will be an actual, real calendar date in the future—when this inevitably happens to you. You.""

......

http://www.theonion.com/article/you-still-die-one-day-52183","2016-12-26 18:00:33","1","[deleted]","1747864603.2963881","renewables now","manual"
"dbmnuvr","t3_5k8txw","5k8txw","collapse","skeptical","Would you say that Nazi Germany invaded France to ""survive""? That the Europeans pillaged the American continent because their very existence was threatened?

We are not surviving, we are overindulging and we are being tyrants to the rest of the natural world because of our delusions and hedonistic drives. The world is not being destroyed, quite literally, because we are facing a threat from the outside and we are risking our existence otherwise. If you wanna see humans in a real state of survival, look for Amazonian hunter-gatherers and see how much their environment is really suffering. I am not claiming they are perfect, but hell they have a history of killing their extra children to maintain a sustainable population number.

Make no mistake, this shitshow was not caused by us reaching the earth's carrying capacity, and although it could be argued if 7 billion people would still face severe environmental constrains in a less technological civilization, the industrial complex is to blame, along with the capitalist notion of growth and the apathy it has created in the common person. Do you think any sane society would bring about its demise so quickly just because of plastic gadgets? I agree that in the long run, our survival would have been compromised by our sheer numbers, but this today is a case of the greed of the ruling classes and their indoctrination or enslavement of everybody else.","2016-12-26 00:54:13","0","[deleted]","1747864603.298957","renewables now","manual"
"dao76t0","t3_5fyv44","5fyv44","collapse","skeptical","I would encourage everyone here to be respectful and considerate.  As passionate as you feel about the issues discussed on this subreddit, it's important to realize that this information could be very helpful to someone who isn't handling it as well as you.","2016-12-01 21:39:29","1","babbles_mcdrinksalot","1747864655.5973198","renewables now","manual"
"dao4hns","t3_5fyv44","5fyv44","collapse","skeptical",">3. Earth won’t turn into Venus. Sometimes speaking about climate change, one compares Earth to Venus. Venus is hotter than an oven, has no liquid water, and nothing can live there. But Venus has an atmosphere ninety times heavier than Earth’s, made of almost pure CO2. That’s 90,000 times more CO2 than even a greenhouse Earth. So trust me, if you didn’t know, we can’t turn Earth into Venus.

>We also can’t reach the irreversible “moist greenhouse” state that has been posited as a similar end to life on Earth – not even if we burn all the fossil fuels.

Man, I hate this trope. The Earth won't turn into Venus. It's like asking your doctor what side effects this medication will have, and having him say ""Well, you won't just suddenly burst into flames.""

I mean, that's nice, but there's a whole range of options between here and there that are anywhere from unpleasant to fatal, and we're at risk of a lot of those, and we should probably talk about that.","2016-12-01 20:47:45","18","MrVisible","1747864655.601273","renewables now","manual"
"daoe6xc","t3_5fyv44","5fyv44","collapse","skeptical",">  For example, the explosive growth of renewable energy has exceeded all expectations, and will allow us to shut off fossil fuel plants a little earlier, if we are willing.

No.

That's not the way it works. Not at all.

We've diverted a small portion of the energy we derive from burning fossil fuels as fast as we possibly can (I do think it is in many ways an end in itself - the shiny, plastic crap we seem to prize so highly is just some sort of byproduct - a token that validates our raw consumption,) into building some renewablez, but they're (seemingly deliberately) designed to be short-lived, even in operation are often reliant on regular (if not continual,) fossil fuel inputs, and will all wear out in a couple of decades anyway and need to be replaced with another round of (even more) expensive fossil fuel inputs and resource raping (if that's even still possible then.)

This will just give them one more excuse to keep the fossil fuels burning for longer.

The true solution is unappealing, but simply this:

Stop. Burning. Shit. Now.

All of it. Just stop.

Learn to live with less.

> The remarkable pace of innovation will have at least some effect on the shape and size of our carbon pulse – I do hope it is to the good.

Sadly it won't be, and can't be. It is precisely the ""remarkable pace of innovation"" and our incontinent industriousness that drives the destruction.

The only way out of this madness is to just stop doing this crazy shit. We should have stopped doing this crazy shit centuries ago (when we still could have without killing us all,) but we didn't.

But that's not going to happen until reality forces us to, because now we've ratcheted ourselves so far up the progress ladder, that we recognise that a fall from this height would kill us all (or at least a sufficiently huge proportion of us to make provoking collapse an unappealing prospect for the majority of sheeple,) and make life a good deal less comfortable for any survivors.

No, technology and progress and growth are not, and never will be the solution. They are the very crux of the problem, and the more of them we get, the fuckeder we inevitably become (and with us, all other life on this once magnificent planet.)

It is only fudging or discounting the costs and energy flows of our technological society that permits this delusion to persist that somehow we can beat the laws of thermodynamics.

But upvoted, because a lot of your other points are good :)","2016-12-02 00:39:34","17","[deleted]","1747864655.607182","renewables now","manual"
"daodptp","t3_5fyv44","5fyv44","collapse","skeptical","Good list, thank you!  I take it as a rejoinder to the hubris of ""knowing"" how bad things are going to get.  As things shade away from the hard science into social and psychological issues, the future becomes a lot less clear, and there's a line between being prepared (mentally, if nothing else) and borrowing trouble.","2016-12-02 00:09:27","8","[deleted]","1747864655.609335","renewables now","manual"
"daol28j","t3_5fyv44","5fyv44","collapse","skeptical","Thanks for posting this.  I hope you keep writing.  The more collapse-aware scientists actively writing and communicating the better!","2016-12-02 03:11:55","7","Whereigohereiam","1747864655.6105442","renewables now","manual"
"daouy1e","t3_5fyv44","5fyv44","collapse","skeptical","I appreciate the effort & sentiment but most of this is half truths or fortune cookie wisdom.

Some of us actually have some knowledge and experience in these fields. Viewed from that perspective, your post roughly reads like a bystander telling a mechanic he can repair the Ferrari 250 GT Spyder Convertible he just totalled with some gaffer tape & WD40 if he just stays positive.

He can't. There was only one ever made, he can't get the parts & and it wasn't even his car to begin with.
","2016-12-02 07:36:07","8","[deleted]","1747864655.6123478","renewables now","manual"
"daoka6s","t3_5fyv44","5fyv44","collapse","skeptical","""we can’t turn Earth into Venus"" challenge accepted","2016-12-02 02:54:29","5","[deleted]","1747864655.614202","renewables now","manual"
"dap0cai","t3_5fyv44","5fyv44","collapse","skeptical",">We are doing much about it. Our eleventh-hour fight against our CO2 emissions, while predictably late, is still massive and commendable. Science has laid bare the consequences, and politicians have finally listened. You may find the policy changes meagre, but they matter and they will grow. Also, we can’t deny that we’ve had a pulse of innovation including efficient and cheap renewable energy, power reduction of appliances, electric cars, “sustainable” building materials, and so on. It’s not enough to stop the warming, but it’s not bad.

This is just not factual at all, it is just hopium and speculation at best. There is no incentive for countries to stop deforestation, mineral mining, intensive agriculture and animal farming. The problem is not global warming because as you said those consequences are far away. The problem will be running out of fresh water sources and fertile soil, running out of oil and precious minerals to build solar panels and the such, also no oil=no infraestructure as a whole. Besides, the third world will continue to develop and increase its footprint and even if the developed countries suddenly become ""green"" (There is no such thing) the carbon footprint will be inherited by South America, India, etc. Sorry to break it to you, but there will be no miracle leapfrogging into clean energy.

I'd recommend you take a look at these articles. Renewables are a fantasy, as well as any form of sustainable development. The only way for us to stop being the cancer of our planet would be to ditch civilization as a whole.

https://lokisrevengeblog.wordpress.com/2016/03/31/collapse-data-cheat-sheet/

https://lokisrevengeblog.wordpress.com/2016/01/24/no-soil-water-before-100-renwable-energy/","2016-12-02 12:04:53","6","[deleted]","1747864655.6176589","renewables now","manual"
"dao5ux7","t3_5fyv44","5fyv44","collapse","skeptical","Good post. I appreciate the time and energy that went into this post; however, I still downvoted it as I don't agree with the vast majority of your points. Sounds like one of those typical pep talks about how things aren't as bad as they seem. They aren't as bad as they seem. They're worse.","2016-12-01 21:13:51","6","-_David_-","1747864655.6190221","renewables now","manual"
"daoxjdo","t3_5fyv44","5fyv44","collapse","skeptical","Thank you. Great submission.","2016-12-02 09:37:54","4","eleitl","1747864655.6213171","renewables now","manual"
"dapchmc","t3_5fyv44","5fyv44","collapse","skeptical","Preserve us from these 'minimizers'! Bad as I would like to take a whack at every debatable point in this piñata, let's pick only a few rotten cherries out of this plastic bag of fifty.

> Four: Earth has been here before

Yes, microbes and simpler metazoans do control the bulk of the Biosphere and may have caused seven or eight of the largest mass extinctions. But lacking intelligence and consciousness, at least they were not smug and dismissive about it.

>Four: Earth's life will carry on

Well excuse me for being ~~sentimental~~ nostalgic for this version of the Biosphere. 

> Eleven - Our animal companions will accompany us

So, you think you can guarantee the survival of a few dozen vertebrate species. Well, at least all of them are edible, and ingredients in established cuisines.

>Twelve: You won't live through it all

Yeah, what did posterity ever do for me.

> Thirteen through Eighteen

You seem to have no real conception of the scale, acceleration, or persistence of the catastrophe we face. 

>Forty Scientists need to scare people.

Sounds like Michael Crichton. No, scaring people is a quick path to professional suicide and even public ridicule, when your dire predictions fail to occur. The bias of scientists and engineers is to exaggerate the positive - synthesizing carbon nanotubes from atmospheric CO2, bio-engineering an improve photosynthesis, mining asteroids. File those away with the thousands of 'cures of cancer' that have been reported for decades. 


> All Fifty

Note to other essayists: to avoid composing so much twaddle, it is best not to set some arbitrary number for reasons for optimism. Are there really *Fifty Ways to Leave Your Lover* or *Fifty Shades of Grey*?

Once, when expounding my grim views of the human prospect on another Reddit site, I encountered a very thoughtful young person, who having just discovered the enormity of the approaching catastrophe, spoke of the futility of his life. Taken aback, I felt obligated to console (Me!) this person - you bear no personal responsibility for this, so back away from the subject, go on with your life, seek out the things that give you comfort, and try to make what meaningful contribution you can.

Feeling depressed about Collapse? Stop coming here and get yourself a subscription to *Wired* Magazine.

 
","2016-12-02 17:08:51","5","dead_rat_reporter","1747864655.6247559","renewables now","manual"
"daolzbh","t3_5fyv44","5fyv44","collapse","skeptical","Thanks for sharing this. ","2016-12-02 03:32:31","3","factczech","1747864655.6256058","renewables now","manual"
"daops8a","t3_5fyv44","5fyv44","collapse","skeptical","What do you think will happen to the 450 ish nuclear power plants and god knows how many spent fuel pools? The power plants need a steady stream of grid electricity, a shit load of water and a 24/7 crew of highly trained people. Back up power is a couple weeks of diesel generators at most. My understanding is it takes at least a decade to safely decommission and sometimes many decades and billions of dollars. Many of the power plants are on the coast - SLR. Some of the ones on rivers are having their rivers dwindle and there have been a number of cooling issues and it's only going to get warmer. Then there is the issue of irresponsible owners and politicians and captured regulatory boards. Many of the plants are past their due date and the same with spent fuel pools and they keep moving the goalposts and granting extensions. Seems like a nightmare waiting to happen - AGW, SLR and increasingly deluded and dysfunctional collapsing societies. And if peak oil hits then it's game over for many of those plants.","2016-12-02 04:56:52","3","[deleted]","1747864655.627894","renewables now","manual"
"daooz50","t3_5fyv44","5fyv44","collapse","skeptical","nobody is suicidal about collapse. Most likely, they have other pressures in their lives, and they turn to collapse as some kind of outlet. It gives their life meaning to think collapse is about to happen, and all this crap in their lives will somehow go away.

If you're depressed and coming to collapse as therapy, stop it. Go talk to friends/family/doctors/counselors. You shouldn't come here, it's not going to help you.","2016-12-02 04:37:17","2","[deleted]","1747864655.6294131","renewables now","manual"
