"id","parent_id","post_id","subreddit","tone","text","created_utc","score","author","scraped_utc","query_used","query_category"
"elj9to6","t3_bg947z","bg947z","collapse","skeptical","doesn't read very peaceful to me. 

i suggest dropping the doomsday and pick up green revolution now.

if nothing else, think of the children.","2019-04-22 23:56:25","12","earthdc","1747913385.253632","renewables now","manual"
"eljea09","t3_bg947z","bg947z","collapse","skeptical","I was doing some gardening today and saw a ton of spiders and a few different types of bees. I was pleasantly surprised to be honest. I dont see as many as I used to though.","2019-04-23 00:55:24","11","Donniedark00","1747913385.254745","renewables now","manual"
"eljp2h8","t3_bg947z","bg947z","collapse","skeptical","I like to go herping (finding snakes and other reptiles) for fun and other older herpers I know have seen a big and steady decline in species populations across the board. We've fucked things up irrevocably.","2019-04-23 03:13:35","9","rishored1ve","1747913385.256154","renewables now","manual"
"elk2q5g","t3_bg947z","bg947z","collapse","skeptical","Its not human nature, its capitalism","2019-04-23 07:26:15","11","[deleted]","1747913385.259424","renewables now","manual"
"eljbtwa","t3_bg947z","bg947z","collapse","skeptical","there's still birds where i live, but the insects were far greater 10 years ago.
There are still some places which are untouched, but they are quite hard to find. Life will evolve to consume plastics, as bacteria have already been observed to evolve to do so.
the policy i use to determine if it's too late is simple: ocean volume. if the oceans are not boiling away, then it (global warming) can still be reversed regardless of the timescale of warning.","2019-04-23 00:22:54","9","SerraraFluttershy","1747913385.260865","renewables now","manual"
"eljtw1j","t3_bg947z","bg947z","collapse","skeptical","\>  We put them in zoos and they all go insane. We think we are helping them. 

To be fair this isn't really an accurate description of zoos. I have a friend who volunteers at a zoo and a lot of the animals that are there wouldn't have made it out in the wild due to various circumstances. In some instances zoos are actually fighting tooth and nail to preserve a lot of species.","2019-04-23 04:25:02","8","[deleted]","1747913385.262167","renewables now","manual"
"eljsopu","t3_bg947z","bg947z","collapse","skeptical","this is our lament","2019-04-23 04:06:01","8","queenmachine7753","1747913385.2636778","renewables now","manual"
"eljtlka","t3_bg947z","bg947z","collapse","skeptical","and NO ONE is listening when told.","2019-04-23 04:20:19","5","sussinmysussness","1747913385.264894","renewables now","manual"
"eljw211","t3_bg947z","bg947z","collapse","skeptical","A few weeks ago I was in Tasmania and I was amazed at just how much wild life there was. Made me realize how much had disappeared elsewhere","2019-04-23 05:01:56","3","[deleted]","1747913385.2687528","renewables now","manual"
"elkdboo","t3_bg947z","bg947z","collapse","skeptical","What's all this ""we"" stuff? We all know that a select few run the world and most of us are cogs in the machine.","2019-04-23 11:55:55","3","[deleted]","1747913385.269429","renewables now","manual"
"elk2abg","t3_bg947z","bg947z","collapse","skeptical","I live in ATX I go out in the morning and ill see deer running around in big numbers through the park. I sat down for dinner by the lake  and saw a snake in the water. I see plenty of wildlife where I live I could keep going.","2019-04-23 07:14:42","2","PastaPalace","1747913385.270782","renewables now","manual"
"elk2peq","t3_bg947z","bg947z","collapse","skeptical","Hasn't happened where I live yet.","2019-04-23 07:25:41","2","runmeupmate","1747913385.272286","renewables now","manual"
"elk9k8w","t3_bg947z","bg947z","collapse","skeptical","Be brave! There's gonna be light at the end of the tunnel ... 

Another train heading right at us.","2019-04-23 10:40:45","2","[deleted]","1747913385.273184","renewables now","manual"
"elk9olf","t3_bg947z","bg947z","collapse","skeptical","I'm in southern Ontario, in a medium large city, in the suburbs

This week in our yard we saw: squirrels, birds (robins, doves, grackles, sparrows, chickadees, finches), a rabbit, a skunk, and a duck. There are ducks and geese everywhere.

I was alarmed a few weeks ago when there were no birds, but they are back now. A robin is making a nest on our porch light.

The insects are out too - tons of little fly type things (not sure what they are) as well as 4 butterflies!!!","2019-04-23 10:43:39","2","mk_gecko","1747913385.274322","renewables now","manual"
"elkcmll","t3_bg947z","bg947z","collapse","skeptical","I remember this is the first time I really started thinking this was an immediate concern

I went to one park every summer with my dog. I noticed every year it got quieter. Used to hear frogs, bugs, and birds in every direction. Now there’s just the occasional animal noise and you really gotta be listening to hear it.

It felt like that place died","2019-04-23 11:44:39","2","Dreadsin","1747913385.275311","renewables now","manual"
"elkftpu","t3_bg947z","bg947z","collapse","skeptical","I haven't seen a single honey bee in 3 years. I've been keeping track. I live in New Hampshire (northeast USA). 

I don't think we're going back to single-cell organisms. Rodents are extremely good at survival, and smart. And they can reproduce *extremely* fast compared to most mammals--which allows them to adapt quickly. They can survive almost anywhere, and they're very good at moving territory.

I'm imagining more ""Rats of NIMH"", than back to the Protozoic era.","2019-04-23 12:32:16","2","Cal1gula","1747913385.276317","renewables now","manual"
"elksphj","t3_bg947z","bg947z","collapse","skeptical","> Yes I cannot spell. I don't care. 

Two spelling errors, which may be typos, in 510 words. I'd say you're doing alright.","2019-04-23 15:00:34","2","64Olds","1747913385.277448","renewables now","manual"
"elkuvl5","t3_bg947z","bg947z","collapse","skeptical","Every time I have to take a paint brush to the little yellow flowers on my tomatoes, I die inside.","2019-04-23 15:23:09","2","Klowdhi","1747913385.278346","renewables now","manual"
"elkbd64","t3_bg947z","bg947z","collapse","skeptical","It’s the start of spring give it a few weeks and things will come back","2019-04-23 11:20:28","1","the_one_tall_guy","1747913385.2790651","renewables now","manual"
"elkdvb8","t3_bg947z","bg947z","collapse","skeptical","> Fill the land with cattle and destroy the delicate and beautiful ecosystem that took millions of years to create.

The indigenous people of North America had it right:  work with the land, not against it.  Cattle are not native to the Americas, and the ecosystem of this continent is not condusive this species.  Tell a cowboy-hat wearing redneck this, and they will give you the nastiest look imaginable, but that doesn't change the fact that you're right!  

The open spaces you see all in the west are **not for grazing cattle, you fucking idiot Ammon Bundy.**  That sociopathic clan AKA the [Malheur occupation was absolutely illegal and wrong](https://www.opb.org/news/series/burns-oregon-standoff-bundy-militia-news-updates/malheur-occupation-ends/).  I still cannot believe a bunch of imbecile jurors in my state let these armed militants off the hook.   

Buffalo are native.  The land has been prospering for tens of thousands of years with these creatures.  

But guess who killed all the buffalo?","2019-04-23 12:04:08","1","shawnee_","1747913385.2804081","renewables now","manual"
"elkfd7w","t3_bg947z","bg947z","collapse","skeptical","Compared to last spring, lots of bugs and birds. I'm in Sweden.","2019-04-23 12:25:58","1","[deleted]","1747913385.281322","renewables now","manual"
"elkh282","t3_bg947z","bg947z","collapse","skeptical","Im surrounded by bugs here because of our unusually warm winter which was thanks to our insanely humid and wet year in 2018.  Of course this means we are all good, let the polluting continue.","2019-04-23 12:49:35","1","drfrenchfry","1747913385.282252","renewables now","manual"
"elkndjw","t3_bg947z","bg947z","collapse","skeptical","I live in Southern, IN, and to be honest, I see tons of birds and bugs.","2019-04-23 14:03:55","1","[deleted]","1747913385.282864","renewables now","manual"
"ella77b","t3_bg947z","bg947z","collapse","skeptical","I live in a very rural area, too. I was just thinking this morning that there is a surprising dearth of rabbits and squirrels this year. I’m used to seeing them all over the place, including my local roadways, this time of year. This year I’ve seen maybe 3 squirrels, and no rabbits at all. I did find one large black snake in a tarp, as I was uncovering part of my old herb bed. I was pretty excited to see it. I always have been excited to find critters who have seen fit to live close to me. 

Possums have often come to my porch to look for my compost bucket. I hang it from a hook in my porch ceiling, but possums can climb up there and get right in the bucket and root around for snacks. (I don’t mind. I’m happy to see them!) This year, though, there have so far been none. 

I also haven’t heard the packs of coyotes yipping nearby like normal. I’ve been naively attributing this to a new neighbor who has loud dogs. 

And of course, as lots of people have noticed, there are few insects. Even at night. My property has fortunately been covered in butterflies and several varieties of bees, but I find myself wondering how many there are in this area. I suspect I’m one of very few people in my county who postpone mowing and who don’t spray pesticides. 

I live near streams, creeks, and rivers. I wonder how aquatic species are doing, and what the water quality is like, but I can’t bear to check. 

I do hear songbirds, but it isn’t the same cacophony I grew up with. I live in the woods, so there should be plenty, but.... Most of the birds I see are the scavenger species. 

:(","2019-04-23 17:59:50","1","DeleteBowserHistory","1747913385.284636","renewables now","manual"
"ellopd2","t3_bg947z","bg947z","collapse","skeptical","I am glad to say that I my observations are different. I live in a small town in Germany, I walked out of my house last Saturday at sunrise with my binoculars and saw 23 species of songbirds within an hour. Nature seems to be very resilient and can come back and thrive when good conditions are provided. Those who work to conserve as many species of plants and animals as possible, in the meantime until we come to our senses, are heros to me.","2019-04-23 20:29:53","1","Samantha_M","1747913385.2857978","renewables now","manual"
