"id","subreddit","tone","title","text","created_utc","score","num_comments","upvote_ratio","url","is_self","author","scraped_utc","query_used","query_category"
"52yvvv","collapse","skeptical","When do you think was the last chance for the world to escape the coming collapse?","Some say it was after World War 2, some say it was after the fall of USSR. Certainly no later than 1995.

The entire problem of the world can be simplified to one thing .. 7.5 billion (and counting) people trying to live the 'modern' life. 

Instead of making civilization advance and building colonies out of earth, a lot of resources were, and are, wasted on feeding and housing 6 billion+ people who are not very likely to add anything to the progress of human civilization.

Someone said Carter's decision to abandon nuclear breeders in the 1970s was fatal for Civilization;

https://ourfiniteworld.com/2016/08/31/intermittent-renewables-cant-favorably-transform-grid-electricity/comment-page-13/#comment-99717

In any case, the leaders of the world did nothing when times were better, and now it has become a desperate last dash to keep things going and continue human progress, which may or may not succeed.

When would have been the final juncture to turn things around before it has entered the point of no return? ","2016-09-15 22:44:51","3","60","0.58","https://www.reddit.com/r/collapse/comments/52yvvv/when_do_you_think_was_the_last_chance_for_the/","True","kulmthestatusquo","1747860152.144474","renewables now","manual"
