"id","parent_id","post_id","subreddit","tone","text","created_utc","score","author","scraped_utc","query_used","query_category"
"f2aqglx","t3_dcqmq9","dcqmq9","science","scientific","Genetic end-user and computer systems administrator here.  This conversation feels very similar to to other data security and ownership discussions and is especially similar to caring for biometric data used for computer authentication.  Rather than asking the question ""Who should have access"" I think one of the questions that needs to be answered is ""Who *could* gain access?"".  You need to assume the data will be retrieved by hackers or adversarial governments via search or seizure simply because the data has value.  

If a user password is compromised its something that be be disposed of and replaced, but that concept isnt possible with biometric data.  Due to this fact, biometric login data is typically encrypted at the device level so that the platform you authenticate against does not hold and can not get the bio-data.  The fact that companies like those that provide fast airport check-in aggregate biometric data is terrifying to me.

Using this idea that the genetic data is unable to be changed by the owner and has potentially catastrophic consequences if accessed by certain sources, you simply should not hold personally identifiable genetic data in a way you can access it.  In this situation a person who does a genetic study for medical reasons should not have their data stored in a manner accessible by the study holder after the study is complete.  A separate system with fully anonymised  data could be made accessible to researchers for broad study on a patient volunteer basis.","2019-10-03 15:29:02","2","kurbycar32","1747926623.147383","renewables now","manual"
"f2atb67","t3_dcqmq9","dcqmq9","science","scientific","I think if there is any monetary benefit from an individual's or distinct genetic subgroup there should be a percentage shared with the individual or group.

 The insulting breach of trust that happened with HeLa should never be repeated. 

I understand that you as individual researchers may have a moral compass regarding this but the people/companies who pay your bills certainly don't. I can just imagine someones genetic information that resulted in a multi billion dollar spin off industry getting skimmed and made anonymous 'accidentally' or the person in question gets occasionally invited to cut a ribbon somewhere and then has to go back to their slum and put a trophy of appreciation that cost six months of their rent next to a high-school bowling trophy or something.

 I want to be optimistic about this and I am excited for the future of genetic engineering and gene therapy but I feel like this will end up being a ""the meek shall inherit the earth but not its mineral rights"" kind of situation where massive multinational corporations just steam roll anyone trying to get any sort of compensation from their genetic data with lawyer team with a million dollar retainer. 

I think this is a terrible time to be an individual with unique genetic information that could be beneficial to society because the implications and practices of genetics is so far ahead of not only the general public, but the vast majority of lawmakers, that having a meaningful conversation about it is nearly impossible. Not to mention many companies who are involved in genetic research are not locked to one country and there are always hungrier economies with more lax regulations. 

In 25, 50, ? Years I think the fruits of this labor are going to be fantastic but I feel like a lot of people are going to get screwed hard in the process. It would be interesting to have a process where the intellectual property rights of an individual's genetic information are shared between the original source(person) and the discoverer for a set period of time. Although I suppose whats to stop you from just editing the gene sequence enough to make a similar but legally distinct analogue.

Tl;dr: I'm optimistic about the potential benefits of real world applications of genetic data but I have zero faith that the information will be handled ethically","2019-10-03 15:45:38","2","begaterpillar","1747926623.14956","renewables now","manual"
"f2ausmk","t3_dcqmq9","dcqmq9","science","scientific","Hi, as an U.S. healthcare provider this field is incredibly exciting, and I look forward to seeing how these technologies may benefit patients in the years to come. Obviously there are many issues as well like whether pharmaceutical companies could potentially gain access to or ""own"" parts of your genome with these therapies. I imagine in the future genetic data would be rolled into our existing HIPPA laws if they aren't already. Do you believe that these laws would be sufficient, or are there additional considerations that our current laws miss?","2019-10-03 15:54:04","2","soulsquisher","1747926623.1505542","renewables now","manual"
"f2b9q2g","t3_dcqmq9","dcqmq9","science","scientific","I haven’t done one of those genetic testing things for one reason, I know at some point an insurance company will buy the testing company and suddenly my health insurance rates will go up because they now know of something I may be susceptible to. Am I smart for thinking so negative of the world?","2019-10-03 17:27:00","2","[deleted]","1747926623.1513228","renewables now","manual"
"f2babnv","t3_dcqmq9","dcqmq9","science","scientific","Absolutely anything without explicit written consent directly from the owner of said DNA. Even if it's anonymous, it's still a massive violation of personal privacy. Would you want people to use your banking activatity for research or your child's daily schedule? Not only is it a violation of said individual it's also a violation against everyone closely related to then. It's disgusting what 23 and me and the other myriad of other companies are doing. If I had it my way I'd completely ban any public offering of DNA sequences from humans.","2019-10-03 17:30:38","2","Lou-Saydus","1747926623.1525261","renewables now","manual"
"f2bcz8y","t3_dcqmq9","dcqmq9","science","scientific","You should tell me about predisposition to illness. You should not share it with anyone or create hybrid goat people.","2019-10-03 17:47:03","2","VaginaFishSmell","1747926623.153366","renewables now","manual"
"f2be0ep","t3_dcqmq9","dcqmq9","science","scientific","What should be done is leave my genetic data alone. However, for the advancement of medicine and science, allow people to volunteer / get paid for to help the industry.","2019-10-03 17:53:25","2","CA_Voyager","1747926623.154321","renewables now","manual"
"f2by5c2","t3_dcqmq9","dcqmq9","science","scientific","Do whatever you want with mine.  Clone me of you want, although why you'd want to clone a 36 year old man who is underweight, has cystic acne and post concussion syndrome.  But hey,you do you","2019-10-03 19:52:17","2","molsonmuscle360","1747926623.155193","renewables now","manual"
"f2c37vf","t3_dcqmq9","dcqmq9","science","scientific","Make sure Gattaca doesn’t happen please.","2019-10-03 20:16:54","2","Mazetron","1747926623.1578639","renewables now","manual"
"f5szdjg","t3_dp6tu5","dp6tu5","sustainability","action-oriented","If this was a headline from 1983, then I'd be impressed.","2019-10-30 14:48:11","10","[deleted]","1747927422.346653","renewables now","manual"
