"id","parent_id","post_id","subreddit","tone","text","created_utc","score","author","scraped_utc","query_used","query_category"
"f2a5tlx","t3_dcqmq9","dcqmq9","science","scientific","Thanks for coming to talk with us!  The privacy issues you raise are relevant to pretty much every area of human existence (commerce, social media, policing....) . It seems likely that privacy models developed for genetics could be more broadly applicable. What do you think appropriate privacy protections and informed consent for genetic data should look like?","2019-10-03 13:22:54","315","asbruckman","1747926623.100518","renewables now","manual"
"f2acnft","t3_dcqmq9","dcqmq9","science","scientific","A week ago or so, someone linked me an article stating that upwards of 50% of our personalities are rooted in our genetics.  Though this study may not hold up, if that were true, could genetic screening for negative traits and subsequent gene therapy become possible, if not widespread in the future?

Will insurance companies ever be able to request a release of a person's genome, or of specific loci (again if this study is true), when offering auto insurance, life insurance, etc...?  I'm interested in your input because I hadn't even considered such possibilities until recently. 

 Personally, I think genetic information needs to be kept extremely private.  I cannot think of many positive things that could come from genetic information being made public, but again since this is so new I'd like to hear opposing viewpoints, if there are any.","2019-10-03 14:07:56","165","c_pike1","1747926623.10231","renewables now","manual"
"f2aa7az","t3_dcqmq9","dcqmq9","science","scientific","This AMA is being permanently archived by *The Winnower*, a publishing platform that offers traditional scholarly publishing tools to traditional *and* non-traditional scholarly outputs—because scholarly communication doesn’t just happen in journals.

To cite this AMA please use: [https://doi.org/10.15200/winn.157011.10655](https://www.thewinnower.com/papers/27408-science-discussion-series-what-should-and-shouldn-t-be-done-with-your-personal-genetic-data-who-should-benefit-we-are-researchers-and-advocates-who-are-working-on-new-models-for-dna-research-let-s-discuss)

You can learn more and start contributing at [*authorea.com*](https://authorea.com)","2019-10-03 13:51:08","133","redditWinnower","1747926623.103616","renewables now","manual"
"f2a903s","t3_dcqmq9","dcqmq9","science","scientific","Hi, thanks for taking the time to come talk to us about your work. Recently the [New York Times reported](https://www.nytimes.com/2019/10/02/us/dna-testing-immigrants.html) that the Trump administration is planning to collect genetic data from immigrants. As people that deal with this sort of information, what are your thoughts on this? How do you think this data will be used or misused? Do you think it will be a beneficial program or have more drawbacks?","2019-10-03 13:43:18","39","PapaNachos","1747926623.104736","renewables now","manual"
"f2a73ms","t3_dcqmq9","dcqmq9","science","scientific","Hi everyone and thanks for joining this discussion!

Are the genetic arrays used by most direct to consumer genomics companies dense enough to be useful for medical research? Especially medical research of minority populations and other groups whose genome is less well-known?","2019-10-03 13:31:11","37","helm","1747926623.105797","renewables now","manual"
"f2af7ri","t3_dcqmq9","dcqmq9","science","scientific","At the core we're addressing the need for a biotechnological bill of rights so we aren't always talking in reactive increments.","2019-10-03 14:23:07","38","QuestionSign","1747926623.106745","renewables now","manual"
"f2a4ym6","t3_dcqmq9","dcqmq9","science","scientific","Hi, welcome to today's [r/science](https://www.reddit.com/r/science) discussion panel! Like AMAs, the goal of discussion panels is to bring exciting, timely topics in science to reddit and have discussions led by subject area experts.

The difference between AMAs and discussions is that discussions will happen much less frequently and will always be led by a team of scientists so that we can hear multiple expert perspectives and answer many more questions. As with our AMAs, discussion posts will be posted in the morning to allow topics and questions for the panel to come in ahead of the panelists arriving to participate. Also, similarly to our AMAs our moderation of these events will be extremely strict, so please make sure you read and follow our rules in the sidebar. Thanks, and we hope you enjoy this new series!

If you have scientific expertise, please verify this with our moderators by getting your account flaired with the appropriate title. Instructions for obtaining flair are here: [reddit Science Flair Instructions](https://www.reddit.com/r/science/comments/5ivw50/do_you_have_a_college_degree_or_higher_in_science/) (Flair is automatically synced with [/r/EverythingScience](https://www.reddit.com/r/EverythingScience) as well).

**As a reminder, it is never ok to ask for (or give) medical advice on** [r/science](https://www.reddit.com/r/science/)**.**","2019-10-03 13:17:19","1","p1percub","1747926623.108583","renewables now","manual"
"f2a5gtw","t3_dcqmq9","dcqmq9","science","scientific","Thank you so much for being here today! Diversity in genetic research is a major area of interest for me. Can you elaborate on how your approaches will improve population diversity in genomics? How are you able to reach and provide access to genomic medicine to currently underrepresented groups with your model of research?","2019-10-03 13:20:36","22","p1percub","1747926623.1100302","renewables now","manual"
"f2a47xq","t3_dcqmq9","dcqmq9","science","scientific","One probably dumb question I struggle with:  How can something you leave behind everywhere you go be yours personally?","2019-10-03 13:12:27","20","mrbooze","1747926623.111393","renewables now","manual"
"f2a6v89","t3_dcqmq9","dcqmq9","science","scientific","I have mixed feelings about the use of the data for hunting criminals. We all want to see serial killers put away. But lately the push to go after women who may have been mentally ill as youngsters--giving birth in bad situations--is chilling to me.

And the current push to test vulnerable refugees is disturbing. 

I don't expect privacy at this point (I know we can almost all be linked through current public profiles), but what I want to know is how we can prevent the misuse of the information.","2019-10-03 13:29:43","20","mem_somerville","1747926623.112573","renewables now","manual"
"f2a7klo","t3_dcqmq9","dcqmq9","science","scientific","Hi and thanks for joining us today!

It's serendipitous that you're having this AMA hours after I've just spat into a tube and mailed it off to 23andMe. 

What do you see my freshly submitted genetic information being used for in the coming years? 

I realize none of you are affiliated with that specific company but as an industry, should I have cause for concern over security and privacy of my information?","2019-10-03 13:34:11","18","PHealthy","1747926623.113518","renewables now","manual"
"f2ag3af","t3_dcqmq9","dcqmq9","science","scientific","I've noticed a shift from pure science towards business regarding DNA research. A lot of companies claim to not sell or share the DNA data you submit when you pay for lab work, but what is stopping them from selling the meta data produced from the analysis of and cross analysis with my personal (non-genetic) information? In theory there is much more valuable data in that relation (meta-data) especially in the current world of targeted advertisement.","2019-10-03 14:28:19","11","Smellywinks","1747926623.114613","renewables now","manual"
"f2ait20","t3_dcqmq9","dcqmq9","science","scientific","I'd like to know if you guys have taken any steps to personally protect your own DNA, if so what were they?

Also, I have thought of a time where everyone's DNA is recorded or checked. For either medical reasons or ancestry reasons. I believe it could give good sociological insights and perhaps help build a better world. But under what type of world do you believe such a thing will come to pass(mass record of DNA data)? From my understanding science fiction seems to believe such a time period would be rather dystopian. I guess I'm asking what is your imagination/ideal dream of the future of DNA record keeping is?","2019-10-03 14:44:25","12","diff2","1747926623.1158028","renewables now","manual"
"f2agchx","t3_dcqmq9","dcqmq9","science","scientific","Hi, former lab rat in a genetics lab and current bioethics student here. One thing that concerns me is data security. Even ""anonymized"" and stripped genetic data can still be used to identify the DNA donor or a possible collection of donors. (https://www.biorxiv.org/content/biorxiv/early/2019/01/26/531269.full.pdf.) 

On a different note diversity of research is important, especially when addressing research inequality. The company 54gene is certainly helping to address this issue, but huge gaps remain in other populations, especially populations that are nomadic or with a justified fear of goverment/science.

One last question. What are your thoughts on nebula genomics business model? I am skeptical that it increases donor interaction with their data, I am concerned that participants in their program can see have their data used in a predatory manner. Although it is an 'anonymous' program genotype-phenotype relationships are important, companies may want more interaction with the owner of the DNA. Interactions that cannot be anonymous.","2019-10-03 14:29:49","9","[deleted]","1747926623.117507","renewables now","manual"
"f2adsbe","t3_dcqmq9","dcqmq9","science","scientific","The question you pose is poignant but goes way further than just genetic data. Any information that you semi wittingly leave for others to use to their advantage (companies, especially insurers, and governement agencies) may be used against you. That also goes for all the meta data that are generated by your car, phone, computer etc. The benefit should be for society, without the possibility of individuals suffering for their candor. Of course that is easily said...","2019-10-03 14:14:37","8","woodmeneer","1747926623.118613","renewables now","manual"
"f2agcc8","t3_dcqmq9","dcqmq9","science","scientific","The one to benefit should be only the owner of the genetic data. If allowed, genetic data should be used for the general good of the species. Profit of third parties should be out of the question.","2019-10-03 14:29:47","6","Gebbetharos2","1747926623.119272","renewables now","manual"
"f2ae4ic","t3_dcqmq9","dcqmq9","science","scientific","Much like my digital data why should I trust my genetic data won’t be abused in the same manner. Sold to the highest bidder etc","2019-10-03 14:16:39","6","[deleted]","1747926623.120673","renewables now","manual"
"f2aiupm","t3_dcqmq9","dcqmq9","science","scientific","I honestly feel that giving your genetic data to private companies (like many ancestry tracking companies), is quite dangerous because there are currently not laws restricting what these companies can and cannot do with your genetic data. In an age where your search data etc is sold to so many companies, I would hate to also have my genetic material taken out of my control as well. 

As somebody with a rare genetic illness I would not mind genetic data being given for research purposes but I would hope that it would be destroyed afterwards because I would not feel comfortable with my genetic information being used in other experiments etc which I have not explicitly signed up for. 

I would love for there to be more research into my genetic illness but if my own genetic data were to be used, I would want to give consent on which research projects that it could be used in. 

Whilst eugenics have an incredibly bad name (I'm Jewish so I get why there's criticism), but it would be great in the future if I were able to have children without running the risk of them also inheriting my illness.","2019-10-03 14:44:41","5","nightfevernewton","1747926623.12232","renewables now","manual"
"f2a9k7g","t3_dcqmq9","dcqmq9","science","scientific","I have a question for u/Yaniv-Erlich- I'm really interested in family histories and pedigrees. From what I can tell, your approach doesn't actually construct an exact family tree or pedigree (which captures not just the distance of relatives but their exact relationship), but is more like a big graph of pairwise relatedness, is this right?","2019-10-03 13:47:00","5","DoShitGardener","1747926623.123292","renewables now","manual"
"f2agwk6","t3_dcqmq9","dcqmq9","science","scientific","Is it a realistic concern to worry about the weaponization of these large databases of genetic info to target specific individuals or groups? If so, is there anything that can be done to slow or prevent this from happening?","2019-10-03 14:33:03","4","[deleted]","1747926623.124223","renewables now","manual"
"f2aksom","t3_dcqmq9","dcqmq9","science","scientific","I don't mind sharing any of my DNA. I rarely get sick unless I'm around cats. I know I have one gene that promethease literally said ""resistance to multiple diseases"", but it's not super rare amongst the European population, but it includes malaria and that would be nice if it could help with that sort of thing.  I also have one or two for my liver or whatever to be able to process alcohol(more like acetaldehyde) like it's nothing as long as I'm getting good nutrition, so that might not hurt for people in danger of cirrhosis.

Then again it would be pretty crazy if the military took a few myostatin modifying genes and created super soldiers.

Anyway, I think the more gene info out there the better, then AI can really get down to the nitty gritty and we could solve some big problems, except for overpopulation, but ya know.","2019-10-03 14:56:03","5","brucekeller","1747926623.1257012","renewables now","manual"
"f2axgby","t3_dcqmq9","dcqmq9","science","scientific","As an autistic person I have real reservations about testing for autism resulting in genocide via prenatal screening. I don't see my condition (co occurring diagnoses aside, I acknowledge there are autistic people with additional conditions such as apraxia who will not agree) is as limiting as it is liberating for me *if others would accept my limitations and not constantly try to push me past them*. I'm very much otherwise happy, healthy, and deserve to live with my unique neurology. 

The downs syndrome community also has issues with this.

What responsibility do science and research have to keep from eliminating genetic variation from the human gene pool?","2019-10-03 16:10:39","5","X_none_of_the_above","1747926623.1270201","renewables now","manual"
"f2agz12","t3_dcqmq9","dcqmq9","science","scientific","Genetic data should be used for the benefit of individuals and of humankind. No one should be allowed to profit from it. It should not be used to segregate people.

I've had my DNA sequenced by 23andme and some of the assumptions they make about who you are, are wrong. So, I think a person's genetic information should be private to prevent incorrect assumptions based on your DNA.","2019-10-03 14:33:28","4","Azozel","1747926623.127955","renewables now","manual"
"f2ahhuu","t3_dcqmq9","dcqmq9","science","scientific","What is your opinion on the recent homosexual phenotype GWAS?","2019-10-03 14:36:40","3","dashtonal","1747926623.128683","renewables now","manual"
"f2aiee9","t3_dcqmq9","dcqmq9","science","scientific","i'm just a civilian, but my general feeling is the same about organ transplantation- if you expect to benefit you should be expected to contribute.

as long as data is in someway anonymised and kept from, say insurance companies, i think with the right advocates  this can be sold as a reasonable position to the public. a pooling of knowledge for the common good","2019-10-03 14:41:56","3","steepleton","1747926623.129708","renewables now","manual"
"f2ak16i","t3_dcqmq9","dcqmq9","science","scientific","Above all, the data from my DNA should not benefit big Pharma. I don’t want a repeat of what happen to the research from HeLa cells and countless other similar happenings.  Researchers from Universities and government grants should not profit from their research that has used public donated specimen and grants. (Former peon researcher here)","2019-10-03 14:51:34","3","francescatoo","1747926623.130688","renewables now","manual"
"f2alb8v","t3_dcqmq9","dcqmq9","science","scientific","I know the field of epigenetics is still young and highly-debated, but I’m not sure where the conversation on ethics lie. Especially now that trauma and the impact of Adverse Childhood Experiences (ACEs) on the brain is more deeply studied, studies on the impact of trauma (individual and intergenerational trauma) on genetic material could lend to ethical issues—especially in regards to ethnic minorities, but also other social minorities (LGBTQIA+ populations, identity-based victims of genocides, folks living in poverty, etc.).

How will we handle genetic information that could be perceived to predetermine the fates (medical, psychological, or otherwise) of these populations? How will we prevent further oppression based on genetic information? How will we empower folks who perceive trauma to negatively affect their genomic offspring (if that is indeed affirmed by science, which is yet to be seen though a growing number of people still believe it regardless)?

I’m not looking for a discussion on the validity of trauma-influenced epigenetic changes or even the severity of how the ACEs affect everyday life. Rather, I want to uncover how the ethical circumstances could negatively impact individuals and populations living with trauma, especially if it can be “seen” in genetic material—and then shared with others. How will we prevent its use for employment or education discrimination, but also use it to provide another layer/dimension of care for people who have lived with trauma or have families who lived through extreme trauma (the Trail of Tears, genocide, slavery, etc.)?","2019-10-03 14:59:05","3","dman0703","1747926623.1325061","renewables now","manual"
"f2b3l7v","t3_dcqmq9","dcqmq9","science","scientific","I just want to say thank you for trying to steer genetic science in this direction.

 I have Huntington's disease and am fearful of sharing my own genes because it isn't just my privacy affected, but everyone I'm related to. But I also feel strongly about  contributing to researching for treatments for this horrible disease.","2019-10-03 16:49:00","3","javamashugana","1747926623.133481","renewables now","manual"
"f2b66m3","t3_dcqmq9","dcqmq9","science","scientific","Will your genetic data eventually be sold to insurance companies so they can “perfectly” adjust your premium?","2019-10-03 17:05:06","3","[deleted]","1747926623.134634","renewables now","manual"
"f2bbd5g","t3_dcqmq9","dcqmq9","science","scientific","Genes should not be patentable in any way. For humans, or for food or livestock. This (Mother Jones)[https://www.motherjones.com/politics/2011/12/myriad-genes-patent-lawsuit/] highlights just some of the issues here.

There is also the issue of gatekept technology. With accessible food and medicine increasingly being seen as a human right, it's unethical to create crops that require proprietary insecticides to survive. We should be engineering food to be be more flavorful or nutritious. Instead food is engineered to machine money from farmers and the public at the expense of flavor, nutrition, and frankly the ecosystem as a whole. (Genetic modification doesn't have to mean monoculture but here we are.)

That's all tangential to the question you're asking, but it's an important illustration of what we need to prevent in the medical field. Industry wants profit. Health wants wellbeing. Those are fundamentally contrary goals. We could end up in a world where gene therapies are engineered to addict us to proprietary medicines for the rest of our lives when they could be made to work the first time.

The fundamental issue in medical ethics is economics. Full stop. Privacy is an economic issue. Ethics are an economic issue. The world is being ruined because people are allowed to profit from ruining it. If you want to fix ethics and privacy in your industry, you have to figure out how to keep the industry from profiting off of ethics and privacy violations.","2019-10-03 17:37:07","3","reedfriendly","1747926623.136348","renewables now","manual"
"f2af09c","t3_dcqmq9","dcqmq9","science","scientific","Hi, one aspect that is rarely analysed as regards the personal genetic data, is a)their publication in press (if you are famous) and b)their utilisation from private medical companies to increase the bills. For the latter, let me give an example: Let's assume I have a heart attack, I am transferred on time in a hospital (a private one) and I survive. If the private company that manages the hospital can prove that I was predisposed to die and they still managed to save me, they might want to charge for more.

&#x200B;

PS. It goes beyond saving that I utterly reject any acquisition of our data by insurance companies. Unfortunately, I am afraid that this will be the case in the future.","2019-10-03 14:21:56","2","BryndenRivers13","1747926623.137444","renewables now","manual"
"f2aft8j","t3_dcqmq9","dcqmq9","science","scientific","My question is about how much control (or say) do you guys as the scientist have in keeping whatever main company that owns our genetic information, from selling it for profit ?","2019-10-03 14:26:37","2","fiddynic","1747926623.138361","renewables now","manual"
"f2agzoh","t3_dcqmq9","dcqmq9","science","scientific","I’m so glad we’re having this discussion! 

I have Ehlers Danlos Syndrome, Hypermobility type which the gene hasn’t been identified for yet. I also had 23&Me and have answered 99% of their research questions. 

While I would usually be more hesitant to share info like that, I’m also pretty desperate to find the hEDS gene. I’m hoping one day crowdsourcing will do what the traditional medical avenues haven’t. Considering how many hEDS patients there are on disability, I really think everyone would benefit from that.","2019-10-03 14:33:34","2","bendybiznatch","1747926623.1395369","renewables now","manual"
"f2ahmlk","t3_dcqmq9","dcqmq9","science","scientific","It should be considered private and copyrighted property with any use of or ""viewing"" to require consent.

Who benefits?  Uncertain what is being asked.","2019-10-03 14:37:27","2","[deleted]","1747926623.14033","renewables now","manual"
"f2ai0xc","t3_dcqmq9","dcqmq9","science","scientific","What's the point of talking privacy when scientists aren't listened to in politics anyway?  None of this matters unless the scientific community seeks to change government policy on privacy.","2019-10-03 14:39:43","2","Quantum-Ape","1747926623.1414652","renewables now","manual"
"f2al5zy","t3_dcqmq9","dcqmq9","science","scientific","What do you think of platforms like [genomes.io](https://genomes.io) that are securing data and controlling access at the individual level? Do you think individual control of information is the way forward?","2019-10-03 14:58:15","2","genomesmark","1747926623.142289","renewables now","manual"
"f2alt8z","t3_dcqmq9","dcqmq9","science","scientific","Hello there! We are living in the the age of information, where a vast ammount of our personal data is already stored in some form and, while belonging to us, can still be used by 3rd parties ( I am looking at goverments for the purpose of my question ).

What are your stances on using genetic information of individuals for advancing the human species as a whole? 

Every now and then we see some news about a person being found with ""a rare blood trait that could cure X"". Is it possible that these traits could be found sooner and in greater numbers if goverments kept this information in a similar fashion they keep personal info? 

Also, could this information be protected in the way, if not better, as the info thr goverment keeps on their residents (like SSN or info on our IDs)?

Thank you for your time.","2019-10-03 15:02:00","2","LaksonVell","1747926623.143457","renewables now","manual"
"f2ao863","t3_dcqmq9","dcqmq9","science","scientific","If privacy isn't maintained, do you foresee a world similar to the film GATTACA where people are openly discriminated against because of their genes? I could definitely see health or life insurance companies denying or altering the rates of people with certian genetic markers that indicate that they're predisposed to having heart disease or something similar. Could we get to the point where employers make hiring/firing decisions based on the genetic data of their employees?

These ideas may be to the extreme (and probably a little fictional) but this is what my mind immediately goes to when discussing genetic data and privacy.","2019-10-03 15:16:07","2","AnonymousFroggies","1747926623.144541","renewables now","manual"
"f2ap2u3","t3_dcqmq9","dcqmq9","science","scientific","From what I understand, there has been bills that have been drafted about letting companies to be able to have access your genetic data that have tried to pass. 

Q: Do you think there is so much data that would need to be protected that a separate branch of government would need to be created? 

(The purpose of this government entity is to focus on being a middle man between consumer data/genetic data regulate the way companies use this data.)

Q: What benefits or innovation to the consumer do you think companies can provide if the data was provided?","2019-10-03 15:21:03","2","vinceod","1747926623.145697","renewables now","manual"
