"id","subreddit","tone","title","text","created_utc","score","num_comments","upvote_ratio","url","is_self","author","scraped_utc","query_used","query_category"
"85xxle","collapse","skeptical","I give up, folks","I can't comprehend how

1) science illustrates how we're on a path of doom

2) a small portion of the public doesn't believe it, elected officials don't care or are ignorant as well. 

3) nothing gets done about point 1).

You know? Our climate is doomed. It's not going to be habitable for us. That's not an assumption but backed up by facts and numbers.

I think democracy and neo classical economics are the paradigms that's going to bring this world down on its knees. Why? You can't have infinite 'growth'. Democracy? Don't let me laugh. It is an elite that rules us and makes policy. We're under the impression we're not, but we're run by elite. Disgusting ","2018-03-21 00:29:27","137","141","0.91","https://www.reddit.com/r/collapse/comments/85xxle/i_give_up_folks/","True","gergytat","1747883744.3274949","climate doom","manual"
