"id","parent_id","post_id","subreddit","tone","text","created_utc","score","author","scraped_utc","query_used","query_category"
"cx90h1b","t3_3tsxx8","3tsxx8","collapse","skeptical","It's not really the IPCC fucking us over. As /u/xrm67 says: It's humans. It's us. It's just how humans behave. 

I actually disagree with you that Paris will be seen as successful. One of the best ways to set climate policy back is to make it look weak and pointless. That's why Kyoto failed (besides W's pullout). You may remember 2009's cop was widely seen as a failure. Now, you have to ask what the agenda of the media is. It's certainly not to see the conference be a success. It is mostly the media keeping any climate change ""debate"" alive.

One of the biggest problems I see is that these agreements are voluntary. It's why the goals are never met. If there is no enforcement then these countries can just do what they want.  If the economy craps out then all the agreements will be going out the window. If you really wanted the goals to be met then you would need some kind of global authority that had enforcement power to force these countries to play by the rules. No such institution exists.
","2015-11-22 14:46:30","3","fatoldncranky1982","1747845210.2171314","sea level projections","manual"
"cx9lxzx","t3_3tsxx8","3tsxx8","collapse","skeptical","I watched a video by a scientist the other day who was also highly critical of the IPCC and the plan to simply cut emissions. He argued we needed to pull carbon dioxide out of the air down to below 280 ppm (or some such - it was somewhere in the 200s) or we risk extreme temperature increase over a millennium scale because of ocean turnover rates.

He said we could fix this with forest regeneration alone in a matter of decades. I lost the video - does anyone know who I'm talking about and how to evaluate his claim against the impossibility of pulling out 10 billions tons a year in the first video posted?

The scientist in the video had quite dire predictions - something like 17 or 22 degrees Celsius increase baked into the system now over a 1000 year scale.","2015-11-23 00:53:07","2","EntropyAnimals","1747845210.232502","sea level projections","manual"
