"id","parent_id","post_id","subreddit","tone","text","created_utc","score","author","scraped_utc","query_used","query_category"
"cwrrfg9","t3_3rvtqe","3rvtqe","science","scientific","I admit I don't understand this at all - are people supposed to avoid antioxidants when exercising?

And is there an ideal schedule for these intervals? I've seen people suggest everything from 15 seconds to 5 mins. Thanks.","2015-11-07 13:21:50","198","chimpscod","1747844866.464182","sea level projections","manual"
"cwrrn42","t3_3rvtqe","3rvtqe","science","scientific","I do intermittent fasting (up to 3 days each week) and continue to work out. It has been amazing - strength increasing and fat disappearing. Do you have any thoughts on fasting and if it acts as a stressor, like HIIT?","2015-11-07 13:33:20","93","matt2001","1747844866.4661822","sea level projections","manual"
"cwrrdpt","t3_3rvtqe","3rvtqe","science","scientific","Does the [7 minute scientific workout] (http://www.medicaldaily.com/why-7-minute-workout-works-high-intensity-circuit-training-331160) qualify as HIIT? ","2015-11-07 13:19:16","60","dilirst","1747844866.468182","sea level projections","manual"
"cwrrb28","t3_3rvtqe","3rvtqe","science","scientific","Hi Niklas,

I have a question : should antioxidants ,like vitamin C or E, be taken before, during or after exercises or is it better to not take them at all? Or should it be taken ""after burn effect"" subsides eg. 16-20 hours after workout?","2015-11-07 13:15:04","52","Bloomsey","1747844866.4701822","sea level projections","manual"
"cwrrdc1","t3_3rvtqe","3rvtqe","science","scientific","Are there differences between a HIIT cardio workout and a HIIT weights workout?  Or is it just HIIT workouts in general that are beneficial?","2015-11-07 13:18:42","52","skuttle64","1747844866.4721825","sea level projections","manual"
"cwrr7lw","t3_3rvtqe","3rvtqe","science","scientific","In light of your findings, what further research do you believe should now be done to improve exercise recommendations to the public?","2015-11-07 13:09:38","49","kapnkerrunch","1747844866.4741824","sea level projections","manual"
"cwrqw1w","t3_3rvtqe","3rvtqe","science","scientific","Science AMAs are posted early to give readers a chance to ask questions and vote on the questions of others before the AMA starts.
 

Guests of /r/science have volunteered to answer questions; please treat them with due respect. Comment rules will be strictly enforced, and uncivil or rude behavior will result in a loss of privileges in /r/science.


If you have scientific expertise, please verify this with our moderators by getting your account flaired with the appropriate title.  Instructions for obtaining flair are here: [reddit Science Flair Instructions](http://www.reddit.com/r/science/wiki/flair) (Flair is automatically synced with /r/EverythingScience as well.)
","2015-11-07 12:50:44","48","Doomhammer458","1747844866.4771821","sea level projections","manual"
"cwrsjfa","t3_3rvtqe","3rvtqe","science","scientific","Could you explain this in ELI5 terms? It would be great if you could give practical examples.  Do this: it is good for you. Don't do this because it is bad or doesn't work. Thanks. ","2015-11-07 14:17:40","32","english_major","1747844866.4791818","sea level projections","manual"
"cwrrapn","t3_3rvtqe","3rvtqe","science","scientific","I'm sure readers will be most interested in the benefits this training can give them, not in the causal factors that explain how it works. 

What's the overall benefit that HIIT brings? Muscle strength, cardio, heart health? 

I used this [7 minute workout](http://well.blogs.nytimes.com/2013/05/09/the-scientific-7-minute-workout/) last year and saw benefits to overall muscle growth, but I never thought I was burning much fat away or at all benefiting my ability to run a bunch. 

And to show I'm not a scientist, around my workouts, should I be avoiding anti-oxidents?","2015-11-07 13:14:32","32","mike-kt","1747844866.4811819","sea level projections","manual"
"cwrrnei","t3_3rvtqe","3rvtqe","science","scientific","For maximal ryanodine receptor damage, and subsequent leak, was there a measurable floor level of vitamins C&E dietary intake?  

I think it would be agreed that vitamins C&E are beneficial and necessary for a healthy body.  Though how much intake is enough to get the greatest impact from HIIT while avoiding negative effects of vitamin defeciency?

edit:: for those below, this is discussing the least amount of these vitamins necessary to allow the greatest training effect, so the opposite of an excess.  A goal of consuming less vitamins C&E to maximize training effect, but not so much as to negatively affect other bodily function.","2015-11-07 13:33:48","22","doubleweiner","1747844866.4831824","sea level projections","manual"
"cwrqzq9","t3_3rvtqe","3rvtqe","science","scientific","This AMA is being permanently archived by *The Winnower*, a publishing platform that offers traditional scholarly publishing tools to traditional *and* non-traditional scholarly outputs—because scholarly communication doesn’t just happen in journals.

To cite this AMA please use: [https://doi.org/10.15200/winn.144690.01009](https://www.thewinnower.com/papers/2926-science-ama-series-i-m-niklas-ivarsson-co-author-of-the-recent-why-high-intensity-interval-training-works-paper-ama)

You can learn more and start contributing at [*thewinnower.com*](https://thewinnower.com)
","2015-11-07 12:56:57","23","redditWinnower","1747844866.4851823","sea level projections","manual"
"cwrruxe","t3_3rvtqe","3rvtqe","science","scientific","Do HIIT workouts produce diminishing returns after awhile the same way doing the same lifting routine can be less effective over time even with increasing weight? ","2015-11-07 13:44:38","20","Geeoff359","1747844866.4861825","sea level projections","manual"
"cwrrb2a","t3_3rvtqe","3rvtqe","science","scientific","Exercise and diet are two realms of knowledge that fall victim to a lot of misconceptions and pseudo-science. 

Do you anticipate an increase in scholarly research concerning exercise and fitness? Do you think HIIT is here to stay or do you think it might be treated like a fad? ","2015-11-07 13:15:04","19","Enshaedn","1747844866.4881823","sea level projections","manual"
"cwrrrs5","t3_3rvtqe","3rvtqe","science","scientific","Your paper shows that the response to free radicals changes after HIIT. What do we know about the connection between this response to free radicals and:

1. Long term health
2. Athletic performance (for example, when are the free radicals a performance bottleneck in practice?)

Thanks!","2015-11-07 13:40:06","11","danielv134","1747844866.4901826","sea level projections","manual"
"cwrrcs5","t3_3rvtqe","3rvtqe","science","scientific","Should I avoid excessive vitamin C if I want to get the best results of my training? How much is too much?","2015-11-07 13:17:50","10","Unidan18","1747844866.492182","sea level projections","manual"
"cwrrnx2","t3_3rvtqe","3rvtqe","science","scientific","I have not read the study yet but release of calcium in the cytoplasm would cause increased transcription factors associated with mitochondrial development. From a nutrition standpoint would it make sense to routinely have a high antioxidant diet, berries, nuts , and leafy green vegetables
and a tums to sequester calcium intracellularly to produce the elements needed to get the most out of HI IT? It would be a jump start to the process. 
Likewise there are quite a few cardiac drugs that target calcium transport in the heart. Would low doses of these effectively increase mitochondrial development thus increasing metabolism?","2015-11-07 13:34:29","6","Gallifreyggle","1747844866.494182","sea level projections","manual"
"cwrscxf","t3_3rvtqe","3rvtqe","science","scientific","Hi,

Thank you for taking the time to do an AMA. I am interested in taking the other side of the debate, since I believe LISS and HIIT of are equal importance to improving health.

>The mitochondrial ROS production was mea-
sured with the fluorescent indicator MitoSOX Red in single FDB
fibers from sedentary control mice and mice that had free access to
a running wheel in the cage. The lat
ter mice performed voluntary
endurance training by running
∼
20 km each night for 40 d (
SI
Appendix
,Fig.S12
A
). The isolated fibers were activated with elec-
trical current pulses and a stimulation scheme mimicking the acti-
vation pattern during the all-out cycling bouts (six 30-s periods of
250 ms tetanic 100-Hz stimulation given every 500 ms with 4 min of
rest between the stimulation periods). At 5 and 10 min after the
simulated HIIT exercise, the MitoSOX Red fluorescence was in-
creased by
∼
200% in the sedentary control mice, whereas the in-
crease was significantly smaller (by
∼
80%) in the endurance-trained
mice

Do you think this and your findings that elite endurance athletes didn't have the same RyR1 fragmentation support that LISS can result in similar adaptations to HIIT?

In addition, what is the amount of antioxidants needed to take to simulate your 20mM concentration? assuming an extracellular fluid volume of 16L (12L interstitial + 4 L plasma), this would mean one would need to take **[87 of these NAC pills](http://www.amazon.com/Foods-Nac-Acetyl-Cysteine-600mg-Vcaps/dp/B0013OUQ3S)**, and assuming 10% bioavailability, more like 870 pills to achieve the same antioxidant concentration you exposed muscle to. **Did you do a lower concentration, and find that it had a lower effect? Did you feed mice an antioxidant and find that it also had no effect?**

Thanks!","2015-11-07 14:09:20","7","halodoze","1747844866.498182","sea level projections","manual"
"cwrrke9","t3_3rvtqe","3rvtqe","science","scientific","What else are the free radicals reacting with within the cell?

 Is there an increased likelihood/consistency with them only reacting with this calcium channel? 

Does the level of exercise relate to the concentration of free radicals, and, assuming that this is the case, does this offer a baseline for what can be considered high intensity training? ","2015-11-07 13:29:21","7","maxillz23","1747844866.4991863","sea level projections","manual"
"cwrrqea","t3_3rvtqe","3rvtqe","science","scientific","Hi,
I wanted to know who you wouldn't advertise this kind of training to.
I understand the appeal for athletes, due to the fact that it prevent them from having to jog for hours to get the heart going, but is it better for someone starting sports after a long break, or even starting sport completely, than for exemple going to the gym, or running/walking long distance?
Taking the case of someone whose goal is to simply get fitter, be it good looking or just less likely to wheeze to death after climbing 5 set of stairs.
Thank you for your time, and good luck on your thesis.

","2015-11-07 13:38:07","6","Sexygrizzly","1747844866.501186","sea level projections","manual"
"cwrrrct","t3_3rvtqe","3rvtqe","science","scientific","Very cool read! Thanks for doing this AMA. 

My question: Looking back now at your study, what are some changes you might consider making to the experiment to improve it? Or maybe there are other burning questions now that you have your results?","2015-11-07 13:39:29","7","BUDDZILLA","1747844866.503635","sea level projections","manual"
"cwrrynd","t3_3rvtqe","3rvtqe","science","scientific","Serious question, ISE or HIIT?
Why limit yourselves to high intensity only, there is significant evidence supporting moderate intensity interval exercise
Do you believe your results would be relevant to MIIT, if so at what intensity would you see diminishing effects?","2015-11-07 13:49:51","5","ReAvenger","1747844866.5057013","sea level projections","manual"
"cwrt0hc","t3_3rvtqe","3rvtqe","science","scientific","Can you dumb it down for the layman: From your research, what is the optimum frequency and duration of exercise/rest/exercise?","2015-11-07 14:38:52","6","Xuttuh","1747844866.5077214","sea level projections","manual"
"cwru6b3","t3_3rvtqe","3rvtqe","science","scientific","I am a weight lifter and I lift 4 times a week.  When should I do HIIT for maximum fat burning?  Right after lifting, same day later or non-lifting days?

What training do you recommend for maximum fat burning?

Thanks.
","2015-11-07 15:24:57","4","[deleted]","1747844866.5097213","sea level projections","manual"
"cwrv4q6","t3_3rvtqe","3rvtqe","science","scientific","1. There's presumably more to fitness than muscle density or power lifters would be excellent marathon runners? Does this really replace the need for the long run, given the necessary improvements in cardiovascular performance, which result in greater oxygen provision?

2. Existing science already tells us there are two broad types of muscle fibre (fast and slow twitch). Are you seeing results in both fibre types or just one?

3. To what extent is this merely a confirmation of the existing interval training done by runners like Lydiard involving track repetitions mixing pace, fartlek training etc. In other words, how much of HIIT is marketing spin for stuff that coaches have been talking about for years?

4. How much have you learned about the way results from an important, but fairly small study on specific chemical reactions are interpreted by society and the mainstream press by this experience?","2015-11-07 15:59:17","5","philipwhiuk","1747844866.5117214","sea level projections","manual"
"cwrs0q9","t3_3rvtqe","3rvtqe","science","scientific","1. Is there any reason simple strength training wouldn't work as well as the exercises used in the paper?

2. Do you think this interaction with calcium has anything to do with lactic acid and anaerobic metabolic buildup.

*Disclaimer; english as second language and no education in biomedicine*","2015-11-07 13:52:51","5","[deleted]","1747844866.5142605","sea level projections","manual"
"cwrsalf","t3_3rvtqe","3rvtqe","science","scientific","Would it be possible to develop a drug that could mimic the effects of these free radicals or perhaps target the ryanodine receptor in a similar manner? In simpler words, could this lead to a workout pill?","2015-11-07 14:06:12","4","[deleted]","1747844866.5152607","sea level projections","manual"
"cwrti1t","t3_3rvtqe","3rvtqe","science","scientific","Can you explain the effects of different interval and rest lengths?  Some intervals can be 20s, 30s, 1+ minutes, etc.  Same for rest periods.  What effect do different lengths have?

Also, it seems like there is a lot of misinformation on the internet about HIIT.  Some HIIT routines will be 30s of bodyweight squats, 30s rest, 30s situps, 30s rest, etc.  I am skeptical of these types of HIIT routines because I doubt the intensity will be there.  It seems like a lot of the benefits of HIIT come from the fact that it is so intense.  I usually do it on a stationary bike to ensure that I can give it 100% each interval.  Do these easier/less intense routines give the same benefits as a more intense HIIT routine?","2015-11-07 14:58:58","4","IAmDavidGurney","1747844866.5182605","sea level projections","manual"
"cwrsfw0","t3_3rvtqe","3rvtqe","science","scientific","Someone please xpost this to /r/fitness, they would love it.","2015-11-07 14:13:10","3","sheeku","1747844866.5192604","sea level projections","manual"
"cwrsv86","t3_3rvtqe","3rvtqe","science","scientific","Within the subset of Different HIITs workouts, is there a large (or slight) variance in effectiveness or is the difference negligible? ","2015-11-07 14:32:30","3","p0rt","1747844866.5209687","sea level projections","manual"
"cwrt736","t3_3rvtqe","3rvtqe","science","scientific","For weight loss, should I eat anything before and/or after a HIIT workout?","2015-11-07 14:46:35","3","ln00","1747844866.5229888","sea level projections","manual"
"cwrth0l","t3_3rvtqe","3rvtqe","science","scientific","I've seen mention of exercise like this contributing to faster aging. Is there any truth to this?","2015-11-07 14:57:48","3","[deleted]","1747844866.523989","sea level projections","manual"
"cwrtv0w","t3_3rvtqe","3rvtqe","science","scientific","Would you refer someone to Cross Fit workouts as a form of high intensity training? I feel as if Cross Fit workouts target all of the scientific evidence behind working out but that there's a stigma behind it that prevents people from actually taking part and utilizing the training program.","2015-11-07 15:13:04","1","maximus9966","1747844866.524989","sea level projections","manual"
"cwrv3ml","t3_3rvtqe","3rvtqe","science","scientific","Niklas - thank you for doing this AMA, and congratulations on your novel findings! I am a first year Exercise Physiology PhD student and I was hoping you could tell your adviser thank you, on behalf of the entire ExPhys field. 

Related to your recent findings, I'm curious as to your thoughts on the role of actively transporting Ca2+ back into the SR post Ryr leak. Theoretically, could the increased metabolic cost (ATP) of active Ca2+ transport account, at least in part, for the observed effects of your intervention?

In your opinion, what can we do to further our understanding of the effects of resistance training, aerobic training, or the mixture of both, on the human scale. 

Lastly, do you have any plans to attend any conferences in the states this year? Would love to talk more over a pint. 

Thank you again, all the best. ","2015-11-07 15:58:14","3","Joshua_trees","1747844866.526989","sea level projections","manual"
"cwrv6wk","t3_3rvtqe","3rvtqe","science","scientific","In the abstract it states the following:

>recreationally active human subjects performed highly demanding HIIT consisting of 30-s bouts of all-out cycling with 4-min rest in between bouts (≤3 min total exercise time). Skeletal muscle biopsies taken 24 h after the HIIT exercise showed an extensive fragmentation of the sarcoplasmic reticulum (SR) Ca2+ release channel, the ryanodine receptor type 1 (RyR1). The HIIT exercise also caused a prolonged force depression and triggered major changes in the expression of genes related to endurance exercise. Subsequent experiments on elite endurance athletes performing the same HIIT exercise showed no RyR1 fragmentation or prolonged changes in the expression of endurance-related genes.

Don't you think this is more related to the fact that elite endurance athletes have already achieved the majority of the benefits they can get from 30 second high-effort bouts on an exercise bike with 4 minutes of rest inbetween? I've never met an elite endurance athlete that *hasn't* been doing interval workouts for years, *in addition* to lower-intensity aerobic efforts, higher-intensity tempo efforts, etc., a la [Jack Daniels](https://en.wikipedia.org/wiki/Jack_Daniels_%28coach%29#Training_philosophy). It seems to me it's more likely than that they're simply at a performance level that can't be improved by *this particular interval workout*, or else elite endurance athletes all around the world wouldn't bother incorporating interval workouts into their training, which we both know is wrong.

It seems more to me like this study suggests that in under/averagely trained individuals, 30 second high-effort exercise bouts show more muscular improvements than those same bouts do in very elite individuals. Because the elite individuals have already gained all the muscular benefits they can achieve through such a workout, so they need to incorporate interval work differently, which they've been doing for years.","2015-11-07 16:01:23","3","Eibhlin_Andronicus","1747844866.530527","sea level projections","manual"
"cwrvtlr","t3_3rvtqe","3rvtqe","science","scientific","Does the effectiveness of HIIT suffer if one is to perform it in a fasted state? Such as immediately upon rising in the morning or if following an intermittent fasting diet?","2015-11-07 16:22:29","3","[deleted]","1747844866.5325274","sea level projections","manual"
"cwrwbck","t3_3rvtqe","3rvtqe","science","scientific","Your paper mentions that HIIT produces large amounts of free radicals that, ideally, would not be neutralized by antioxidants.

Does this mean that exercising this way could have implications as far as early-aging and/or cancer?","2015-11-07 16:38:23","3","killedbyhetfield","1747844866.5345275","sea level projections","manual"
"cwrwo1q","t3_3rvtqe","3rvtqe","science","scientific","So...all of the beverages that tout their ""anti-oxidant"" ingredients... could those be inhibiting the benefits of interval training?","2015-11-07 16:49:28","3","I_make_things","1747844866.5355275","sea level projections","manual"
"cws05iw","t3_3rvtqe","3rvtqe","science","scientific","Why was the explanation removed from this thread!?","2015-11-07 18:33:01","3","livingchip","1747844866.5365274","sea level projections","manual"
"cwrrfn8","t3_3rvtqe","3rvtqe","science","scientific","What positive or negative effects does activation of mitochondrial transcription factors have?","2015-11-07 13:22:09","2","[deleted]","1747844866.5385273","sea level projections","manual"
"cwrsg6y","t3_3rvtqe","3rvtqe","science","scientific","After reading your article my girlfriend pointed out that she was under the understanding that free radicals are not necessarily a good thing. Is this assumption correct and can you expand on what they do? And now that you have explained HIIT, do you recommend it?","2015-11-07 14:13:35","2","Secularnirvana","1747844866.5405273","sea level projections","manual"
"cwrsizv","t3_3rvtqe","3rvtqe","science","scientific","Does age factor in on the effectiveness of this training?","2015-11-07 14:17:08","2","target51","1747844866.5415273","sea level projections","manual"
"cwrso9w","t3_3rvtqe","3rvtqe","science","scientific","What about the effects of HIIT on the central nervous system?","2015-11-07 14:23:46","2","Th3MadScientist","1747844866.5425272","sea level projections","manual"
"cwrsv62","t3_3rvtqe","3rvtqe","science","scientific","Hi Niklas! Thanks for doing this AMA!

What is considered HIIT? I do 1-1.5 minute sprints and rest for a min, which I repeat for 6 times. I have seen some people do HIIT of various types and some last for 3 minutes. I have been wondering if that is too long to be considered HIIT since even at 1.5 minutes, my pace starts to wear off quickly and I am unable to keep up the high intensity. 

So I'm curious as to whether there is a specific work:rest ratio to follow when we are performing HIIT workouts to experience the proper gains.","2015-11-07 14:32:27","2","CircusManTheFirst","1747844866.5445273","sea level projections","manual"
"cwrsvxq","t3_3rvtqe","3rvtqe","science","scientific","so what kind of HIIT routine would you recommend to get this optimum basal Ca2+, & just wondering what you mean by mitochondrial improvements?","2015-11-07 14:33:22","2","birelbirel","1747844866.5455272","sea level projections","manual"
"cwrsx1k","t3_3rvtqe","3rvtqe","science","scientific","What common things containing antioxidants should be avoided then (green tea, wheatgrass juice?), and for how long before the workout?","2015-11-07 14:34:40","2","Turkishfigs","1747844866.5475273","sea level projections","manual"
"cwrtblp","t3_3rvtqe","3rvtqe","science","scientific","What is the difference between HIIT and HICT?","2015-11-07 14:51:44","2","manueslapera","1747844866.5485275","sea level projections","manual"
"cwrtd9b","t3_3rvtqe","3rvtqe","science","scientific","What are your thoughts on a program like Starting Strength or 5x5? I.e. Lifting weights 5 sets for 5 reps. ","2015-11-07 14:53:35","2","[deleted]","1747844866.5505276","sea level projections","manual"
"cxa2t4x","t3_3txns6","3txns6","science","scientific","What self testing protocols do you think would allow people to apply this knowledge to themselves instead of guessing half blind with things like elimination diets followed by reintroductions?

Would blood glucose be the primary test or should other metrics be involved? Also,  not everyone would like the idea of attaching to a constant monitor (which I assume is also pricey). What testing intervals would make the most sense? Every 20 minutes after a specific meal for 3 hours? ","2015-11-23 12:56:22","114","[deleted]","1747844885.288263","sea level projections","manual"
"cxa2koj","t3_3txns6","3txns6","science","scientific","Very cool paper guys.

I note that your algorithm predicts consistent alterations to the gut microbiota. Do you think you could do the reverse of this, i.e. alter someone's gut microbiota (e.g. with a foecal transplant) and predict the alterations to the glycaemic response? If so, do you think your model offers a rational approach to targeted microbiome alterations?

On a different note, I notice that your bosses are hosting/speaking at the upcoming Weizmann next generation immunology/microbiome [conference](http://www.weizmann.ac.il/conferences/NGI2016/welcome) - will either of you be presenting this data? (I'm waiting to hear back about a scholarship, if I'm lucky I might be there to hear it!)","2015-11-23 12:43:35","67","jamimmunology","1747844885.2997699","sea level projections","manual"
"cxa2qad","t3_3txns6","3txns6","science","scientific","Do there appear to be specific profiles or subtypes of responses to different foods, or do diets need to be completely individualized and tailored for each person?","2015-11-23 12:52:10","53","darbosama","1747844885.302497","sea level projections","manual"
