"id","parent_id","post_id","subreddit","tone","text","created_utc","score","author","scraped_utc","query_used","query_category"
"cxa328t","t3_3txns6","3txns6","science","scientific","* When you found diverging responses for a particular nutrient, how common were they? Would it be like 400 people responded one way and 400 responded another way? Or 799 people responded one way and 1 person responded differently?

* Do you plan to make your model publicly available? I understand you used gradient boosted regression trees, so releasing the model parameters isn't useful unless you publish them as PMML or something like that. Do you plan to give people access to your model via a webapp or something like that? Or a commercial product of some kind?

* Is there any way normal people can leverage the results of your study to improve their own diet without getting specialized testing for their own glycaemic responses? What is the takeaway for this study for normal people besides ""everyone is different?""","2015-11-23 13:09:18","40","shaggorama","1747844885.302497","sea level projections","manual"
"cxa2a94","t3_3txns6","3txns6","science","scientific","This AMA is being permanently archived by *The Winnower*, a publishing platform that offers traditional scholarly publishing tools to traditional *and* non-traditional scholarly outputs—because scholarly communication doesn’t just happen in journals.

To cite this AMA please use: [https://doi.org/10.15200/winn.144828.81618](https://www.thewinnower.com/papers/3007-science-ama-series-we-are-david-zeevi-and-tal-korem-graduate-students-at-the-weizmann-institute-of-science-and-authors-of-a-recent-study-which-showed-that-people-respond-differently-to-the-same-food)

You can learn more and start contributing at [*thewinnower.com*](https://thewinnower.com)
","2015-11-23 12:27:10","37","redditWinnower","1747844885.302497","sea level projections","manual"
"cxa2vao","t3_3txns6","3txns6","science","scientific","**Mod Message!**

Here is a **[video abstract](https://www.youtube.com/watch?v=Ryc5M3Ciytg)** for the paper that provides a great explanation. Or the **[original cell paper](http://www.sciencedirect.com/science/article/pii/S0092867415014816)**

If you're like to share the AMA on facebook, there is a post on the new **[/r/science facebook feed](https://www.facebook.com/sciencereddit/posts/905421472876726)**, and the now active **[twitter feed](https://twitter.com/RedditScience/status/668781691775905792)**.

Thanks again to Irena at Meta for helping to set this up!","2015-11-23 12:59:31","33","Surf_Science","1747844885.302497","sea level projections","manual"
"cxa2goq","t3_3txns6","3txns6","science","scientific","Which food had the most drastic difference between people?","2015-11-23 12:37:24","28","ematics","1747844885.302497","sea level projections","manual"
"cxa2t7p","t3_3txns6","3txns6","science","scientific","Hello, and thank you for doing this AMA! I am a graduate student studying the micro biome of honey bees, but I find any micro biome research compelling..So, I have a few questions for you:

Have you/ have you considered studying relationships between micro biome disruption (e.g. dysbiosis as a result of antibiotic use) and the onset of obesity, diabetes, etc?

What is your opinion on fecal transplant therapy as a way to manage PPGR, obesity, and diabetes? Do you think it could be effective, and you think that it would be more effective to manage diet than to directly manipulate the microbiome?

Thanks again!","2015-11-23 12:56:29","17","[deleted]","1747844885.302497","sea level projections","manual"
"cxa3juz","t3_3txns6","3txns6","science","scientific","Did some people really have ice cream on their ""healthy"" list??

Also, this study really resonates with me because everyone always says oatmeal is a long lasting, low glycemic food, but it makes me feel awful and starving soon (even without sugar). ","2015-11-23 13:32:26","15","ljuvlig","1747844885.302497","sea level projections","manual"
"cxa2plw","t3_3txns6","3txns6","science","scientific","Were there any identifiable physical or emotional reactions in subjects with poor food absorption?","2015-11-23 12:51:07","14","AC_Slaughter","1747844885.3165026","sea level projections","manual"
"cxa2j5y","t3_3txns6","3txns6","science","scientific","What were the most unexpected patterns you observed in your subjects' ppgr responses?","2015-11-23 12:41:18","10","[deleted]","1747844885.319081","sea level projections","manual"
"cxa3335","t3_3txns6","3txns6","science","scientific","How much does the ethnicity of a person effect their gut flora? Is it always the case that a person born and raised in India will be able to effectively digest spicy food better than Englishman? Or does gastrointestinal tract adapt to the foods that it's exposed to? 

Thank you for taking the time to discuss your research. This has always seemed like common sense to me, but this is the first time that I've seen any dedicated study on the subject specific nutrition. ","2015-11-23 13:10:32","12","[deleted]","1747844885.320169","sea level projections","manual"
"cxa44qq","t3_3txns6","3txns6","science","scientific","What was the result of the predictive algorithm? How can someone use these results to gain/lose weight? I really want to gain 10lbs, but eating 2800+ calories a day is super hard","2015-11-23 13:57:15","11","Sports_Addict","1747844885.3220735","sea level projections","manual"
"cxa2tjz","t3_3txns6","3txns6","science","scientific","I recently developed IBS. How long into the future do you think we will have a service available that maps your gut bacteria etc. for personalized dietary planning?","2015-11-23 12:56:58","9","SpookySP","1747844885.3220735","sea level projections","manual"
"cxa4p5c","t3_3txns6","3txns6","science","scientific","I find this subject to be quite fascinating, because I've found that I react differently to food than people around me. I always thought it super unfair that when I was a teenager, my little sister consistently finished my portions for me, and yet I was still consistently gaining weight, while she wasn't. Thankfully, I finally figured out what was wrong.  I'm living with PCOS, and I can only help to control my symptoms and weight through a ketogenic diet and restricted calories. 
 

My question is about calories in vs calories out. It's always frustrated me when people put down the obese by saying, ""It's just a simple matter of burning more calories than you eat!"" It's never been that simple for me.  Calories are these weird, arbitrary numbers that have to do with heating water, right? So a food's calorie value may have nothing to do with the way that food interacts with different peoples' bodies? 

How do you think this discovery will change the way people look at weight loss and calories in vs calories out?","2015-11-23 14:19:33","11","basilhazel","1747844885.3220735","sea level projections","manual"
"cxa4aiw","t3_3txns6","3txns6","science","scientific","Thanks for your great work!  My parents have diabetes and have been experimenting with their own diets to lower their PPGRs for years. 

What were some of the foods you found that had the greatest interpersonal variability, and were there any that affected all participants in the same way?

How long do you think it will take for the average person to be able to benefit from your algorithm?

Have you and the participants in the study changed your/their diets in different ways since you conducted this study?

Again, thanks so much for your rigorous work.  This has to be a big step forward from the ""x food is good for you"" ""x food is bad for you"" kind of thinking that is propagated nowadays.","2015-11-23 14:03:53","7","dilatory_tactics","1747844885.3220735","sea level projections","manual"
"cxa4mqz","t3_3txns6","3txns6","science","scientific","Did you find any evidence that different combinations of food produced different responses, than if the component parts where eaten alone or part of a different meal?","2015-11-23 14:17:04","8","koorb","1747844885.3220735","sea level projections","manual"
"cxa92rv","t3_3txns6","3txns6","science","scientific","*Your study focused on glucose response. But glucose response is not always proportional to insulin response. It's highly disproportionate with high-fat and high-protein foods. Proteins and fats elicit nearly as much or even moreso insulin than do unrefined carbs. http://ajcn.nutrition.org/content/66/5/1264.full.pdf 

From your paper:
> with regard to PPGRs, approaches that grade dietary ingredients as universally “good” or “bad” based on their average PPGR in the population may have limited utility for an individual

Do you think you should clarify for the public that glucose response is not always proportional to insulin response? You're promoting the idea that people should fit their diets to their glucose response but glucose response is only half the story. 

*Are you going to share the data? I'd like to see the results for specific foods or at least macronutrients. 

*I read on a news release of this paper that a banana had two opposite results on two different people. Will you comment on the implications of that? Specifically, does it mean that one person with a negative reaction should avoid that food altogether or perhaps ween themselves onto it until their body has an appropriate reaction? 

*Are you familiar with Dr. Neal Barnard's work on diabetes? Is there a contradiction between his findings that diabetes type II is reversed on a low-fat, low-protein whole-food plant-based diet and your findings? Again, specific data would clear the air here. 

*It is true that increased glucose response is linked with diabetes type II. However, is the problem with glucose or insulin? A proposed mechanism, by the same doctors who reported clinical reversal of diabetes, suggests that fat blocks insulin from entering the cells to appropriately respond to glucose. Are you familiar with this mechanism and how does this relate to your findings? 

*Suggesting that no one diet is for everyone is very bold. This has the potential to be a dangerous rationalization for a bad diet. It would be great if you could be transparent with your data so the public can see for themselves how exactly one should fit a diet to one's self. Without a mention of at least macronutrients, I'm afraid your results are useless to me, as a reader. Does ""no one diet fits all"" mean that I should eat 90% carbs while my neighbor should eat 90% fat? Or is it a smaller difference, say I should eat 90% carbs and my neighbor should eat 85%? Or are macronutrients less important and it's the type of food that matters? 

*Your paper states:

>Factors that may affect interpersonal differences in PPGRs include genetics (Carpenter et al., 2015), lifestyle (Dunstan et al., 2012), insulin sensitivity (Himsworth, 1934), and exocrine pancreatic and glucose transporters activity levels (Gibbs et al., 1995).

If I want to be healthy should I focus on optimizing the listed factors or focus on a diet that achieves a particular glucose response? If glucose response is dependent on the listed factors, wouldn't it make sense to focus on those factors- the cause of my glucose response? If I should be focused on those factors, why do you suggest I worry about how a diet fits my glucose response? 

*How effective at lowering rates of the diseases you mentioned do you believe tailoring one's diet to glucose response will be? 
","2015-11-23 16:31:47","8","[deleted]","1747844885.334963","sea level projections","manual"
"cxa264i","t3_3txns6","3txns6","science","scientific","Science AMAs are posted early to give readers a chance to ask questions and vote on the questions of others before the AMA starts.
 

Guests of /r/science have volunteered to answer questions; please treat them with due respect. Comment rules will be strictly enforced, and uncivil or rude behavior will result in a loss of privileges in /r/science.


If you have scientific expertise, please verify this with our moderators by getting your account flaired with the appropriate title.  Instructions for obtaining flair are here: [reddit Science Flair Instructions](http://www.reddit.com/r/science/wiki/flair) (Flair is automatically synced with /r/EverythingScience as well.)
","2015-11-23 12:20:21","7","Doomhammer458","1747844885.3380303","sea level projections","manual"
"cxa2eyn","t3_3txns6","3txns6","science","scientific","Amazing work! My question is: how do you see your work empowering individuals either now or further down the road? In other words, what can the lay person do now to improve their diet and overall health? What can they see happening in the future? (Now that we know many factors effect response to diet and one's response to diet.)

EDIT: also i think you have a broken link?","2015-11-23 12:34:43","8","[deleted]","1747844885.3397448","sea level projections","manual"
"cxa3ioo","t3_3txns6","3txns6","science","scientific","Any thoughts on Soylent or similar foods? ","2015-11-23 13:30:59","7","PM_ME_YOUR_MECHANISM","1747844885.3397448","sea level projections","manual"
"cxa7stb","t3_3txns6","3txns6","science","scientific","How do you feel about the ketogenic diet?","2015-11-23 15:57:27","8","BowQueesha","1747844885.3397448","sea level projections","manual"
"cxa2yy9","t3_3txns6","3txns6","science","scientific","Do you think there are differing levels of gherlin and leptin in obese people? What about a difference in the pleasure/reward center of the brain? 

I'm a RD/LDN doing my MS thesis on obesity/diabetes ","2015-11-23 13:04:40","6","[deleted]","1747844885.3462474","sea level projections","manual"
"cxa4row","t3_3txns6","3txns6","science","scientific","Have you heard of eating according to one's blood type? Since there are so many disease risk correlations with ABO blood type, would it be too far-fetched to include this in a future data set?","2015-11-23 14:22:08","5","[deleted]","1747844885.3462474","sea level projections","manual"
"cxa6lx3","t3_3txns6","3txns6","science","scientific","Does this shed any doubt on the ""calories in/calories out"" weight-loss adage?  Are some people going to absorb greater/fewer calories than others from certain foods?","2015-11-23 15:23:07","6","[deleted]","1747844885.3462474","sea level projections","manual"
"cxa3fgq","t3_3txns6","3txns6","science","scientific","Is the assumption that certain kinds of PPGR (spiky?) are bad for everyone? Or could people also differ in how their health responds to PPGR?","2015-11-23 13:27:01","4","ljuvlig","1747844885.3540723","sea level projections","manual"
"cxa84tz","t3_3txns6","3txns6","science","scientific","Is the prediction algorithm available to public? What else beside macronutrients of fat, protein and carbs does it take into consideration when judging a meal? 

Can person without diagnosed diabetes benefit from manipulating their blood sugar? How would they go about profiling their food response? Is one glucose measurement per meal enough to determine their response or should such person aim for larger sample size?
","2015-11-23 16:06:38","4","Dohrun","1747844885.3556771","sea level projections","manual"
"cxa2lwa","t3_3txns6","3txns6","science","scientific","Hey, just want to say great work, I had heard about your study a while back and I just wanted to know how do you see this being implemented in real world scenarios and how far away are we from these kinds of tests being available to the public so we can construct our own diet? Thanks","2015-11-23 12:45:27","3","007lads","1747844885.3556771","sea level projections","manual"
"cxa3fzc","t3_3txns6","3txns6","science","scientific","How long after each meal did you test? Also, did you test pre-meal to determine how much of a spike there was in BG levels?","2015-11-23 13:27:40","3","susinpgh","1747844885.3556771","sea level projections","manual"
"cxa49h7","t3_3txns6","3txns6","science","scientific","Indeed extremely interesting. I guess you've already said this somewhere, but I've missed it: When will you start selling your 'product'? What will that look like?","2015-11-23 14:02:41","3","[deleted]","1747844885.3556771","sea level projections","manual"
"cxa60xq","t3_3txns6","3txns6","science","scientific","What do you eat on a daily basis? What changed your own personal eating habits as a result of your findings? What's your morning routine? How long do you sleep each night?","2015-11-23 15:04:55","5","Tinkletyme","1747844885.3556771","sea level projections","manual"
"cxa6u3f","t3_3txns6","3txns6","science","scientific","This might be late, not sure. Do you think this could be linked in any way to people's different tastes in food? Like how some people love/hate certain fruits, meats, etc.","2015-11-23 15:30:03","3","[deleted]","1747844885.366194","sea level projections","manual"
"cxad53x","t3_3txns6","3txns6","science","scientific","Did BMI affect the PPGR significantly? Were those with a BMI >25 the ones with a higher PPGR to foods and those with one <25 more likely to have a lower response? ","2015-11-23 18:10:58","3","fiona63","1747844885.367823","sea level projections","manual"
"cxa3g22","t3_3txns6","3txns6","science","scientific","What effect does our indigenous microbial flora have on glycemic response apart from aiding degradation of polysaccharides and liberating nutrients from indigestible starch?
TY","2015-11-23 13:27:46","2","nohomoerectus","1747844885.3691356","sea level projections","manual"
"cxa41nd","t3_3txns6","3txns6","science","scientific","Have you guys potentially looked into the research done on the genetic basis for [Indian Ayurvedic types](http://www.ncbi.nlm.nih.gov/pubmed/18564959)? I would think that there might be something to relate your research on the response to food and the broader genetic types found.","2015-11-23 13:53:46","2","IM_A_NOVELTY","1747844885.3691356","sea level projections","manual"
"cxa44qj","t3_3txns6","3txns6","science","scientific","What were the trends in the study?  I see that you have collected data, but what were the findings of your analysis specifically?  For example, we know that people from northern European and Asian backgrounds tend to be intolerant of lactose.   Did you find any surprising data?","2015-11-23 13:57:15","2","OxenRan","1747844885.3691356","sea level projections","manual"
"cxa4pjh","t3_3txns6","3txns6","science","scientific","This is a great observation.

In the future, when we really understand how diet and nutrition work in different people, we will wonder why we kept trying for so long with one-size-fits-all techniques that failed.

It's like we're a bunch of alchemists or something.  ""No, really, this diet will work.   It's low fat.  Erm, low carb.  Well, maybe low-sugar.  Would you believe...paleo?""","2015-11-23 14:19:56","2","yes_its_him","1747844885.3691356","sea level projections","manual"
"cxa6rmd","t3_3txns6","3txns6","science","scientific","I was interested in the computational tools used in this study, but  the most I could find in the paper/supplement was:

>Our predictor is based on code adapted from the sklearn 0.15.2 (Pedregosa et al., 2011) GradientBoostingRegressor class

Are your code and fit regression models available for download? Did you try other regression algorithms? How did you arrive at the choice of gradient boosting regression trees? ","2015-11-23 15:27:58","2","DrGar","1747844885.3691356","sea level projections","manual"
"cxa7xqq","t3_3txns6","3txns6","science","scientific","How static do you think these results are? E.g. If you profile me today and a year from today, how consistent do you think the result would be? Or would it very based on if foods I consumed in the year in between altered my gut microbiota? 

Also, how do I trick my body into thinking cookies are low glycemic? Fecal transplant? (Mostly joking on this second one. Mostly.)","2015-11-23 16:01:15","2","LabRat3","1747844885.3691356","sea level projections","manual"
"cxa8gy1","t3_3txns6","3txns6","science","scientific","So how would one go about finding out the correct foods to eat?","2015-11-23 16:15:45","2","pjackgt","1747844885.3691356","sea level projections","manual"
"cxa8i6x","t3_3txns6","3txns6","science","scientific","Great work, congratulations.
As someone who struggles with weight I would gladly try your algorithm and personalized diet. What would be best way to test myself and see which food have low sugar impact on me ? ","2015-11-23 16:16:39","2","djdule","1747844885.3840988","sea level projections","manual"
"cxaa1kh","t3_3txns6","3txns6","science","scientific","If prediction algorithm can predict PPGR for people, does that mean PPGR on a person is not changing over time (not because of age but most importantly because of the diet)? If not, what are the personal factor which effect the prediction algorithm that is possible to change by diet?","2015-11-23 16:56:23","2","rosencreuz","1747844885.3858688","sea level projections","manual"
"cxa5ko4","t3_3txns6","3txns6","science","scientific","If this is related to microbiome stuff, could fecal transplants affect one's optimal diet?","2015-11-23 14:50:12","1","Hedgehogs4Me","1747844885.386372","sea level projections","manual"
"cxa5ndf","t3_3txns6","3txns6","science","scientific","Hi, there. Your video, which saw on Reddit, blew my mind. My question is: Wouldn't it be difficult to personalise each person's diet? I presume there are many factors to consider and not to mention the countless number of foods to test. How would you simplify this problem?
Thanks","2015-11-23 14:52:41","1","saisharan007","1747844885.386372","sea level projections","manual"
"cxa6its","t3_3txns6","3txns6","science","scientific","How quickly do the microbes in the stomach change in response to a new diet? Is it variable person by person?","2015-11-23 15:20:32","1","Enfulio","1747844885.386372","sea level projections","manual"
"cxa725k","t3_3txns6","3txns6","science","scientific","Did you test individuals eating a whole food plant based diet? If so, how different was the microbial makeup and digestion process from those individuals eating animal products.?","2015-11-23 15:36:28","1","pinonnut","1747844885.386372","sea level projections","manual"
"cxa78gn","t3_3txns6","3txns6","science","scientific","I'm curious to hear your opinion on a hunch that I have regarding the relativity of health and nutrition:

My hypothesis:
Health is more a factor of a stable diet than specifically what you eat. Looking at food cultures in india, thailand, peru, etc, there are set dishes with set ingredients that are generally served with set frequencies (some dishes are ""special"" others like rice are more day-to-day).

Is it possible that this sort of cultural diet eating could contribute to a more stable and healthier gut microbiome, which could in turn contribute more to human health?

Thanks for your research on this awesome article!","2015-11-23 15:41:34","1","biohazmatt","1747844885.386372","sea level projections","manual"
"cxa7pdj","t3_3txns6","3txns6","science","scientific","Hi guys, I recently attempted a bit of self-discovery in regards to my diet. Over the course of about four months I ate a diet that was as healthy as possible. No salt, sugar, red meat, gluten or processed anything. Made every meal at home, all grains, vegetables, fruits and white meat, and I felt no different. I didn't lose weight, my mood didn't improve. My question is, is it possible for a person to have such low sensitivity that they can eat whatever without being heavily effected, or is more likely that I just wasn't eating my magic combination of foods that works just right for my body? Maybe I cut out something my flesh needed or ate too much of something ""healthy"" that made my body logy?","2015-11-23 15:54:52","1","NewToSociety","1747844885.386372","sea level projections","manual"
"cxa7pei","t3_3txns6","3txns6","science","scientific","Do the results change for someone who had a poop transplant?","2015-11-23 15:54:53","1","canyoutriforce","1747844885.386372","sea level projections","manual"
"cx3uh45","t3_3aosn1","3aosn1","collapse","skeptical","When Mount Pinatubo erupted in the Philippines, it introduced tens of thousand of tons of iron dust into the oceans of the world and caused vast blooms of phytoplankton which caused a measurable reduction in atmospheric CO2.   Perhaps we can send huge tankers of iron dust and fertilize the worlds oceans and sequester CO2 to the bottom of the ocean.
https://en.wikipedia.org/wiki/Iron_fertilization","2015-11-17 22:45:07","1","anonymous_212","1747845197.268501","sea level projections","manual"
"cx902o1","t3_3tsxx8","3tsxx8","collapse","skeptical","Aren't we all just fucking ourselves over? The IPCC cannot stop 7+ billion people from emitting GHGs nor can it alter human behavior:

Not a single politician runs on a platform of DEGROWTH. For one, it's political suicide. Two, it's counterintuitive to human nature to strive for a lower standard of living. Three, the entire world would have to agree to shrink. It's not the biosphere we're concerned about, ""It's the ECONOMY, stupid!""","2015-11-22 14:27:19","12","xrm67","1747845210.2171314","sea level projections","manual"
