"id","subreddit","tone","title","text","created_utc","score","num_comments","upvote_ratio","url","is_self","author","scraped_utc","query_used","query_category"
"7itvh4","collapse","skeptical","collapse daily","I'm not allowed to post links to Loki's Revenge Blog here, but you can find links to all these headlines there. You can copy and paste this line into your browser to get there.

lokisrevengeblog.wordpress.com/2017/12/10/collapse-daily-headlines/

Solar, wind and nuclear have ‘amazingly low’ carbon footprints (carbonbrief.org) | Very likely giant pack of lies, plus greenies hate nuclear

Vegetarian sausages found to be just as unhealthy as meat sausages, Metro

Wired releases a surveillance self-defense guide, Boing Boing | Like I trust wired!

Bitcoin fairy dust sends other niche assets soaring, FT

US farmers lose their heirs to opioid epidemic, The Times

Amazon is running its own hunger games – and all the players will be losers, Guardian

U.S. Says 2,000 Troops Are in Syria, a Fourfold Increase, NYT

The $10 Trillion Investment Plan To Integrate The Eurasian Supercontinent | Because China and Europe are green energy leaders

China bans “foreign waste” causing recycling chaos in the US (npr.org) | People think cell phones get recycled lol

Trump administration facing lawsuit for allowing fracking companies to dump waste in Gulf of Mexico (independent.co.uk)

Northern Alaska is warming so fast, it's faking out computers (grist.org)

California fires: Year around blazes set to become 'the new normal' as Governor blames climate .. (independent.co.uk)

Jerry Brown: Expect to see Southern California burn up because of climate change(washingtonexaminer.com)

Southern California fires are destructive and unprecedented — and a sign of things to come (desertsun.com)

'Firefighting at Christmas' may become normal in California (apnews.com)

'Daunting' Antarctic sea ice plummet could be tipping point (newshub.co.nz)

Almost 17 million infants worldwide are breathing toxic air, potentially affecting their brain development (edition.cnn.com) | Which explains reddit collapse

Gene Mod plants in bird feed found in non-GMO Switzerland (swissinfo.ch)

Prisons dropping free face to face visits, Switching to $12.99 per phone/video call. (theguardian.com)

Why is it easier to blame 150,000,000 Americans being 'lazy' rather than 400 Americans being greedy. (i.redd.it)

Super Rich Shown To Have Grown Out Of Ancient Farming (Guardian) | We knew this

Pentagon Loses Track Of 44,000 Soldiers(zerohedge.com)

Scores of Leading Economists Demand End to All Fossil Fuel Investments: ""Simply put - there is no more room for new fossil fuel infrastructure and therefore no case for ongoing investment,"" declaration states. (commondreams.org) | That's how fucking clueless economists are. They think wealth is magic

The U.S. Media Yesterday Suffered its Most Humiliating Debacle in Ages: Now Refuses All Transparency Over What Happened (theintercept.com)

GREENWALD: ""Virtually every false story published goes only in one direction: to be as inflammatory and damaging as possible on the Trump/Russia story. once “mistakes” all start going in the same direction. they cease looking like mistakes."" (theintercept.com)

The Numbers of Women in Tech Rise and Fall, But Sexual Harassment is Ever Present, IEEE Spectrum

The economy’s biggest mystery — paychecks just aren’t growing, CNBC | Yeah, big fucking mystery

Notes on the Ascendancy of Identity Politics in Literary Writing, Subtropics


SKS weekly climate science stuff

Sun Dec 3, 2017

Soil Power! The Dirty Way to a Green Planet, Opinion by Jacques Leslie, Sunday Review, New York Times, Dec 2, 2017

Analysis: How developing nations are driving record growth in solar power by Zeke Hausfather, Carbon Brief, Nov 29, 2017

Judge Questions Exxon’s Attempt to Block Climate Fraud Investigations by Nicholas Kusnetz & David Hasemyer, InsideClimate News, Dec 1, 2017

The Carbon Brief Interview: Dr Bill Hare by Leo Hickman, Carbon Brief, Dec 1. 2017

Tropical deforestation is getting bigger, study finds by Morgan Erickson-Davis, Mongabay, Nov 29, 2017

Batteries can be part of the fight against climate change - if we do these five things by Jonathan Eckart, World Economic Forum, Nov 28, 2017

Climate change: Obama regrets lack of US leadership, AFP/AP/Reuters/Deutsche Welle, Dec 3, 2017

Johannesburg's new ""agripreneurs"" dig for green gold on skyscraper rooftops by Inna Lazareva, Thomson Reuters Foundation, Dec 1, 2017

Mon Dec 4, 2017

Wind power blows past coal in Texas by Ryan Maye Handy, Houston Chronicle, Nov 28, 2017

Tesla switches on giant battery to shore up Australia's grid by David B Gray, Reuters, Dec 3, 2017

Importance and scale of past climate change underestimated by Kevin O'Sullivan, The Irish Times, Dec 4, 2017

The moral and intellectual bankruptcy of the Republican Party by Dana Nuccitelli, Climate Consensus - the 97%, Guardian, Dec 4, 2017

Did U.S. Negotiators Actually Accomplish Something in Bonn? by Bob Berwyn, Pacific Standard, Dec 1, 2017

Forest gumption: How scientists are tapping everything from drones to pruning shears to stem global warming by Daniel Grossman, Christian Science Monitor, Dec 3, 2017

Global warming to claim 33% of ice volume in Hindu Kush Himalayan region: Expert, IANS/Hindu Times, Dec 4, 2017

Skeptical About Climate, Clean Energy Skeptics by Angus McCone, Bloomberg New Finance, Nov 30, 2017

Tue Dec 5, 2017

Why remote Antarctica is so important in a warming world by Chris Fogwill, Chris Turney & Zoe Robinson, The Conversation AU, Dec 4, 2017

Trump Disbands Group Meant to Prepare Cities for Climate Shocks by Christopher Flavell Bloomberg News, Dec 4, 2017

20 years after Kyoto Protocol, where does world stand on climate? by Eric Johnston, Japan Times, Dec 4, 2017

Top US firms including Walmart and Ford oppose Trump on climate change by Richard Luscombe, Guardian, Dec 1, 2017

Southern California fire is 'out of control,' forcing thousands to evacuate by Paul Vercammen, Jason Hanna and Madison Park, CNN, Dec 5, 2017

Does hope inspire more action on climate change than fear? We don’t know. by David Roberts, Energy & Environment, Vox, Dec 5, 2017

Bitcoin could cost us our clean-energy future by Eric Holthaus, Grist, Dec 5, 2017

""Alternative Facts"" about Climate Change by Ben Santer, Observations, Scientific American, Dec 5, 2017

Climate scientists see alarming new threat to California by Evan Halpar, Los Angeles Times, Dec 5, 2017

Wed Dec 6, 2017

Australia's largest solar plant to be built in 2018 by Cole Latimer, Brisbane Times, Dec 5, 2017

Instrument of Power: How Fossil Fuel Donors Shaped the Anti-Climate Agenda of a Powerful Congressional Committee by Marianne Lavelle & David Hasemyer, InsideClimate News, Dec 5, 2017

There’s little middle ground in Internet discussions of climate change—Does it matter? by Sarah DeWeerdt, Anthropocene, Dec 5, 2017

Wildfires continue to rage across Southern California by Madison Park, Steve Almasy & Paul Vercammen, CNN, Nov 6, 2017

Myth and Dystopia in the Anthropocene by Mark Kernan, Open Democracy/Reslience, Dec 6, 2017
4 Takeaways From a Gathering of Mayors on Climate Change by Mitch Smith, New York Times, Dec 5, 2017

4 Questions on the California Fires and Climate Change by Georgina Gustin, InsideClimate News, Dec 5, 2017

Fire rages near Bel-Air, Getty museum in Los Angeles by Jason Hanna, Madison Park & Stella Chan, CNN, Dec6. 2017

US government report finds steady and persistent global warming by John Abraham, Climate Consensus - the 97%, Guardian, Dec 6, 2017

California will burn until it rains — and climate change may keep future rains away by Rachel Becker, Science, The Verge, Dec 6, 2017

Thu Dec 7, 2017

Carbon Capture Is Essential To Limiting Global Warming, But No One Knows How To Do It Or How Much It Will Cost by Steve Hanley, CleanTechnica, Dec 4, 2017

Get ready for more California droughts thanks to climate change by Alex Lubben, Vice News, Dec 5, 2017

The most accurate climate change models predict the most alarming consequences, study finds by Chris Mooney, Washington Post, Energy & Environment, Dec 6, 2017

As Greenland Melts, Where’s the Water Going? by Henry Fountain & Derek Watkins, Climate, New York Times, Dec 5, 2017

Rising Waters: Can a Massive Barrier Save Venice from Drowning? by Jeff Goodell, Yale Environmental 360, Dec 6, 2017

Don't blame God or nature. This is our fault, Opinion by David Suzuki, National Observer, Dec 7, 2017

The Most Accurate Climate Models Predict Greater Warming, Study Shows by Georgina Gustin, InsideClimate News, Dec 6, 2017

Renewable Energy Isn't Perfect, But It's Far Better Than Fossil Fuels by David Suzuki, Alternet, Dec 6, 2017

Fri Dec 8, 2017

Climate change is radically reshuffling UK bird species, report finds by Damian Carrington, Guardian, Dec 5, 2017

Mount Agung erupts in Indonesia: Is it a climate event? by Tom Di Liberto, NOAA's Climate.gov, Dec 5, 2017

California fires: Blazes stretch from Ventura to San Diego County by Paul Vercammen, Faith Karimi and Steve Almasy, CNN, Dec 8, 2017

More Than 80 Leading Economists Demand “Not A Penny More” Spent On Fossil Fuels by Joshua S Hill, Clean Technica, Dec 7, 2017

The first wintertime megafire in California history is here by Eric Holthaus, Grist, Dec 8, 2017

New research, Nov 27 - Dec 3, 2017 by Ari Jokimäki. Skeptical Science, Dec 5, 2017

Scott Pruitt’s terrible plan to “objectively” assess climate science by David Roberts, Energy & Environment, Vox, Dec 7, 2017

Environment concerns in trade talks with China progressing well, says McKenna, Canadian Press/National Observer, Dec 7, 2017

Sat Dec 9, 2017

'Death spiral’: half of Europe’s coal plants are losing money by Damian Carrington, Guardian, Dec 8, 2017,

Trees are the dominant source of methane emissions in Amazon wetlands, Guest Post by Vincent Gauci, Carbon Brief, Dec 4, 2017

Australian Climate Science Denier Ian Plimer Follows Tony Abbott in Pushing Dodgy Science to London Think-Tank by Graham Readfearn, DeSmog, Dec 7, 2017

In a Warming California, a Future of More Fire by Henry Fountain, Climate, New York Times, Dec 7, 2017

As “Climate Change” Fades from Government Sites, a Struggle to Archive Data by Leila Miller, Frontline, PBS, Dec 8, 2017

Climate Science On Trial Again by William S Becker, HuffPost, Dec 8, 2017

Koch-Backed Business Group Splinters in Climate-Change Dispute by Ari Nater, Bloomberg News, Dec 8, 2017

New Conservative Argument: Climate Change Is So Awesome, You Guys, Opinion by Wiliam Rivers Pitt, Truthout, Dec 9, 2017
","2017-12-10 13:23:39","0","0","0.38","https://www.reddit.com/r/collapse/comments/7itvh4/collapse_daily/","True","BeezelyBillyBub","1747785781.97567","global warming myth","manual"
