"id","parent_id","post_id","subreddit","tone","text","created_utc","score","author","scraped_utc","query_used","query_category"
"d20yibp","t3_4ejhf3","4ejhf3","climatechange","action-oriented","
Here are a few papers describing warm periods in the past.   The first ties today's climate to the last interglacial.   The second describes the mid-Miocene,  a time when the earth was quite similar to today and atmospheric CO2 levels were over 500 ppm.   The third paper explains the mid-Pliocene warm period.   The forth reference is from Wikipedia and is an excellent paper discussing the Paleocene–Eocene Thermal Maximum.   This was a time when mammals were well established and the climate was much warmer than all but the most extreme predictions for our future. 

1) 
[Ice melt, sea level rise and superstorms: evidence from paleoclimate data, climate modeling, and modern observations that 2 °C global warming could be dangerous] (http://www.atmos-chem-phys.net/16/3761/2016/) 



2) 
[Antarctic ice sheet sensitivity to atmospheric CO2 variations in the early to mid-Miocene] 
(http://m.pnas.org/content/113/13/3453.full#sec-5) 


3)
[Integrating geological archives and climate models for the mid-Pliocene warm period] (http://www.nature.com/ncomms/2016/160216/ncomms10646/full/ncomms10646.html) 

4)
[Paleocene–Eocene Thermal Maximum] (https://en.m.wikipedia.org/wiki/Paleocene%E2%80%93Eocene_Thermal_Maximum)","2016-04-13 09:44:06","2","ninthinning01","1747762203.2786272","global warming myth","manual"
"d20ruxb","t3_4ejhf3","4ejhf3","climatechange","action-oriented","For how long have we been monitoring the temperature? Now compare that to how long the earth have been here. In my humble opinion we should focus on pollution not temperature. ","2016-04-13 04:12:59","4","Zugas","1747762203.281739","global warming myth","manual"
"d20rdc9","t3_4ejhf3","4ejhf3","climatechange","action-oriented","Yes but the temperature rose much more slowly. It still caused one of the grest extinction events,  though.","2016-04-13 03:57:15","1","strzeka","1747762203.283929","global warming myth","manual"
"d20rfkw","t3_4ejhf3","4ejhf3","climatechange","action-oriented","The earth has been much warmer than today and much cooler.  The issue isn't the actual temperature,  the issue is the rate of temperature change.   Global temperature changes,  like what we are observing,  occur on the scale of thousands to millions of years.   This gives time for life to evolve in response to these changes.  

The change we are seeing today though is occurring over the course of decades and will likely lead to mass extinction of organisms unable to cope with the various consequences of rapid global temperature increase. ","2016-04-13 03:59:16","1","hintofinsanity","1747762203.286958","global warming myth","manual"
"d20wu7s","t3_4ejhf3","4ejhf3","climatechange","action-oriented","Temperatures have been far hotter, even as recent as 1000 years ago... and the rate of change has been far higher on the warm up from most inter-glacial periods.","2016-04-13 07:55:38","0","FireFoxG","1747762203.2891572","global warming myth","manual"
"d2693rc","t3_4f6f6g","4f6f6g","science","scientific","Do the 3 percent have any reasonable arguments? Is there any commanlity within them ? (E.g. tend to be solar researchers instead of atmospheric scientists)","2016-04-17 12:44:00","1011","iorgfeflkd","1747762579.796125","global warming myth","manual"
"d26at5q","t3_4f6f6g","4f6f6g","science","scientific","I have a few questions and thank you for your time!



1. How many scientists agree that the animal agriculture business contributes to climate change?

2. Is there anyway we could change the outcome of climate change in a fast effective way?



3. Can we reverse it or just ride the incoming tide doing what we can?

","2016-04-17 13:55:12","624","Autica","1747762579.797345","global warming myth","manual"
"d2698r3","t3_4f6f6g","4f6f6g","science","scientific","My dad's not an idiot, but like many people his age, he completely scoffs at the whole idea of humans causing climate change. Have you come upon any single sentence you can say to someone like this to at least get them to THINK about the possibility?","2016-04-17 12:50:34","254","mcqtom","1747762579.7986581","global warming myth","manual"
"d2698p1","t3_4f6f6g","4f6f6g","science","scientific","Hi there I have a few questions, but first I'd like to thank you for your work it's always good to have proof on this.

- Who is part of the remaining 3% and what are their criticisms ? (Why aren't we at 99.9% as to me it looks as clear as lead paint not being healthy)

- Do you know how that statistic changes if you take into account other scientific domaines ? Like what is the the rate of denial across education levels ?

- With regard to publishing papers on climate change and global warming, I know that the language used in the media has changed substantially over the years (now people mostly talk about climate change rather than global warming), but has this also been reflected in published research ? Do you feel as though there are certain taboos when tackling the subject ? EDIT: re reading my comment I can see how my question was poorly phrased, I just meant that despite the terms being accurate and distinct, has public backlash affected the vocabulary now used when talking about these issues either in public or in the literature ? ","2016-04-17 12:50:30","208","DrFrenchman","1747762579.800471","global warming myth","manual"
"d269kxo","t3_4f6f6g","4f6f6g","science","scientific","If I remember correctly, the last research paper that claimed this statistic ended up being wrong because they just assumed certain scientists agreed based on a selective number of papers. They also never consulted the authors and turns out that many of them were pretty upset someone else spoke for them on the issue. And the paper gathered information from other sources that didn't have much to do with climate change. In your research, how have you prevented repeating their mistakes? Have you established confidence levels to the 97% stat? What possible errors (systemic or procedural) did you encounter? And I'm assuming you tested for a type 1 error? Sorry, I don't mean to blast you with questions. I've an AS in applied science and currently working on a BS in earth-space science minor in geology (I want to be a high school science teacher), so I remain skeptical on many things until I feel I've satisfied my science brain hahaha. Otherwise, thank you for the extensive research!","2016-04-17 13:06:08","154","HurleyBurger","1747762579.802204","global warming myth","manual"
"d26gmza","t3_4f6f6g","4f6f6g","science","scientific","In response to /u/kanagawa

---

Hello there!

>I read the paper and its pretty convincing.

This is a strange claim to make from someone who is blatantly misrepresenting the paper's contents and the views of its authors.

>they argue that the slowdown was real and current climate models aren't particularly effective. 

I have coauthored with Michael Mann and speak to him regularly. He has published several papers showing that climate models do just fine **when one takes the care to ensure that the phasing of natural variability in the models is the same as that of the observations**. 

Why would think that it was a good idea to misrepresent Mann and his work? Did you think no one would call you out on it?

-- Peter Jacobs","2016-04-17 16:53:40","151","ClimateConsensus","1747762579.803634","global warming myth","manual"
"d268x3b","t3_4f6f6g","4f6f6g","science","scientific","Science AMAs are posted early to give readers a chance to ask questions and vote on the questions of others before the AMA starts.
 

Guests of /r/science have volunteered to answer questions; please treat them with due respect. Comment rules will be strictly enforced, and uncivil or rude behavior will result in a loss of privileges in /r/science.


If you have scientific expertise, please verify this with our moderators by getting your account flaired with the appropriate title.  Instructions for obtaining flair are here: [reddit Science Flair Instructions](http://www.reddit.com/r/science/wiki/flair) (Flair is automatically synced with /r/EverythingScience as well.)
","2016-04-17 12:34:38","1","Doomhammer458","1747762579.8051279","global warming myth","manual"
"d269e0q","t3_4f6f6g","4f6f6g","science","scientific","What do you think of environmentalists (who are most likely NOT climate scientists) that spread doomsday scenarios with severe governement intervention as the only solution? I believe that that is a fundamentally anti-humanist approach. I used to have a similiar view, until I started studying geology, and various international and local scientists seemed MUCH more casual, less alarmist, more skeptical and calm about the figurative sky falling, when visiting and lecturing at my school.
Do you believe that global warming has been abused by certain groups to further policy? Be it political parties, universities, etc.
Do you think dismissing the opinions of geologists is a good thing? After all, they are needed for gathering data on past climates, are they not?","2016-04-17 12:57:21","81","WolfdogWizard","1747762579.8068538","global warming myth","manual"
"d26e69c","t3_4f6f6g","4f6f6g","science","scientific","If I can convince someone about the 97% figure, I often hear the same followup argument: that scientists are essentially forced to agree about climate change. The idea is that it's very difficult to become/remain a well-respected climate scientist if you don't believe in human-caused climate change. Your papers don't get published, you don't get funding, and you eventually move on to another career. The result being that experts either become part of the 97% consensus, or they cease to be experts.

How would you respond to claims like that? 

I tend to think that anyone who found strong evidence against climate change would immediately publish it and collect their Nobel prize. But I'm curious if there's any evidence to support that. And also, my argument doesn't address the idea that skeptical undergrads are getting forced out of climate change research before they're experienced enough to build a real case against it. I don't think that's happening, but I don't know how to argue it.","2016-04-17 15:42:47","61","greenlaser3","1747762579.8084428","global warming myth","manual"
"d26fxfo","t3_4f6f6g","4f6f6g","science","scientific","Many skeptics are concerned that the group of ""climate experts"" are self selecting, and that they went into climate science because they already believed in AGW, leaving them susceptible to confirmation bias, and social pressure to conform.   

They are also concerned that skeptics are not welcome in the community of climate experts, having their papers rejected, and their studies unfunded.  Simply put, you're not allowed in the club of climate experts unless you've already accepted the proposition that humans are causing climate change, so it's a tautology to say climate experts accept the proposition that humans are causing climate change.

Can you address these objections?","2016-04-17 16:34:02","58","marksf","1747762579.8098629","global warming myth","manual"
"d269cfr","t3_4f6f6g","4f6f6g","science","scientific","Why do you think such a large portion of the American public is so resistant to the idea of man-made global warming? That is, why does overwhelming scientific consensus not convince people that the hypothesis is likely to be true?

There is so much sociological and psychological research that discusses the fact that people's incorrect beliefs become *more* solidified when presented with evidence that contradicts their views. There are other studies which present alternative methods for convincing people, such as really trying to see things from their perspective. What do you think the scientific community could do to increase the public's acceptance of mainstream science?","2016-04-17 12:55:18","58","jesterbuzzo","1747762579.81122","global warming myth","manual"
"d26bfd9","t3_4f6f6g","4f6f6g","science","scientific","Didn't Thomas Kuhn demonstrate in his book ""The Structure of Scientific Revolutions"" that time in again in the history of science status quo consensus is a bad benchmark to decide if something is true or not?  Time and again the scientific consensus has been proven wrong by a small group of people willing to question the status quo.  How can you be sure that historically the status quo belief has turned out to be 100% wrong, and people outside of that belief were initially ridiculed and ultimately proven right.  How can you be sure that isn't the case here.  

Plate techtonics is a good example of what I am talking about.  *Everyone* said that guy was off his rocker, but in the end it turned out *everyone* was wrong.  There are plenty of other examples as well. 

https://en.wikipedia.org/wiki/The_Structure_of_Scientific_Revolutions    

","2016-04-17 14:16:33","46","skeeter1234","1747762579.8126678","global warming myth","manual"
"d26bd21","t3_4f6f6g","4f6f6g","science","scientific","There's a long history of apocalyptic belief in western civilization. Throughout european and american history, many people (mostly for religious reasons) seem to have been drawn to the idea that the world is coming to an end soon. 

I'd be curious to know your thoughts about how this history interacts with (or complicates) the task of convincing the public about climate change -- since global warming offers a kind of science-based end-of-the-world scenario.

I wonder if some people become climate-change doubters because they dismiss it as just the latest reason the world is supposed to end. As in, first the world was going to end because Christ was going to return, then it was because nuclear war was going to kill us all, and now it's because of global warming.

Do you think a kind of end-of-the-world fatigue might have set in among much of the public, which makes it difficult to convince people that this time the world (as we know it) really might be in serious trouble?","2016-04-17 14:14:31","40","yoobi40","1747762579.81407","global warming myth","manual"
"d269ikp","t3_4f6f6g","4f6f6g","science","scientific","What would a climate friendly community look like as a whole? Are modern cities able to adapt and change their basic infrastructure to incorporate energy saving techniques in order to thwart further climate change or do they have to be rebuilt altogether? ","2016-04-17 13:03:10","39","Druwdrewballs","1747762579.815167","global warming myth","manual"
"d26azi9","t3_4f6f6g","4f6f6g","science","scientific","The one subject that never comes up in any of the debates on climate change is overpopulation, even though it seems to me that this is the root cause of all environmental problems we have. What is the point of reducing a person's carbon footprint if every effort we make is negated by an ever increasing population ?

For example, we could reduce our environmental impact by 90%, 99% or even 99,9% in a single generation simply by drastically reducing the production of new humans. 

Is population control such a taboo subject that no research is being done or is there another reason for this ?","2016-04-17 14:01:43","34","BorgDrone","1747762579.8164248","global warming myth","manual"
"d26989a","t3_4f6f6g","4f6f6g","science","scientific","I feel really helpless as an individual in making any difference in the direction we're heading. Is there anything we can do that would actually be helpful to stop or reverse global warming?","2016-04-17 12:49:56","24","toastandpeanutbutter","1747762579.817325","global warming myth","manual"
"d269r33","t3_4f6f6g","4f6f6g","science","scientific","I guess I'm confused about this whole thing. What's the point of making a paper showing that the majority of scientist in this field of study agree on something? Is this a scientific version of shaming the remaining scientists who disagree so you can move forward with your studies? Why waste the time persuading someone when you can just act on your own research?","2016-04-17 13:13:43","26","sound-of-impact","1747762579.818169","global warming myth","manual"
"d26978j","t3_4f6f6g","4f6f6g","science","scientific","Hi, thank you for doing this, what energy source do you think we should be focusing on? ","2016-04-17 12:48:41","22","Diroxas","1747762579.818967","global warming myth","manual"
"d269pzz","t3_4f6f6g","4f6f6g","science","scientific","Isn't this 3% of published papers that take a position rather than ""climate experts""? That's what your abstract seems to imply anyways...","2016-04-17 13:12:26","14","petevalle","1747762579.819623","global warming myth","manual"
"d26czc3","t3_4f6f6g","4f6f6g","science","scientific","I know a ""skeptic"" who feels very passionate about this subject.  As it turns out, he doesn't deny climate change is happening or even that a lot of climate change is likely driven by human activity. He insists, however, that factors like deforestation, soot  buildup and land use are the big culprits.  He thinks that all this focus of co2 is politically driven and diverts attention and resources from real solutions.  He claims that his beliefs are fairly mainstream among skeptics (the better educated ones anyway) and that a biased media misrepresents them as science-denying crackpots.
I honestly don't have the expertise to judge his claims or even to competently investigate them.  Have you run into similar arguments and do you feel they have any weight?","2016-04-17 15:06:01","13","xaveria","1747762579.8209229","global warming myth","manual"
"d269sjr","t3_4f6f6g","4f6f6g","science","scientific","Not a climate change denier here, but I will say a slight skeptic. I don't know the figures on this but I imagine you've heard of Obama's deal with the UN to reduce carbon emissions and decrease global temperatures which costs [some purportedly large amount of money] and was said to be massively ineffective. I think the claim was that in 50 years the money spent would have an aggregate effect on the temperature of -1/10 of a degree. Is there any evidence to substantiate this claim?

And following that question is there any realistic or economic way for humans to significantly affect climate change in a positive way?

Finally, do scientists agree to the speed with which climate change becomes a legitimate threat to human civilization?

Thank you all very much. Just trying to stay informed.","2016-04-17 13:15:24","9","[deleted]","1747762579.8220549","global warming myth","manual"
"d269ta0","t3_4f6f6g","4f6f6g","science","scientific","Are humans causing global warming or contributing to it? I have been under the impression the globe would warm regardless, just at a slower pace.","2016-04-17 13:16:16","9","Dejimon","1747762579.822953","global warming myth","manual"
"d26azma","t3_4f6f6g","4f6f6g","science","scientific","What do you think such a study accomplish?

On one hand, this sounds like an argument by authority. This reminds me of what Einstein said upon the publication of *A Hundred Authors Against Einstein*: ""If I were wrong , then one would have been enough.""  
On the other hand, showing there's a consensus among the most knowledgeable people in the field might get deniers to reconsider their views.","2016-04-17 14:01:51","9","UnluckyLuke","1747762579.823916","global warming myth","manual"
"d26b88r","t3_4f6f6g","4f6f6g","science","scientific","As an individual in society, what can I best do to help stop and/or reverse the effects of climate change?","2016-04-17 14:10:18","7","daphnephoria","1747762579.8246589","global warming myth","manual"
"d26bhpz","t3_4f6f6g","4f6f6g","science","scientific","Does that 97% all agree to what degree humans are causing global warming?
","2016-04-17 14:18:38","8","[deleted]","1747762579.82583","global warming myth","manual"
"d26cdt6","t3_4f6f6g","4f6f6g","science","scientific","It would be an awesome AMA for the opposing 3%","2016-04-17 14:46:50","7","Gobears773","1747762579.8264809","global warming myth","manual"
"d26gnow","t3_4f6f6g","4f6f6g","science","scientific","My questions are around **how you eliminated any bias** in your study.

**1)** What steps did your group take to ensure that your work was unbiased?  (i.e., were any members of the research group part of the 3% that weren't already convinced of global warming?)

**2)** You show that the level of agreement with the consensus view increases with expertise.  Obviously, it goes without saying that the more we can convince the general public and the government that more drastic action is required, the more funding will be given to climate scientists.  Some might argue that these individuals with more expertise in the field of climate change would benefit the most from this, and perhaps this is the true reason behind the correlation.  Simply put, it could be argued that climate scientists may be predisposed to seeing climate change as more serious, because they want more funding.  What's your perspective on that?

EDIT:  added the second question.","2016-04-17 16:54:12","7","Emzam","1747762579.827774","global warming myth","manual"
"d26997o","t3_4f6f6g","4f6f6g","science","scientific","Are the three percent caused by the alpha level of the statistical tests (assuming they ignore the other studies)?","2016-04-17 12:51:10","7","[deleted]","1747762579.828426","global warming myth","manual"
"d26a7v0","t3_4f6f6g","4f6f6g","science","scientific","Has there been any information gathered on what deniers see as motivation behind climate change science? Basically, why do deniers think that scientists would lie or be led astray on this?","2016-04-17 13:32:44","8","[deleted]","1747762579.829422","global warming myth","manual"
"d26bchr","t3_4f6f6g","4f6f6g","science","scientific","Hello there. I'm from the Philippines, I would like to ask what did the 3% climate experts said about global warming?","2016-04-17 14:14:02","7","yummypunani","1747762579.830291","global warming myth","manual"
"d26cfhc","t3_4f6f6g","4f6f6g","science","scientific","What is it that they agree on that is the main cause? I see everyone rallying around fossil fuels but what about the effect of animal farming for food production? ","2016-04-17 14:48:17","7","MetalGearGauss","1747762579.8310342","global warming myth","manual"
"d26djca","t3_4f6f6g","4f6f6g","science","scientific","Given 99% of nutrition scientists got fat/sugar wrong for the last 40 years, why should we believe you guys?","2016-04-17 15:23:30","8","[deleted]","1747762579.831816","global warming myth","manual"
"d26b33n","t3_4f6f6g","4f6f6g","science","scientific","Why is Antarctica taking on ice and why does this support human influenced global warming?","2016-04-17 14:05:25","4","Schlitz001","1747762579.8325472","global warming myth","manual"
"d26fu5t","t3_4f6f6g","4f6f6g","science","scientific","Here is what i see behind this study.

11 944 papers analyzed. Of all the abstracts, 32.6% endorse Antropomorphic Global Warming (3896). On the other side, 66.4% of the papers (7930) have NO position whatsoever. 0.7% reject it, and 0.3% are uncertain. People are mislead as to what the actual numbers are behind this study, it is not a meere 3% who reject or are uncertain, it is more like 66.4% who do not even have a position on the subject, maybe because they don't want to jump to conclusions too quickly? I really don't know, i'm asking.

Out of the 32.6% who endorse it, 97.1% actually have a POSITION on the subject. So, if i take into account the 11 944 papers analyzed, it is still 32.6% of all the papers reviewed, not 97.1%. Quote from the study:

> The ISI search generated 12 465 papers. Eliminating papers that were not peer-reviewed (186), not climate-related (288) or without an abstract (47) reduced the analysis to 11 944 

So, my question is, who is the 66.4% that has no position? But they are climate related? They are peer reviewed and have an abstract. It wasn't even taken into account. The soul purpuse of this study is to see if there is a consensus on the matter, and the only thing i see it 32.6? out of 11 944 papers endorse and have a position on antropomorphic climate change. Not 97.1%. 

I think this is more of a public relations scheme more than anything, in the conclusion of the study it says quite clearly:

> The public perception of a scientific consensus on AGW is a necessary element in public support for climate policy (Ding et al 2011)

> The narrative presented by some dissenters is that the scientific consensus is '...on the point of collapse' (Oddie 2012) while '...the number of scientific ""heretics"" is growing with each passing year' (Allègre et al 2012).

Am I an Heretic to question this study?

> The situation is exacerbated by media treatment of the climate issue, where the normative practice of providing opposing sides with equal attention has allowed a vocal minority to have their views amplified (Boykoff and Boykoff 2004).

And why we should make this a one sided argument? Isn't this what science is about? Consider both sides? Debate in a civilized way? Not just slam and push it aside? I just find this number to be overused without it being understood for what it is: a statistic. Nothing more.","2016-04-17 16:31:19","4","mat_899","1747762579.83486","global warming myth","manual"
"d26a6sw","t3_4f6f6g","4f6f6g","science","scientific","What is, in your opinion, the best thing to do for individuals right now to reduce this impact? This can include small things like recycle or buy a tesla, but also development steering or anything like that. Just really curious what experts truly believe is the right way to go right now? ","2016-04-17 13:31:31","3","kazeykazeman","1747762579.8356931","global warming myth","manual"
