"id","parent_id","post_id","subreddit","tone","text","created_utc","score","author","scraped_utc","query_used","query_category"
"cpsyhhq","t3_30jbk4","30jbk4","AskReddit","unknown","I don't think life has any innate purpose. We get to create our own.","2015-03-27 21:31:45","3","Leeser","1747839161.065551","our planet is dying","manual"
"cpsyh1h","t3_30jbk4","30jbk4","AskReddit","unknown","What i worry/think about is what will happen when i die.

That is my #1 fear.

What will i feel? During and after.","2015-03-27 21:31:22","2","MusicalMastermind","1747839161.0677829","our planet is dying","manual"
"cpsyigk","t3_30jbk4","30jbk4","AskReddit","unknown","The other way round, you're big to the little insect crawling on your shoulder. That insect is big to a bacterium inside its intestine. That bacterium istelf is big compared to a virus. The virus is big compared to, uh, atoms. Atoms consist of other smaller things. 

How deep you wanna go?","2015-03-27 21:32:32","2","JanV34","1747839161.069535","our planet is dying","manual"
"cpsysc5","t3_30jbk4","30jbk4","AskReddit","unknown","Petie! It's ya roommate. Remember, time and circumstance changes everything. Life as we know it, is temporary. ","2015-03-27 21:40:36","2","iCantDieSoWhyDontYou","1747839161.07099","our planet is dying","manual"
"cpsyusb","t3_30jbk4","30jbk4","AskReddit","unknown","It's kind of amazing how we evolved to where we are now. I don't really think too much about what it all means, but in terms of my purpose, I love my life and I spend it with the people I love and hopefully make a positive impact on my community and the people around me. ","2015-03-27 21:42:36","2","tengolacamisanegra","1747839161.072696","our planet is dying","manual"
"cpsyyi8","t3_30jbk4","30jbk4","AskReddit","unknown","Respectively, happenstance and nothing.","2015-03-27 21:45:38","2","Asmor","1747839161.073814","our planet is dying","manual"
"cpt06dh","t3_30jbk4","30jbk4","AskReddit","unknown","To discuss things on Reddit, of course...","2015-03-27 22:23:43","1","m_queen","1747839161.0751958","our planet is dying","manual"
"cpt5hbp","t3_30jbk4","30jbk4","AskReddit","unknown","You are making the assumption that life has a meaning and there is some sort of grand reason the universe exists. ","2015-03-28 01:20:41","1","ValkyriesFire","1747839161.076274","our planet is dying","manual"
"cpszc5b","t3_30jbk4","30jbk4","AskReddit","unknown","Umm... were you living in a closet all these years or something? Just read the Bible... you know some math text books have answer books? Well it's easy as that... Life's answer book is the Bible, it's just ridiculous that people seem to be questioning the meaning of life and coming up with these creative humanly ideas when the answer is just right there. Just cracks me up.","2015-03-27 21:57:07","-1","[deleted]","1747839161.0783591","our planet is dying","manual"
"cp4mv96","t3_2xyjf4","2xyjf4","AskReddit","unknown","If you look into it a but you would see that people dont just reincarnate into another person, Their are many variations to reincarnation and in some beliefs you can reincarnate into an animal or flora.","2015-03-05 00:15:39","2","Denvermax31","1747839259.489867","our planet is dying","manual"
