"id","parent_id","post_id","subreddit","tone","text","created_utc","score","author","scraped_utc","query_used","query_category"
"e11a5gq","t3_8skmlj","8skmlj","TrueOffMyChest","unknown","Dude I think I wrote an essay trying to break this down piece by piece, it was getting dumb long so I'll just try to distill that thing into its basic parts.

If the issue at the heart of our discourse (and it is) is a lack of nuance, details, context, however you want to phrase what I can only call good information then the only thing you're ever going to be able to do is talk to people who are willing to be spoken to one on one and hope you get throught. ""Meaningful Discussion"" is not possible when societies have devolved beyond a certain point. Our capacities for anything of that sort died a long time ago, at least when it comes to talking about the actual roots of our problems. (***Capital, the state's relation to it, the social conditions deriving from the consequences of said relationship and our unwillingness or even support for this socially destructive setup***) The kill em where they stand talk will keep on until an actual outlet for the discontent presents itself. No one with any amount of sense actually thinks your parents are Nazis, they're probably nice people, it's the nice people that trust most easily anyways. But so long as they're plugged in to Hannity, Carlson and that weird British Guy they're still compromised on one level or another. And that's something that does have to be tackled, just not by a firing squad. Maybe a nice talk with the TV off and some nice food.

I don't know what kind of idiots you're dealing with on Facebook, but they're probably not as representative of the country as you think they are. If they were, this thread would reach the front page.

And I'm really trying my hardest to respond in a calm measured way because I, like you, don't want our problems settled in the street  (not when my side would lose anyway). I will grant to you however, that the dehumanization talk is dangerous, not because it's dangerous now but because it's virulent and if it continues to grow then I will have to buy a gun, you will too and everyone will have to board up their windows. Let's hope it doesn't get there.

And just briefly on the Southern Strategy thing. You're not digging deep enough OP, our problems don't start in 1964. America has always had a place for fascism when times aren't good, a place for reactionary politics, it's in our nature. You have to go farther than 60ish years if you want to get to the root of it. I hope this came out well, this is like the third rewrite and I hope I get through.","2018-06-21 06:14:07","0","[deleted]","1747910038.8258061","our planet is dying","manual"
"e104awk","t3_8skmlj","8skmlj","TrueOffMyChest","unknown","Please remember to read our sidebar. We try to remove as little as possible, but we still enforce our rules. You can see any removed comments at the snew link in this comment.

Snapshots:

1. *This Post* - [archive.org](https://web.archive.org/20180620181839/http://www.reddit.com/r/TrueOffMyChest/comments/8skmlj/i_consider_myself_pretty_liberal_but_the/), [_megalodon.jp\*_](http://megalodon.jp/pc/get_simple/decide?url=http://www.reddit.com/r/TrueOffMyChest/comments/8skmlj/i_consider_myself_pretty_liberal_but_the/ ""could not auto-archive; click to resubmit it!""), [removeddit.com](https://www.removeddit.com/r/TrueOffMyChest/comments/8skmlj/i_consider_myself_pretty_liberal_but_the/), [archive.is](https://archive.is/emfbh)

2. /r/The_Donald - [archive.org](https://web.archive.org/20180620181843//r/The_Donald), [_megalodon.jp\*_](http://megalodon.jp/pc/get_simple/decide?url=/r/The_Donald ""could not auto-archive; click to resubmit it!""), [_archive.is\*_](https://archive.is/?url=%2Fr%2FThe_Donald&run=1 ""could not auto-archive; click to resubmit it!"")

3. /r/politics - [archive.org](https://web.archive.org/20180620181848//r/politics), [_megalodon.jp\*_](http://megalodon.jp/pc/get_simple/decide?url=/r/politics ""could not auto-archive; click to resubmit it!""), [_archive.is\*_](https://archive.is/?url=%2Fr%2Fpolitics&run=1 ""could not auto-archive; click to resubmit it!"")

4. Southern Strategy - [archive.org](https://web.archive.org/20180620181853/https://en.wikipedia.org/wiki/Southern_strategy), [_megalodon.jp\*_](http://megalodon.jp/pc/get_simple/decide?url=https://en.wikipedia.org/wiki/Southern_strategy ""could not auto-archive; click to resubmit it!""), [archive.is](http://archive.is/lKha2)

*^(I am a bot.) ^\([*Info*](/r/SnapshillBot) ^/ ^[*Contact*](/message/compose?to=\/r\/SnapshillBot))*","2018-06-20 18:19:34","-2","SnapshillBot","1747910038.828619","our planet is dying","manual"
"e10lmxx","t3_8skmlj","8skmlj","TrueOffMyChest","unknown","Go on r/askthe_donald for a bit, trust me, it will change your life","2018-06-20 22:21:14","-4","[deleted]","1747910038.8303099","our planet is dying","manual"
"e10e1l9","t3_8skmlj","8skmlj","TrueOffMyChest","unknown","Aren't the conservatives the ones who like guns though? I'd love to see the libtards try anything.","2018-06-20 20:30:14","-9","[deleted]","1747910038.831348","our planet is dying","manual"
"e10vbdb","t3_8skmlj","8skmlj","TrueOffMyChest","unknown","They run an administration that calls for the separation of children from families, vulnerable sick people to be kicked off their healthcare, and the growing divide between poor and wealthy. That’s all violence to me. But please, tell me how conservatives are the victims here. 

The GOP has a SUPERMAJORITY and somehow its supporters are the ones who deserve a little TLC after they’ve emboldened the absolute dregs of Washington? They’re the real fucking snowflakes.","2018-06-21 01:10:17","-14","BizarroJordan","1747910038.833117","our planet is dying","manual"
"e0u1eh0","t3_7upo2t","7upo2t","conspiracy","unknown","Would it serve to add to the conversation here regarding my near death experience and take this to another possibility? I became a ""born again"" Christian as the result of a NDE during a horrific auto accident as a teenager. I'm not sure if it would open a proverbial can of worms if I were to state that we are in essence, capable of reaching our higher self, aka ""Christ like"" self as his spirit ascended to the higher 6th dimension. I've read a lot of content that speaks of the uncertainties of our journey After death and I can assure you that I do know for a fact that when we die, it is just a transition to the next stage or level of being as in the spiritual realm. I did not go to the pearly gates for judgement nor were the flames of hell licking at my backside. When I left my body I met a being, who strangely looked familiar at the time. I was very drunk as a 17 year old teen but was suddenly very sober upon leaving my body. Go figure. This being told me; ""It's not your time. You must go back for you have much work to do."" I spent the majority of my life trying to find the meaning in these prophetic words to me from a seemingly familiar man who reminded me of Jesus. I was later told by a spirit called ""Abram"" from an old Mayan shaman who was channeled or ""reached"" by a man who is the medium in FL, that this person was ""my higher self""... I was in a state or shock and yet also recognition of myself, the familiar being, and the completion of the circle of mystery that had surrounded this event during a 100 mph auto accident. I've since discovered that my ""work"" is to help people overcome their fears of death as well as the help enlighten them to the aspects of our spiritual identity as beings who are direct descendants of the ""god source"" and that our true essence will more than likely be debated throughout eternity but that we are in fact eternal beings on a quest to get off the Samsara karma wheel. As we are beings of light and images of ""god's"" likeness, we need to shed the evil and negative aspects of this carnal incarnation and strive to be as pure as we can in order to ascend to the next dimension or levels as they are also known. Jesus was very emphatic about his teaching and all that he said to corroborate the essence of purity as the ""key"" to ""heaven"". in MHO, heaven is a ""state of mind"" and not a destination and ""hell"" as we know it here on earth is the continuous trap of everlasting life in this cursed karmic wheel. As I've actually seen demons on several occasions as well as UFO's, my interpretation is still being analysed and understood... I'm just here working as a ""puzzle assembler"" trying to make sense of it all from what I know from the other side and trying to help people wake up if that makes any sense...","2018-06-17 19:47:35","2","Lonewolf3758","1747910821.4133172","our planet is dying","manual"
