"id","subreddit","tone","title","text","created_utc","score","num_comments","upvote_ratio","url","is_self","author","scraped_utc","query_used","query_category"
"7upo2t","conspiracy","unknown","Gnosticism and the Demiurge is the Truth amidst a realm ridden with Deception","According to Gnostic literature, it reveals the true nature of this reality to be illusory and that the material universe is corruptible. While contemporary Abrahamic religions contend that an allegedly benevolent God shapes this world and the Devil/Satan wreaks havoc in defiance of this 'Lord', such dichotomy may be inaccurate according to Gnosis. The being responsible for the creation of this world is not an infallible or perfect figure, in fact the terms ""God"" and ""Devil"" are perhaps speaking of the same entity known as the Demiurge. If you examine biblical literature, there are many passages that demonstrate the viciousness and outright hostility of YHWH, the being that people today refer to as 'God'. The Demiurge, whose secret name is Yaltabaoth, or child of Chaos, and its entourage of Archons are deemed responsible for the captivity of our souls in this illusory, material matrix realm of pain and suffering. The Demiurge's behavior demonstrates that it is devoid of compassion and empathy, and even possess bloodlust. Observe your world, this realm is steeped in Chaos. Has your experience here proven that this is the divine working of a perfect creator? Instead, has this realm brought you adversity, agony, suffering? Does your happiness come at the expense of other sentient beings? Have you endured cruel and unfathomable pain that you would not wish upon the most despicable of people? Inconceivably heinous and abominable things happen here, and for what good reason?

The beast system where animals mercilessly attack and kill other beings as a means of survival. People dying in agonizing ways by diseases, natural disasters, famine and gruesome murders among many others. From my own experience all that I've ever known was immense suffering dealing with several different diseases and watching innocent children die a brutal, agonizing and slow death to cancer. What kind of benevolent God would allow such atrocities to persist? People find it exciting when pondering the notion of reincarnation into perhaps a fearless lion or bear. But what if you draw the short end of the stick and reincarnated as an innocent baby impala or gazelle over in the eastern parts of the world? What you find over in r/natureismetal and online videos is the beast system in its raw form where these souls are eaten alive In such immense agony by other beings in this realm. [https://www.youtube.com/watch?v=PcnH\_TOqi3Ibaby](https://www.youtube.com/watch?v=PcnH_TOqi3Ibaby) (baby impala being eaten alive by baboons) [https://www.youtube.com/watch?v=Lc63Rp\-UN10baby](https://www.youtube.com/watch?v=Lc63Rp-UN10baby) (baby elephant being eaten alive by lions) [https://www.youtube.com/watch?v=90M7kH5wCtA#t=04m15s](https://www.youtube.com/watch?v=90M7kH5wCtA#t=04m15s) (koala eaten from a tree by a puma)

An evil, wrathful, vengeful entity that constantly demands worship is what I interpret the Demiurge and the Buddhist teachings which closely ties with Gnosticism greatly resonates with me. To liberate our souls out of this archontic karma reincarnation system and break the cycle of suffering. Freedom from the Samsara Wheel.

[http://college.holycross.edu/projects/himalayan\_cultures/2011\_plans/dsexton/Wheel\_of\_Samsara.html](http://college.holycross.edu/projects/himalayan_cultures/2011_plans/dsexton/Wheel_of_Samsara.html) (an ancient Buddhist painting depicting the Demiurge grasping the wheel of the various different hellish/heavenly astral realms we find our souls in. The bottom pictures show beastly entities, demonic in nature who are tormenting many human souls in depths of fire (hell). The being to the right floating above the cloud is a Buddhist monk who was able to attain complete Liberation from this evil Samsara Wheel)

Take a moment to truly analyze what is occuring within the pictures here [https://imgur.com/a/Mr9zV](https://imgur.com/a/Mr9zV) Notice that their is a very distinct common theme from various parts of the world in their interpretation of the Hellish astral realms our souls/consciousness can reside in. They were certainly more tuned into the spiritual aspect of human existence compared to the matrix spell we are under today. The beastly demonic entities that are depicted within these ancient paintings from all over the world are the agents & minions of the Demiurge/Archons. Archons are hidden negative controllers of humankind, inorganic interdimensional entities that must now be exposed and exorcised from the individual human mind, from our human species, and from the planet as a whole as part of our collective evolution to a new state of consciousness and being. Archons are a parasite that has ruled over and controlled earth for centuries. We have been spiritually enslaved exactly as it is depicted in The Matrix. Pure evil, it is up to us to put in the work and effort in achieving liberation out of this for the sake of the collective soul. The intro of the film the Animatrix sums it up rather perfectly. The robots are essentially the Archons responsible for tormenting our souls [https://m.youtube.com/watch?t=304s&v=jNiO2sTe2wo#t=05m10s](https://m.youtube.com/watch?t=304s&v=jNiO2sTe2wo#t=05m10s)

([http://www.bibliotecapleyades.net/vida\_alien/alien\_archons16.htm](http://www.bibliotecapleyades.net/vida_alien/alien_archons16.htm))

The reason you hear people or David Icke refer to ""ruling family bloodlines"" is because humanity is controlled by 13 bloodlines. These bloodlines hold the genetic DNA blueprint required for these archons to survive on. Devoid of empathy, love, positivity, these beings are the literal reincarnational opposite of what human beings truly are. Our reality has been hijacked, our emotions manipulated, our culture destroyed, divided, attacked. We are not a hateful species. We do not truly resonate at a level of negativity, anger, fear, hatred, but by control through financial institutions, pharmaceutical companies, military, entertainment, food, media, everything. We have been controlled and put into a state of constant fear, worry, anxiety, the exact opposite of what we are as humans. The archons feed off negativity and the fear vibrations of human beings that are constantly induced in those states because of the lifestyle that has been constructed for us to control us as modern day slaves. Although archons do exist physically, the real danger they pose to humanity is not invasion of the planet but invasion of the mind. The archons are intrapsychic mind\-parasites who access human consciousness through telepathy and simulation. They infect our imagination and use the power of make\-believe for deception and confusion. I hope I am tying this together well enough. With 13 ruling bloodlines, with the genetic DNA blueprint required for these entities to continue living through us contained in those 13 bloodlines. By control of all major institutions required to live on this earth we are basically forced into their system of control. By being subjugated to that voluntary control that appears as reality but is really controlling us they manage to keep humanity in a low state of vibrational being. This has been done for eons. Everything dark in the world is related to this archons. Pedophile networks are tied to these negative beings that use the fear, depravity, and lack of light as a means to sustain itself. Archons have become so disconnected from light, so disconnected from God source, they require the exact opposite of what God source is to survive because it is the polar opposite of what the creator is.

The inverted pentagram is the primary sigil associated with Satanism, the dark occult, dark arts, left\-hand path.

The explanation for this is because it represents a perversion, or an inversion of the sacred seal of the upright pentagram.

The upright standing pentagram has five points. The bottom four points of the star symbolize the elements that comprise matter: Earth, Fire, Air, Water. The apex of the pentagram symbolizes Spirit, and it's governance over the forces and elements of Matter.

The Hermetic definition of Spirit is a higher or mystic force or power. Spirit is also the Numinous Presence or Power contained within the divinity of Man. This is the force that counters and repels the demonic forces of iniquity peddled by the Archons. Without cultivating the Heart and pursuing Spirit, we are but wounded prey no more intelligent than the animals here in Kenoma (realm of matter) to these Astral Predators.

When the Pentagram becomes inverted, it subjugates the Spirit and permits the forces of corruptible matter to reign over the Numinous. This is the ultimate maneuver of subjugating the souls incarcerated in this realm. It is a formidable force that dominates this world. Observe your world, and know that the majority of Souls are motivated by the pursuit of worldly things \-\- gratification, wealth, power, sensual pleasure, etc. There is a profound lack of True education on matters of the Soul and matters of Spirit.

[https://image.spreadshirtmedia.net/image\-server/v1/compositions/124984169/views/1,width=300,height=300,version=1472099537/pentagram\-elements\-spirit\-magic\-icon\-t\-shirts\-mens\-premium\-t\-shirt.jpg](https://image.spreadshirtmedia.net/image-server/v1/compositions/124984169/views/1,width=300,height=300,version=1472099537/pentagram-elements-spirit-magic-icon-t-shirts-mens-premium-t-shirt.jpg)

[https://wallpapercave.com/wp/JM4jF6W.jpg](https://wallpapercave.com/wp/JM4jF6W.jpg)

If anyone has an interest in a variety of material considered 'gnostic' by virtue of the systems utilized to unveil that which is hidden, I recommend The Secret Teachings of All Ages by Manly P. Hall as primer into the genre of classical esoterics.

For more literature based on classical authentic Gnosis I recommend delving into the texts contained in the Nag Hammadi series. It is in my opinion the premier library of texts that present the unadulterated Gnostic revelation \-\- an apocalyptic vision of the story of our genesis. It portrays a uniquely different interpretation of the contemporary Christian mythos, that is: the story of Creation and the Garden of Eden, was the Fall of Man as clear cut as we are taught?

Read the Apocraphyn of John, the Gospel of Thomas, Hypostasis of the Archons. These are but a few contained within the incredible library found in Nag Hammadi, but I recommend The Dead Sea Scrolls and research the Cathars, the Valentinians, Sethians, Manichaeism, etc.

The Cathars were a legitimate Gnostic sect of Christianity that shared many tenets of Buddhism and Dharma. They were an exceptionally peaceful group of ascetics that abstained from meat consumption and taught the revelation of the transmigration (reincarnation) of souls as orchestrated by the Archons/Lords of Karma. They were annihilated by the Archon/Demon infiltrated Catholic church in one of the most egregiously heinous murder campaigns ever waged, sanctioned by Pope Innocent III.

Gnosis is about redemption and liberation from the clutches of the Beast system. Truth is the conduit to this freedom.

Here is a short video of the brilliant thinker Graham Hancock discussing a brief overview on the origins of Gnosticism and the Demiurge [https://youtu.be/5A6Kbf\-ocWk](https://youtu.be/5A6Kbf-ocWk)   ","2018-02-02 07:15:24","91","74","0.79","https://www.reddit.com/r/conspiracy/comments/7upo2t/gnosticism_and_the_demiurge_is_the_truth_amidst_a/","True","ADPNova","1747903953.374481","our planet is dying","manual"
