"id","parent_id","post_id","subreddit","tone","text","created_utc","score","author","scraped_utc","query_used","query_category"
"e1gu5co","t3_8uo4s7","8uo4s7","collapse","skeptical","Making yourself miserable doesn't help anyone. ","2018-06-28 22:52:51","84","[deleted]","1747909673.44617","our planet is dying","manual"
"e1gys4p","t3_8uo4s7","8uo4s7","collapse","skeptical","Old Proverb: ""Eat, Drink and be merry. For tomorrow we die.""

Go ahead, feel free. It's not like it would change anything anyway.","2018-06-29 00:12:39","53","shortbaldman","1747909673.448041","our planet is dying","manual"
"e1gzea8","t3_8uo4s7","8uo4s7","collapse","skeptical","Just strive to be a kind person, it's really the only thing you can control. Being happy spreads joy to others.","2018-06-29 00:23:42","21","send_it_buddy","1747909673.4490602","our planet is dying","manual"
"e1h67kr","t3_8uo4s7","8uo4s7","collapse","skeptical","Look, the latter half of the 20th century was one big fluke. We’re at peak prosperity. If you have the means, go out and spend. Hookers and blow. It’s the end of the world as we know it and I feel fine. But don’t have kids.","2018-06-29 02:23:17","15","redditreloaded","1747909673.450967","our planet is dying","manual"
"e1gugfw","t3_8uo4s7","8uo4s7","collapse","skeptical","Enjoying oneself is all anyone living on Earth can do, if they even can to begin with aside from just day to day survival.","2018-06-28 22:57:55","9","GWNF74","1747909673.45254","our planet is dying","manual"
"e1gunyo","t3_8uo4s7","8uo4s7","collapse","skeptical","It's better to die at the same time as everyone else. That way ... fewer assholes outlive you.","2018-06-28 23:01:21","12","nuthernameconveyance","1747909673.454023","our planet is dying","manual"
"e1gzo76","t3_8uo4s7","8uo4s7","collapse","skeptical","I did the same thing last year. I came to the realization that I wasn't going to retire so I took 7 weeks off and hiked, kayaked, camped, met cool people, did drugs, went to music festivals,  visited friends that lived far away from me. It felt good. 

Part of my trip was hiking the W in Torres del Paine national park. It required booking tickets and hostels several months in advance. Being an avid /r/collapse reader, I really started to get nervous a SHTF moment would happen before I ever got to do anything fun. Once I got out, I was fine if civ collapsed or my life collapsed but I would have been pissed if something happened that triggered a fast collapse and I spent my whole life in school or a crappy job. 

Now I'm back to having a shitty job and I'm itching to run away again. So yeah do it. Do it now. Even if the techno optimists are right, that doesn't mean you're going to live forever. Do what you want to do. There's no rules for how to live your life. The default thing to do - get a job, have kids - is destroying the biosphere, you're free to not do that. It's probably better if you don't. 

This will sound dumb (as in cliche and not profound). I don't share it IRL but I'm on the internet so I don't care what people think - A mantra that I like to live by came from an EDM song ""do what you feel like, who fucking cares, heaven is so close, just be prepared""","2018-06-29 00:28:40","10","[deleted]","1747909673.456502","our planet is dying","manual"
"e1hbvwn","t3_8uo4s7","8uo4s7","collapse","skeptical","I disagree. Be happy and fulfilled, but don't be a part of the problem with your blind-eyeing the issues.

Don't deny your individual impact as a convenience to yourself, you have the agency to make daily choices for our global ecosystem and society. No one is asking you to move a mountain. Just carry your load.","2018-06-29 04:14:31","8","eidolist","1747909673.458143","our planet is dying","manual"
"e1gwsdj","t3_8uo4s7","8uo4s7","collapse","skeptical","There's no better time to enjoy yourself than right now. ","2018-06-28 23:37:42","5","DJDickJob","1747909673.45968","our planet is dying","manual"
"e1h0nz6","t3_8uo4s7","8uo4s7","collapse","skeptical","SMOKE EM WHILE YA GOT EM","2018-06-29 00:46:51","5","[deleted]","1747909673.464281","our planet is dying","manual"
"e1h2v29","t3_8uo4s7","8uo4s7","collapse","skeptical","Morality doesn't exist. Nothing is okay as much as nothing is wrong. You do what you want to do as long as you are willing to face the consequences. In this case, your input to the destruction of the planet is 1/7.000.000.000.000 so you might as well indulge in a trip.","2018-06-29 01:24:54","4","[deleted]","1747909673.466214","our planet is dying","manual"
"e1hhqjb","t3_8uo4s7","8uo4s7","collapse","skeptical","Definitely enjoy yourself more.  We're in the last days of pseudo-democracy in the United States, so I'm having fun while I can.

It's an incredible ride. 

Trying to keep a positive outlook.  It'll all be over soon.","2018-06-29 06:37:08","4","[deleted]","1747909673.4681542","our planet is dying","manual"
"e1i93rb","t3_8uo4s7","8uo4s7","collapse","skeptical","Absolutely.  Ride this dumpster fire into the sun.  Not a single thing you do will matter ultimately anyway, so why care.","2018-06-29 16:48:40","3","ErikaTheZebra","1747909673.469226","our planet is dying","manual"
"e1gxt0t","t3_8uo4s7","8uo4s7","collapse","skeptical","I think its totally okay, I find myself going down that route too.  Unless we see something like the holodeck from Star Trek in our lifetimes, we're living in the epitome of material pleasure and entertainment.  Might as well take advantage of it while it's still here.","2018-06-28 23:55:25","3","[deleted]","1747909673.471382","our planet is dying","manual"
"e1h0iga","t3_8uo4s7","8uo4s7","collapse","skeptical","Why not, we're all gonna burn together, might as well get a tan.","2018-06-29 00:44:03","3","On_The_Fourth_Floor","1747909673.4736588","our planet is dying","manual"
"e1h1ndj","t3_8uo4s7","8uo4s7","collapse","skeptical","Its the only option in my opinion.
Besides that I feel privileged to love during these times. To be living at the end of an era has it’s beauty imo","2018-06-29 01:04:05","3","OffendingBuddist","1747909673.475105","our planet is dying","manual"
"e1hq85a","t3_8uo4s7","8uo4s7","collapse","skeptical","Pull up a chair and enjoy the fire.

I brought some marshmallows to roast too!","2018-06-29 11:23:04","3","Redz0ne","1747909673.476307","our planet is dying","manual"
"e1h7cfd","t3_8uo4s7","8uo4s7","collapse","skeptical","been on a whore monger spree. you aint the only one","2018-06-29 02:44:23","2","jewishsupremacist88","1747909673.482101","our planet is dying","manual"
"e1hai6c","t3_8uo4s7","8uo4s7","collapse","skeptical","No it is not ok but why would you care?","2018-06-29 03:46:10","2","avocadowinner","1747909673.483271","our planet is dying","manual"
"e1hn5wx","t3_8uo4s7","8uo4s7","collapse","skeptical","/r/nihilism  we got a logo now and everything!","2018-06-29 09:41:08","2","potent_rodent","1747909673.485536","our planet is dying","manual"
"e1h0j5c","t3_8uo4s7","8uo4s7","collapse","skeptical","Go volunteer at a soup kitchen or something bub","2018-06-29 00:44:26","1","[deleted]","1747909673.487457","our planet is dying","manual"
"e1h0ods","t3_8uo4s7","8uo4s7","collapse","skeptical","even if our society wasn't fucked up there'd still be reason to feel that way

compare the pleasure a lion gets from eating a gazelle to the pain experienced by the gazelle 

that same relationship can be seen in countless places, slight pleasure in exchange for excessive pain

you're the only one who can decide how you cope with that

personally I'm of the opinion that what I do, what I want to do, and what I have to do are all the same thing, so that way I can rationalize whatever I want, lol

","2018-06-29 00:47:03","1","reddit_is_pretty_rad","1747909673.489425","our planet is dying","manual"
"e1h39mg","t3_8uo4s7","8uo4s7","collapse","skeptical","You are quite confused. If in this transitional time you are unable to **get a new meaning of life**, than that of the deteriorating past one, you will suffer forever.

> We feel powerless and doomed.

That are strong strong feelings. Most of all they are immobilizing and a self-fulfilling prophesy.

> I don't even want to fight anymore.

Having no aim means, you cannot hit the target!

> I feel that because collapse is so imminent and there's no future

If you cannot say good bye to your passing life, you drown with it.

> I feel selfish but there's nothing else I could do. 

You are, but you aren’t!

> The end is nigh. 

A dead-wish, never to realize …

> At least, I want to enjoy a little bit more before the explosion.

To feel happy is a well deserved need. Stress is unavoidably part of our life. Running away doesn’t solve that contradiction.

>  I rally want to die before collapse starts. 

To run away from disaster is a natural impulse.

> This world is a mess.

It always was. Only the illusion was it to be orderly and neat. Now you are confused, not the world.","2018-06-29 01:31:45","1","Hubertus_Hauger","1747909673.491959","our planet is dying","manual"
"e1h79fs","t3_8uo4s7","8uo4s7","collapse","skeptical","I posted so something recently and someone had a bit of a go at me for flying long distance reminding me of my enormous carbon footprint.
Yeah, fair cop, but let's say I resolve to never fly again, meaning I'll never see some loved ones ever, ever again, what difference will that really make to the planet?","2018-06-29 02:42:49","1","[deleted]","1747909673.4939148","our planet is dying","manual"
"e1h8gl3","t3_8uo4s7","8uo4s7","collapse","skeptical","What else can you do? if you can feel happy, feel blessed and enjoy it!","2018-06-29 03:05:41","1","Duckmandu","1747909673.4972339","our planet is dying","manual"
"e1h9ha5","t3_8uo4s7","8uo4s7","collapse","skeptical","What would be better?","2018-06-29 03:25:26","1","Swarengen","1747909673.500234","our planet is dying","manual"
"e1haxm8","t3_8uo4s7","8uo4s7","collapse","skeptical","Definitely. What is the point of being around at such an amazing time in human history and not enjoying it?","2018-06-29 03:54:51","1","EnfantDeGuerre","1747909673.5018969","our planet is dying","manual"
"e1hh2l5","t3_8uo4s7","8uo4s7","collapse","skeptical","This is adorable","2018-06-29 06:18:33","1","[deleted]","1747909673.504501","our planet is dying","manual"
"e1homet","t3_8uo4s7","8uo4s7","collapse","skeptical","Your actions has consequences, as long as you're ok with the consequences you can act the way you do.","2018-06-29 10:32:45","1","Dave37","1747909673.506315","our planet is dying","manual"
"e1hpnrl","t3_8uo4s7","8uo4s7","collapse","skeptical","You have only one life and to waste it by not having fun or enjoyable experience doesn't make sense.

We should be aware of the consequences of our actions and how the contribute but it's just a fact that individually we can't do much.

If you wouldn't go I bet there's 10 people waiting to go and take your spot.

Its your own call.","2018-06-29 11:06:13","1","Farade","1747909673.508013","our planet is dying","manual"
"e1hsb65","t3_8uo4s7","8uo4s7","collapse","skeptical","yep, within reason","2018-06-29 12:17:08","1","SevereAnxiety76","1747909673.508933","our planet is dying","manual"
"e1i9qqi","t3_8uo4s7","8uo4s7","collapse","skeptical","Are you flying there? If so, you are the explosion.

Edit - You don't have to be the explosion in order to enjoy yourself.","2018-06-29 16:57:39","1","[deleted]","1747909673.514459","our planet is dying","manual"
"e1gwpex","t3_8uo4s7","8uo4s7","collapse","skeptical","OH NOES!!! THE END IS NIGH!!

I seem to recall the same words during Earth Day 1970. How many more half centuries will go by before it becomes obvious enough that the pessimists and misanthropes just tend to like this idea? ","2018-06-28 23:36:16","-7","[deleted]","1747909673.5159569","our planet is dying","manual"
"e04vrt2","t3_8okcfr","8okcfr","sustainability","action-oriented","We have to stay positive and thinking that more and more people are getting conscious about the outdated system we are living in. The problem is that the world is control by an economic system that was working 50 years but doesn't work nowadays. For the quantity  of energy that we  are getting ,It has became more expensive to extract charcoal than using renewable energy. And even if the government know that، there is no change or really few to push renewable energy۔ 
The best way to change this system is first to change our habits , make a change in our community and vote۔ 
I hope your project will get the fund needed to start۔ 
Happy environment Day","2018-06-05 05:20:17","3","Titel974","1747909741.740212","our planet is dying","manual"
"e060bhp","t3_8okcfr","8okcfr","sustainability","action-oriented","What is nature and what is not? Our planet is changing, and the life that inhabits it is evolving along the way. Preserving biodiversity while minimizing climate change will be mankind's role over the next 50 years.

Even in New York City, you can find beautiful examples of these kinds of efforts. They even save money! [NPR - Do Cities Need More Green Roofs](https://www.youtube.com/watch?v=FlJoBhLnqko)?","2018-06-05 19:26:55","2","fonix5","1747909741.742691","our planet is dying","manual"
"e04ta6b","t3_8okcfr","8okcfr","sustainability","action-oriented","While I don't totally disagree that our system is messed up, and that we don't have a basic appreciation for nature, I don't have as one-sidedly pessimistic a view-point. 

I think we take a very privileged perspective of the ""wonder of nature."" I think there's a very harsh reality that nature is also exceedingly rough around the edges. It's not like before human society existed we were in perfect union with nature. The earliest humans murdered each other. Everyone died by our standard of ""middle age"" from starvation and disease. 

I don't think many humans pre-civilization sat back and marveled at the wonder of nature, because there wasn't anything else in contrast. They probably hated nature. Nature was their primary oppressor. I'm just saying, that I think we fantasize about something that probably isn't a reality. 

But I do agree with you, our system is built around a shitty ideology that makes us use our immense resources to mostly gain worthless material and consequently destroy the environment. But I don't think everyone is indoctrinated. I think we're kinda selfish to begin with and it only really takes an incentive of wealth and superficial stuff to get us to forget about anyone but ourselves.  But there are definitely some people who don't think this way.","2018-06-05 04:21:16","1","Tscook10","1747909741.746581","our planet is dying","manual"
"e104h89","t3_8skmlj","8skmlj","TrueOffMyChest","unknown","I'm Republican and in the same boat. My father is almost as liberal as it gets. I'm shocked by death threats towards liberals and the hatred towards Muslims.  I'm also very bothered by conservatives attacking children over gun rights. These children that survived school shootings. ","2018-06-20 18:21:55","14","PickleweaselNaeNae","1747910038.793659","our planet is dying","manual"
"e10o2ep","t3_8skmlj","8skmlj","TrueOffMyChest","unknown","So I'm on the right side, and actually support trump. But you my friend are the real hero. I never see people on the left saying this. Let me rephrase that, I never see anyone on any side saying this. I believe if more people are like you(and myself), that would be what this country needs. Just because I am conservative doesn't mean I don't "" cross political lines"". Sometimes I think common sense prevails, and everyone needs to get on that boat, rather than just bashing people for different point of views. ","2018-06-20 23:00:32","12","wandsmith","1747910038.795713","our planet is dying","manual"
"e104ui6","t3_8skmlj","8skmlj","TrueOffMyChest","unknown","I quite agree and find myself in almost the same boat as you. My folks are the same, and I won't fault them for being manipulated by main stream media... That's the party they were raised in, but it's also a very different generation, the names stayed the same, but not their politics. People that preach tolerance the most, I see, are the most intolerant of anyone of differing view points. They immediately go to extremes, violence, riots, death threats, racism, etc. etc. etc. ","2018-06-20 18:26:57","7","blueeyedbeauty420","1747910038.7973278","our planet is dying","manual"
"e10gg3t","t3_8skmlj","8skmlj","TrueOffMyChest","unknown","As you've noticed and the likely reason why you're posting here and not the original offmychest subreddit is because ""your"" side is becoming ever more insular, all dissent is disallowed. With no moderating opinions left it's only the crazies with the loudspeakers shouting. 

You say Fox is manipulative and yes it is true but the rest are just as bad if not worse because Fox isn't the one dominating mainstream culture. Fox views doesn't have institutional power in colleges all over your country. They're seemingly the only outlet left if you dislike what the mainstream media is pushing unless you want to go to youtube. 

The current left went on the crazy train years ago leaving me behind. They're now the same authoritarian thought police as the right I was against in my youth. Diversity of thought is okay as long as you agree with me. Diversity of race is okay as long as you agree with me. Diversity of sexuality is okay as long as you agree with me. They're going down a dangerous path that can only lead to a lot of suffering for their misguided intentions. 
","2018-06-20 21:03:34","11","iwantmynickffs","1747910038.7998998","our planet is dying","manual"
"e10vyjb","t3_8skmlj","8skmlj","TrueOffMyChest","unknown","I very much believe most of us are moderates that lean left or right. But, it is the extremists that make the noise and get the attention.","2018-06-21 01:21:38","7","chermk","1747910038.8014898","our planet is dying","manual"
"e10vv6x","t3_8skmlj","8skmlj","TrueOffMyChest","unknown","I like the graphic simply because I was raised a “yellow dog” dem. in the south. That being said, man, I can’t get down with either party anymore, at least not with the visible, vocal part of them. 

Seems like the non silent majority of both parties are damn near reactionary hysterical all the damn time. Every story met with !!!! And YUYYHH craziness. 

I voted for myself in the last pres. election, just wrote in my own name, just couldn’t vote for the fools the parties threw at me. 

Idk what I’ll do in 2020... hopefully the dems back a rational human and not a relic of the fucked up past. Otherwise I’ll sort threw the info on the fringe candidates and probably settle on me again. ","2018-06-21 01:20:01","5","[deleted]","1747910038.803565","our planet is dying","manual"
"e10bl2p","t3_8skmlj","8skmlj","TrueOffMyChest","unknown","Personally I just wish we could all find common ground in that were American. We live in the most free, most opportunistic country in the world, although our country has problems we need to A) be willing to listen to each other, and B) respect each others opinions. I’m not calling for everyone to get along but right now on both sides there’s just pure hatred. ","2018-06-20 19:57:08","6","backhandslapbang","1747910038.805131","our planet is dying","manual"
"e10rba7","t3_8skmlj","8skmlj","TrueOffMyChest","unknown","What most frustrates me about all this is that people refuse to see that in general, people believe the way they do because of their life experiences and not because they are trying to be hateful. There are very valid points to both sides of most issues, so you shouldn’t assume you know why most liberals and conservatives think the way they do, because most of them are not represented by the loud minority of crazies.","2018-06-20 23:59:31","5","mewtwo-strikes-out","1747910038.806658","our planet is dying","manual"
"e10soxa","t3_8skmlj","8skmlj","TrueOffMyChest","unknown","To sum up the last 50 years very briefly, society flipped from culturally right wing (think Christian republicans) to culturally left wing(think SJW's in institutions) what I believe we are seeing now is the social friction as both sides are rubbing up against each other as neither one has enough control. And it just will only get worse. ","2018-06-21 00:24:20","6","[deleted]","1747910038.808099","our planet is dying","manual"
"e119790","t3_8skmlj","8skmlj","TrueOffMyChest","unknown","It's a shitty, toxic behavior both sides are really good at putting forth. It's why I'm now a centrist, because the right and left wing care about winning, not being correct. Even if that means calling each other cucks and Nazis. 

From a former right winger.","2018-06-21 05:47:46","5","[deleted]","1747910038.80942","our planet is dying","manual"
"e11334n","t3_8skmlj","8skmlj","TrueOffMyChest","unknown","Look up the intellectual dark web and their members. Particularly, for your points, David Rubin. There’s a lot of people realizing this, not only on the left but also those on the right. The alienation of issues and elitism of both extremes is getting out of hand. You’re not alone in being concerned, you’re paying attention. 

Edit: I forgot to explain why you should look into Rubin. He’s gay/married and used to align himself heavily to left. The past few years, however, he’s changed his outlook. He’s not blindly siding with the “right” but instead looking at these calls to violence and other things you’re seeing as well and reconsidering his views much your self. ","2018-06-21 03:29:11","1","PoundsinmyPrius","1747910038.811862","our planet is dying","manual"
"e115y9i","t3_8skmlj","8skmlj","TrueOffMyChest","unknown","Some people can't agree. These are the alt-right and the alt-left we need to watch for. I wish one day we can all accept our differences instead of lunging at each other's throats. ","2018-06-21 04:28:03","1","[deleted]","1747910038.814983","our planet is dying","manual"
"e11fo4y","t3_8skmlj","8skmlj","TrueOffMyChest","unknown","The one REAL PRIVILEGE this country can't comprehend is not having had the blood and devastation of a war on home soil since- the *first* Civil War. 

War never changes- or ends well. ","2018-06-21 09:18:03","1","The_MysteriousLurker","1747910038.816324","our planet is dying","manual"
"e12019p","t3_8skmlj","8skmlj","TrueOffMyChest","unknown","I recently took a trip to Baltimore at the beginning of May, To visit family and see the capital. It really concerned me that a lot of the anti-gun protest where more like anti-conservative, demanding for persecution for not aligning with the 'proper ideology.' 

It's ironic that those who believe they are stopping the rise of an authoritarian government are the ones who believe and demand for its practice.","2018-06-21 16:11:14","1","Frostysno93","1747910038.8178618","our planet is dying","manual"
"e132ezv","t3_8skmlj","8skmlj","TrueOffMyChest","unknown","I'm also pretty far to the left, and this really worries me because it's basically admitting we don't see the other side of the political spectrum as people. In my mind, that's exactly the opposite of where our political values should come from. Leftist politics should be based on respect and care for other people. Respect and care for people who think exactly like you doesn't cut it.

I can see killing people who are actively trying to commit violence themselves (though I'd still argue for them to be humanely imprisoned, if at all possible). But your average Fox News viewer isn't actually going to hurt anyone. The worst they'll do is make an ass of themselves in public, which is only a problem for them. Talk to them if you know them, try to get them out of the far right echo chamber if you can, but threatening violence is too much.","2018-06-22 01:41:58","1","tumblruser290","1747910038.8200278","our planet is dying","manual"
