"id","parent_id","post_id","subreddit","tone","text","created_utc","score","author","scraped_utc","query_used","query_category"
"er6jpr4","t3_c0ly9r","c0ly9r","vegan","unknown","I'm shocked I made it this long without ever knowing about the horrors of animal agriculture, or making the connection between being an ""animal lover"" that would catch and release bugs from her home, rescue an injured baby squirrel, and feel bummed whenever she saw roadkill in the road, who felt like hunting and fishing were ""mean"", while also happily paying people to kill animals for me to consume.

I guess there were probably little things here and there that I didn't really pick up on, snippets of things about how factory farms were bad etc, but overall I had *no idea*, until I stumbled onto a conversation thread in /r/askreddit about ""modern day atrocities"" or somesuch. I went vegan basically overnight once I realized.

And even now, I struggle between wanting to shout it from the rooftops, shove it in everyone's face and MAKE them SEE... and just trying to get along socially, keep things nice and comfortable. To not lose my friends. To not cause fights. To not alienate people. 

But it's such a betrayal. After everything I've done to them. They're *dying*. *Right now* they're suffering and dying and I'm... sitting at home, on the internet, typing this. Comfortable and safe. It's so, so wrong. I would want people fighting for me. I would want the hope of it ending one day. I would feel so utterly betrayed if people found out what was happening to me and just... washed their hands of it and walked away. If they were still able to smile in the faces of people still funding my torture, and pretend like it was all okay.","2019-06-14 21:55:43","8","spicewoman","1747930787.559078","our planet is dying","manual"
"er6prlm","t3_c0ly9r","c0ly9r","vegan","unknown","No one ever converted to veganism because they lost the argument.

That said, just be the vegan you would have wanted to know before you were vegan. If it would have worked for you, it’ll probably work for others. :)","2019-06-14 23:09:11","7","[deleted]","1747930787.560322","our planet is dying","manual"
"er677ky","t3_c0ly9r","c0ly9r","vegan","unknown","This book has a great take on both approaches of activism: Motivational Methods for Vegan Advocacy: A Clinical Psychology Perspective https://g.co/kgs/Xo7sTo","2019-06-14 19:43:27","6","bloomcosmic","1747930787.5612679","our planet is dying","manual"
"er6q5dp","t3_c0ly9r","c0ly9r","vegan","unknown","Making people hate vegans with vitriolic criticism absolutely and unquestionably hurts the cause.  

Let the downvotes begin.","2019-06-14 23:14:34","6","[deleted]","1747930787.5628119","our planet is dying","manual"
