"id","parent_id","post_id","subreddit","tone","text","created_utc","score","author","scraped_utc","query_used","query_category"
"ergnu8q","t3_c1zekj","c1zekj","collapse","skeptical","Wall-e is not only an eco-dystopia, I think that it's also quite socialist. As you said, in the movie all human are rich and probably represent the bourgeois class while the robot represent the working class with alienating jobs. What we see in the movie is a revolution of these workers (mostly broken and marginalized robots) allied with some of the bourgeoisie whom reject consumerism and ""unplug"" from their TV.  In the movie this revolution is ""cute"" because it's made by funny robots, but still, it's a violent revolution where they actually fight again cops.


It's also interesting to notice that there is not one bad guy. The captain could have been the bad guy but instead it's the autopilot. The bad guy is not one incompetent leader but it's the whole system, the business as usual is the problem.


Also it's quite feminist because the real badass hero is eve not wall-e.


It's a powerful movie.","2019-06-18 09:11:25","73","docfab22","1747930185.25874","our planet is dying","manual"
"ergmm6g","t3_c1zekj","c1zekj","collapse","skeptical","I haven’t seen he movie in quite some time as my children are older but I think of it from time to time. There’s a reason billionaires are investing in moon rockets and space exploration and not investing in carbon catching science here. They’re securing that their own future generations will be part the futuristic colonies hovering above earth and or on moon and mars. I know it sounds crazy.","2019-06-18 08:38:32","21","Restrictedreality","1747930185.260158","our planet is dying","manual"
"ergt2si","t3_c1zekj","c1zekj","collapse","skeptical","I saw the humanity part of movie in the style of Elon Musk's failed Hopium, especially the magical spaceships that can sustain people for 700 some years while I assume it's circling around the Solar system.

It would have been great if the Humanity part of the movie had been revealed at the end as some delirious dream of the bots built to serve them.  Like, keep it the same all the way through, including the Human sub-plot except for a few details, but then the ships land and the doors open, and then... nothing.  Wall-E peers in and it be all these long-wasted skeletons.  The ships attempted a previous landing, explaining the previous subplot, but due to dwindling supplies, but found the planet still dead so it took off and died sometime.  The ships and bots, with lower energy requirements in sleep mode, survived.  Wall-E hasn't been working for 700 years, but 700,000 thanks to fixer bots and the like.  Humanity is no more than a fevered digital dream.

As it stands, I saw a bunch of humans, even more ignorant and childish than before, ready to destroy a planet that just has the inklings of recovery, not actual recovery.  90% die the first year, the rest, fitter and smarter, go on to pillage the earth once again.","2019-06-18 11:16:54","6","[deleted]","1747930185.262246","our planet is dying","manual"
"erhu480","t3_c1zekj","c1zekj","collapse","skeptical","I sketched an outline for a prequel to this movie where all the left behind people fight it out over what's left. Sort of Fallout/Mad Max thing. It explains things like.

Why Wall-E feels the need to scavenge useful items and self repair. 
Because survivor enclaves re-purposed them for that.

Why Eve shoots at anything that moves and why Otto REALLY doesn't want to go back.

Because survivors used plants grown in their underground vaults to lure them back there and ambush them. Early on they still have a few crude spaceships in orbit. They're no match for the escapee's tech though.

The left behind people built the wind turbines we see and used Wall-E blocks to build fortifications.

The escaping rich have continually improved their tech while out in space, what they come back with is much better than when they left. The story doesn't deal with them much though, we just hear rumors of their existence through dialog. Where I pick up the story things are to the point where you need oxygen assist to leave your vault and scavenge and have to make oxygen in your vault. The divide is between vaults that have enough that their leaders pursue a kind of trade/respect of looting territory strategy and those that have just gone the warlord Humongous/Negan route. The main characters are a talented looter girl, her Wall-E helper and her grandpa.","2019-06-18 18:35:25","5","DukeOfGeek","1747930185.2643058","our planet is dying","manual"
"erh3z7v","t3_c1zekj","c1zekj","collapse","skeptical","wow whop would have thought that wall-e is too communist propaganda. /s","2019-06-18 14:02:37","3","jameswlf","1747930185.265205","our planet is dying","manual"
"erhk0sx","t3_c1zekj","c1zekj","collapse","skeptical","well I mean look at Palmer Luckey he bought a decommissioned nuclear silo in northen Chico, CA so I guess that's one of his bunkers...","2019-06-18 16:55:03","2","ViperG","1747930185.26643","our planet is dying","manual"
"erj4tjf","t3_c1zekj","c1zekj","collapse","skeptical","The same reasons why you and I loved the movie are the same reasons my parents hated it. When we saw it in theatres, my parents started saying how it was just liberals spouting their agenda. But this is some real stuff.","2019-06-19 03:42:18","2","Chewbacca22","1747930185.267349","our planet is dying","manual"
"erq6u0k","t3_c1zekj","c1zekj","collapse","skeptical","wal e is my faverite i want to have a sex of him","2019-06-21 17:02:02","1","PetscopKid5","1747930185.268499","our planet is dying","manual"
"eq9d1o1","t3_bxsi1c","bxsi1c","TrueOffMyChest","unknown","I feel like our world just developed wrong, we got our chance and we fucked it, the powerful are just in too secure positions.

The political structure of the world is basically the rich get rich and the poor get poorer and it will stay this way for the rest of history. 

As an individual I also feel completely helpless in 
this process and just have to sit by and watch the world errupt into chaos.","2019-06-07 09:44:16","55","SnakeMcbain","1747930476.590842","our planet is dying","manual"
"eq9dqd5","t3_bxsi1c","bxsi1c","TrueOffMyChest","unknown","I feel its like the beginnings of a cyberpunk universe without the cool robot parts and ninja hackers.","2019-06-07 10:02:49","48","[deleted]","1747930476.592205","our planet is dying","manual"
"eq9d1hd","t3_bxsi1c","bxsi1c","TrueOffMyChest","unknown","It makes total sense. I don't know what to do about it but I think about it the most when I'm high, which is probably the worst time to be thinking about it. Damn. 

It's so fucking strange. What I do is find loopholes, look out for myself and the few people in my circle, don't be afraid to cheat the system when I can because who really gives a fuck about ""the man"" or ""the rules"" as long as you stay out of jail/prison, and generally try to be kind, not litter and trash up the place more than it already is. 

Be humble but fucking share your thoughts and ideas and get it all out there, create something, do something, have something that matters to you, whatever that may. SOME kind of escape. For me that's art, certain drugs, and World of Warcraft.

I don't know the answers and I never fucking will. I have my theories, but I try not to think about them. The government is literally poisoning us.","2019-06-07 09:44:08","20","[deleted]","1747930476.593802","our planet is dying","manual"
"eq9fec6","t3_bxsi1c","bxsi1c","TrueOffMyChest","unknown","I feel this exact feeling like a rising, choking panic every single day. I wish I had some answers beyond ""keep trying"" but I don't. 

Read ""Enlightenment Now"" by Stephen Pinker... It seems to have helped others I know a lot. It's on my list too but I just haven't picked it up for some reason.

Edit: typos","2019-06-07 10:44:03","8","banditwandit","1747930476.595358","our planet is dying","manual"
"eqa6ixi","t3_bxsi1c","bxsi1c","TrueOffMyChest","unknown","I think you might be watching the news too much and listening to doomsayers too much.  A lot of people seem to like instilling panic and fear into us -- but really, you need to shut it out and live your life.

Fact:

1. Violence world wide has been decreasing over time.    The last two decades have been the most peaceful on record.  Even in the US violent crime is dropping.  Things seem to be getting better.
2. Wealth has never increased this much world-wide.  Literally billions have been lifted out of poverty.  Doesn't mean they are all living at Western Nation standards but the vast majority of humanity isn't destitute anymore.
3. Many people have predicted massive climate change and that we'd all be dead by year X which simply hasn't happened yet.  Yes, I think global warming is a thing and bad stuff could happen in the near future - for instance, ecological refugees is eventually going to be a thing as sea levels rise, coastal cities will be flooded and places like Bangladesh will likely be permanently flooded.  But it doesn't mean an end of the world.  For instance, the extra CO2 in the atmosphere is greening the planet.    Earth will reach a new equilibrium at some point.   Best thing to do is keep an eye out.
4. You seem to think that the globe isn't moving on this.   I think on the contrary that various people are taking actions.  The whole mass migrations happening with people moving into Europe is probably part of this.  The big question is - can we do anything about it tangibly?

Lets face it -- there's too many people on earth.   Population on earth would have to drop to early industrial levels to reverse the trend.  Back in 1900, world population was 1.5 billion (est).  Today we are around 7.5 billion people.  5 times as much.    Now you, if you were the leader of the world - lets say we had a global government.  Would you really be willing to cull 75% to 80% of the population so that we could save the species?

Does anybody on the planet have that authority?  Would we want to have anybody be able to get rid of so many people?  Would you be willing to kill yourself to save civilization?  That's the conundrum of our times.

Like it or not, there's nobody here living that either has the authority or the willingness to ""fix"" the problem because the solution is so drastic and final.  So we either ride it out, adapt, or try to smooth things out.

Earth will take care of the problem by itself.   Just consider yourself lucky if you happen to live in a western nation in the northern hemisphere.  The further north, the better.","2019-06-07 16:51:40","4","Dingbat1967","1747930476.598943","our planet is dying","manual"
"eq9f4dk","t3_bxsi1c","bxsi1c","TrueOffMyChest","unknown","You are not the only one who thinks this way. If anyone who thinks like this would just live their lives as good as they possibly could, I think it will have big influence on these problems on longer term. We can't give up and lose our hope even tough everything seems already lost and distroyed. Educate your friends and relatives about this, then you already have more people doing things right.","2019-06-07 10:37:35","5","kontsu","1747930476.600249","our planet is dying","manual"
"eq9rebe","t3_bxsi1c","bxsi1c","TrueOffMyChest","unknown","Well lucky for you most countries are essentially 100% free, so in reality you can do whatever you. Theres no dystopia, since no one is forcing you to do anything. Being part if a decadent society (so far is a choice). Although i do agree society has become decadent, lazy, and content.","2019-06-07 13:59:20","2","[deleted]","1747930476.602411","our planet is dying","manual"
"eqavnif","t3_bxsi1c","bxsi1c","TrueOffMyChest","unknown","Once you log off social media the world doesn't seem so bad.

Social media is cancerous. I used to think the US was being taken over by neo-nazis. Now I just think the internet is being taken over by loud-mouth pussies. I only go on reddit to kill time at work, but this site especially man. What a fucking cesspool this site can be.

You want to feel better about the world? Get off the internet and go live in it for a bit. I feel pretty okay about life these days.","2019-06-07 20:52:15","2","[deleted]","1747930476.603615","our planet is dying","manual"
"eq9d2b9","t3_bxsi1c","bxsi1c","TrueOffMyChest","unknown","So basically you mean we are slaves of social media and capitalism","2019-06-07 09:44:44","1","Stokiy","1747930476.6050172","our planet is dying","manual"
"eq9jfpp","t3_bxsi1c","bxsi1c","TrueOffMyChest","unknown","Read ['The Better Angels of Our Nature'](https://www.amazon.co.uk/Better-Angels-Our-Nature-Violence/dp/0141034645/ref=sr_1_1?keywords=the+better+angels+of+our+nature&qid=1559908955&s=gateway&sr=8-1)","2019-06-07 12:03:09","1","spacecatbiscuits","1747930476.606334","our planet is dying","manual"
"eq9pxyi","t3_bxsi1c","bxsi1c","TrueOffMyChest","unknown","Stand back and ask if your feelings are based on facts.  Climate change is awful and economic inequality is rising.  But severe poverty has been cut in half in the last 30 years and infant mortality is plummeting all over the world.  Racist politics is on the rise.  But globally, overall deaths from violence continue to fall dramatically.  In short, there is lots of good and lots of bad, and I bet your feelings are based on a focus on the bad.","2019-06-07 13:40:35","1","itsmorecomplicated","1747930476.607489","our planet is dying","manual"
"eq9qrx5","t3_bxsi1c","bxsi1c","TrueOffMyChest","unknown",">We still continues to increase our plastic production

Who exactly are ""we""? You come off as glaringly ignorant and racist.","2019-06-07 13:51:27","1","Millenia0","1747930476.608982","our planet is dying","manual"
"eq9rf2w","t3_bxsi1c","bxsi1c","TrueOffMyChest","unknown","I feel like this has always gone on. At least the part about people thinking of themselves first. The difference is the magnitude of the impact. There are way more people alive today than there have ever been. I really dont think it's that bad though. For every step we take backward, we take two forward. Most of us, if left to the conditions of the world, would be dead without scientific advancements and modern medicine. The world even a hundred years ago was alot harsher than it is today. We can never give up, or we dont deserve a future at all.","2019-06-07 13:59:35","1","jables322","1747930476.610472","our planet is dying","manual"
"eq9v5i1","t3_bxsi1c","bxsi1c","TrueOffMyChest","unknown","To be frank, the big picture is important, but it doesn't help keep a roof over my head or make sure I'm safe or my family is safe.

I do as much as I reasonably can. I limit my plastic consumption, recycle, buy as much local produce and meat as I can. I'm not going to go out of my way and try and explain to people how shitty the natural environment is getting. Jeremy Wade's Mighty Rivers show is a good example of how daily life is ruining fresh water rivers. 

So awareness is great and action is better, but I'm still a selfish person who wants to look out for myself and not waste my energy worrying about what other people are doing. 

I'm not trying to bad mouth you or anyone. For some reason I just get really annoyed with topics like this.","2019-06-07 14:44:07","1","notgoodwithyourname","1747930476.612004","our planet is dying","manual"
"eqa584r","t3_bxsi1c","bxsi1c","TrueOffMyChest","unknown","i think we all need to find a way to join together so that we are heard as a group, hopefully the majority, rather than just a bunch of individuals complaining that the world is fucked. but even that seems impossible with how distracted people are with social media and technology","2019-06-07 16:37:17","1","masondean73","1747930476.6147048","our planet is dying","manual"
"eqa6ebm","t3_bxsi1c","bxsi1c","TrueOffMyChest","unknown","Consume your own content","2019-06-07 16:50:16","1","[deleted]","1747930476.6163359","our planet is dying","manual"
"eqahgy3","t3_bxsi1c","bxsi1c","TrueOffMyChest","unknown","i know!! i know. i picture like, martial law. & wonder if theyd even need it to keep us down. thats where we already are. penopticon type shit. im in the u.s., i think were living in a fascist state? i feel like we're gonna see some real shit go down. i dont know if its getting faster so much as we're getting Closer. its like we keep waiting for it to get just enough worse or soemthing but like we're already there!! little kids in camps & shit. fuck

for some hope: 
""we live in capitalism. its power seems inescapable. so did the divine right of kings.""
ursula k. le guin

i just fear not enough people will see or well all just think we're the only ones & theres nothing to b done. imminent looming global environmental shit makes it seem rlly fucking necessary to dismantle capitalism Soon or Else but at the same time, its like a fucking ticking clock & i dont think we're gonna do it in time.","2019-06-07 18:43:31","1","stigmatagurl711","1747930476.618609","our planet is dying","manual"
"eqam0gi","t3_bxsi1c","bxsi1c","TrueOffMyChest","unknown","Your concerns are very real and valid, and I basically share them, however your extremely negative perception is off and a bit warped. 

Ancient civilization was brutal and monstrous compared to today's society. While we still have many serious problems that need to be addressed and resolved, we've also come a long way. Look at things in light of historical context. 

The future of humanity needs work, absolutely. But it is *not* hopeless.","2019-06-07 19:25:49","1","AnomalousAvocado","1747930476.619765","our planet is dying","manual"
"eqanmmd","t3_bxsi1c","bxsi1c","TrueOffMyChest","unknown","I was so upset about the same thing yesterday that I literally broke down crying. That sense of being powerless and small is so discouraging. I see no way out of it, and I too try to reduce my carbon footprint as much as I can, but does it really matter?","2019-06-07 19:40:16","1","kim_possimpible","1747930476.620843","our planet is dying","manual"
"eqao7bs","t3_bxsi1c","bxsi1c","TrueOffMyChest","unknown","And heck more people would buy reusable disposable stuff if it wasnt so expensive.


Poor people are gonna buy the cheapest thing","2019-06-07 19:45:33","1","[deleted]","1747930476.62222","our planet is dying","manual"
"eqb2d5k","t3_bxsi1c","bxsi1c","TrueOffMyChest","unknown","We are not civilized yet

-Jacque Fresco","2019-06-07 21:45:25","1","Public_Tumbleweed","1747930476.6246881","our planet is dying","manual"
"eqb3340","t3_bxsi1c","bxsi1c","TrueOffMyChest","unknown","its never been a better time for humanity, youre just ignorant on the subject","2019-06-07 21:50:12","1","[deleted]","1747930476.625922","our planet is dying","manual"
"eqb4ocz","t3_bxsi1c","bxsi1c","TrueOffMyChest","unknown","This is so dumb. We’re living in one of the most prosperous times in human history. Untold numbers of diseases are prevented or cured. 

I’m guessing OP has never had to live on a farm or try to homestead. It’s so much harder than you think to eek out a living instead of working a 9-5 and buying your groceries at a store.

For instance one guy tried to grow or make all the ingredients for a sandwich from scratch. It took him over a year to make one goddamn sandwich. Which he said didn’t even taste that good. 

Take the most basic thing you’d use for camping. Like a tent. Odds are you can’t make something as good or waterproof with some linen and stitches. 

Living how we do today is so much better and easier than how it is “naturally”.","2019-06-07 22:00:56","1","[deleted]","1747930476.6274781","our planet is dying","manual"
"eqbej8w","t3_bxsi1c","bxsi1c","TrueOffMyChest","unknown","That's why I subbed to r/ABoringDystopia or else I'd get even more depressed with civilization. But I know I'm not alone.","2019-06-07 23:00:37","1","Unholy_Urges","1747930476.6286101","our planet is dying","manual"
"eqcmihj","t3_bxsi1c","bxsi1c","TrueOffMyChest","unknown","Telling yourself the world is fucked is the quickest way to prove yourself right. 

Look, nothing happens overnight. There isn’t a magic “fix the world” button that some CEO could press. Even if the powerful made a concerted effort, it would take years if not decades to “fix the world.” 

It requires 90% of the people to do good. The other 10% will follow because they will be forced to (money, politics, new laws, etc). That means it’s on YOU. And me. And everyone else in this thread. So start small and build habits. Your habits will reverberate and push others to do the same. The good you start today will set an example for the good done tomorrow (read: a decade from now).

So here’s a few good spins on bleak situations for some positivity. There’s always a bright side.

-more people are attending higher education than ever before

-we are producing more than ever despite wages stagnating, which means people have more material wealth

-US (example) emissions have been decreasing since 2005

-the internet has given people far more perspectives than ever before

Long story short, if you give up, then you’re doomed to lose.","2019-06-08 06:00:28","1","[deleted]","1747930476.630671","our planet is dying","manual"
"eq9g0jq","t3_bxsi1c","bxsi1c","TrueOffMyChest","unknown","I like to read about people who did make good observations and a small difference and wonder what the world would look like if we took their knowledge and experience and actually applied to the world.  Johnathan (Appleseed) Chapman, John Muir, George P. Marsh, Jacques Cousteau, Rachel Carson, Rudolph Steiner, J.I. Rodale.............","2019-06-07 10:57:46","0","dyrtdaub","1747930476.632511","our planet is dying","manual"
"eq9h433","t3_bxsi1c","bxsi1c","TrueOffMyChest","unknown","I dont panic about it. On the grand scale the pressure will build and build until enough noncaring people start caring. 

Try as much as you can, but at the end of the day, all you can do is you, and you cant change the world, so why worry so much?","2019-06-07 11:20:31","0","[deleted]","1747930476.6336079","our planet is dying","manual"
"eqacmyr","t3_bxsi1c","bxsi1c","TrueOffMyChest","unknown","We live in a great time.  I don't care about income equality that much.  It's a thing.  But the poor in the world have it better than any time in history.

Capitalism is winning and has lifted billions out of poverty.","2019-06-07 17:58:41","0","Houstonearler","1747930476.634495","our planet is dying","manual"
"er5okql","t3_c0ly9r","c0ly9r","vegan","unknown","I turned vegan as a result of my cousing going vegan and being very shy about it - she dropped facts from now and then and always answered questions in a smart way, but mostly kept to herself. In time I discovered I actually agree with her and all of her answers made sense to me. It took some time but her approach is what planted the seed in my mind.

I'm the complete opposite of that, but it doesn't mean it's working better for me. Her approach normalized veganism and spread the word, while my aproch is trying to wake up people to the problem as fast as possible. IDK which is going to save more lives.","2019-06-14 16:38:10","35","toalp","1747930787.5532002","our planet is dying","manual"
"er5navy","t3_c0ly9r","c0ly9r","vegan","unknown","There are many approaches to changing Minds. You don't have to alienate yourself from all of your loved ones. One way of changing Minds is over the long-haul. Being a role model and being in people's lives even if you don't agree with them about the value of life","2019-06-14 16:25:48","22","Alejandrazx","1747930787.554239","our planet is dying","manual"
"er5t0rx","t3_c0ly9r","c0ly9r","vegan","unknown","So I get what you’re saying. We don’t have to be silent. Spread the truth! People should know the truth about how their food is produced. Make it impossible to ignore. Protest. Call people out on lies and misinformation about veganism being hard/expensive unhealthy. 

But don’t attack people for eating meat/dairy/eggs. That’s how you alienate people. Hate factory farming and blame them for everything. Give the individual consumer compassion and understanding. It takes a while to undo years of brainwashing. It might be longer than we have, but it’s how we’re going to be most effective.","2019-06-14 17:21:33","17","kittenmittens4865","1747930787.5558138","our planet is dying","manual"
"er5v2xp","t3_c0ly9r","c0ly9r","vegan","unknown","I honestly wish the vegans I used to know were more pushy, I'd have gone vegan years earlier.","2019-06-14 17:41:36","15","floopaloop","1747930787.556863","our planet is dying","manual"
