"id","subreddit","tone","title","text","created_utc","score","num_comments","upvote_ratio","url","is_self","author","scraped_utc","query_used","query_category"
"82p5um","conspiracy","unknown","Concealment of knowledge by Saturn Death Cult is the most important conspiracy there is","

**The most important secret they conceal is the godlike power each of us possess to love and create.**



If I can ask that you look at the world around you right now, wherever you are. While you do that, just stop and think of your life. Please ignore the endless procession of fuckeries and injustice you’re aware is surely occurring to multiple someone’s, in various somewheres and elect only to focus on the more commendable aspects of humanity. The cool people you’ve met, times you’ve had, places you’ve seen, meals you’ve eaten, all underpinned by a collective ability to manifest abstract concepts into tangible actuality.

We’re a fucking bad ass species, no?

We wanted to live in colder places - we created clothes. We wanted to cross water - we created boats. We longingly observed the birds in the sky until we could take it no longer - we created planes. Satisfied for a while we marvelled in this new power- but still we longed for more. 
The moon had always been a stalwart companion of humanity, a bulwark against the terrors of the night and a marvel to behold to boot, yet it had always been a source of mystery and awe.. but still , *what if we could actually go there? [Wouldn’t that be something?](https://m.youtube.com/watch?v=g25G1M4EXrQ)?*


All technology - spear to space shuttle- is the manifestation of this. More so than any other quality, our inherent ability to create - *to mentally visualise and then subsequently manifest in the physical form*, is and has always been humanity’s defining quality. We marvel when we observe animals displaying even infantile elements of this - but again even our [ability to **create** a “mind-space”](https://philosophyandpsychology.wordpress.com/2010/07/19/the-god-that-is-our-brain-bicameralism-and-theology/)  in which to  form this comparison, uniquely identifies us as different ([see Jaynes - Origins of Consciousness in the breakdown of the Bicameral Mind](http://s-f-walker.org.uk/pubsebooks/pdfs/Julian_Jaynes_The_Origin_of_Consciousness.pdf))

Along with love (*conscious desire*), it’s been the driving force behind our ascent to the stars - it’s quite literally the reason each of us exist: 

#Love + Creation = Humanity.


So we can argue against the dogma of mainstream science when it states that there is no rhyme or reason to creation, that we’re the mere manifestation of an unbroken series of fortuitous coincidences. That there exists no entity/force/originator possessing both the conscious desire (love) and ability (create) to initiate happenings on a universal scale. If you can be convinced that all that exists is the material, then through their control of the material - they can control you entirely. But if you can innately understand that **you** aren’t your hands, any more than **you** are your brain, then you’re only a small leap away from appreciating that *you are in fact something more than you have been led to believe*, then you can never be truly controlled. 

So I say we can argue with confidence, as our conscious awareness of our existence, coupled with an innate ability to love and create,  stand as  testament to this fact - *we are much more than we’ve been led to believe.*


A self improving, conscious organism that possesses sufficient intelligence to construct novel solutions to external stimuli, to the extent we’ve been able to mould an entire planet to a design of our likings, filled with creations of our making.

Short of the obvious (people born with severe cognitive handicaps etc), I truly believe with the appropriate guidance and resources, every single baby born on this planet, has the capacity to manifest into maturity as a highly capable individual, skilled in a variety of disciplines and fully able to contribute to humanity’s progression in all manner of ways. Look at how far we’ve advanced as a species with the more noteworthy contributions coming from a small minority, plucked from the pool of the economically advantaged. 
That’s not to say there’s not instances in recent times or recorded history of anomalies surfacing who bucked the trend. But for the most part, recorded history has told a tale of the wealthy becoming so through exploitation of the masses, so we can reliably infer that a greater number of that wealthy will become educated to the extent they can deliver contributions that advance our collective capabilities or/and understandings. 

With resources to thrive- nutrition, varied & engaging education, a stable family environment, access to healthcare etc kids grow to be capable adults. Even without that, kids grow to be capable adults. With that  - In our current system of global governance, the propensity towards systemic inequality is inevitable.



Depending on where you are in your journey, you’ll understand the reason things are like this is because a small group of very powerful banking and industry families, their lackeys and frontmen, have hijacked and now control for their own ends, institutions that should rightly be operating in the interest of all humanity. I imagine most here can take it a little further, and realise it goes further than just wanting to make money, and that these families and affiliated organisations & persons,  in some cases whole genetic lines ,belong to a millennia old cult devoted to the worship of  a Saturnian golden age.  

They understand that, in addition to sating the sexual depravities of these fiends, that [systemic elite pedophilia](https://np.reddit.com/r/conspiracy/comments/1cm0t3/original_research_the_mountain_of_evidence_for_a/?st=JEH8OGR3&sh=37d22646)  functions as part of Mystery Babylon’s blackmail network. It’s chief purpose  to ensure compliance & continued secrecy of their nefarious subterfuge of humanity, through the entrapment of  would-be participants in compromising situations ([see Roy Cohn](https://m.youtube.com/watch?v=6yRVhOCw3LY) & [Jeffrey Epstein](https://nypost.com/2016/10/09/the-sex-slave-scandal-that-exposed-pedophile-billionaire-jeffrey-epstein/) 

The current cabal are just the latest manifestation of the usury driven, Babylonian system created by the priest schools that emerged after the fall- this is what The Tower of Babel refers to. The tower falling refers to the global collapse of the Ponzi scheme we know is inevitable in economies built on debt-based finance.

The popular misconception that the “myth” is a cautionary tale warning against overreach & arrogance is exactly that- yet another piece of disinformation foisted upon the masses to conceal the truth: that they’ve been here before, 


Matthew 7:16
>>You will know them by their fruits. 



[Ive found Troy D Mchlachans site Saturn Death Cult ](http://saturndeathcult.com/crimes-of-the-saturn-death-cult/the-tower-of-babel-myth/) a valued resource:

>>The people who joined in on the Babel project had a way of doing things, a system of operating and this was the real threat to the occupants of heaven (i.e. those in authority).  The reference to ‘speech’ in the 7th verse is from the Hebrew word ‘debar’ and it refers to the means of communication by which the ‘caphah’, or ‘way of doing things’, was co-ordinated.  Why would the writer repeat himself by using both ‘language’ and ‘speech’ in the first verse if he simply meant the spoken language of the people?

>>Babel, therefore, represented a ‘way of doing things’ that was different to those who traditionally held authority.  Because Babel is linguistically linked to Babylon, and because Babylon is symbolic of a counter-financial system in opposition to the biblical God, we can safely assume that Babel was primarily a financial system under the control of those who resided in its infamous ‘Tower’.  That tower, as we have seen, was the central temple and it has as its modern day equivalents, I believe, the various central banks of this modern era.



[Global Reserve Currency Timeline](https://www.zerohedge.com/article/history-worlds-reserve-currency-ancient-greece-today) 

Roman Aureus
Byzantium Solidus
Florence Fiorino
Netherlands Gulden
Spain Real de a ocho or Spanish Dollar
Great Britain Pound
United States Dollar
China Yen?

“They” (*members of various blood line families, mystery school adherents, their inductees etc*) are the custodians and operatives of a global system of control - that cycles through national currencies every few centuries, setting up central banks, operating fractional reserve confidence scams, hoovering up physical resources and labour with the resultant capital. It’s promissory notes are backed by nowt to be dispensed, circulated and returned with interest on the compound. Interest on the compound - a further fee on the debtor, presumably justified as a privilege for them receiving the loan. A model that’s resulted in the rampant inequality we see across the globe. 


Say you were to take a loan with interest, once you pay the compound, you’re working for the interest - ie your labour goes towards your creditor. Through no skill other than having the capital and authority to issue the loan to you. With no interest, any credit gained from labour enacted after the debt has been paid, is yours to keep. Providing you the surplus required to devote to other pursuits, learning new skills - growth. So when your country’s central bank issues it’s debt based currency, they’re quite literally manufacturing future promises to repay today’s debt - ie ensuring successive generations are born into bondage.



[The Hamilton Economic Program](https://en.m.wikipedia.org/wiki/Hamiltonian_economic_program) America was founded on is more akin to what we see in the bible:

>>Exodus 22:25 
King James Version 
25 If thou lend money to any of my people that is poor by thee, thou shalt not be to him as an usurer, neither shalt thou lay upon him usury.

Ecclesiastes 4:9-12 
Two are better than one, because they have a good reward for their toil. For if they fall, one will lift up his fellow. But woe to him who is alone when he falls and has not another to lift him up! Again, if two lie together, they keep warm, but how can one keep warm alone? And though a man might prevail against one who is alone, two will withstand him—a threefold cord is not quickly broken

Mchlachan - Saturn Death Cult

>>Having no other asset than the product of their own labours from the land on which they lived, the colonists did the unthinkable. They started to issue their own money against that very asset, and they had the temerity to issue it debt free. It was a debt-free system of financing that was diametrically opposed to the debt-based financial model as practised by Mystery Babylon and enforced by the Bank of England –and to the horror of Britain’s banking elite it seemed to be working

The American system of finance was the catalyst behind the emergence of a nation with majority middle class, majority adult literacy and consequently , one that posed a  direct threat to the old world orders global system of debt slavery that the world labours under- [something had to be done.](https://en.m.wikipedia.org/wiki/History_of_the_United_States_public_debt) 
Each  crisis provides an opportunity for debt to be leveraged . The correlation is evident. What isn’t so apparent is the hidden hands who engineer these conflicts for that very purpose.

As is obvious by now,[all wars are banker wars ](https://m.youtube.com/watch?v=5hfEBupAeo4). If the banks didn’t want a nation to go to war - they wouldn’t finance it. It works the other way too- how often have we seen Banks instigate conflicts, then fund both sides. No matter who wins, the bank wins ..twice.



The bible is filled with historical accounts that correlate  with non-biblical sources. Flood myths, for example, are [prevalent amongst hundreds of ancient cultures ](https://en.m.wikipedia.org/wiki/List_of_flood_myths)  - clearly none of whom were practicing Christianity at the time. Now is the bible also filled with fallacy, wilfully inserted to maintain control through obfuscation & concealment? Of that there can be no doubt. But one thing you can also verify is Jesus was real. A bonafide living breathing person- his life was documented [in numerous sources outside of the New Testament ](https://www.biblicalarchaeology.org/daily/people-cultures-in-the-bible/jesus-historical-jesus/did-jesus-exist/). I was raised Christian and found the church a weekly series of fallacious drudgery. Then I grew up and realised aha!it was a series of semi-true tales, spliced from and replicating other earlier religions, deployed by the moneyed elite as a control mechanism to keep the unruly serfs in order. Now? The [High Level Insider threads ](https://np.reddit.com/r/conspiracy/comments/6semd3/high_level_insider_mystery_schools_reddit_an/?st=JEH9VNXS&sh=93d4bd6b) and its focus on symbology offered an interpretation of biblical events that warranted  2nd reading, this time with a (extremely) rudimentary understanding of symbology & some context  (see below) in place. 

>>The appearance of Jesus 2000 years ago was not as a messiah but as a messenger (Islamic view of him as a prophet).
>>The jews are right that the first coming was not as a messiah, but wrong to reject him as a prophet because they do not understand that there were to be two separate missions (Christianity and Islam both get this right and anticipate the return).
>>Christianity is correct to emphasize the virginal birth and sacrifice. What the virgin birth means is that he rose to consciousness outside of the mystery schools, which laid bare the fraud of them concealing knowledge. His entire life was lived as a sacrifice spreading the truth to ensure that connection to higher consciousness / the godhead would never be the exclusive possession of the corrupted schools.
>>Christianity is, symbolically, the inversion of the old world order; the antithesis of the US regime. It is a first of its kind religion in this respect and of utmost significance to world history. You should know and be familiar with the Bible but it has been manipulated, pruned, incorrectly taught, and so on. We recommend [Thomas](http://gnosis.org/naghamm/nhl_thomas.htm)  and [Mary](http://www.maryofmagdala.com/GMary_Text/gmary_text.html) , both of which were removed from the canon for being too straightforward for the old order's tolerance.


I’m nowhere near done with research, but  feel I’m at the stage where I  consider most of what I was taught to be bullshit. Now  I guess I’d say Old Testament reeks of Mystery Babylon - vengeful god, concealment of knowledge is necessary etc) I think it’s an encoded collection of historical accounts and prophecies centred around the life of a man who came upon the means to achieve elevated consciousness, - The Godhead- and rather than conceal it, he chose to share it with the world.


Terms like being “born again” and “the kingdom of heaven is inside you” are solemnly intoned by adherents to the faith - most never really questioning wether the interpretation they’ve received from the Church is in keeping with that intended by Jesus. The pedophilic practices of the Catholic Church are no secret. It should be evident that an organisation that enacts cover ups at the highest level of such abuse, is automatically disqualified as a credible compass towards an enlightened existence. 

Once you work through the bogus interpretations we were all fed as children  and view the biblical accounts of Jesus as a collection of allegories and symbology, the story of his life is amongst the most inspiring ever recorded. 

[Troward ](https://www.consciouslivingfoundation.org/ebooks/13/CLF-TheHiddenPower-ThomasTroward.pdf) makes the point better than I ever could:


>>He died because he maintained the Truth; that he was one with the Father. That was the substantive charge on which he was executed. ""Art thou the son of the Blessed?"" he was asked by the priestly tribunal; and the answer came clear and unequivocal, ""I am."" Then said the Council, ""He hath spoken blasphemy, what further need have we of witnesses?"" And they all condemned him to be worthy of death.


>>**And so we find throughout that Jesus nowhere makes any claim for himself which he does not also make for those who accept his teaching. **Does he say to the Jews, ""Ye are of this world; I am not of this world?"" Equally he says of his disciples, ""They are not of the world, even as I am not of the world."" Does he say, ""I am the light of the world?"" Equally, he says, ""Ye are the light of the world."" Does he say, ""I and my Father are one?"" Equally he prays that they all might be one, even as we are one. Is he styled ""the Son of God?"" Then St. John writes, **""To them gave he power to become sons of God, even to as many as believe on his name;"" and by belief on the name we may surely understand belief in the principle of which the name is the verbal representation.**



>>**The essential unity of God and man is thus the one fact which permeates the whole teaching of Jesus.** He himself stood forth as its living expression. He appealed to his miracles as the proofs of it: ""it is the Father that doeth the works."" It formed the substance of his final discourse with his disciples in the night that he was betrayed. It is the Truth, to bear witness to which, he told Pilate, was the purpose of his life. In support of this Truth he died, and by the living power of this Truth he rose again. **The whole object of his mission was to teach men to realise their unity with God and the consequences that must necessarily follow from it; to draw them away from that notion of dualism which puts an impassable barrier between God and man, and thus renders any true conception of the Principle of Life impossible; and to draw them into the clear perception of the innermost nature of Life, as consisting in the inherent identity of each individual with that Infinite all-pervading Spirit of Life which he called ""the Father.**""


So you see the fundamental issue with the bible is the disinformation. The nuggets of truth interspersed with fallacy, the way allegory and literal meaning are interchanged to deceive and confound -the virgin birth for example.  A central tenet of Christianity. The teachings have been perverted to to deny us access to the truth. “Died for our sins”? What the fuck does that even mean? Didn’t he die because the Jewish church leaders  accused him of blasphemy? For claiming that he, and us all, are all children of God by definition - - not privilege? 
We’ve been taught that the miracle of a baby born to a virgin stands as testament to his divine origins. As you’ve read, this is a deliberate obfuscation of the intended meaning. When rational people hear shit like that, they tend to switch off. I know I did. I’m sorry but I just couldn’t reconcile anything I’d been taught, had sought or observed with the absurd notion of God having a child with a woman. Like Zeus turning into a bull or a pile of Gold. I mean come on. “Wouldn’t God be having a child with themselves as they made everything?” I asked. “God moves in mysterious ways” the Pastor replied. And that was that. 

How ironic that the condescending, illogical nature inherent in organised religion, turns so many away from the innate pivot towards questioning reality, that formed the demand  for its very existence.  And therein lies the crux of our tale: people are either turned away from the foolishness of it all, or embrace what they’ve seen, more or less. In either case they’re no nearer to what they sought than when they first started.

This is all by design.

If we realised and embraced the truth things would be very different. That we could all become a Jesus. Any of us. A personality of the ages, whose actions echo throughout history, inspiring others to assume the mantle of transcendent achievement. Like Krishna. Mohammed. Was that not the central tenet of his teachings?  That not only are we Gods children, we are Gods also. For how can the Kingdom of heaven exist within a person ... and that person not be a King themselves?

Admittedly the situation at present seems pretty bleak. The concealment of knowledge in all its forms -[scientific ](https://www.newscientist.com/article/dn18691-uk-keeps-three-times-as-many-patents-secret-as-the-us/) , [historical ](https://m.theepochtimes.com/uplift/piri-reis-map-evidence-of-a-very-advanced-prehistoric-civilization_1165572.html),[political ](https://m.youtube.com/watch?v=sqxq03izxrQ) or otherwise- ensures a gap between the enlightened and the ignorant. Control of the institutions that dispense these truths results in control of those who use them to navigate their realities - ie all of us. But it’s heartening to see people question the official narrative more these days. Oh they’ll play it down on the media or wholly omit it altogether, but ask yourself why initiatives like social media censorship, net neutrality, CTR, need be enacted unless Mystery Babylon realised people were cottoning onto the reality things are very wrong, and have been for some time. 
But if you’ve only reached that realisation in the last election cycle for example, you’d be forgiven for thinking all conspiracies were centred around Pgate, Seth Rich, Rep/Dem etc 
It can be somewhat discouraging to witness the subs descent into a battleground of opposing political ideologies. One the other hand, everyone has to start somewhere:

 *Pgate* is a conversation away from someone in the thread who can link it to *Franklin Coverup* is a link from *Epstein & Cohns Pedophile black mail rings* is a link away from *CIA drug trafficking* is a click away from *OSS* is a link away  from *Opium wars* etc ... is a link away from




>> “So if all this other stuff is bogus, what do you think the truth is about Jesus?”




So far from seeing the influx of curious minds, the flat earth psyops etc  as a negative, it should be considered a positive sign of a changing times, when the corrupt institutions that previously held authority, are exposed as frauds. The consequent shift towards research and reason can only be a mass benefit long term to the collective consciousness- people navigating the world by what we learn, rather than what we’ve been told.

Collective awareness of the true nature of reality will be both our salvation and the catalyst to a future of continued advancement. 

       
Tl:Dr: Jesus was the original and ultimate  conspiracy theorist. His revolt against the moneyed elite laid the framework for the American Revolution. Mankind’s god given ability to advance through *our love of creation* as *creations of love*, has been subverted by Mystery Babylon for millennia. Growing awareness of this is moving us into an age of transition, itself occurring during the passing of the dollar as reserve currency, this taking place  as we move into the [Age of Aquarius ](http://earthsky.org/human-world/when-will-the-age-of-aquarius-begin) . Despite the strength of our adversaries, I choose to believe we emerge triumphant.


>>Once, on being asked by the Pharisees when the kingdom of God would come, Jesus replied, “The coming of the kingdom of God is not something that can be observed nor will people say, 'Here it is,' or 'There it is,' because the **kingdom of God is inside you**






","2018-03-07 15:40:21","378","128","0.84","https://www.reddit.com/r/conspiracy/comments/82p5um/concealment_of_knowledge_by_saturn_death_cult_is/","True","elnegroik","1747905463.4439511","our planet is dying","manual"
