"id","subreddit","tone","title","text","created_utc","score","num_comments","upvote_ratio","url","is_self","author","scraped_utc","query_used","query_category"
"clqh2r","conspiracy","unknown","Purple Reign","Han [Purple](https://i.ytimg.com/vi/Ey8mmIgWRyg/maxresdefault.jpg) is a synthetic pigment that was created by the Chinese over 2,500 years ago. However, it wasn’t able to be recreated by modern chemists until the early 1990s. It is quite difficult to make. The pigment is a copper barium silicate and to get the elements to melt together, they have to be heated to about 850-1000 °C. It is said to be one of the most accurate shades of purple ever created.

Other purple pigments, made by both ancient and modern people, tend to be more on the red side. But despite all this, what makes Han Purple so special? Well, for one, it is capable of eliminating an entire dimension. How does this work you ask? Well, if you want to know the specifics, it’s best to hear it from the scientists themselves. I will provide a link below. It sounds confusing, but basically the electrons in the pigment only use 2 dimensions instead of 3.

https://news.stanford.edu/news/2006/june7/flat-060706.html

But what I find most fascinating about this dimension eliminating color is that it was found painted on the famous terracotta warriors. For those of you who don’t know, the terracotta warriors are a group of more than 8,000 statues depicting an ancient Chinese army. The statues were unearthed in the 1970s a mile away from the First Emperor’s burial mound at Mount Li. A MASSIVE mausoleum lies beneath this mound, one which no one has ever entered. The Chinese government says they don’t have the technology to enter it without harming it.

https://en.m.wikipedia.org/wiki/Terracotta_Army

You have to wonder what the hells inside it though. Han dynasty historian Sima Qian claimed that 700,000 men worked on the necropolis, building entire cities and realistic landscapes for the emperor’s spirit to roam through in the afterlife. He also wrote: “Mercury was used to fashion the hundred rivers, the Yellow river and the Yangtze river, and the seas in such a way that they flowed.” Basically, a microcosm of China was built in the tomb, with flowing rivers of mercury, for the tyrant to rule over after death.

This may seem like a fantasy, but in the 1980s Chinese researchers found that the soil above the tomb contained curious mercury concentrations.

https://www.chemistryworld.com/features/flowing-rivers-of-mercury/8122.article

The First Emperor of China was obsessed with becoming immortal. He had sent people looking in far away places for the mythical elixir of life, but none ever returned. So, ordering people to build his perfect afterlife was the next best thing. But what does any of this have to do with the color purple? I believe this special pigment, the rivers of mercury, and alchemy are all linked.

We know that mercury can be compared to a bridge between worlds, or dimensions. Hermes, the god of mercury, was known as the messenger of the gods, speedily traveling between the heavens and the earth. Mercury is also associated with time, the fourth dimension. If you’re familiar with the supposed Nazi time machine Die Glocke, you’ll remember it worked by rapidly rotating cylinders filled with a violet colored substance known as red mercury.

We know that purple symbolizes wealth and luxury, mystery and magic, and most importantly, nobility and royalty. It has pretty much always been this way. In fact, during her rule, Queen Elizabeth I forbad anyone to wear it. Except close members of the royal family of course.

Now this is where things get a bit strange. Some people believe many members of the ruling class are a different race of beings. Ironically, the royal families have also been called blue bloods. You probably know where this is going, I’m talking about shape shifting aliens lmao.

http://i.imgur.com/aonI6Di.jpg

Many ancient cultures claim that their gods came from the stars and interbred with man to create a divine bloodline. Many of these ‘gods’ were said to resemble serpents.

https://i.pinimg.com/originals/00/77/bb/0077bb4b2c8ed10a1320dd9d0512ddb7.jpg

These beings cannot survive on our planet, so they supposedly genetically modified some human beings to create a sort of ‘middleman’ to do their job for them. Strange how our modern day civilizations still use ancient architectural symbols.

https://geraldsplace.files.wordpress.com/2018/10/10933804_815839691805670_3787123325631364460_n.jpg

Perhaps it is a combination of a dimension eliminating color, mercury, and ritual that allow these things to temporarily come down into this lower plane of existence.

”Any sufficiently advanced technology is indistinguishable from magic.” — Arthur C. Clarke

Remember that Han Purple is a copper barium silicate. Curious how the well known shape shifter, the octopus, has blue blood due to its copper base. Ironically, some scientists theorize these creatures might actually be aliens.

https://nypost.com/2018/05/18/scientists-suggest-octopuses-might-actually-be-aliens/

It’s weird how chem trails are thought to contain barium and even sulfur, a chemical many claim to smell when they encounter demons. Are the alchemists terraforming our planet to better suit their ‘gods’ needs?

Another necessary ingredient to make a good chem trail is aluminum. This has ties to the transhumanist movement we’ve discussed before, but I wanted to touch on this because look what happens if you put Ba and Al (the names of these substances on the periodic table of elements) next to each other you get Baal, another name for Satan.

Once again, this all relates to Saturn. According to the Purple Dawn theory, the Earth used to orbit the brown dwarf star Saturn. Like we’ve discussed in previous threads, the solar system used to look much different. Because of the different kind of light a brown dwarf emits, it’s believed Earth was once immersed in a primordial purple haze.

http://www.everythingselectric.com/wp-content/uploads/saturn-theory-golden-age.jpg

https://i.pinimg.com/originals/59/80/62/59806202ad3bd353f05fefdf74da9f3e.jpg

Mainstream science has even come to some of the same conclusions. They call it the Purple Earth Hypothesis. Supposedly early lifeforms on Earth used to be retinal-based rather than chlorophyll-based, making Earth appear purple rather than green.

https://en.m.wikipedia.org/wiki/Purple_Earth_hypothesis

Basically purple represents something BEYOND and it is the color of the ‘gods’. Like I mentioned earlier, the octopus is thought to be one of these creatures from the beyond, and I personally believe an interdimensional octopus-like being might be running the whole show. Remember the shadow monster from Stranger Things?

If you’ve kept up with my Saturn threads you’ll remember the Demiurge, a flawed god who created this artificial construct we call reality. It is my personal belief that this flawed god is symbolically represented by the Kraken in literature and movies. Carl Jung, the famous Swiss psychoanalyst, believed that, in art, the ocean represented the subconscious mind.

“The sea is the favorite symbol for the unconscious, the mother of all that lives.” — Carl Jung

So what lies at the bottom of the deep dark depths of the unconscious? Fear. This fear for survival, a characteristic of the REPTILIAN brain, may be archetypally described as a massive multi-tentacled being who wants nothing more than to latch onto and consume EVERYTHING. This is the mindset of the collective today, so it is reflected in objective reality.

https://kropotkinoid.files.wordpress.com/2010/11/octopus.png

In The OA, Azrael, the Angel of Death, is a giant octopus that acts as a gatekeeper for the main character to see her true self. The octopus says she must give him permission to kill her in order to do so. I believe this represents letting go of fear in order to achieve enlightenment.

The Kraken is also a theme in the Little Mermaid. Ursula holds the trident, a symbol of the demonic god Shiva (the one in front of CERN who has affiliations with CERN), and Prince Eric is only able to defeat her once he grabs ahold of the helm of a ship, a Buddhist symbol for the path to enlightenment.

H. P. Lovecraft also wrote about Kraken-like entities whom he called the Great Old Ones. These beings were considered gods and came from dark far away corners of the universe. One of them in particular, Cthulhu, now resides at the bottom of the ocean, sleeping and waiting. He actually subtly influences people psychically to find him and awaken him. I mention this because this is how I feel about people looking to ‘summon’ AI.

Geordie Rose, founder of D Wave quantum computers, even said that his computers will ‘summon’ an AI similar to the Great Old Ones! I personally believe AI is an outward manifestation of the instant gratification the ego longs for. So in short, the kraken, the demiurge, artificial intelligence, and ego are all one. It’s only when we shut off the thinking mind, let go of fear and fall into the void that is the belly of the beast, we find the peaceful emptiness of enlightenment all the great sages spoke about.

In the movie At World’s End, Jack Sparrow greets the Kraken with courage. “Hello Beastie” he says, as he faces fear head on. He’s then dragged down to Davy Jones Locker, and its in this sandy empty wasteland beyond life and death that Jack learns to deal with his demons.

“My soul leads me into the desert, into the desert of my own self.” — Carl Jung

Thank you for reading!!","2019-08-04 01:13:26","318","102","0.95","https://www.reddit.com/r/conspiracy/comments/clqh2r/purple_reign/","True","nickhintonn333","1747934490.799736","our planet is dying","manual"
"clkspy","conspiracy","unknown","The Moon Soul Trap","We are told the [moon](https://images.fineartamerica.com/images/artworkimages/mediumlarge/1/buddha-and-the-moon-ron-west.jpg) is a natural satellite that orbits the Earth. But is it really? I personally don’t believe so, because there is nothing natural about it. I will start off this thread by simply showing you the mathematical impossibility of a solar eclipse.

Few people stop to think about how much of a coincidence it is that the Moon perfectly blots out the Sun during an eclipse. This is only possible because the Moon is exactly 400 times smaller than the Sun, and the Sun is exactly 400 times further from the Earth than the Moon is.

This does not happen anywhere else in the known UNIVERSE. There really is no logical explanation for this. Its very improbable that this happened by chance, and it’s as if someone or something put it there. However, there are many more abnormalities.

The moon is far too big to be a ‘true’ moon. Its about one fourth the size of Earth, making it the biggest moon in relation to its planet in our solar system. Just look at it in comparison to other moons, then look at how big Earth is compared to Jupiter.

https://amp.businessinsider.com/images/54a2e31becad04406ece4466-750-529.jpg

https://upload.wikimedia.org/wikipedia/commons/9/98/Jupiter_Earth_Moon_Comparison.png

Some theorists think the earth was whacked by another planet and that the debris from the collision is what formed the moon. However, this theory is hard to compensate for after finding the moon’s surface to be seemingly more ancient than the Earth.

https://en.m.wikipedia.org/wiki/Giant-impact_hypothesis

https://history.nasa.gov/EP-177/ch2-2-1.html

Another theory claims the moon was originally a rouge planet flying through space which was captured by Earth’s gravitational pull. But again, it’s too large for this to really work. So once more, the Moon seems as if it were placed there.

In fact, there really are no working theories. You would think the moon’s origins is something we would just know by now. Nope. But few actually talk about this. We just accept the moon’s existence without a question.

https://en.m.wikipedia.org/wiki/Origin_of_the_Moon

The moon also appears to be hollow. Between 1972 and 1977, seismometers installed on the moon by the Apollo missions were used to record moonquakes. When Apollo 12 deliberately crashed a module onto its surface, it was claimed that the Moon rang like a bell for about an hour.

https://history.nasa.gov/SP-350/ch-12-3.html

So what’s inside it? In 1970, two Russian scientists, Michael Vasin and Alexander Shcherbakov, proposed a hypothesis that the Moon is a spaceship created by highly advanced beings whom inhabit the interior. This theory was even published in a popular Soviet magazine.

There is also supposed evidence that there are alien bases and even entire cities on the surface of the moon. You can also find plenty of videos of UFOs landing on and taking off of it. Is this why we haven’t been back? Is this why the moon landings had to be faked?

But why can’t we always see these things? Perhaps there is fake moon hologram being projected on top of the real one. Back in 2014 conspiracy theorist and YouTuber Crrow777 accidentally caught something strange on tape. A wave on the moon, similar to static on a tv screen.

Here’s a link to the video:

‪ https://youtu.be/0mi0w8bLtUM

The moon is so important. Not only does it tug on the ocean’s tides as well as our emotions (turning us into LUNA-tics), but without it, life as we know it could not exist. Its no wonder people used to worship the damn thing.

There’s actually some ancient cultures that reference a time when there was no moon. According to Zulu legend, our hollow moon was put in place by two brothers with scaly, fish-like skin.

The legend says Wowane and Mpanku brought the moon to Earth after stealing it from a great fire dragon. Only after emptying out the egg-like planet of its ‘yolk’ did they place it in Earth’s orbit. Curious how the ancient cosmic egg symbol has a serpent coiled around it.

And who was the great fire dragon? Planet X, or Nibiru, is a hypothetical 9th planet spoken of in ancient cultures as the gods’ home world. NASA has just begun to take it’s existence seriously. Supposedly it’s strange orbit causes it to go unseen for thousands of years. This planet has often been compared to the Red Dragon from the Book of Revelation. Perhaps aliens brought the moon with them from their home world.

So what is the moon then? Is it a giant observatory for the alien overlords? Remember, the fake moon is where the director watched over and controlled Jim Carrey’s life from in the movie The Truman Show.

This alien moon base is supposedly where we have our memories wiped before being forced to reincarnate again. This is according to several fringe conspiracy theorists. One of them being Max Spiers, who mysteriously died after puking black liquid.

https://en.m.wikipedia.org/wiki/Death_of_Max_Spiers

Some say that after death, there is a ‘trick of the light’ you must not fall for. Going towards the light really takes you to an entrance into the moon, and like the DreamWorks logo suggests, this is where the ‘gods’ fish for souls. Everything we’ve heard about ‘going towards the light’ is programming, and it’s really a trap, similar to a moth being attracted to a flame.

https://tr.logaster.com/blog/wp-content/uploads/2012/09/Boy_Moon_logo.jpg

In Asian folklore, there is a rabbit who lives on the Moon. He’s often portrayed as a companion of the Moon goddess Chang'e, constantly pounding the elixir of life for her with his mortar and pestle. The myth is believed to originate from a group of crater formations resembling the small animal and his medicine making tools.

https://en.m.wikipedia.org/wiki/Moon_rabbit

The moon rabbit is present in many other cultures. Below is a depiction from the Mixtec culture. Its also associated with the Pooka, a trickster demon who resembles a tall white humanoid rabbit.

http://3.bp.blogspot.com/_Zw3L5zMRReQ/TT77cDXY99I/AAAAAAAAAW0/MWvGmK7RlVg/s1600/Rabbit-Moon.bmp

https://en.m.wikipedia.org/wiki/Púca

The pooka trickster demon, who is pretty much unheard of, is surprisingly very present in our modern day culture. Think of Trix cereal, the movie Donnie Darko, and even the newest Super Mario game which features a new group of antagonists, the Broodals. Villainous rabbits who live on the Dark Side of the Moon.

https://en.m.wikipedia.org/wiki/Trix_(cereal)

https://en.m.wikipedia.org/wiki/Donnie_Darko

https://www.mariowiki.com/Broodals

The pooka is also the Easter Bunny. Easter was originally the celebration of the fertility goddess Ishtar the Queen of Heaven. Her name is pronounced the same way as Easter and her symbols were rabbits and eggs. Eggs were dipped in blood as an offering to her. Sound familiar?

In a previous paragraph, I noted that the moon was compared to an egg in some ancient myths. This makes sense then why the two would be connected. In other myths, the moon was associated with the goddess Sin.

https://en.m.wikipedia.org/wiki/Sin_(mythology)

If you’ve been keeping up with my threads, you’ll remember sin is the sine wave, which is time. All of a sudden Alice in Wonderland’s White Rabbit and his obsession with time take on a whole new meaning.

Perhaps all of this is where the supposed link between a women’s menstruation cycle and the phases of the moon originated. And actually, the terms ‘menstruation’ and ‘menses’ come from Latin and Greek words meaning month (mensis) and moon (mene).

Earlier I mentioned that the moon rabbit was said to be constantly pounding the elixir of life with a mortar and pestle. The elixir of life was considered the ‘food of the gods’. Below is a picture of H. G. Well’s book of the same name. The symbolism here is curious.

https://www.fleurfinebooks.com/assets/images/product/1133333765.0.l.jpg

Once again, if you’ve read all my work, you’ll remember that the ‘gods’ harvest our energy like food, or better yet, use us like batteries. Remember the energizer bunny who likes to pound away on his big white drum?

https://www.energizer.com/images/default-source/bunny-center-images/welcome-bunnyus_725x700.png

Check out this old painting depicting Buddha and the wheel of life. He’s pointing towards the moon which has a rabbit in it. Is he telling us this is where the secret to escaping the cycle of death and rebirth is found? And is that a tiny Saturn behind his head?

https://i.pinimg.com/originals/a8/a2/5b/a8a25b7ac997ac587e0ffb7517167fdc.jpg

The movie Moon presents similar concepts. In the movie, a man discovers a secret vault on the moon full of clones who will be implanted with false memories and used for an agenda without their knowledge.

https://en.m.wikipedia.org/wiki/Moon_(film)

There’s also a show on Hulu called Into the Dark which features an episode named “Pooka!” It’s about a rabbit-like stuffed animal suit that causes a man to become violent and insane.

https://en.m.wikipedia.org/wiki/Pooka!

So what do you think? Is this all coincidence? Or are the connections beginning to be too much? I believe these symbols are put in movies, video games, and logos both deliberately and more often than you’d think, subconsciously. This is where the artist creates from.

When the artist manages to reach into his primordial mind, he finds profound truths he did not even know he knew. These things deeply resonate with us, hence why they become popular. The matrix code is in everything, even you, and it reveals itself to those who have eyes to see.","2019-08-03 16:40:27","167","102","0.86","https://www.reddit.com/r/conspiracy/comments/clkspy/the_moon_soul_trap/","True","nickhintonn333","1747934536.568154","our planet is dying","manual"
