"id","parent_id","post_id","subreddit","tone","text","created_utc","score","author","scraped_utc","query_used","query_category"
"cyaryny","t3_3y500w","3y500w","conspiracy","unknown",">  Millions die from pollution in China alone. This is a very unhealthy future for humanity.

Pollution is obviously a problem and, of course, we should be trying to get ourselves off fossil fuels. But there is no scientific experiment that proves CO2 emissions are responsible for Global Warming. Climate Change is statistical analysis, it is not science. If I am wrong, please explain the methodology of the experiment that proves CO2 is directly responsible for the increase of global temperature.

>  but proof the opposite way gets hardly any

What proof? There is only ""scientific consensus"". Consensus IS NOT science. Once upon a time, there was consensus that the Earth was flat and that the Earth was the center of the Universe. Do you know what the scientific gatekeepers called Galileo and Copernicus? ""Deniers"". 

That being said, I believe that CO2 is a huge pollution problem and for that alone we need to get off fossil fuels. But remember, if the Government and Elite think that climate change is seriously a ""national security threat"", then why are there still [3000 renewable energy patents classified by the patent office?](https://www.gpo.gov/fdsys/pkg/USCODE-2011-title35/pdf/USCODE-2011-title35-partII-chap17-sec181.pdf) Wouldn't you think they'd release new energy devices to the public and subsidize them? Wouldn't you think they'd stop subsidizing the Oil companies in favor of renewable energy? 

Furthermore, think about the solution being presented. The only ""solution"" to the problem anyone is talking about is a [Global Carbon Tax](http://www.wsj.com/articles/SB122826696217574539). So if that gets passed, the UN will have a brand new bureaucracy that collects taxes from Americans and a bunch of other countries. For all intents and purposes, we will be beholden to a new form of government that will collect taxes and make decisions about our industry and the industry of many other countries. The UN will be able to stop small countries from developing their industry if it is deemed that they are producing too much Carbon. This is about control, not saving the world. Will we be able to vote on the people making decisions in this new government? Of course not. No taxation without representation.

""Climate Change"" is a smoke screen being used to set up a new form of government. They are playing on everyone's heart strings and humanity to trick people into paying a new tax that *will not do anything*. Do you think Climate Change would just magically reverse course and everything would then be cool? Of course it wouldn't be in reality but the MSM would start reporting ""We've saved the world! We've done it! No need to worry about Climate Change anymore because now you're paying taxes directly to the UN and now the problem is solved."" Meanwhile the Oil companies will continue to receive their subsidies, pollution will continue to get worse and worse, and all the inventions that could change the world will remain suppressed and hidden in the black projects going on in the bottom levels of S4 and Area 51.","2015-12-25 06:36:24","2","[deleted]","1747856013.674678","our planet is dying","manual"
"cyaxro3","t3_3y500w","3y500w","conspiracy","unknown","Conspiracies happen and operate all the time. If you've had a job you've seen little conspiracies at work. Perhaps there's a bigger conspiracy that keeps customers coming in. You, me, and everyone reading this, are probably involved in one or more conspiracies right now. Not all conspiracies are bad, or even carried out maliciously.

Most people don't know why they believe what they think to be true. We may be subject to conditioning, propaganda, peer-pressure, or lies. A lot of the time though what we believe comes from ""experts"". We recognize our ignorance and so rely on others to guide our thinking. Once we see that thinking in a particular way gets positive results we resist change.

I don't believe that the entire pro-AGW community is involved in conspiracy. Some, like the more well-known advocates, have flesh in the game and so will go to any lengths to obfuscate and pontificate when holes appear in the theory or predictions. Others are simply dependent on AGW for their livelihoods and so will not hear opposition. Take for example the IPCC. We all laugh when prominent believers are tripped up and aren't aware of basic details. But if you're convinced that you're correct and have built a career around it, you have a vested interest in protecting your position. 

While there may be a large-scale conspiracy we can't assume that to be so. We do see a number of smaller, inter-related conspiracies though, and most of those have to do with money. AGW is called, and considered, settled. Being outside of a settled theory carries professional and personal cost. Many researchers, journals, and others connected tangentially to AGW let their real self-interest guide their thinking.  

AGW is a cause for environmental concern and is therefor a political ""mommy"" issue. Mommy issue have huge traction in the public mind. Is it any wonder that AGW skeptics are so vilified? Taking a stance against AGW evokes the same visceral response as being against motherhood itself. People don't know why they're upset but they're willing to strike down all opposition if that makes them feel better. AGW is not so much a huge conspiracy as it is a cultural phenomenon that has the same effect.   ","2015-12-25 13:41:57","3","Sucks_2_B_U","1747856013.6780212","our planet is dying","manual"
"cyb4fb2","t3_3y500w","3y500w","conspiracy","unknown","OP posts this: [Global warming skeptic organizations & the fossil fuel industries that fund them. Everyone knows about them lobbying, but they also fund the spread of misinformation to the public.](https://www.reddit.com/r/conspiracy/comments/3y0ejl/global_warming_skeptic_organizations_the_fossil/)

Interesting article considering his claims in this post.

I wonder if this post is bullcrap from the getgo.","2015-12-25 18:42:12","2","elj0h0","1747856013.679174","our planet is dying","manual"
"cybd4ei","t3_3y500w","3y500w","conspiracy","unknown","The globe is warming, but it's got very little to do with us. These are natural cyclical temperature variations caused by the sun. See this graph for proof. [img]http://i.imgur.com/UFk1Jvt.png[/img] The world has been hotter than it is now, several times, long before the industrial revolution. Long before modern humans even existed. The real conspiracy is the conspiracy of fear. The globalists use fear of the temperature, to pass legislation which de-industrializes countries or to get useful idiots to donate to their lucrative charities. Of course very little of that money will ever go to fix the problem, it will mainly line the pockets of scumbags.","2015-12-26 00:03:30","2","ninja_gangsta_pirate","1747856013.6806688","our planet is dying","manual"
"cybd7qx","t3_3y500w","3y500w","conspiracy","unknown","2 other points worth making- Trees love CO2, it's like brawndo, its what plants crave. If we weren't clearcutting millions of acres of rainforest, we would be seeing less impact from CO2 because the trees would soak it up. and a warm globe is infinitely preferable to an ice age. if its too hot you can go for a swim, but if it's too cold, most of humanity dies. simple as that.","2015-12-26 00:07:07","2","ninja_gangsta_pirate","1747856013.681914","our planet is dying","manual"
"cyakulm","t3_3y500w","3y500w","conspiracy","unknown","It's kinda like how cigarette companies didn't want to make a connection between their product and cancer. They tried every angle they could think of to avoid the truth.","2015-12-25 01:43:15","3","AlienPsychic51","1747856013.682983","our planet is dying","manual"
"cyaldjm","t3_3y500w","3y500w","conspiracy","unknown","People should only deal with a situation as a crisis, if the people telling others about the crisis act like it is an actual crisis. (I'm paraphrasing, don't know who originally came up with this concept). ","2015-12-25 02:04:49","1","_Tyler_Durden_","1747856013.683956","our planet is dying","manual"
"cyanip5","t3_3y500w","3y500w","conspiracy","unknown","When you realize that Mars and Venus have had similar temperature changes as Earth and that CO2 levels have been far higher on this planet you may wonder why this is such a huge deal. We are between ice ages right not, the interglacial ...one would expect it to get warmer globally, until it doesn't.  ","2015-12-25 03:34:33","1","toomuchpork","1747856013.685375","our planet is dying","manual"
"cyap05j","t3_3y500w","3y500w","conspiracy","unknown",">Millions die from pollution in China alone. 

climate change was pushed after pollution was deemed too nebulous to act on.   The stakes were seen to fit the agenda for alarmism.

The effort to control the agenda started with money but now the pro-sovereignty crowds have been stimulated into siding with the climate change deniers.    Very interesting and slightly amusing.   Also cringe-worthy.

Its akin to the environmental movement turning pro-nuclear power.   Even to the point of embracing the efforts to claim that the damaging effects of Chernobyl and Fukushima were being blown out of proportion and supporting the reactivation of nuclear plants in Japan,   and condemning the closure of nuclear plants in Germany.

Information and misinformation are truly the new battlegrounds.

My takeaway is that each issue has to be investigated without reliance on the franchise of the media channel we heard it from.    The story being broken is the hero,    not the messenger.    Too many messengers have let a little bit of notoriety go to their heads,   and are distracted by their attempts to profit by the status that their message could afford them.

In other words,  we need to ask questions faster than the media channels can decide for us what the real issues are.    Right now,   the climate change deniers are fixated on the problems of correlating climate change with human industrial activity.    Millions dying from pollution are not of concern to them,  evidently.

We can all be distracted by a Judy Wood from time to time.    That doesn't mean that Richard Gage is perfect either.    But the real stories stand the test of time.    And the lies do end up getting exposed.    

In the long run,   those who do not come clean on their mistakes are shown to be self-promoters more than they were committed to the truth.

In the long run,   the statistical correlations of human activity with climate interference will prevail.    What other natural event on the planet was the equivalent of man's consumption of fossil fuels over the last 100 years?   Merely by volume of impact of the mined and burned (vaporized into the atmosphere) of coal,  natural gas,  and crude oil?    How much is just 80 million barrels of oil a day?   That would be 19,000 normal sized supertanker loads a year for global demand.    Every year.    If you can't imagine this  having an effect on the greenhouse effect,   I would call that make believe.   http://gadgetopia.com/post/6118  And remember,  that does not include mountains of coal every year,   or the deforestation of Indonesia or the Amazon.

It reminds me of the dismissal of the Gulf oil spill a few years back,   the dismissal of the toxic effects of the dispersants (corexit) that were sprayed in the Gulf.     The deal is that the media can suppress the news of the impacts to life,   and that other news events eventually drown out the chatter.    

Only this time,   we are rolling much bigger dice.","2015-12-25 04:32:37","1","rockytimber","1747856013.688877","our planet is dying","manual"
"cyaxueh","t3_3y500w","3y500w","conspiracy","unknown","**[Check out this Joe Rogan podcast.](https://youtu.be/G0Cp7DrvNLQ)**

Climate change is real but [the idea that carbon dioxide, a necessary component to life and a fraction of the atmospheric make-up is going to kill us all is just insane.](https://youtu.be/HJUzkugANmQ)","2015-12-25 13:47:19","1","facereplacer3","1747856013.690093","our planet is dying","manual"
"cybem0b","t3_3y500w","3y500w","conspiracy","unknown","We know it happens, our economy depends on fuel, the lives of thousands of people that are directly related to the fuel industry will be devastated if we fix it. That's why new investors are pointing to other sources of energy. We are moving there but one generation at a time, hoping the sons and grandchildren of the big oilers point somewhere else.","2015-12-26 00:59:30","0","quienchingados","1747856013.6913002","our planet is dying","manual"
"cyam34y","t3_3y500w","3y500w","conspiracy","unknown",">I see people deny it a lot here, what’s the conspiracy behind it?
 
The purpose of lying about AGW is to destroy the industrial civilization of the Western world and ONLY the Western world. Nowhere else on Earth is told to shut down its power and industrial production.

>Millions die from pollution in China alone.

Pollution has ABSOLUTELY NOTHING to do with anthropogenic global warming.

>proof the opposite way

There IS no proof the opposite way. It isn’t happening.","2015-12-25 02:34:49","-1","Thrice_Baked_Ham","1747856013.6924958","our planet is dying","manual"
"cyatx33","t3_3y500w","3y500w","conspiracy","unknown","Its not CO2, pollution among other chemicals leaves CO. CO is known as carbon monoxide one of the reasons that firefighters wear a breathing apparatus for instance. 

Carbon dioxide, known as CO2, is part of the oxygen and carbon dioxide cycle. Lifeforms other than plants, on land, breathe oxygen and exhale carbon dioxide. Plants breathe carbon dioxide and exhale oxygen.

If there is any dispute it could be what chemicals are not good for the atmosphere as well as what terms to apply to such a topic. As far as a conspiracy is concerned maybe, eco-fascism? Not fundamentally a ""false flag"" maybe an attempt to hijack the good cause of protecting the environment, the planet and so forth. 

Before it was CFC and hydrocarbons that were at the centre of the environment particularly the ozone layers. The ozone layers were hot topics in the 1980s and the 1990s.","2015-12-25 08:28:55","-1","CelestialPhoenix","1747856013.694154","our planet is dying","manual"
"cyauwdt","t3_3y500w","3y500w","conspiracy","unknown","The conspiracy theory is that many thousands of scientists from many different countries and many different institutions over the course of several decades at least have somehow created a scientific hoax (which in reality would be impossible to pull off), but luckily a brave heroic band of politicians and oil companies have seen the ""truth"".

It's one of many conspiracy theories which simply cannot be true because organising something on that scale involving that many people would not be anywhere near possible. It would be impossible to organise it within one country, let alone almost the entire climate science community across the whole world.

The real conspiracy here is that fossil fuel companies and those with financial links to them have heavily funded various organisations and politicians promoting climate change denial over many years, because oil companies and the like don't want climate change action taken that would hurt their profits.","2015-12-25 09:41:29","-4","inevitablelizard","1747856013.695952","our planet is dying","manual"
