"id","parent_id","post_id","subreddit","tone","text","created_utc","score","author","scraped_utc","query_used","query_category"
"cxj0qka","t3_3uzgr3","3uzgr3","futurology","unknown",">or last go out with a bang like our great ancestors before

You going to explode yourself or something?

Plz no.","2015-12-01 11:50:50","7","MewKazami","1747855728.4161081","our planet is dying","manual"
"cxjedap","t3_3uzgr3","3uzgr3","futurology","unknown","No.  It's always been this bullshit.  I'm sat here not watching the latest vote-to-go-to-war because fuck it, I'm bored of the frustration.

>>  So now even seeing the things I see, reading religious texts, listening to conspiracies, just taking in everything that I can see happening. 

Develop critical thinking skills.  Every prediction of the end times so far has been wrong.  That's the worst prediction rate *imaginable*, so why should they be right all of a sudden?  And the lizard illuminati are just pap for weak, lazy minds.  It's not aliens, it's just *complicated*.","2015-12-01 18:54:15","5","[deleted]","1747855728.419848","our planet is dying","manual"
"cxj01db","t3_3uzgr3","3uzgr3","futurology","unknown","Thank the Lord for Donald Trump","2015-12-01 11:02:20","2","fuckpositivekarma","1747855728.4221902","our planet is dying","manual"
"cxjngwk","t3_3uzgr3","3uzgr3","futurology","unknown",">I try to stay mostly up to date in world relations. 

>So now even seeing the things I see, reading religious texts, listening to conspiracies

> All the stories from different sources so as not to get too biased of a view...

Hoo boy....

>is just our version of the end. I'm sure throughout history... all sorts of bullshit happened and people thought it was the end or their day

>it's humanities way of coping

Pretty much. There has always been people that think the world is going to end soon. Ragnarok, the apocalypse, Rapture, The end times.  It's just sort of a psychologial bug imbued into a certain percentage of the human populace. Typically it's a religious thing.

>do you think it matters [how] I spend my life,

Well, yes. It matters to the rest of the populace and to future generations well after you're dead. It matters to YOU as much as you feel it does while youre alive. 

Does it matter to the rotation of the planets? No. They'll keep spinning no matter what you do. 

Does it matter to you after you're dead?  No, you're dead. Nothing matters to you after that, take a break. 

>or last go out with a bang like our great ancestors before, beyond the life, when we were still stars, exploding in a blaze and fury

Please don't blow anyone up.  That would be super lame. ","2015-12-01 22:19:30","2","heckruler","1747855728.4268742","our planet is dying","manual"
"cxk2np8","t3_3uzgr3","3uzgr3","futurology","unknown","I wish the mods would let us report posts for ""posting while high"". That would save me time. ","2015-12-02 05:07:30","2","KharakIsBurning","1747855728.428865","our planet is dying","manual"
"cxj1fve","t3_3uzgr3","3uzgr3","futurology","unknown","Things are going way better than they ever did in the history of mankind. Sure there is some chaos and we have potential for mass destruction, but still things are getting better at a macro level. ","2015-12-01 12:34:04","1","MrPapillon","1747855728.431162","our planet is dying","manual"
"cyfb00h","t3_3ynwk2","3ynwk2","conspiracy","unknown","Thank you for posting this!  We will never stop the murdering, raping, pillaging of the people until we stop it on our plates.  Peace and Love!","2015-12-29 20:13:25","20","Omgitsdiscojim","1747856000.80213","our planet is dying","manual"
"cyf6vct","t3_3ynwk2","3ynwk2","conspiracy","unknown","People fail to understand how much agriculture effects culture. 

People on this sub and elsewhere complain how stupid people are all the time. The ""stupidity"" is completely traceable to diets high in sugar and processed foods. Considering insulin was used as shock treatment (and still is), filling your body with refined sugars is a form of self-abuse that affects and impairs cognitive function.","2015-12-29 18:30:59","16","malcomte","1747856000.8045068","our planet is dying","manual"
"cyf8lx6","t3_3ynwk2","3ynwk2","conspiracy","unknown","The barbaric cruel treatment of animals happens because people are full of cruelty and lack compassion. The consumption of cruelly treated animals transfers the energy into the body. It's a cycle that gets worse through time. A vicious downward spiral. The more sick meat that is consumed the sicker the society becomes. You are what you eat. We are dosing ourselves with our own medicine of darkness. By their fruits you will know them. ","2015-12-29 19:14:18","14","NonThinkingPeeOn","1747856000.806746","our planet is dying","manual"
"cyf1yam","t3_3ynwk2","3ynwk2","conspiracy","unknown","Lucent was heartbreaking and eye opening ... I was shocked that Canada treats their pigs in a similar matter ","2015-12-29 16:23:18","13","47chemtrails","1747856000.8087711","our planet is dying","manual"
"cyf85ow","t3_3ynwk2","3ynwk2","conspiracy","unknown","Question everything you've been brought up to believe.

https://www.youtube.com/watch?v=VlNXG1_gheI","2015-12-29 19:03:00","8","george_torwell_84","1747856000.811929","our planet is dying","manual"
"cyfh7ks","t3_3ynwk2","3ynwk2","conspiracy","unknown","There's a lot of money behind animal agriculture. The documentary Cowspiracy is a must watch. When we are so far removed from the process of raising animals and processing them into food stuff, we can justify the commodification of feeling, intelligent life. If we shifted towards insect protein it would be better for the environment and I think it is morally less reprehensible. ","2015-12-29 22:52:36","6","CannabisRuderalis","1747856000.813695","our planet is dying","manual"
"cyfmq8n","t3_3ynwk2","3ynwk2","conspiracy","unknown","I am finding that black beans soaked overnight, rinsed and then put in a crock pot of 5 hours on high is a much more satisfying meal than any steak. Mind you I have eaten many steaks in my life, but am completely satisfied now with beans. This is not my normal M.O. but something in my gut, my intuition, tells me that it is time to either buy local meat from a farm (that I know for a fact is local meat) or not eat meat at all. This is intuitive, if you listen to yourself, you will hear this.","2015-12-30 01:23:28","5","[deleted]","1747856000.8155541","our planet is dying","manual"
"cyfjqkd","t3_3ynwk2","3ynwk2","conspiracy","unknown","And the government puts massive money into the meat industry through subsidies. Not a surprise the meat industry is 80% owned by 4 main conglomerates.","2015-12-30 00:02:14","4","marshcatguy","1747856000.817078","our planet is dying","manual"
"cyg51wn","t3_3ynwk2","3ynwk2","conspiracy","unknown","I became vegetarian 2 yrs ago for this reason and for my own health.  I think it is more healthful, and certainly has more heart and integrity.

But there is something everyone should know about switching to vegetarian diets and it's a big thing. There is a [problem with not getting enough B12 in a vegetarian diet](http://chriskresser.com/what-everyone-especially-vegetarians-should-know-about-b12-deficiency/).  Try to find enough [B12 in a vegetarian diet.](http://www.webmd.com/food-recipes/20030618/vegetarian-diet-b12-deficiency) -- can't be done. 

I am *not* arguing against it, but if you switch you must take B12 supplement, otherwise you'll run into real medical trouble.  I had severe anemia (b12's needed to absorb iron) last year from not paying attention to the B12 thing....and it caused me to hallucinate and become very paranoid.  I was almost hospitalized until I figured out what was happening.  I reversed all the high weirdness around me by chewing up several B12 supplements, although if we had a better healthcare system I'd just have asked for a b12 injection and that would be that.

I have a chronic illness that contributes to a B12 deficiency at an even higher rate than normal, so a regular person would not have the issues I had quite so quickly.  If the world collapsed though, vegetarians would have no choice but to supplement with meat.","2015-12-30 14:35:20","2","[deleted]","1747856000.820189","our planet is dying","manual"
"cyfemc4","t3_3ynwk2","3ynwk2","conspiracy","unknown","Vitro meat is on it's way. Perhaps in 25 years the meat will taste better than conventional meat. 

But let's just make sure the same companies who're producing pink slime would be prevented from producing Vitro meat.

There's wild hogs who're an invasive species who out number hunters. There are catfish who're also an invasive species.

Death by a bullet is a less painful method  of slaughter than what factory slaughter houses use. Hunters don't want to track down a animal who has ran off,so bullets that are designed for hunting are designed to kill swiftly.

 https://www.youtube.com/watch?v=aRrMdmEco0A

Society would be better off if families had their own cows,and these cows would live on open range farms that are  a a co-op. Instead of a cow being sent to a slaughter house,farmers would use a hunting rifle to deliver a quick and humane death.","2015-12-29 21:43:39","1","Rotundus_Maximus","1747856000.8223202","our planet is dying","manual"
"cyfjcpy","t3_3ynwk2","3ynwk2","conspiracy","unknown","cruelty to animals should not be allowed. i'm gonna assume that in the past, before animals were injected with antibiotics & other chemicals (& before corp. farms), meat wasn't harmful to health. 

imo, there could be a 'better way', corp. farming is not it. i'm not anti vegan, as i'm eating way less red meat. i don't think it's possible to ""persuade"" people to stop eating meat, but maybe if it's possible to change *how* people eat. i like to think if more people demanded organically grown produce, that would be a good start.","2015-12-29 23:51:40","-1","make_mind_free2go","1747856000.827774","our planet is dying","manual"
"cyf754y","t3_3ynwk2","3ynwk2","conspiracy","unknown","This is why we need to embrace and plant more hemp and weed. It's the only plant capable of sustaining the planet that provides complete sources of protein and fatty acids. It's the natural solution to meet everyone's nutritional needs, and it's one of the few plants that a human being can survive on entirely. It will reduce our dependence on the meat industry for meat as well as heal the environment, as the plant itself is capable of purifying the air and soil.","2015-12-29 18:37:49","-2","Maki_Man","1747856000.8293839","our planet is dying","manual"
"cyf32ey","t3_3ynwk2","3ynwk2","conspiracy","unknown","It's pretty dumb. I have 0 sympathy for people who suffer from the effects of eating animal. Good post.","2015-12-29 16:53:44","-4","digdog303","1747856000.830368","our planet is dying","manual"
"cyf47jd","t3_3ynwk2","3ynwk2","conspiracy","unknown","Vegetables are alive before you kill them and eat them too.","2015-12-29 17:23:48","-4","5arge","1747856000.832416","our planet is dying","manual"
"cyf454z","t3_3ynwk2","3ynwk2","conspiracy","unknown","How is this a conspiracy? go to /r/treehugging","2015-12-29 17:22:04","-10","DoYouEvenBrewBro","1747856000.833708","our planet is dying","manual"
"cyf5qzf","t3_3ynwk2","3ynwk2","conspiracy","unknown",">Animals are objectified as a commodity

They’re not human. End of discussion.

>and their rebuttals.

There is no rebuttal.

Veganism has nothing to do with starving yourself of vital nutrients. It has everything to do with an egotistical belief that you are better than everyone else merely because of the molecules you shove down your food hole. I can tell you without a doubt that the food you are withholding is going to be your downfall. Joint pain, sterility, slow metabolism, lower body temperature, hair loss, severe muscular and skeletal deficiencies–not to mention the mental and emotional problems that will arise as a result. Upton Sinclair, author of The Jungle, had to abandon veganism because his mind and body were not able to function on a diet of mere fruits, vegetables, juice, nuts, and seeds. Gandhi, once a proud supporter of the vegan movement, declared their ideas were fraudulent, stating, “No wonder that mortality figures are on the increase and there is a lack of energy in the people. It would appear as if man is really unable to sustain life without either meat or milk products. Anyone who deceives people in this regard or countenances the fraud is an enemy of India.”","2015-12-29 18:03:03","-11","Thrice_Baked_Ham","1747856000.835892","our planet is dying","manual"
"cyal6wa","t3_3y500w","3y500w","conspiracy","unknown","This comment has been overwritten by an open source script to protect this user&apos;s privacy. 

   If you would like to do the same, add the browser extension [GreaseMonkey](https://addons.mozilla.org/en-us/firefox/addon/greasemonkey/) to Firefox and add [this open source script](https://greasyfork.org/en/scripts/10380-reddit-overwrite).   

 Then simply click on your username on Reddit, go to the comments tab, and hit the new OVERWRITE button at the top.","2015-12-25 01:57:16","41","CasioQuartz","1747856013.6452322","our planet is dying","manual"
"cyalolq","t3_3y500w","3y500w","conspiracy","unknown","The Rockefellers and many of the foundations sponsored by the elite had a set of agendas they wanted enacted.

A world government, fewer people, control of resources.

There are some other agendas, but we can start with these. To make their agenda a reality, they pursued many means of population control, many ways to bring about a world government and basically already had resource control. 

CO2 is exhaled by all people and is part of each and every human transaction. There are methods to avoid it, power sources that don't produce CO2, but they are not discussed by the global warming crowd.

Exxon is now being portrayed as the ""bad guy"" in global warming. This is true, but not how the media tells it. Exxon published 53 papers supporting AGW. Exxon belonged to the Rockefellers and they were driving the message of AGW through Exxon and other resources. 

It's important to understand the depths of the Rockefellers influence and connections. At the turn of the 20th century, the Rockefellers took over the American Medical Association and made it into what it is today. They took a bunch of everyday Joes and made the idea of a doctor as a status symbol, highly paid and godlike. They simultaneously ensured that diseases would be treated rather than cured and the pharmaceutical companies treating the diseases would be Rockefeller companies. 

People couldn't become doctors without the AMA, they could be dismissed from the AMA for curing people.

They did kind of the same with climate science. The history of climate science is a bunch of people jumping on board with the current trend and not being able to explain it, with some being extremely alarmed about it. This happened during the dust bowl, the 50s to the seventies were a scare of global cooling, and then the uptick in temperature came about and a new thing to jump on board and cause alarm over was put in place. But this time the Rockefellers were there.

The Rockefellers of course provided the land and helped the UN get started as the follow up to the League of Nations which they also got started. Both these groups essentially were moves towards a world government.

Maurice Strong started the IPCC and gave them their raison d'être: find human influence on the environment. Maurice Strong was a high school drop out, from Canada, who found himself living in the apartment of a wealthy and influential New Yorker at the age of 19. He was introduced to the Rockefellers and went into the oil business. He helped make Canada dependent on foreign oil and then was put in charge of PetroCanada to get Canada independent from foreign oil.

And then just as the uptick in temperature occurs, he becomes:

> Secretary General of both the 1972 United Nations Conference on the Human Environment, which launched the world environment movement, and the 1992 Rio Environmental Summit, he was the first Executive Director of the United Nations Environment Programme (UNEP).

He establishes the IPCC and then 600 scientists are set to work to determine ""man's influence in the climate"" during a warming period.

Man's influence was then obviously to warm the climate and CO2 was a good scapegoat for the cause. People make lots of it, it in fact encompasses every facet of human life.

So they rolled with CO2. 

The next step is to get the world to start funding the problem. All that we need to do is fund this world body with a payment from every aspect of our life and also give them the ability to enforce. Enforce against every aspect of our life.

The Rockefellers turned climate scientists into many superstars with very good salaries. And anyone who goes against their story is attacked all around. Only few older scientists are willing to cross them. Young scientists who object to the theory just don't get hired.

The models have been completely wrong. Antartica's ice is growing. No hotspots were found, the temperature hasn't risen in 18 years of the greatest CO2 output, there is no past evidence of CO2 driving warming.

And you can see from the truly ""religious"" believers in global warming what their sentiments are (many leading advocates for global warming have instructed their followers to ""stay on message"" i.e. don't say shit like:) ""I'm not going to have kids"", ""Humans deserve to die"", ""Deniers should be imprisoned"".

Anyways, we have 25% energy poverty in my province. Last year the models predicted a ""mild"" winter with ""high confidence"", it turned out to break the record for the coldest winter, broke the snow record, was what many contractors for snow removal based their prices on and got screwed for. 

Their policies and belief in their models which have never been right cause havoc. Less access to energy and people taking taxes for CO2 will certainly result in terrible consequences. But they've prepped their faithful for this. Part of studying climate change is to go through moral dilemmas where they basically tell you to save humanity you need to be willing to kill most of it.

The thing that makes it most obvious are their lack of solutions. Thorium can prove a thousand years of energy with no CO2 emissions, but they won't mention it. Biofuel is supposed to be producing 3000 gallons per acre of marginal land, but gets no mention. 

I could go through a long list of technologies that exist and are competitive but are not promoted. 

An interesting example is Lomberg. First, I completely disagree with his ideas, but the funny thing is he completely agrees with the premise that CO2 causes warming, but suggests that trillions of dollars aren't necessary to deal with it.

For that, he is called a denier. He proposes solutions, and so he is a denier.

Climate Change is the apocalypse for athirst/would be scientists. And to say it can be prevented is sacrilege. 

That's the basic story of climate change.","2015-12-25 02:17:44","25","[deleted]","1747856013.65621","our planet is dying","manual"
"cyapl9r","t3_3y500w","3y500w","conspiracy","unknown","Saved this comment a short while back. It's excellent and is right up your alley if you are genuinely looking into the AGW situation.

All credit to /u/doge_designer

>According to the satellite data (the most accurate record we have on global climate) there has been no extreme warming for the past 18+ years (it's in the 10ths of a degree which is quite OK). It really makes me wonder where people are coming from when actual scientific observation is disregarded in favour of preserving a political ideology.

>The Arctic, Greenland and Antarctica are all breaking records for ice accumulation, sea ice extent, shortest melt seasons etc. We've seen normal sea level rise, which has been rising steadily since the end of the last ice age about 10,000 years ago. Hurricanes, cyclones, monsoons are all in decline and the climate isn't rising at an alarming rate.

>All this, and more, in spite of rising levels of CO2. It seems that nature just doesn't want to play ball with the UN and its anthropogenic climate alarmism. Seriously, if you're getting your news from Arnold and Bill Nye (who doesn't know shit about the climate FYI, Richard Lindzen is an atmospheric physicist from MIT) you're not helping yourself or anyone else.

>We've seen a 40% greening of the planet, crop yields are up and the plants are loving it. CO2 only exists in the atmosphere at a level of around 0.04%. Of that very small amount only 3% is man made. Heck, ants all over the world produce ten times more CO2 than humans do each year. Is ant CO2 good but human CO2 bad?

>Did you know that if CO2 levels dropped to 150ppm all plant life on the planet dies? By all estimates, before humans came along and started putting CO2 back into the atmosphere, from whence it came, the planet only had about 2 millions years left before reaching that catastrophic level. Levels of CO2 are still less than 400ppm, which is less than ideal for plants to flourish. As an example, owners of agricultural greenhouses pump in extra CO2 up to levels of 1,200ppm so that plants will grow more efficiently and with higher yields.

>The UN is an unelected political body that is using anthropogenic global warming as a means to change the world order and accrue power unto itself. Their Sustainable Development document, which I have read in its entirety, is nothing short of a blueprint to establish a technocratic socialist world order. It's a centrally planned nightmare. If the 20th century is anything to go by, this new version of global socialism will cause way more harm than good. Central planning and socialism in general just doesn't work.

>I have also taken the time to download and analyse John Cook's 97% scientific consensus paper with the data. It's a scam. That guy, who lives just up the road from me, literally, faked that consensus. There was nothing like the consensus he claimed there was. In fact, based upon his data, it's more like a 0.3% consensus if you don't group unrelated categories or include papers that have nothing to do with AGW. If you knew anything you would know that the only place you'll find a scientific consensus is at the UN. The Petition Project, where 31,487 scientists have signed a document stating that AGW is not real, refutes the consensus claim, as does the survey conducted by the Scottish, Climate & Energy Forum.

>You criticise us deniers as loons and immovable but we're, at least, prepared to take time out of our days to actually look into the data. Are you? If you're willing, maybe a good place to start is to research why that bloomberg page linked above is nothing but climate alarmist propaganda. Also, typically, climate sceptics have had their minds changed at least once, so to say they can't change their minds is also silly. I used to believe in AGW until I started asking questions and looking for answers.","2015-12-25 04:55:05","7","elj0h0","1747856013.6622999","our planet is dying","manual"
"cyaukvt","t3_3y500w","3y500w","conspiracy","unknown","""Credits"" are a form of currency that have been introduced into the public awareness since as long ago as the original Battlestar Gallactica series. Carbon credits, where it is basically acknowledged that a human is a net liability on the earth, who must earn ""credits"" to continue to exist, is the next economy. The economy of the NWO, thanks to agenda 21 and the fuckwit softheads that push its agenda. ","2015-12-25 09:16:18","5","zeropoint357","1747856013.66376","our planet is dying","manual"
"cyaso6y","t3_3y500w","3y500w","conspiracy","unknown","What does pollution in China have to do with CO2?  You realize that CO2 is healthy and a very common molecule?

As for greenhouse gases, how much CO2 needs to be released to cause warming?  Do you know?  How much warming has to happen for it to be harmful?  Do you know?  You should know before you believe something.","2015-12-25 07:12:49","6","[deleted]","1747856013.665579","our planet is dying","manual"
"cyasit7","t3_3y500w","3y500w","conspiracy","unknown","As an electrical engineer studying electric engines and clean energy, here's my input. 

1.) doesn't matter if it's a conspiracy. Clean energy (especially electric engines) in their infancy are more efficient than fossil fueled combustion engines 100 years developed. Embrace the new cool tech.

2.) the facts above about how we put a small ass amount of CO2 in the air compared to its natural levels is totally believable. My concern with our current energy usage is pollution. I'm not too concerned with melting the ice caps. Mother Earth has ways to deal with it and there's plenty of room left in Central US for new cities should the water level rise. I'm more concerned with the after-products of coal and other forms of pollutants being tossed into our water and air supplies by coporationfags

Edit: also, I saw once that really longly-named volcano in Iceland?? (Not sure) a few years back launched so much CO2 into the air that it undid the carbon reducing efforts of a decade. If someone has a source to back this up, then the ""global warming from CO2"" shit is 100% just political nonsense","2015-12-25 07:04:39","4","BigShlurpy","1747856013.667851","our planet is dying","manual"
"cyakjj2","t3_3y500w","3y500w","conspiracy","unknown","Denying and questioning the current narrative are two very different things. Question everything!","2015-12-25 01:30:48","2","[deleted]","1747856013.669108","our planet is dying","manual"
"cyana4l","t3_3y500w","3y500w","conspiracy","unknown","http://m.imgur.com/YHPdeUZ

Proof that global warming is real.","2015-12-25 03:24:40","3","starquake16","1747856013.6703858","our planet is dying","manual"
