"id","parent_id","post_id","subreddit","tone","text","created_utc","score","author","scraped_utc","query_used","query_category"
"erkh4j3","t3_c2bfyv","c2bfyv","ClimateActionPlan","unknown","Most living things have died many times in the past. These things happen and will continue to happen. I try to accept what I cannot change and billions of people won't change overnight.

What gets me through is the idea that we are trying to colonize Mars and have companies that are throwing a lot of resources behind those ideas. Not because Mars is our future, but because the technology will save Earth at it's worst. 

When society has it's back up against a wall, we get shit done. We need our back up against a wall to Force it. We're on the verge of that and will all get to experience something amazing as a result. 

Holding onto the comfort of how things have always been makes it really uncomfortable, but 20 years ago, computers made most people uncomfortable and now my 85 year old grandfather carries one in his pocket. There is comfort on the other side and it will likely be amazing once we get there.","2019-06-19 16:55:43","5","IHaveSoulDoubt","1747929690.9616482","our planet is dying","manual"
"erkk6z8","t3_c2bfyv","c2bfyv","ClimateActionPlan","unknown","The main thing to remember is we dont really know whats going to happen. We dont know how bad it will be, which areas will be most effected, which areas will be the least effected, or if technology is going to straight up reverse it. You have know control and thats ok, you do have control over your experience. Enjoy nature, respect it and be happy that we have it here and now. When things get really bad then worrie, until then its not worth your time","2019-06-19 17:27:49","5","ThorFinn_56","1747929690.963184","our planet is dying","manual"
"erjvomv","t3_c2bfyv","c2bfyv","ClimateActionPlan","unknown","We are adaptable, and we are greedy. When things get bad enough, there are going to be people willing to pay for immunity. $$$ makes the world go round after all. I truly believe that our greed is usually the one thing that gets us into these situations, but also ultimately what will get us out too. 

In the meantime, I invest in the companies I think will have an impact on climate change (amongst others of course), and I try to do my part in spite of my likely ignorance. Recycle, pick up trash, ride my bike to work, you know  I will be teaching my daughter about the importance of keeping the world clean as well as making sure she has adequate resources to eventually even turn that understanding into a career path if she chooses. That and programming.. I think will be very important (and lucrative) in her future.","2019-06-19 12:46:13","3","slowgojoe","1747929690.965045","our planet is dying","manual"
"erk44v8","t3_c2bfyv","c2bfyv","ClimateActionPlan","unknown","Several things.

1. I don't expect to have children, so I don't *need* to worry as much what's going to happen beyond my lifetime. I understand the world has to be preserved, but I do not expect to bring a new human into the inevitable clusterfuck.
2. I'm doing what I reasonably can to reduce my footprint: I tend to walk wherever I'm going, I reuse dishes when possible, I've changed all my lights to LED's and am planning to replace my washing machine, water heater, fridge and stove with more energy-efficient versions. I have no air conditioning, and for the winter months I've had my windows changed so the place isn't leaking heat. The only concession I did have to make is personal transportation (a motorcycle) beyond walking distance because the QOL improvement is so immense, disproportionately to the footprint increase.
3. I vote for parties who place increased emphasis on combating climate change in their manifesto.
4. I internalised that time spent on anxiety is time spent not getting things done.","2019-06-19 14:34:27","3","[deleted]","1747929690.9670029","our planet is dying","manual"
"erk67w2","t3_c2bfyv","c2bfyv","ClimateActionPlan","unknown","Identifying the name of how you feel is important. A philosopher created a word for this called solastalgia: https://qz.com/1423202/a-philosopher-invented-a-word-for-the-psychic-pain-of-climate-change/

Here is a short film about it which offers a look at the pain but also a way out of it: a deep appreciation and gratitude for our shared planet, regardless of if we make it or not ( attachment to things being good creates friction in us)
https://vimeo.com/goodkindfilms/solastalgia","2019-06-19 14:57:52","3","WEoverME","1747929690.9681652","our planet is dying","manual"
"erkjxpm","t3_c2bfyv","c2bfyv","ClimateActionPlan","unknown","i know it’s hard, but live in the present. i was watching bill burr on conan and he was like “this is the golden age of global warming. put your arm out of the car windows and enjoy it.” everyone laughed but, it’s kinda true. i mean, ya only have one life and you were gonna die anyways, and you still don’t know when you’re going to die. any of us could die at any time. that doesn’t stop us from living. that’s how i try to think about it. not to give up the fight against climate change. but to give up that climate change anxiety. everyone’s gonna die, everyone has a fear of death. this is just a new flavor.","2019-06-19 17:25:10","3","josski32","1747929690.9695349","our planet is dying","manual"
"erl1y6e","t3_c2bfyv","c2bfyv","ClimateActionPlan","unknown","Perhaps a little Stoicism might help OP.

- Understand that there are some things completely out of your power. Like the anthropocene mass extinction. You aren't Captain Planet to save all those earthlings. 

- Accept that civilizations do die. Some prematurely, some after having reached the heights. We are probably the former.

- After having internalize the above two, understand that it is your duty to try and improve the situation, in whatever small way you can. Or, at least try and not make things worse.

Death is inevitable to all in this universe OP. If humanity does die out due to climate catastrophe, it wouldn't be half as sad as the fact that we failed ourselves, and the rest of the earthlings. I just hope all this rampant consumerism, exploitation of nature and constant economic growth was worth it all for those who practised it.","2019-06-19 20:33:40","3","kfpswf","1747929690.971293","our planet is dying","manual"
"erjud7c","t3_c2bfyv","c2bfyv","ClimateActionPlan","unknown","Im not sure this will help everyone, or maybe anyone, but I like to listen to debunking videos, reminding myself of how stupid the deniers are makes me feel better, like once they either pass away or are educated we can see much bigger change

I also like to throw *facts and logic* at their feelings... but tbf I do also let my self get absorbed by a book or a game to take my mind of the real life stuff for a while.","2019-06-19 12:26:24","2","silverkingx2","1747929690.973366","our planet is dying","manual"
"erjv4sl","t3_c2bfyv","c2bfyv","ClimateActionPlan","unknown","I'm a bot, *bleep*, *bloop*. Someone has linked to this thread from another place on reddit:

- [/r/neogaianism] [😐](https://www.reddit.com/r/neogaianism/comments/c2gjih/_/)

&nbsp;*^(If you follow any of the above links, please respect the rules of reddit and don't vote in the other threads.) ^\([Info](/r/TotesMessenger) ^/ ^[Contact](/message/compose?to=/r/TotesMessenger))*","2019-06-19 12:38:00","2","TotesMessenger","1747929690.974543","our planet is dying","manual"
"erjzhan","t3_c2bfyv","c2bfyv","ClimateActionPlan","unknown","I think Gramsci’s aphorism “pessimism of the intellect, optimism of the will” is quite helpful. Push and remain defiant and we can overcome. 

And his description of his times applies today: “The crisis consists precisely in the fact that the old is dying and the new cannot be born; in this interregnum a great variety of morbid symptoms appear.” If we keep fighting through this moment until the old is gone, change can really happen.","2019-06-19 13:38:15","2","blazeofgloreee","1747929690.976104","our planet is dying","manual"
"erk5eor","t3_c2bfyv","c2bfyv","ClimateActionPlan","unknown","The samvartaka fire","2019-06-19 14:48:53","2","TheGenesisPattern","1747929690.978723","our planet is dying","manual"
"erk5xpa","t3_c2bfyv","c2bfyv","ClimateActionPlan","unknown","Listen to this podcast: [https://xenetwork.org/ets/episodes/episode-49-climate-science-part-5-business-usual/](https://xenetwork.org/ets/episodes/episode-49-climate-science-part-5-business-usual/)","2019-06-19 14:54:46","2","lfortunata","1747929690.9800441","our planet is dying","manual"
"erl9kj9","t3_c2bfyv","c2bfyv","ClimateActionPlan","unknown","**Dear** [**u/UT\_Teapot**](https://www.reddit.com/user/UT_Teapot/) **and** [**u/WaywardPatriot**](https://www.reddit.com/user/WaywardPatriot/)**,**

Thank you so much for leaving this up. If I remember correctly, the topic doesn't do so well in the /r/Anxiety sub, and there's not a lot of places for climate-anxiety-ridden people like me to talk constructively. ***Even IRL***. 

To be 100% honest, I have such bad anxiety (& now depression) in the first place (and for so many years), that for the sake of my health and sanity, I'm going to have to dial things **way** back. It's gotten so my Google news feed just triggers anxiety too often now. Either I turn it off altogether, or I stop going to so many climate-related links. 

**Dear** /u/Weak_Praline, thank you so much for posting this!

**Dear Everyone Else offering advice in this thread,**

There looks to be some real solid advice here. (Special shout out to [/u/ILikeNeurons](https://www.reddit.com/user/ILikeNeurons/) and [/u/thebearsaint](https://www.reddit.com/user/thebearsaint/).) I bookmarked this page, which I do not do with Reddit. I will be coming back here for reference as long as it stays up.

As for myself, I need to ""do what I can"" and then find a way to ""let the rest go."" I am not, and have never really been the activist type, due in part to my anxiety issues. I'm also looking for less, not more things on my ""to do"" list, so I don't know how effective I will be with some of the activism advice, but I will take an honest look and try to do as much as I can.

I really appreciate the **hope** here. Thank you all.","2019-06-19 21:59:14","2","ItsJustLittleOldMe","1747929690.9822211","our planet is dying","manual"
"erlwv7u","t3_c2q9mb","c2q9mb","environment","emotional","> Show us what we can do to help.

Anything to tear down the capitalist, consumption based system within a decade. Worldwide.

Capitalism requires economic growth, i.e. making and consuming more stuff. Stuff is made with minerals and energy in the end and minerals are mined using more energy. Only a small percentage (4% if you're generous) of that energy is renewable and that percentage is growing so slowly (much less than economic and energy growth) that the absolute consumption of fossil fuels worldwide keeps growing like it has for decades.","2019-06-20 02:51:17","13","rrohbeck","1747929698.457417","our planet is dying","manual"
"ermbkac","t3_c2q9mb","c2q9mb","environment","emotional","In the order you asked:

r/zerowaste 

r/plantbased4theplanet

r/lowcar and r/plantbased4theplanet as well. If you decide that you DO want a family, don't birth them yourself, but instead adopt. r/composting 

Lobby. u/ilikeneurons constantly posts about the importance of lobbying for carbon taxing - basically, it would be a 'fee to pollute' imposed on companies and businesses and would help cut emissions.

I mean, I can't give you a list of companies to stay away from all nice and tidy. At the end of the day, basically everything we do comes with a hefty carbon price. Obviously try not to drive so much so you aren't giving money to oil companies, but that's a start. r/anticonsumption and r/buyitforlife kind of has the idea. Buy used where you can, and if you HAVE to buy new, buy the best damn quality you can so it LASTS. Cut out fast fashion. Buy local, in-season food where possible. Don't upgrade your electronics just because, but wait until they completely crap out... And even then, consider buying your 'new' one second hand.

r/extinctionrebellion r/fridaysforfuture

r/permaculture r/gardenwild r/letsplanttrees 

It's ok to be scared. Be afraid, and then turn that fear into calm, collected action. r/climateactionplan is good about keeping focused and not letting the outside pessimism cloud rationale.

Sometimes it feels hopeless, but it always does at the beginning. Keep in mind that with every person giving up meat, deciding to walk, and adopting zero waste practices, we shift culture - and it is happening, just not as fast as would be ideal. We just gotta keep trucking, and also keep putting pressure on the top.","2019-06-20 07:00:59","8","rezkidsinlove","1747929698.460177","our planet is dying","manual"
"ermbuk2","t3_c2q9mb","c2q9mb","environment","emotional",">How do I correctly recycle single-use plastics, like straws, to make sure they stay out of the environment?  And plastic packaging that comes with makeup, toilet paper, CDs, etc.

Recycling (really downcycling) at best only saves half the energy of producing new plastic.  China no longer accepts our plastic so a lot of ""recycled plastic"" is ending up in landfills. Better to just eliminate plastic use - check out r/ZeroWaste 

>How can I change my diet to better impact the environment?

Learn to garden. If you have a yard use it for food production.  For food you don't produce yourself, try to purchase from farmers who practice regenerative agriculture.  Figure out how to meet nutritional requirements without meat.

>What can I do in my everyday life to cut down on my pollution?

Live Simply.  Besides changing food habits, don't buy much, and when you do buy, buy second-hand or an object that will last a lifetime. Avoid traveling long distances. Hang your laundry to dry. Live in a small space that does not require much energy to heat. 

>What companies should we stay away from?

All of them.  Whenever possible, make what you need or buy second-hand.  Prefer local enterprises for services and goods you don't have the skills or means to meet yourself. 

>How can we get the attention of people who don't care or refuse to listen about climate change?

It is not easy.  But the biggest problem is not lack of awareness, it is people who are aware but do not act on their awareness, or if they do act they do not go beyond token gestures.

>How can we prepare for the changing environment without feeling like we are just going to die?

It is better to learn to accept death as a part of life and to be thankful for the time that we have. It is not easy to fully confront your own mortality but it is ultimately liberating.  Once you have accepted the inevitability of death and of all things outside of your control, you can focus your energy on what you can control.","2019-06-20 07:07:19","8","1HomoSapien","1747929698.462647","our planet is dying","manual"
"erlyy33","t3_c2q9mb","c2q9mb","environment","emotional","Climate depression and climate anxiety are a thing.

Politically being involved is your best bet, and it's really up to you on where to devote your time there.

A vegan diet without palm oil (while being aware of food miles) is probably your best bet for diet - if there are any additions to this I'd love the be aware of them because its what I'm currently transitioning to.","2019-06-20 03:19:33","6","[deleted]","1747929698.463955","our planet is dying","manual"
"erm3k4o","t3_c2q9mb","c2q9mb","environment","emotional",">How do I correctly recycle single-use  plastics, like straws, to make sure they stay out of the environment?   And plastic packaging that comes with makeup, toilet paper, CDs, etc.

You can't. It's not possible.

So don't use them in the first place.

&#x200B;

>How can I change my diet to better impact the environment?

Livestock farming uses up masses of resources.... so cutting out meat is very helpful.

&#x200B;

>What can I do in my everyday life to cut down on my pollution?

Not driving would be a great start.

&#x200B;

>How can we get the attention of people who don't care or refuse to listen about climate change?

If we knew, there wouldn't be a problem.

&#x200B;

>How can we prepare for the changing environment without feeling like we are just going to die?

We are going to die. Unless we ALL change how we live in the next year, 2100 will look like Mad Max & Waterworld. If you watch world news, you'll see extreme flooding  in [China](https://news.sky.com/video/flooding-kills-sixty-one-people-in-central-and-southern-china-11742270) and the mid-west US. Record breaking heat in [California](https://www.cnn.com/videos/weather/2019/06/12/daily-weather-forecast-heat-severe-weather-rain-flooding.cnn) and [India](https://www.ecowatch.com/india-heat-wave-deaths-2638801311.html) & [mid-east](https://www.usatoday.com/story/news/nation/2019/06/18/temperature-extremes-two-earths-all-time-heat-records-confirmed/1491360001/). 

but compared to corporations, individual humans are powerless to stop it.","2019-06-20 04:28:29","8","Wuz314159","1747929698.466006","our planet is dying","manual"
"erm1sqt","t3_c2q9mb","c2q9mb","environment","emotional","There are things we can do on a smaller scale to lower our environmental footprint: 

- Walk, take public transport when possible 
- check your local waste management website to see what types of plastics and garbage go in which bin 
- unfortunately straws are made of crappy plastic that cannot be recycled so avoid buying/using at all restaurants! You can buy reusable straws or paper straws if needed
- use reusable produce bags at the grocery store
- use cotton tote bags (no plastic)
- bamboo toothbrush
- buy local fruits and veg that are in season
- avoid buying things in lots of plastic packaging (ex if you  are buying yogurt, get the big tub rather than a bunch of individual sizes) 
- try to clean up a place in your community; this doesn't take long and you may be able to get garbage bags donated... This also raises public awareness
- shampoo bar (lush has excellent ones) 
- make your own coffee at home/ no paper cups
- washable cloth napkins instead of tissues and paper napkins
- don't buy synthetic clothing (polyester, acrylic, etc); when washed; thousands of plastic fibers are released which are difficult to filter in waste water treatment plant
- styrofoam takes the longest to decay so try to avoid this the most!!!! 
- research big companies like Nestle that are making quite a splash in the news regarding groundwater 
- avoid fast fashion (synthetic materials)
- use looseleaf tea (most of the bags have plastic in them)

This is a good and doable start to living consciously! You do not have to make big changes all at once, but gradually..for example when it's time to get a new toothbrush or shampoo consider making a change.there is a lot of information online about zero waste/ conscientious shopping/etc.","2019-06-20 04:00:51","4","here4wine","1747929698.468527","our planet is dying","manual"
"erm3q8d","t3_c2q9mb","c2q9mb","environment","emotional","As a fellow young person, the best thing to do is just follow the news. But what news you follow matters too. On reddit, there are many other subreddits such as r/climateactionplan which posts on current action, and r/zerowaste for personal impact etc...

I recommend mainstream media like the Guardian, who reports regularly on the environment.(like [this](https://www.reddit.com/r/environment/comments/c2nowb/how_youre_recycling_plastic_wrong_from_coffee/?utm_source=share&utm_medium=ios_app) article on recycling)


As others have said, the most impact you can make is in lobbying(Citizens Climate Lobby) if there are avenues for such things is your area.

But I thank you for your concern. Knowledge is key. Read on solutions, the science behind climate change etc...

There’s a reading list somewhere. I’ll try and link it later.
Reading list [here](https://www.reddit.com/r/climatechange/comments/byzj3g/a_big_climate_change_reading_list/?utm_source=share&utm_medium=ios_app)


r/Climateoffensive also posts on action","2019-06-20 04:31:13","3","exprtcar","1747929698.4700758","our planet is dying","manual"
"ermcvbq","t3_c2q9mb","c2q9mb","environment","emotional","Put big pressure on political institutions. Let the world know you are a climate/environment voter.","2019-06-20 07:30:35","2","cindacollie","1747929698.4722838","our planet is dying","manual"
"ermtiyj","t3_c2q9mb","c2q9mb","environment","emotional","[Systemic change is necessary](https://www.usatoday.com/story/opinion/2019/06/03/climate-change-requires-collective-action-more-than-single-acts-column/1275965001/) if we really want to address climate change. 

So [**lobby**](https://citizensclimatelobby.org/join-citizens-climate-lobby/?tfa_3590416195188=reddit-CarbonTax&utm_source=reddit&utm_medium=referral&utm_campaign=CarbonTax) for the change we need. [Lobbying works](https://sociology.stanford.edu/sites/default/files/publications/friends_or_foes-how_social_movement_allies_affect_the_passage_of_legislation_in_the_u._s._congress.pdf), and you [don't need a lot of money to be effective](https://www.jstor.org/stable/41759323?seq=1#page_scan_tab_contents) (though it does help to [educate yourself on effective tactics](http://www.congressfoundation.org/storage/documents/CMF_Pubs/cmf-citizen-centric-advocacy.pdf)). If you're too busy to go through the [free training](https://citizensclimatelobby.org/new-member/#climateadvocatetraining), sign up for [text alerts](https://citizensclimatelobby.org/text/) to join coordinated call-in days ([it works](http://www.congressfoundation.org/storage/documents/CMF_Pubs/cmf-citizen-centric-advocacy.pdf)) or set yourself a monthly reminder to [write a letter](https://www.ted.com/talks/omar_ahmad_political_change_with_pen_and_paper?language=en) to your elected officials. According to NASA climatologist and climate activist [Dr. James Hansen](https://en.wikipedia.org/wiki/James_Hansen), becoming an [active volunteer with Citizens' Climate Lobby](https://citizensclimatelobby.org/join-citizens-climate-lobby/?tfa_3590416195188=reddit-CarbonTax&utm_source=reddit&utm_medium=referral&utm_campaign=CarbonTax) is [the most important thing you can do for climate change](https://www.youtube.com/watch?v=q4DAW1A6Ca8), and [climatologist Dr. Michael Mann](https://en.wikipedia.org/wiki/Michael_E._Mann) calls its [Carbon Fee & Dividend](https://en.wikipedia.org/wiki/Carbon_fee_and_dividend) policy [an example of sort of visionary policy that's needed](https://www.usatoday.com/story/opinion/2019/06/03/climate-change-requires-collective-action-more-than-single-acts-column/1275965001/).","2019-06-20 13:17:39","2","ILikeNeurons","1747929698.4744298","our planet is dying","manual"
"ermgoih","t3_c2q9mb","c2q9mb","environment","emotional","This is my favourite post I've seen on here for a long time. This is so true.","2019-06-20 09:08:00","1","vainviking","1747929698.475498","our planet is dying","manual"
"ernbr4s","t3_c2q9mb","c2q9mb","environment","emotional","Great post! I would also add that places like these www.sycomo.re will help you and others alike not only be educated but “engaged”.","2019-06-20 16:45:33","1","jasonthecole","1747929698.4765341","our planet is dying","manual"
"ero70xx","t3_c2q9mb","c2q9mb","environment","emotional","Best thing you can do is let go of all the lies the dominant culture tells you about who you are and why you are here. It is a death cult and it is destroying this Earth. 

You are not a part of that culture. You're not an individual person living your life for yourself apart from other individual people and apart from the life of this Earth.

You are a part of the life of this Earth and we are here to share it, sustain it, and protect it. 

Our mother, this Earth whose life we share, is being killed.

The answer to all your other questions flows from this realization.","2019-06-20 22:32:34","1","naufrag","1747929698.4778152","our planet is dying","manual"
"es9m5z3","t3_c6lug9","c6lug9","environment","emotional",">A lot of us are vegetarian, a lot of us are vegan

If only that were true. Vegan posts often just get down-voted for being vegan. Many people on this sub only oppose dirty energy. Up-voting news stories is as far as many of their ""environmentalism"" goes.

>More has to be done, it is time to act. What is it that I’m suggesting?  
>  
>I can’t say. It’s against the reddit rules. Even what I said just above is theoretically against the rules (witch hunt type of stuff ya’kno, luckily I didn’t name names).

Its the sad state we live in, where the criminals write the rules.","2019-06-28 16:29:35","3","Vegan_Ire","1747929729.4533498","our planet is dying","manual"
"ergni60","t3_b1k072","b1k072","environment","emotional","Ok buddy that’s pretty cool I guess","2019-06-18 09:02:18","1","SoWren9","1747929733.544885","our planet is dying","manual"
