"id","subreddit","tone","title","text","created_utc","score","num_comments","upvote_ratio","url","is_self","author","scraped_utc","query_used","query_category"
"876p6k","climate","scientific","Ive created a working revolution","To learn everything you need to know about our human condition as the 99% go on this Instagram account: Woke_revolution and join the taking back of our true freedom. 

Our government and corporate entities our enslaving the majority of our race and holding back our potential as a people to a great measure. Its not about working jobs, its about who we are working for. And i am telling you right now we are working for very corrupt and wealthy individuals, who only care for themselves and their interests, and not the people. If the government had been working for the people and our planet climate change and world hunger would be long gone out the window. But instead we are still enduring these crimes against humanity, and our potential. No government, and no elected leaders are on your side, and it is obvious. Just look at the current state of our world. Division, hatred, people being uneducated, wars, corporate and government corruption. And that just starts the list of whats wrong in our world. We have been fed lies and we are distracted every day to keep us unable to see through to how corrupt and twisted the world really is. The media isnt focusing on whats important. And the people are blind to this. Theyve just been 
taught to go to shool, get a job, work, have a family, consume, then just die. People dont know what we as a race are really capable accomplishing because because we have only had corrupt, non ambitious, unfaithful and uncaring leaders. All across the world. None of the leaders care for the people, and same as the governments. They only care to keep us trapped within this self destructive system which has been designed to destroy us. At this point that is whats happening. If fwe rise up as a people and take back our power and our lives. We can be free. We can know what it means to really be free. Until we destroy the governments hold on ourselves as a people, we wont know freedom. If we run the revolution we can solve famine and climate change in months. Yes. Together once we work with eachother and are united. We can work very fast. And accomplish great goals quite easily. Because we as a people are doing these things. Which has never happend before, it was always the sly governments and corrupt corporate heads that run the show and what and where the world goes. Liturally they benefited off keeping us down, oppressed, and enslaved. And did so very effectively cus this has been going on for years by badly selected leaders. So the people largely just have no idea. 

Our potential as a human species is undiscovered. Because we dont even know our own capabilities yet. This means once we come together and take our power back. Adding to or taking over the goverment. We can do so much good, we dont even know yet. Because we have the RIGHT! People in charge. As the revolution. We can stop all wars, have goals and specific interests that we as a race can accomplish and achieve together, stop famine in months, climate change likewise, poverty, and any suffering. We can stop all that, And do much more to build our race and earth. We are working for the enemy, the people trying to keep us working for them so they and few bastards gain greatly. We need to work for the revolution and take back/ change and transform the world for the fate of the human race!! 

We need to unite and break free, as a people, from the corporate and government grasp and do things ourselves. Or else our potential will be lost, and we will life in this horrible cycle of corrupted death. 

This was a great a real way of putting things, and find out more on Instagram: Woke_revolution","2018-03-26 05:21:01","0","1","0.33","https://www.reddit.com/r/climate/comments/876p6k/ive_created_a_working_revolution/","True","Revolutionz0","1747904057.204048","our planet is dying","manual"
"8272xv","vegan","unknown","Changing a mindset","Hi Everyone,
I wanted to get people's thoughts and stories on some questions I have, and also maybe get some discussion going.
My girlfriend and I just recently became Vegans and it has been an eye opening experience and exciting journey. The more we learn about all the benefits of being a vegan, the more we want our friends and family to also convert.
One of my questions is, have you ever successfully or even minimally converted someone, and how? I understand the normal excuses, ""it's two hard, can't afford it, doesn't taste good"" I mean people will literally come up with any excuse not to change. So was it through debate, education, force, never tried?
No one in my life was, or has ever been a vegan so I was never told to make a change. It wasn't long ago that we (girlfriend and I) ate meat, but I feel as though it was being educated that really got us to change our mindset and better ourselves.
How did you become a vegan?

For us, it started with ordering a ""TB12"" meal set. For those of you who don't know ""TB12"", it is Tom Brady's (American Football Player) side business. It's all about maintaining peak performance through diet and pliability. The set comes once a week with three meals, feeds two people per meal, and it is all plant based. Overall we love the recipes and since the food gets delivered it makes for an easy week of cooking. So we got a couple of those meal sets but never considered going completely plant based until we watched three documentaries on Netflix. The first was ""Food Choices"", the second was ""Fat, Sick, and nearly Dead"" and the third was ""Forks over Knives"". I know we have so much more to learn, but simply watching those three movies was enough for us. We emptied our fridge the next day, giving away any animal related items and buying some vegan cookbooks to get new ideas and recipes. We bought ""Thug Kitchen"", ""How Not to Die"", and ""The super easy Vegan slow cooker cookbook"". All of them are great, we are experiencing new flavors and meals we've never tried before, as well as becoming better chefs in the kitchen. 
So getting back to why I'm asking, I want my parents to eat better first off. We all know the health benefits of being vegan. And with them being above 60, some things are bound to start going wrong at some point. So last weekend we went to my parents house to spend a day with them. Cook them some vegan meals (to show how easy it is and how tasty they are), and watch one of the documentaries while answering any questions along the way. I would say it was pretty successful but not 100%. They were willing to listen to us and make some change, so they may get there one day. Others fight it tooth and nail though. I tried talking to my two brothers about this and they just ""Yes'd"" me to death so I know they didn't care to listen and they for sure won't change.
For me, being a vegan is a no brainer. Better for the planet, no killing animals, healthier me and gf (we've both lost 10-15 pounds already). However the other members of my family and friends don't see this, they know about the environmental impact, but do nothing. They know about the health impact, keep eating meat. It's like, how do you change a mindset that doesn't want to be changed?","2018-03-05 16:19:39","3","5","0.72","https://www.reddit.com/r/vegan/comments/8272xv/changing_a_mindset/","True","CoCleric","1747905226.7894132","our planet is dying","manual"
"88e0bp","vegan","unknown","I recently did a 2000 mile road trip, from Chicago to Los Angeles. Was gone for a whole week, and I wanted to share what I ate.","I'm not going to lie, there were a few Taco Bell and Subway lunches involved. My hotel breakfasts were pretty standard: fruit and/or potatoes, plain bagel or oatmeal with peanut butter, and a cup of tea, so I won't go over those. But I wasn't expecting to find vegan pizza in Lincoln, Nebraska. (Good job, Nebraska. Now I like you more than Iowa.) But Disneyland - WTF, Disney? For a place that claims to be the ""Happiest Place on Earth,"" you sure do insist on putting dead body parts in all your dishes. Yeesh! But anyways, I wanted to share with you all the places that I visited and food that I ate.

**Quick Backstory:** 

My brother's fiancé is a Disney fanatic and just got her dream job at Disneyland, so they had three weeks to pick up and move from Chicago to Anaheim. I love road trips, and I'm between jobs so I had the time. So I loaded up my playlist and drove out there with my brother, his fiancé, and her mother, all omni's.

**To Prepare for the Trip:** 

I take a [**daily multi vitamin**](https://www.amazon.com/Deva-Vegan-Vitamins-Multivitamin-Supplement/dp/B001GAOHVG/ref=sr_1_2_a_it?ie=UTF8&qid=1522442416&sr=8-2&keywords=deva+multivitamin) on a regular basis as well as a [**Vitamin D supplement**](https://www.amazon.com/Deva-Vegan-Vitamins-Vitamin-90-Count/dp/B005NZ636M/ref=sr_1_2_a_it?ie=UTF8&qid=1522442494&sr=8-2&keywords=deva+vitamin+d) (because apparently I can't stand out in the sun like a normal person) so I packed those with me. I also did a bit of shopping beforehand and bought some vegan breakfast bars and bananas. Seriously, there are so many vegan breakfast bars out there, so just grab whatever you'd like. I also packed my custom blend protein powder from [**TrueNutrition.com**](https://truenutrition.com) just in case anything partly resembling real vegan food wasn't an option. Also, because my Significant Other is the sweetest person on the planet and an amazing cook, he made a variety of vegan muffins for everyone to take on the trip. Otherwise, I relied on the [**Happy Cow app**](https://www.happycow.net) to show me where all the vegan-friendly restaurants were in each city, because I knew I wouldn't be able to rely on cooking for myself, and, y'know, FOOD TOURISM!

**Day 1**

Left Illinois first thing in the morning, drove through Iowa for a bit, stopped in Des Moines for lunch. We ate just plain ole Taco Bell. I had the 7-layer burrito with no cheese or sour cream, and I may or may not have added potatoes to those. Sometimes I do; sometimes I don't.

Finished the first day of driving in Lincoln, Nebraska. Happy Cow brought us to [**Mellow Mushroom,**](https://mellowmushroom.com) a casual build-your-own pizza bar on the University of Nebraska campus. I had a [**small pizza topped with an assortment of veggies and smoked tempeh.**](https://imgur.com/wuIurC3) It was pretty delicious!

By the way, it also looks like there's a [**Blue Sushi Sake Grill**](https://bluesushisakegrill.com) in the same area. I just tried that restaurant here in Chicagoland area, and I've got to say it's some of the best vegan sushi I've had in a long time. So make sure you try that too!

So good job, Nebraska. Now I have a reason to look forward to driving through your state again.

**Day 2**

Finished driving through Nebraska and stopped for lunch just as we crossed over into Colorado. Subway for lunch. I made a veggie sandwich with an assortment of veggies and guacamole. 

There was a cannabis shop next door, so we figured we'd do a bit of tourism and visit our first cannabis shop. They sold a variety of cannabis and cannabis-infused things like tea, lotion, lip balm, edibles, etc. A lot of it wasn't vegan, but they did sell hemp seeds. They taste like sunflower seeds and probably would have made a good snack, but I didn't buy anything.

Ended our day by stopping in Denver. This was my second time in Denver, and I have to thank r/vegan for giving me so many great recommendations the last time I was there. I fucking love Denver, and [**Watercourse Foods**](https://www.watercoursefoods.com) is my favorite restaurant ever. For those who have never been, Watercourse Foods is a casual all-vegan dine-in restaurant that serves the most amazing comfort food, and I've been completely blown away by everything that I tried there. Fortunately, my travel buddies were open-minded enough to go to Watercourse with me, and you guys... that restaurant nearly converted everyone.

I had the [**Street Tacos Platter,**](https://imgur.com/HWsuSZ4) which I thought was amazing, really great flavors all around and really impressive sour cream. My brother's fiancé had the [**Nachos with the tempeh chorizo and the cheese sauce which is to die for.**](https://imgur.com/fU2aneq) Her mom had the [**French Toast**](https://imgur.com/9u0Jzbh) (potato quality, sorry) and it looked like the best French Toast I had ever seen. And my brother had the [**Classic Seitan Burger with the Tofu Bacon.**](https://imgur.com/5mDuy0N) You guys... my brother is a pretty standard burger-and-fries kinda guy who used to be hesitant about trying vegan food, and he said this burger broke his top 5 burgers of all time! I was sure to get a bite of it and FUCK that's tasty! The only let-down about Watercourse Foods was that they ran out of ice cream, so we didn't get to try their milkshakes. But I have never eaten so hard in my life, and I waddled back to our hotel because I so full of delicious food. So thank you, Denver, and thank you r/vegan for that wonderful recommendation.

**Day 3**

Finally left the flat lands and did some gorgeous mountain driving. I'm completely serious when I say I want to leave Chicago and move to the Denver area. Some day...

Lunch was in Grand Junction, not too far from the Utah border. Had Subway again, same sandwich as last time. Nothing too exciting.

We stopped in Cedar City, UT for the night, and honestly, not much popped up on the Happy Cow. Fortunately, I had some leftovers from Watercourse that I ate for dinner at the hotel while everyone else ordered pizza. I've gotta say, Watercourse Foods is still good a day later. Utah is really pretty, but if I ever go back to visit, I might try Salt Lake City instead.

**Day 4**

Last day of driving, and lunch was in Las Vegas. As expected, Las Vegas has a ton of vegan restaurant options, and I'm sad that I didn't get to try more it because a lot of it looked really exciting. We ended up getting lunch at a casual chain called [**SkinnyFATS,**](https://www.skinnyfats.com) and I had the Mean Bean Burger (black bean burger) with rice, because their fries aren't vegan which I thought was kinda odd. Sorry, I don't have pictures of the food because it was honestly underwhelming. Again, I would have loved to stay in Vegas longer and eat some really good food, but we had to get back on the road.

Finally, we arrive at the new home in Anaheim, California, but since the place is small, we got a room at the Grand Californian Hotel on the Disney campus. And this is where it gets really disappointing. It was really hard to find vegan food at the hotel and on the campus without actually entering the park. The hotel itself had plenty of restaurants, but just about every item on every menu had animals products that couldn't be substituted. Same with the Downtown Disney restaurants. We ended up eating at the [**Rainforest Cafe**](http://www.rainforestcafe.com) where the only vegan option that wasn't a salad was the **Anaconda Pasta** (quinoa pasta with veggies) sans cheese. (Sorry, no pics of this one either.) The pasta was ok, but I thought, of all places, Disney would be have a variety of foods and be able to accommodate.

**Day 5**

Spent most of the day unloading the truck and getting everything unpacked. Lunch was Chipotle. Call me simple, but I do love a good vegan burrito bowl from Chipotle. Pretty sure I skipped dinner that night because Chipotle was pretty filling and I made use of my protein powder for the first time during the whole trip.

**Day 6**

Flying back to Chicago, but first, breakfast. I know I said I wouldn't talk about breakfast, but I have to show you this because it's the dumbest thing ever. [**This was my breakfast during my time at the Grand Californian.**](https://imgur.com/0IYrNM6) From their White Water Snacks Food Bar, these were their only vegan options and this breakfast cost me something like $8 or more. [Relevant...](https://i.redd.it/v5hsghqxo9901.jpg)

But wait... brother's MIL called the kitchens and asked if they could make a vegan anything, and they offered to make me a potato omelette with whatever veggies I wanted. Sweet! I had no idea you could do that. So I ordered a ridiculously expensive [**potato omelette with broccoli, spinach, mushrooms, and peppers.**](https://imgur.com/oUinCVS) It was honestly just a giant plate of potatoes cooked in different ways, but as someone who lives and dies by the potato, this was a-okay with me.

I got to LAX airport around lunch time, and I was hungry again. I had time to explore and eat, and I found an all-vegan organic place called [**Real Food Daily.**](http://www.realfood.com) As you can imagine, organic, all-vegan airport food in Los Angeles was expensive as hell, so I didn't eat too much. I just ordered a [**small bowl of marinaded tofu and seaweed,**](https://imgur.com/vPn6Fll) and it was... kinda sad. The tofu tasted like it was just marinaded in plain soy sauce with nothing else, and the vegetables were soaked in soy sauce too. Oh well. I'm happy to be home.

So that's it! That was my trip across the country. If you're hesitant to travel because you're worried about not being able to find something to eat, I can't speak for outside of the U.S., but you can find vegan food just about anywhere here.

**TL;DR:** I ate my way from Chicago to Los Angeles and shared my food adventures. [**Full album here.**](https://imgur.com/a/h8NAg)","2018-03-30 21:44:36","8","0","0.83","https://www.reddit.com/r/vegan/comments/88e0bp/i_recently_did_a_2000_mile_road_trip_from_chicago/","True","Zippies_and_Hoodups","1747905240.98371","our planet is dying","manual"
