"id","subreddit","tone","title","text","created_utc","score","num_comments","upvote_ratio","url","is_self","author","scraped_utc","query_used","query_category"
"ctx2po","NoStupidQuestions","unknown","Wouldn't it be more impacting to state about that we are killing the human being instead of incentive people about saving the planet?","Nowadays, all environmentalist and people willing to fight for climate change have (almost) always the same approach and try to tell us that we are killing the planet, but beside all the animal, insect and vegetation on the planet, on a strictly chemical plan, the planet actually don't give a single damn about what we do on it. She was a big magma sphere, she suffered multiple mass extinction, and she's still spinning around the sun like the good old days. 

My point is, because I am convinced about that the choices of words matter a lot to build up the way we think about everything and matter even more when the the underlying goal is to incentive people to act. Then why always caring about this poor mother nature when we should focus on our own survival, the coming suffering from breathing, eating and drinking. 

You may argue this is the point of view of a catastropher. But I am not saying we are all going to die or anything close like that, I am just asking you to think about all the posters you saw about the environment, all the lectures you heard, even the way we talk about the planet : it's mostly about her with a feeling of guilt, and not really about us with compassion and a profound wish for a healthier future.","2019-08-22 12:58:07","3","7","0.71","https://www.reddit.com/r/NoStupidQuestions/comments/ctx2po/wouldnt_it_be_more_impacting_to_state_about_that/","True","needbill","1747933817.8067179","our planet is dying","manual"
"cu31qo","TrueOffMyChest","unknown","How am I supposed to stay sane and hopeful when our world is on fire, our wildlife is slowly dying out, our sources of food are perishing, our air is being poisoned and the most powerful and influencial people in the world don't even seem to care?","I'm only 18 and it doesn't seem like the future is going to be bright - if there is a future at all. I just feel like laying down and giving up on life as I won't ever be in the position to be able to single handedly save our planet from imminent disaster.

I recycle, I use public commute as a way of transport, I even put up an insect hotel in my garden to help solitary bees and other insects with finding a home, but none of that seems to matter on the grand scale of things.

So what if I recycle?
Some rich guy is probably going to dump more trash in a river than I could ever recycle in my life.
So what of I use public commute as a way to reduce carbon dioxide emissions?
Big corporations will still refuse to alter their schemes to make a few extra bucks before our planet becomes null and void.
So what if I try to help out bees - the most important pollinators on the planet?
The temperatures are getting more extreme than they have ever been and there's more carbon dioxide in the atmosphere than there's ever been, so bees will eventually die out as a result.

So tell me, how am I supposed to have hope for the future? How am I supposed to not have to worry about whether my future children will have clean air to breathe or whether they will have enough food to eat and water to drink?","2019-08-22 20:21:10","1","5","0.56","https://www.reddit.com/r/TrueOffMyChest/comments/cu31qo/how_am_i_supposed_to_stay_sane_and_hopeful_when/","True","KOLKOWoJo","1747934020.008917","our planet is dying","manual"
"cu3oz9","TrueOffMyChest","unknown","It doesn't feel worthit to start a family","My entire childhood I knew I wanted to someday have kids. I know now that I'll be a really great Mom. A handful of years ago I met an amazing man who is now my husband and we are finally at the point in our lives where we want to start a family. Honestly? I'm excited. I'm more than excited. I'm ecstatic, but I'm terrified. I'm terrified because of the kind of world we may be leaving him/her. I'm terrified because everywhere I turn the news is saying that humanity is going to die. There are politicians and people in high places who are putting everyone in danger because they want to make profits. 

I'm terrified because everything I have done since I was a kid to help bring attention to climate change feels worthless. My single action of voting doesn't make a damn difference anymore. I feel hopeless and I so badly want to be able to raise a small family, but do I really want to help bring a baby into a dying world? Do I want to pass this burden off to my kids? Do I want them to feel the fear that I'm feeling on a daily basis? 

It's not even worthit. No matter what we do the future is grim. I don't know if I actually want to have kids anymore just because I can't go one day without hearing how the planet is dying. It would be best if human stopped breeding. We are a fucking parasite.","2019-08-22 21:07:56","2","4","0.63","https://www.reddit.com/r/TrueOffMyChest/comments/cu3oz9/it_doesnt_feel_worthit_to_start_a_family/","True","throwit_yawa","1747934024.08614","our planet is dying","manual"
"cuw0w2","TrueOffMyChest","unknown","The current climate change discussion reminds me why Mass Effect 3 poorly reflects how international politics work","Let me explain. (Spoilers for Mass Effect 3 obviously) I'd like to preface this by saying I understand that Mass Effect 3 is a video game and is not a reflection of how the real world works at all, but this is just something I was thinking about recently while reading a lot about climate change, and for whatever reason Mass Effect 3 and its ""save the universe with the help of everyone"" plot line came to mind.

So when Mass Effect 3 came out a majority of the discussion was about the lunacy of the ending. Personally I don't find it as egregiously terrible as most, as I think a majority of the game is quite good, but I'm not here to talk about that. For those of you who are not familiar with Mass Effect 3, essentially the game revolves around the main character Shepard preparing for the upcoming apocalyptic invasion of the Reapers. The game (and series) are much more complicated than that but I won't be going much further into the plot line than that.

The game begins with Earth being invaded by the Reapers. Now even if you haven't played the games I think you can understand that that is a big no-no. In the context of the game it is an inter-galactic travesty, similar to some relatively smaller scale tragedies happening today do to climate change, no? Just go with me.

I bring up the comparison because climate change in modern times is treated by many as just as devastating as the reapers. 5,10, 15 years until irreversible damage including global temperature increases, rising sea levels and global food shortages. Apocalyptic circumstances, some might say.

Following the invasion of Earth and the universal epidemic of the Reapers invading, Shepard manages to use ""politics"" to solve all issues with the help of his companions and magically solve millennia long conflicts between the various alien species in the game. What a guy.

For example, he cures the Genophage of the Krogan race(essentially universal birth control for the species), the century long struggle between the Geth and Quarians(Quarians were kicked out of their homework by Geth), and manages to unify all governmental bodies to throw their full support into protecting the Citadel and destroying the Reapers. Pretty fucking amazing that he does that in such a short amount of time, right?

Now at this point you may be wondering why the hell I'm bothering with this comparison. It's a stupid video game, who cares. Art never reflects reality, right?

There's a quote from Mass Effect that I always found quite powerful. ""Stand in the ashes of a trillion dead souls and ask the ghosts if honor matters. The silence is your answer."" Pretty interesting quote right?

Except you can't really ask ghosts questions, so I guess it doesn't really matter. Only living people get to answer questions, because only living people matter, right?

So I'd like all you people who have already condemned yourself to death in the next couple decades to ask yourself how much your opinion really matters as a dead person. Do you think because you preach to others about going to war over the Amazon rainforest or declaring a global emergency over climate change it's actually going to happen? Sorry to tell you, but those who are living, the people with all the power, don't care much. They actually don't care at all about your pleas or your ""conspiracy theories."" To them, saving the earth for the global population is not hope for their survival. It’s hope for the general popualce’s survival, which doesn’t have quite as nice of a ring to it. They don't hope to allow the earth to be sustainable for the future. All they care about is their own ability to adapt, and those with the real money won't really have a problem with rising sea levels. they have plenty of other things to worry about.

Now I'm not saying that anyone is wrong about what they think is going to happen due to climate change. I'm not a climate change expert or a scientist, but I'd like to think I have a decent grasp on how people work. But I might be wrong.

Shepherd unifying all species to stop a universal threat may seem within the realm of belief in Mass Effect, but in real life? Truth be told most of the people in power don't give a damn about the dead or those who will be dead in the future. There are definitely some that think they can unify the world against a global epidemic, what you could call ""the good ones.""

But those who fall to the allures' of honor, greed, sloth and power are not the ""good ones,"" and unfortunately they have the power in most cases.

So how do you change the minds of the powerful? Well you have two options in my opinion. Appease them, or take away their power.

In Mass Effect 3, Shepard goes for appeasement. The Quarians will help if they get their homeworld back, the Krogans will help if the Genophage is cured etc. Are their situations like this in real life where it would be possible to appease those killing the planet?

Well I'm not sure. I'm not a politician. But at the very least there's not much us regular folk can do outside of voting (which by the way, I implore you to do). I'm sorry to say that I don't think there's much you can do individually to stop the Brazilian government from cutting down the Amazon rainforest. So what about taking away their power?

There are a lot of people calling for violence and war to do such a thing. Personally, I'm not in favor of violence at all. I don't see how a global conflict to stop rising powers from using their resources would do anything other than make things worse.

So is that all you can do? Patiently vote and hope that someone with power will help the world out?

In Mass Effect 3 there isn't much information about how the regular people react to the Reapers. You know how all of the main characters react to the solving of all interspecies conflicts, but what about the regular people? How did they react?

Well, I'm not exactly sure, but I'd like to think they did what they could. And that's where I guess I get to the point of this.

Do what you can. Vote. Make little changes in your life. Try your best. Sure, raise awareness I guess. But worry about yourself, Don't get stressed about the people in charge and what they're going to do because there isn't much you can do about them.

Little changes in your life may seem inconsequential, but they really aren't, and I say this as someone who scoffs at the ""small"" requests that many environmentalists make. ""Use less wood, paper, plastic, oil, electricity, beef, dairy etc."" I would ask those people who request people to cut out essentials from their lives if they actually think the common person is going to listen, because I don't think they will. Don’t act like completely changing your lifestyle is within the realm of reason for most people. if you actually want some change, drop the apocalyptic angle.  

Implore people to simply do what they can. It's the best you can ask for. We ain't getting a Jesus like figure in Shepherd to come save us, and waiting for the general populace to ""wake up"" isn't doing much. So do what you can. Can you cut back on beef to help the world? I hope so. It's not much to ask for, but if it is, fine. Not like me yelling at you is going to change much anyway. I can only control myself.

""I fight for freedom. Mine, and everyone's. I fight for the right to choose our own fate. And if I die, I'll die knowing that I did everything I could to stop you. And I'll die free.""

&#x200B;

If you actually red all of this, I appreciate it. Mostly just written out of passion rather than careful study so I appreciate any comments or discussion. Just had a desire to write out my ideas, hope you enjoy it","2019-08-24 17:06:47","2","3","0.75","https://www.reddit.com/r/TrueOffMyChest/comments/cuw0w2/the_current_climate_change_discussion_reminds_me/","True","ryann_flood","1747934028.879662","our planet is dying","manual"
"cugf6e","vegan","unknown","The world is dying and more people need to start caring","Dude you can throw a million studies at people that claim to be environmentalists that say that the meat industry is causing some of the worst issues and they act like it doesn't matter as long as they remember to bring their reusable bags once this month to the store. Yeah, that helps, but I feel like I shouldn't have to explain that animals are dying, getting raped, enslaved, etc for their tastebuds. Dude this is like a holocaust (and I do NOT use that term lightly) for animals but there isn't anyone that cares enough. I have gone almost 5 years being a vegan that never talked about the issues or would say something that would make someone feel bad. I care about humans and to help all of us we need to go vegan or at least MAJORLY cut back on animal products. 

I hate being overly emotional and I hate being ""that vegan"" but people try to bully me to eating meat but the second I open my mouth about animal suffering and the planet I'm the bad guy. I might as well be ""that vegan"" and start really sticking up for animals because guys tons of them are dying every year and I've kept my mouth shut for 5 of them. 

People care about the rainforest until it is ruined because of animal products. People in America cry as other countries eat our pets but we don't get upset that we eat animals other countries consider holy.","2019-08-23 16:42:53","22","2","0.94","https://www.reddit.com/r/vegan/comments/cugf6e/the_world_is_dying_and_more_people_need_to_start/","True","leeloodesebat","1747934228.07159","our planet is dying","manual"
"cnwzlz","futurology","unknown","Society should shift towards a technology and science focus and away from consumerism and amassing wealth","It seems that humanities' current purpose is largely to make money, pay taxes, and die. If you're able to escape to a different purpose it still revolves around your capacity to earn money, which usually is driven by a consumer based economy, pay taxes, and die.

If you're an artist, you are typically only making money if your art can make money for someone. For video games, if there isn't a profit involved then it doesn't get made. People sacrifice quality and passion to drive profits. But what are these profits after all? Essentially they're the individual's ability to amass more wealth and that wealth is used to amass more consumer goods. 

What if, instead, a higher emphasis were placed on advancing science and technology for the betterment of all of the planet? If everyone looked away from consumer goods and could contribute to a higher purpose, then even mind numbing jobs would have more meaning than simply acquiring wealth for consumerism and survival. Instead, now you're working to improve the advancement of all of humanity, because your tax contributions (for example) are focused on giving all of humanity greater advancements in science and medicine and tech which would, in turn, make life easier and enriched for everyone. 

The excess wealth would not be amassed by individuals which is sat on and squandered, but it would expand and enrich these pursuits which have the primary purpose of automating processes and providing solutions to problems which all humans face. 

Imagine if a medical program had trillions of dollars at its disposal worth of power, instead of a few hundred humans having that wealth between themselves for no reason other than that they invested it half a century ago? 

I know this is a radical attack on our current principles and economics but I think that we need to make a drastic shift because the rates of suicide and depression are very obvious indicators that humans are not content with slavery to a perpetual system of stepping on each other for the sake of profits and increasing individual bank accounts. 

Cant we, instead of *fighting* and hoarding for a better future, work towards sincerely creating as close to a utopia as possible without individual wealth and power being a concern? What if there is simply a solution through future tech that every human can experience happiness and have all of the necessities they require for a healthy and fulfilling life? What if it doesn't involve owning mansions and drowning in excess? What if that could be experienced through future virtual reality for personal pleasure instead of actual reality at the expense of so many billions of humans lives?

I think we have come to a point where this is actually possible. Maybe not in the next ten years. But I think it is something that can be worked towards. It would involve cooperation and genuine interest in providing our societies most brilliant minds with the propensity they need to achieve the greatest groundbreaking achievements possible in the shortest amount of time. 

Currently many limitations in science, medicine, and technology are set by financial limits. Why should this be the case? I think that our planet has enough resources and enough hard working and intelligent people that we could achieve a far greater version of life than the average person currently experiences. Imagine instead of having to choose between buying a new fancy car and a new fancy house if you were already content and happy with what you have and you were able to choose how you spend your free time with your friends and family? I think time is more valuable than the pursuit of consumer goods. We could provide much needed time and peace of mind to more people if our science and tech allowed us to. 

Why do we not have bright minds focused towards these pursuits by giving them the tools they need to do so? We put so much emphasis on working long hours to amass wealth to make the next expensive clothing or the next fast car or the next big television, but these things are empty temporary pleasures that have very little happiness value compared to a harmonious society where people rely on advanced possibilities, technologies/scientific & medical breakthroughs of the future which are no longer a dream because we have all contributed to making them real here and now instead of simply wishing. 

It would be possible for everyone to have everything they could dream of in an advanced virtual reality for example. Why do we need physical goods and waste and byproducts of waste as things and stuff just grow obsolete or damaged and constantly replaced by the next shiny things and stuff? 

This is a little bit of a rambling but it's an idea I had and thought I'd share it. Maybe I'm not able to make sense of this idea any better. Perhaps some of you can throw your ideas out there as well. Even if we are just dreaming, I think dreams are important and eventually become reality when people see incentive in them. A lot of talk of socialism seems to still revolve around profits and an archaic sense of monetary wealth. I just feel that our current technology has shown that this system is becoming obsolete and we should shift towards something better. I know rich people wont like this as much as poor people because they have a hand up on everyone, but what if that hand up is unnecessary and what if your happiness could increase along with everyone else's by owning and being part of an advanced civilization instead of sitting in the 21st century still arguing over 17th century ideologies?","2019-08-09 03:57:55","29336","3101","0.81","https://www.reddit.com/r/Futurology/comments/cnwzlz/society_should_shift_towards_a_technology_and/","True","Bjornskald","1747934262.415553","our planet is dying","manual"
"cl10xd","futurology","unknown","About that discussion on china's social credit system 5 months ago.","Im late to the discussion but i have some questions given i am also terrified of it too.

- What are the chances of this spreading to other countries and eventually enveloping the entire world.

- Will people with low scores effectively die of poverty, starvation, and thirst given they are restricted access to goods and services. because that seems to be the intent of that system. the dissenters die in their own home or die in the streets alone. 

- will living off the grid and hiding in the wilderness help one escape?

- will this social credit system bar me from committing suicide?

- is there any hope left in this world if this becomes global?

People are talking about how scary it is, how it looks like a black mirror episode/1984 and how dystopian and terrifying it is, but i wanna know if this will spread globally in the future and most importantly, within our lifetimes.and if this will snuff out any hope of freedom (except in death).

Because I am a Filipino American citizen trapped in the phillipines and I fear Duterte or his Protege implementing this after china implements it in 2020 as well as the us and other countries implementing it too.

Because I, a Freethinker, intellect and lover of freedom have no place in a social credit society and would prefer death over being turned into an organic machine on par with the proles or outer party from 1984. I fear next year and i fear the future. I'm not chinese but i still fear a future where every nation in the entire planet has gone full china and become as oppressive and as authoritarian and china where democracy and other western ideals have been snuffed out of living memory and freedom can only be attained in death and the whole of humanity is enslave. turned into mindless organic machines incapable of thought, incapable of emotion and programmed to do one thing: obey the party. obey the state.

please for the love of god, answer","2019-08-02 07:42:48","3","14","0.6","https://www.reddit.com/r/Futurology/comments/cl10xd/about_that_discussion_on_chinas_social_credit/","True","Newman1651","1747934298.846285","our planet is dying","manual"
