"id","parent_id","post_id","subreddit","tone","text","created_utc","score","author","scraped_utc","query_used","query_category"
"dietlyu","t3_6f1w0g","6f1w0g","vegan","unknown","That's an amazing recovery... happy you're doing so much better :)","2017-06-03 17:09:51","10","anachronic","1747887345.052042","our planet is dying","manual"
"dieyoa0","t3_6f1w0g","6f1w0g","vegan","unknown","Go you for being willing to think outside the box and adjust your habits in order to improve your own health and well-being! Empowering, isn't it?

I went vegan a year ago in an effort to combat symptoms of Hashimoto's disease (autoimmune thyroid disease). I would say that I am now about 95% symptom free. It has totally changed my life.

The whole coughing up blood thing is scary as hell. I'm so sorry you had to go through that, but I'm so happy to hear you're healing! 

Food is medicine.","2017-06-03 19:10:30","5","rbf_queen","1747887345.055587","our planet is dying","manual"
"diezqip","t3_6f1w0g","6f1w0g","vegan","unknown","doctors are shit at nutrition and it doesn't even take a med grad to understand that every bite of chicken and glass of milk has naturally occurring and possibly artificial hormones in them. this throws our body's desired hormone function out of whack and can fuck up women's periods. 

the effect long term diet has on health is vastly underestimated","2017-06-03 19:34:32","6","eat_fruit_not_flesh","1747887345.058551","our planet is dying","manual"
"diewoi7","t3_6f1w0g","6f1w0g","vegan","unknown","I am so sorry you went through that, how terrifying. Thank goodness you figured it out and I'm so glad you are doing well. ","2017-06-03 18:22:54","5","[deleted]","1747887345.061415","our planet is dying","manual"
"dif1pqy","t3_6f1w0g","6f1w0g","vegan","unknown","I love hearing success stories like this! So glad you're feeling better :)","2017-06-03 20:19:24","5","meganovaa","1747887345.064286","our planet is dying","manual"
"didtjhr","t3_68i54i","68i54i","conspiracy","unknown",">Isa = Christ

>Lamb = The Sacrifice of Isa

>Isalamb = Islam

Nice try but that only works in English.","2017-06-02 22:16:20","3","[deleted]","1747887584.69242","our planet is dying","manual"
"dibo48p","t3_6dwgcd","6dwgcd","conspiracy","unknown","[Mars! So hot right now!](https://www.youtube.com/watch?v=eGPraEH2KoY)","2017-06-01 16:45:14","1","ufotheater","1747887799.024131","our planet is dying","manual"
