"id","parent_id","post_id","subreddit","tone","text","created_utc","score","author","scraped_utc","query_used","query_category"
"f28wita","t3_dcl3cv","dcl3cv","sustainability","action-oriented","I agree. Combining resources, taking advantage of economics of scale and division of labor

You say selling this to your parents won't be easy. Have you offered to pay rent or do housework?","2019-10-03 03:16:33","5","JustWhatAmI","1747985181.1247501","green energy transition","manual"
"f28wr8a","t3_dcl3cv","dcl3cv","sustainability","action-oriented","You should totally do it! (as long as it is a safe place for you to go there)
The idea of living with family may be a little unsavory, but multi family living could be very beneficial for the earth. Making a smaller footprint even if it's just taking up one less home","2019-10-03 03:19:45","2","mirmice","1747985181.128139","green energy transition","manual"
"f28x3nx","t3_dcl3cv","dcl3cv","sustainability","action-oriented","Have you asked your parents? It’s really up to them if they want to let you stay with them.","2019-10-03 03:24:27","2","[deleted]","1747985181.1297102","green energy transition","manual"
"f28ztyc","t3_dcl3cv","dcl3cv","sustainability","action-oriented","I honestly think it’s beautiful, your plan.  I am trying my hardest to reduce my footprint, too. Imagine if more and more people on our precious planet did the same - we’d be in a much better spot.  You’re making the right call.  Your parents, much like my and my partner’s and almost everyone I know their age, have much to learn about sustainability and the consequences of economic growth.","2019-10-03 04:04:56","2","lifelovers","1747985181.133622","green energy transition","manual"
"f2azxqj","t3_dcl3cv","dcl3cv","sustainability","action-oriented","what is SIMB?","2019-10-03 16:26:04","1","minion_toes","1747985181.134987","green energy transition","manual"
"f36h7lb","t3_d9leqw","d9leqw","renewable","action-oriented","Very intresting","2019-10-10 12:55:59","1","ilovebrawlstars007","1747985267.245048","green energy transition","manual"
