"id","parent_id","post_id","subreddit","tone","text","created_utc","score","author","scraped_utc","query_used","query_category"
"d9gp13a","t3_5aip84","5aip84","science","scientific","I've been holding off on buying a solar system for the house because of a fairly high confidence that solar technology will become significantly more efficient and cost effective.  Do you believe we have reached diminishing returns on solar panels yet, or are there still near to medium time span technologies working their way to market?","2016-11-01 12:18:17","152","nate","1747947017.80979","green energy transition","manual"
"d9gqo5t","t3_5aip84","5aip84","science","scientific","Cursory reading indicates that current solar cells operate at 15 to 22 percent efficiency, and degrade up to 35 percent over their expected lifetime, meaning that they will eventually have to be replaced.

Disregarding the initial upfront investment, and arguable financial break-even analysis, I'd like to ask about the life-cycle of solar cells.  What happens to cells that have degraded to the point of uselessness?  Can cells be rejuvenated or refurbished, or can they be recycled in any useful fashion?  If not, what are the financial and environmental impacts to safely disposing of them?

Thanks!","2016-11-01 13:11:36","106","Milspec1974","1747947017.811415","green energy transition","manual"
"d9gp9aa","t3_5aip84","5aip84","science","scientific","Are the new glass solar panel roof tiles introduced by Tesla/Solar City as exciting as I think they are?

","2016-11-01 12:26:23","91","[deleted]","1747947017.812472","green energy transition","manual"
"d9gr1b1","t3_5aip84","5aip84","science","scientific","Hey I attend Virginia Tech as well, and was wondering how I could get involved with any potential research that you are doing involving solar energy or renewable energy in general.  I am currently studying environmental science and chemistry here at virginia tech, so if you know of the best route to take to get myself involved with your research please let me know.  Go hokies! ","2016-11-01 13:22:06","83","Eman848","1747947017.814192","green energy transition","manual"
"d9grc26","t3_5aip84","5aip84","science","scientific","Hi, hope this still makes it. I have recently turned my entire office building into a solar farm, I run almost 100% on solar during the ""power hours"" but I don't store. The reason being is because the price of solar panels has gone down and output up gradually each year.... but storage... storage is another thing, they are expensive, somewhat cost prohibited (my saving will never pay for them over their life) and just a bad all around.

What is being done in this field, I see solar as what all the cool kids are doing now a days, but storage isn't keeping up. Thoughts?","2016-11-01 13:30:18","35","Likalarapuz","1747947017.8157802","green energy transition","manual"
"d9gpths","t3_5aip84","5aip84","science","scientific","How quickly do the returns on solar generated electricity reduce as you move north, and have to start dealing with conditions such as deep snow and weaker winter sun?","2016-11-01 12:45:15","30","khendron","1747947017.817028","green energy transition","manual"
"d9gpkwu","t3_5aip84","5aip84","science","scientific","Which do you think is a bigger hurdle for solar: the efficiency and cost of the technology or legislation regarding its use?

Edit: to clarify, I'm curious if more progress could be made on a global scale by improving the technology, or by focusing on better legislation, specifically in countries whose governments are not fully supportive of solar. To word it another way: Are certain countries' policies slowing the growth of the industry globally, or is industry growth limited by the technology itself?","2016-11-01 12:37:31","22","[deleted]","1747947017.818323","green energy transition","manual"
"d9gpu5d","t3_5aip84","5aip84","science","scientific","Why do you think the future of electricity is solar and not nuclear? When do you think solar will be able to reach the practicality of a modern nuclear power plant?
","2016-11-01 12:45:50","20","The_Good_Count","1747947017.819197","green energy transition","manual"
"d9gpo82","t3_5aip84","5aip84","science","scientific","I read an article recently about a lab that had found what they claimed to be an efficient and scalable way to take CO2 and turn it into ethenol. Essentially reversing combustion.  It was offered as a way to store excess energy from a sustainable grid as ethenol. 


Did you read that? Is that a viable storage solution? How important is a storage solution?","2016-11-01 12:40:34","17","kirkendall71","1747947017.820569","green energy transition","manual"
"d9gp2t3","t3_5aip84","5aip84","science","scientific","At what point is solar energy NOT worth it? As is, I have a westerly facing roof pitch in NY; would adding solar panels really be worth it? ","2016-11-01 12:19:56","12","MidnightMoon1331","1747947017.8216372","green energy transition","manual"
"d9gp456","t3_5aip84","5aip84","science","scientific","Why is there so much effort being put into standalone water splitting catalyst technologies? Wouldn't it be more efficient to just use a PV+electrolyzer that has a high efficiency solar cell with the required potential? Or is it a current limitation? ","2016-11-01 12:21:17","12","nanoH2O","1747947017.823086","green energy transition","manual"
"d9gpi4x","t3_5aip84","5aip84","science","scientific","As a kid, I dreamt of huge bioreactors functioning as artificial leaves that could extract significant quantities of CO2 from the lower atmosphere downwind of a city in a pseudo-photosynthesis process. Could this [theoretically] be done?","2016-11-01 12:34:55","12","[deleted]","1747947017.824074","green energy transition","manual"
"d9gr93u","t3_5aip84","5aip84","science","scientific","Hi professor. I feel that solar photovoltaic energy production in its current form is unsustainable due to photoelectric inefficiency and the requirement for semiconductors with rare earth elements, not to mention the non-existent recycling of solar panels... where do you see the future heading w.r.t. these issues?

Also, do you have any hope for a hydrogen economy based on splitting water with catalysts that use sunlight as an energy source? We're well on our way to generating virtually free hydrogen (see Daniel Nocera's lab @ MIT).","2016-11-01 13:28:07","10","hyperproliferative","1747947017.825539","green energy transition","manual"
"d9goxp7","t3_5aip84","5aip84","science","scientific","Science AMAs are posted early to give readers a chance to ask questions and vote on the questions of others before the AMA starts.
 

Guests of /r/science have volunteered to answer questions; please treat them with due respect. Comment rules will be strictly enforced, and uncivil or rude behavior will result in a loss of privileges in /r/science.


If you have scientific expertise, please verify this with our moderators by getting your account flaired with the appropriate title.  Instructions for obtaining flair are here: [reddit Science Flair Instructions](http://www.reddit.com/r/science/wiki/flair) (Flair is automatically synced with /r/EverythingScience as well.)
","2016-11-01 12:14:50","1","Doomhammer458","1747947017.826923","green energy transition","manual"
"d9gppu6","t3_5aip84","5aip84","science","scientific","I've been thinking of a career in solar energy, but I currently don't have any relevant skills. Where are the jobs in solar energy? Will that change going forward? And what kinds of qualifications/accreditations are you looking for?","2016-11-01 12:42:03","10","action_lawyer_comics","1747947017.828328","green energy transition","manual"
"d9gq0a7","t3_5aip84","5aip84","science","scientific","This AMA is being permanently archived by *The Winnower*, a publishing platform that offers traditional scholarly publishing tools to traditional *and* non-traditional scholarly outputs—because scholarly communication doesn’t just happen in journals.

To cite this AMA please use: [https://doi.org/10.15200/winn.147800.04664](https://www.thewinnower.com/papers/5634-american-chemical-society-ama-hi-i-am-amanda-morris-an-assistant-professor-of-energy-chemistry-at-virginia-tech-ask-me-anything-about-how-to-make-solar-energy-competitive)

You can learn more and start contributing at [*thewinnower.com*](https://thewinnower.com)
","2016-11-01 12:51:13","8","redditWinnower","1747947017.829643","green energy transition","manual"
"d9gx06c","t3_5aip84","5aip84","science","scientific","Why are we still wasting money and time on these solar road people? Isn't this basically debunked and a complete waste of resources?

Link: http://www.solarroadways.com/","2016-11-01 15:36:46","7","autoposting_system","1747947017.8305259","green energy transition","manual"
"d9gp8e9","t3_5aip84","5aip84","science","scientific","Is the organic photovoltaic field dead now that perovskites has zoomed past opv efficiencies? Is there still viable place for organic semiconductors in green energy or should we just all move over to inorganic bulk hetero junctions? ","2016-11-01 12:25:30","6","asianyarg","1747947017.8322408","green energy transition","manual"
"d9gq0vi","t3_5aip84","5aip84","science","scientific","What is the lifespan of solar panels, how good is the recycling (can we do an identical brand new panel from an old one, or is it more like glass, where there is loss in quality)? How energy intensive is it? Same question for batteries.  
Assuming, say, 50% of OECD production from solar, what yearly volume of waste are we looking at? per kWh?","2016-11-01 12:51:46","7","233C","1747947017.8334012","green energy transition","manual"
"d9grnzr","t3_5aip84","5aip84","science","scientific","My job is on the line manufacturing solar panels. The max efficiency I have ever seen used is 20.50%. Is there a theoretical alternative to a Silicon matrix that would increase efficiency and would it be cost effective?","2016-11-01 13:39:03","7","frequencyfreak","1747947017.834337","green energy transition","manual"
"d9gqjqz","t3_5aip84","5aip84","science","scientific","How can the developing countries replace their coal plants by solar systems? How much scalability is necessary? 
Roughly speaking how much energy would be sufficient for a family of four in developing countries?","2016-11-01 13:07:55","6","Wowistheword","1747947017.8351831","green energy transition","manual"
"d9gquov","t3_5aip84","5aip84","science","scientific","Two parter here: In your experience, what are some of the biggest misconceptions about solar energy you've encountered, and how would you suggest countering them?

Edit: a word","2016-11-01 13:16:53","5","[deleted]","1747947017.836183","green energy transition","manual"
"d9gsoai","t3_5aip84","5aip84","science","scientific","What are your thoughts on nuclear power as a greener alternative to fossil fuels until renewable sources can viably replace countries power supplies over the long term?","2016-11-01 14:04:28","5","Nydusurmainus","1747947017.8373919","green energy transition","manual"
"d9gt0hg","t3_5aip84","5aip84","science","scientific","What do you think of Elon Musk's new solar roofing tiles and are they worth it economically?","2016-11-01 14:12:38","4","omnichronos","1747947017.838156","green energy transition","manual"
"d9gvosk","t3_5aip84","5aip84","science","scientific","How many games will VT football win this season?","2016-11-01 15:10:33","5","kysmith1306","1747947017.8387918","green energy transition","manual"
"d9gx4io","t3_5aip84","5aip84","science","scientific","What are your thoughts on Florida amendment 1 and what effects it may have on the industry here. https://ballotpedia.org/Florida_Solar_Energy_Subsidies_and_Personal_Solar_Use,_Amendment_1_(2016)","2016-11-01 15:39:04","4","Major_Monocle","1747947017.8397398","green energy transition","manual"
"d9h0bhh","t3_5aip84","5aip84","science","scientific","How will the biggest hurdles of solar (and wind) be solved? Namely the fact that it's output unpredictable? And that it requires huge amount of area for same output compared to coal, gas or nuclear?

For 1 nuclear plant you roughly need to carpet a circle with roughly 18 mile radius with solar cells to get the same output.","2016-11-01 16:40:47","3","beginner_","1747947017.840543","green energy transition","manual"
"d9gpax2","t3_5aip84","5aip84","science","scientific","Don't take this the wrong way...how about combating local resistances and prejudices? I'm all for increased green energy etc. But having lived in south side VA for many years, i know much of the cadre couldn't care less; they'd rather be ""rolling coal"" for example from their Cummins diesels. Perhaps it's different in Blacksburg idk i went to vcu, but it's been my experience that large segments of the population are resistant to the idea of green or even alternative energy. How do you combat societal norms that don't express an interest in change?  ","2016-11-01 12:27:58","3","SoyMurcielago","1747947017.841965","green energy transition","manual"
"d9grdbz","t3_5aip84","5aip84","science","scientific","Why are panels made so heavy, the aluminum and glass is inflating the price, cells and cables from a 100 w panel weighs around 250 grams I've learned, what do you think?

I think we should put them in a much simpler enclosure, such as thin transparent plastic, and design it so that it wouldnt change much if one cell got broken,

and also spit out panels from factories at maximum speed without regard for market prices.","2016-11-01 13:31:15","4","1980sumthing","1747947017.843055","green energy transition","manual"
"d9grlad","t3_5aip84","5aip84","science","scientific","Hi! Do You think algae generating hudrogen and hydrocarbons as a side product of their modified photosynthesis process could actually compete with typical photovoltaic solar farms in terms of energy efficiency? We seem to have reached a soft limit and most innovstions in photovoltaics seem to be in the field of WHAT can we coat with solar sensitive materials, rather than how efficient these materials actually are.","2016-11-01 13:37:02","3","zamach","1747947017.844009","green energy transition","manual"
"d9gteye","t3_5aip84","5aip84","science","scientific","Hi, I'm looking into greener energy and the different available sources. 

How would you compare nuclear energy to solar energy? Which is more efficient and/or safer for the world?","2016-11-01 14:21:52","3","[deleted]","1747947017.845025","green energy transition","manual"
"d9gtpie","t3_5aip84","5aip84","science","scientific","You always hear stories (more or less misleading) about solar energy making economical sense somewhere. 

But how far are we from it being *energetically* senseful?

I'm talking about EROI and EMROI [specifically](http://www.dailykos.com/story/2013/07/08/1221552/-GETTING-TO-ZERO-Is-renewable-energy-economically-viable). ","2016-11-01 14:28:30","3","mirh","1747947017.846313","green energy transition","manual"
"d9gvo5r","t3_5aip84","5aip84","science","scientific","Fellow Artificial Photosynthesis Scientist here, I like that you are looking to use quantum dots for your DSSC motifs. I proposed (in a vacuum at graduate school) a similar concept utilizing carbon quantum dots harvested/grown by laser ablation, vapor deposition,  and cutting graphene sheets to certain sizes, all for light absorption and emission capabilities based on size and shape.

How did you go about setting yourself apart from the rest of the Artificial Photosynthesis Scientists when seeking a tenure track position, writing a grant, etc...?

I am also curious if you have been following the development of Natural Gas Hydrates and their potential as a renewable resource with more than enough energy deposits. Do you think this will alter the course of green renewable resources? 

Thanks for your time!
","2016-11-01 15:10:12","3","BTownPhD","1747947017.8477309","green energy transition","manual"
"d9h1612","t3_5aip84","5aip84","science","scientific","This might be outside your experience but what are the transportation restrictions to creating massive solar farms in the desert southwest and transporting that electricity across the entire United States? I recently read that it would only take approximately 15% of New Mexico or Arizona's available land to create enough power for the entire U.S.","2016-11-01 16:57:02","3","BallzSpartan","1747947017.8487139","green energy transition","manual"
"d9gplva","t3_5aip84","5aip84","science","scientific","What steps will your energy policy take to meet our energy needs, while at the same time remaining environmentally friendly and minimizing job loss for fossil power plant workers?","2016-11-01 12:38:25","2","shaggorama","1747947017.850133","green energy transition","manual"
"d9grwvs","t3_5aip84","5aip84","science","scientific","Fellow Hokie here! My master is in Materials Science & Engineering, working with the aero and chemistry department was instrumental in my research . How do you encourage multidisciplinary efforts within your research, department, and grad students? ","2016-11-01 13:45:26","2","silverpony24","1747947017.85141","green energy transition","manual"
"d9grz0v","t3_5aip84","5aip84","science","scientific","A lot of amateur solar enthusiasts remark on how one tiny shade spot on their solar panel can mean a massive loss of potential power collection.  Can solar technology overcome this problem? ","2016-11-01 13:46:57","2","Chachmaster3000","1747947017.852439","green energy transition","manual"
"d9gtez4","t3_5aip84","5aip84","science","scientific","When will we get viable grid-scale storage for extended periods of time, let's say over the winter? When will these technologies in combination with solar reach parity with Nuclear? ","2016-11-01 14:21:53","2","[deleted]","1747947017.853374","green energy transition","manual"
"d9gtmem","t3_5aip84","5aip84","science","scientific","Two ridiculous questions.

I am okay with 'making stuff' and considered making my own DSSC cells for my roof. I know they are less efficient, but I planned on making a model and seeing how long they might last under extreme UV to try and simulate accelerated aging. (I mean, how long can blackberry juice hold up under the punishment of the sun?)

So, would this be a terrible idea-- can you save me the trouble of wasting a few months and my wife looking at me like I am crazy? (I mean, actually being a nut is bad enough. I don't need my beautiful and wonderful wife's face all screwed up at me for no reason-- takes away from the pleasing aesthetic and derails what could have been more enjoyable dinner conversation...)

I am not opposed to having specialized tools or chemicals/process in my shed away from my house.

The two requirements are that they cost less than commercially produced cells (which seem to be unusually expensive for the materials that go into them). And that they will last 10-15 years.

From there, I should be able to come up with a water tight design, set of steps to create a standard form factor, and the circuitry to patch into a commercial load handler (yeah, I'm not building that myself I can get 5V@???A output from the cells to whatever the input is (a Magnum Energy Inverter per se... they have 12/24V@~100A units like this one http://www.solarelectricsupply.com/solar-components/solar-inverter/magnum/the-ms-series-pure-sine-wave-inverter-charger-ms4024 ).

But, electricity not from fossil fuels is the way forward and I want in sooner than later. Thanks for picking this field and doing this, as ambitious as I am I think my best effort to help is electing people that want to subsidize alternative energy sources...

Q1: The cells are prohibitively expensive-- would you encourage or discourage well made DIY DSSCs?

Q2: Is there a better candidate type of cell for DIY cells?","2016-11-01 14:26:33","2","BradChesney79","1747947017.85518","green energy transition","manual"
"d9gvrf5","t3_5aip84","5aip84","science","scientific","In regards to sustainability, do you think we can continue making solar cells the way we are now - with Silicon extracted from silicon dioxide; or are here better ways? From my understanding there is a lot of pollution in the process of actually making solar cells. Also, how easy or difficult is it to recycle/repurpose old solar cells? 

I am an Energy and Environmental Policy major with a concentration in energy, science, and technology and a huge advocate for sustainable energy. How can someone like me get involved in the solar energy industry? Any tips? ","2016-11-01 15:12:03","2","treeev","1747947017.856436","green energy transition","manual"
"d9gvyqz","t3_5aip84","5aip84","science","scientific","I know several people who want solar on their homes but they don't want to deal with those lease-back programs that are being pushed by all the big solar installers. Selling systems outright is treated as not being worth their time, and pricing is still quite high compared with cost of materials and labor. Will we see a turnaround in this practice as solar becomes commonplace, or are there good reasons for solar installers to ignore people who want to purchase?","2016-11-01 15:16:09","2","lvl2bard","1747947017.8573089","green energy transition","manual"
"d9gw9xs","t3_5aip84","5aip84","science","scientific","I used solar electricity in the remote Himalayas between 1995 and 2002.

We used it for lighting mostly, the state of the art was Monocrystalline panels rated at 36 peak watts (But hardly ever saw a true power output of more than 24)

We pretty much monitored the ammeters all the time and two strange phenomena which we observed , and I have no clear idea why they occured.

1) When there was a very thin (alto-cirrus?) wispy cloud layer in the sky, the charging current increased to about 2.8A from a baseline of 2A - approaching the rated output of the panel.

2) When we poured cold water on the panels, the charging current would rise to about 2.6A from a baseline of 2A. The water came from a very cold mountain river, so it would have been at most 15 degrees centigrade. The boost lasted for a few minutes.

I have seen no mention of these effects anywhere in any literature related to solar PV systems

Effect #1 is especially intriguing!

Can you explain why these occurred? 

 



","2016-11-01 15:22:26","2","rep_movsd","1747947017.8584719","green energy transition","manual"
"d9gwnu8","t3_5aip84","5aip84","science","scientific","Do you believe that solar energy will ever be the premier energy source used in the US and abroad? Or do you see solar energy supplementing other clean(er) energy sources like nuclear and hydroelectric? 
","2016-11-01 15:30:04","2","Indiebear445","1747947017.859651","green energy transition","manual"
"d9gyqzn","t3_5aip84","5aip84","science","scientific","Are there any elements/chemicals/processes that if used would greatly increase the efficiency of solar panels but as of right now are to costly to implement. If so do you think we might see a drop in price in the next few years that will increase the appeal or solar?","2016-11-01 16:10:26","2","[deleted]","1747947017.860336","green energy transition","manual"
"d9h0s3h","t3_5aip84","5aip84","science","scientific","Hi, thanks for this topic!
I was wondering if you have any information regarding how solar cells technology compares to other renewable electrical technology in term of environmental impacts (based on the whole life cycle assessment of these technology and on the additional technology that may be needed, such as battery).
","2016-11-01 16:49:40","2","BGo_research","1747947017.861239","green energy transition","manual"
"d9h1lj7","t3_5aip84","5aip84","science","scientific","Starting by considering that the Earth and it's atmosphere are somewhat of a closed global ecosystem with sunlight coming into it.    

If we as a global society were to commit to as much solar energy usage as possible, there is a possibility that the sun's effects on the non solar energy producing surfaces could change considerably. Like I am imagining all rooftops, all roads, and basically anything that could convert solar power into electricity were doing so with decent efficiency.    

Are there any groups that are mapping out the potential positive and negative effects to that type of endgame? Like where the radiant energy that currently make our deserts hot, makes our roofs thaw after a snow, and makes our roads drivable in inclement weather?       

The energy is currently hitting all surfaces and dissipating into our environment in a lot of different ways. I am just wondering what the effects are of removing all of that energy from our ecosystems, neighborhoods, and whatnot.   ","2016-11-01 17:05:20","2","kickdrive","1747947017.862505","green energy transition","manual"
"d9h65v5","t3_5aip84","5aip84","science","scientific","Why are cells not made into windows? I'd heard of a type of solar cell that uses Sphealar Cells (butchered the name probably) that's a a lot of little metal balls embedded into glass with a fine clear mesh connecting them together. They are able react with a photon several times to create electricity coming in and out of the building.

Wouldn't solar power become more efficient if we could place them in windows that, while tinting the window (which is a benefit in southern states) could create electricity without taking space from large areas of land such as solar farms.","2016-11-01 18:32:48","2","Dragonsmoon333","1747947017.863457","green energy transition","manual"
