"id","subreddit","tone","title","text","created_utc","score","num_comments","upvote_ratio","url","is_self","author","scraped_utc","query_used","query_category"
"e74x23","ClimateActionPlan","unknown","Broad danish coalition agrees on legally binding resolution to reduce CO2 emissions 70% by 2030 (from 1990 levels)","A broad danish coalition counting 167 of the 179 members of parliament have announced the first binding climate legislation in Denmark. 

The law will require Denmark to cut emissions by 70% before 2030 compared to the levels of 1990. 

The law have a binding partial goal due in 2025, and will be evaluated every year. 

Most importantly, the reductions must take place on danish soil, and cannot be offset by purchase of CO2 quotas. 

Source (in danish):
https://www.dr.dk/nyheder/politik/danmarks-foerste-klimalov-med-bindende-maal-er-paa-plads","2019-12-06 21:33:12","171","2","0.99","https://www.reddit.com/r/ClimateActionPlan/comments/e74x23/broad_danish_coalition_agrees_on_legally_binding/","True","EscapeTrajectory","1747867896.370421","climate legislation","manual"
