"id","parent_id","post_id","subreddit","tone","text","created_utc","score","author","scraped_utc","query_used","query_category"
"cv4namp","t3_3lajil","3lajil","science","scientific","How do scientists calculate a reliable global average temperature from data 100, or even 50, years ago, that can then be compared to current temperatures and afford the ability to discriminate between averages that differ by a fraction of a degree? How much statistical modeling is required to adjust for differences in the location of thermometers, differences in the microenvironments in which the thermometers reside, quality of the recorded information and variation in the method of measurement, etc.?","2015-09-17 13:35:37","7","lakelandman","1747747379.218407","climate data","scientific"
"cv4laeq","t3_3lajil","3lajil","science","scientific","What's the concensus on how climate change will affect the gulf stream and weather in europe?","2015-09-17 12:20:09","6","TinySamurai","1747747379.219418","climate data","scientific"
"cv4lot1","t3_3lajil","3lajil","science","scientific","Will the North Eastern U.S. continue to have record breaking long and cold winters or have the past two years been coincidental? ","2015-09-17 12:37:11","7","JManSenior918","1747747379.2203991","climate data","scientific"
"cv4kveq","t3_3lajil","3lajil","science","scientific","Science AMAs are posted early to give readers a chance to ask questions and vote on the questions of others before the AMA starts.
 

Guests of /r/science have volunteered to answer questions; please treat them with due respect. Comment rules will be strictly enforced, and uncivil or rude behavior will result in a loss of privileges in /r/science.


If you have scientific expertise, please verify this with our moderators by getting your account flaired with the appropriate title.  Instructions for obtaining flair are here: [reddit Science Flair Instructions](http://www.reddit.com/r/science/wiki/flair) (Flair is automatically synced with /r/EverythingScience as well.)
","2015-09-17 12:00:10","6","Doomhammer458","1747747379.2221582","climate data","scientific"
"cv4llyh","t3_3lajil","3lajil","science","scientific","The Pacific NW saw an unusually dry and warm winter this past year.... should we start getting used to that?","2015-09-17 12:33:54","6","GoldyGoldy","1747747379.2232409","climate data","scientific"
"cv4m2i9","t3_3lajil","3lajil","science","scientific","I live in Florida. How long do you think we have before the polar ice caps melt and we'll be under water?","2015-09-17 12:52:20","4","SkydiverRaul13","1747747379.2246752","climate data","scientific"
"cv4v7vc","t3_3lajil","3lajil","science","scientific","I work in local tv. A few of our on-air meteorologists don't believe in climate change. They are quite knowledgeable about the weather. What can I say to convince them otherwise? Or, what would you say to them? ","2015-09-17 17:07:05","5","davzig","1747747379.2256231","climate data","scientific"
"cv4lcx7","t3_3lajil","3lajil","science","scientific","In a recent interview on [Econtalk Matt Ridley](http://www.econtalk.org/archives/2015/06/matt_ridley_on.html) said that water vapour does not look to have the amplification of temperature that the standard climate models now give it

""They are saying that that small amount of warming will trigger a further warming, through the effect mainly of water vapor and clouds. In other words, if you warm up the earth by 1 degree, you will get more water vapor in the atmosphere, and that water vapor is itself a greenhouse gas and will cause you to treble the amount of warming you are getting.""...""The clouds are making sure that warming isn't very fast. And they're certainly not exaggerating or amplifying it. So there's very, very weak science to support that assumption of a trebling""

Is he correct in this view about water vapors effects on climate change or do you think the current models are more accurate?","2015-09-17 12:23:13","5","cavedave","1747747379.2273972","climate data","scientific"
"cv4lg3j","t3_3lajil","3lajil","science","scientific","As someone who loves in dead center Oklahoma, the weather has always captivated me.  

I have a degree in EE already and I've honestly been debating going back to school for a second in Meteorology. I would love to be able to apply the two together and areas such as climate change/trends seem a good possibility for it. The passion is there; however, I'm uncertain to how the field is for a career. What would be your honest opinion?","2015-09-17 12:27:00","5","prefinished","1747747379.228964","climate data","scientific"
"cv4m9x0","t3_3lajil","3lajil","science","scientific","Based on recent estimates of future projected global temperature averages, do you think we have passed the tipping point?","2015-09-17 13:00:11","4","circus_snatch","1747747379.230721","climate data","scientific"
"cv4o7mx","t3_3lajil","3lajil","science","scientific","How much of a role do human-produced aerosols influence our climate and weather?","2015-09-17 14:03:49","5","DrTreeMan","1747747379.2318468","climate data","scientific"
"cv4pae0","t3_3lajil","3lajil","science","scientific","Hi Bernadette, I miss you in Baltimore. But thanks for helping to save the world :) WXshift will be helpful as often I bring up climate change on Reddit and people see it as a future event. It's difficult to show current impacts.","2015-09-17 14:34:24","4","FF00A7","1747747379.23332","climate data","scientific"
"cv4lz8u","t3_3lajil","3lajil","science","scientific","Have we as a race truly reached the ""point of no return"" on climate change as some have suggested? Implying that the damage we have done is far too great and there is little to nothing we can do to reverse it?","2015-09-17 12:48:46","4","Nixplosion","1747747379.2343261","climate data","scientific"
"cv4m01a","t3_3lajil","3lajil","science","scientific","So Chicago has seen crazy wet and cool weather this year.  I know one year doesn't indicate a trend, but seemed to be the same last year.  What macro trends should the midwest (and specifically Chicago) be expecting for the next 10/20/50 years?","2015-09-17 12:49:41","3","5-4-3-2-1-bang","1747747379.2352068","climate data","scientific"
"cv4mbce","t3_3lajil","3lajil","science","scientific","How much are humans to blame for climate change? ","2015-09-17 13:01:41","3","Cmboxing100","1747747379.236533","climate data","scientific"
"cv4mip5","t3_3lajil","3lajil","science","scientific","Are there mechanisms or models that accurately predict shifts in climate that are area specific?  For instance can we tell that one region/continent is going to experience more moisture in their atmosphere, while another should expect lower temperatures?","2015-09-17 13:09:05","3","CatchingRays","1747747379.23766","climate data","scientific"
"cv4lem0","t3_3lajil","3lajil","science","scientific","What affect does wasting water have on climate change?
","2015-09-17 12:25:14","2","CincinnatiBengals","1747747379.238872","climate data","scientific"
"cv4lz5u","t3_3lajil","3lajil","science","scientific","Is [MERRA](http://gmao.gsfc.nasa.gov/research/merra/) legitimate, and does reanalysis of climate models affect metearology in any long term or profound way? ","2015-09-17 12:48:41","2","StellarJayZ","1747747379.239937","climate data","scientific"
"cv4lzi8","t3_3lajil","3lajil","science","scientific","How hard was it getting the data? and given that gathering the data is a continuous process, can you take us through the processing involved? 
 ","2015-09-17 12:49:04","2","crovalin","1747747379.240736","climate data","scientific"
"cv4m86p","t3_3lajil","3lajil","science","scientific","Thank you for doing this AMA. My question, do you believe there to be a correlation between climate change and the sudden onslaught of powerful earthquake activity worldwide in the last few years?  On that note, are there any effects of climate change that are either not 100% certain and/or that the general public is oblivious to?","2015-09-17 12:58:27","2","Idtelligence","1747747379.2417438","climate data","scientific"
"cv4mdv1","t3_3lajil","3lajil","science","scientific","What are we, as scientists, doing to educate the worlds people about the specific mechanism of global warming?  I have many instances where global warming was expressed as a 'hoax'.  My approach to this type of discussion is to talk calmly about the daily warming of the earth and how CO2 and other gases re-radiate the heat back to the earth - at least when I'm actually allowed to explain.  We need to explain the science better.","2015-09-17 13:04:17","2","Roidy","1747747379.2426848","climate data","scientific"
"cv4mqol","t3_3lajil","3lajil","science","scientific","Hello I am studying atmospheric science in Maryland right now. I was wondering if climate change will effect the amount of wildfires? It's a pretty broad question but hopefully you could answer it!","2015-09-17 13:16:56","2","brokenstrings8","1747747379.2436411","climate data","scientific"
"cv4n6d8","t3_3lajil","3lajil","science","scientific","Is there any possibility of WXshift or similar happening outside the US?","2015-09-17 13:31:44","2","[deleted]","1747747379.244475","climate data","scientific"
"cv4n6kv","t3_3lajil","3lajil","science","scientific","I feel like we are the frog in the slowly boiling water. Reports and forecasts are too abstract. The occasional image of distaught polar bears and bird extinctions have not been enough to incite necessary behavioral change on our part.  What will it take, in your opinion?","2015-09-17 13:31:54","2","yourcodesucks","1747747379.245619","climate data","scientific"
"cv4nb6b","t3_3lajil","3lajil","science","scientific","Are there any methods of carbon capture that work on short timescales (less than 1000 years) and can address the 600 Gtons or so CO2 that has been generated by pulling fossil fuels from the earth since the industrial revolution? ","2015-09-17 13:36:05","2","MY_IQ_IS_83","1747747379.246283","climate data","scientific"
"cv4novl","t3_3lajil","3lajil","science","scientific","No really a science question, but why is it still almonst non-existant to hear climate change mentioned in conjunction with the extreme weather and weather records that we're seeing regularly now?","2015-09-17 13:48:07","2","DrTreeMan","1747747379.2471218","climate data","scientific"
"cv4o3kn","t3_3lajil","3lajil","science","scientific","My question is that how long will it take us to restore the climate back to it normal ways.....and another one is that is there a possibility to make the Earth more cooler and humid less pleasant.","2015-09-17 14:00:23","2","etimejumper","1747747379.2478771","climate data","scientific"
"cv4pde9","t3_3lajil","3lajil","science","scientific","What is your opinion on the tweet from Jason Box saying ""If even a small fraction of Arctic sea floor carbon is released to the atmosphere, we're f'd.""?","2015-09-17 14:36:42","2","pianobutter","1747747379.2486908","climate data","scientific"
"cv4q8xq","t3_3lajil","3lajil","science","scientific","Most of the world's weather happens over the oceans, where it is generally ignored by people. What ideas do you have to address this, and bring it home that there is an elephant sitting in the next room over?","2015-09-17 14:59:55","2","jongleur","1747747379.249619","climate data","scientific"
"cv4qsk6","t3_3lajil","3lajil","science","scientific","What can we actively do to try to educate people stuck in their ways in believing that climate change isn't a real phenomenon?","2015-09-17 15:14:18","2","Tony_Brown_III","1747747379.250443","climate data","scientific"
"cv4sjjz","t3_3lajil","3lajil","science","scientific","Will there be any changes related to tropical cyclones pattern with the climate change?","2015-09-17 15:59:02","2","rimarua","1747747379.2511501","climate data","scientific"
"cv4tb8o","t3_3lajil","3lajil","science","scientific","What is the expected change in climate in Texas?","2015-09-17 16:18:56","2","TreeArbitor","1747747379.2518342","climate data","scientific"
"cv4uf56","t3_3lajil","3lajil","science","scientific","What places on Earth will be minimally affected by climate change?
","2015-09-17 16:47:03","2","Utpala","1747747379.252617","climate data","scientific"
"cv4uxjz","t3_3lajil","3lajil","science","scientific","Hey, Bernadette, and welcome! What's the long-term prognosis at present for maritime climates like in the Pacific Northwest? Since it's generally pretty wet here, can we expect wetter winters and springs? Will the summers and autumns also be wetter or will they be dryer? Thank you!","2015-09-17 16:59:49","2","[deleted]","1747747379.2536662","climate data","scientific"
"cv4v65f","t3_3lajil","3lajil","science","scientific","What is going on with weather engineering (high altitude spraying) ? Is it doing more harm than good? What could the long term effects be? ","2015-09-17 17:05:53","2","Velzevul666","1747747379.25443","climate data","scientific"
"cv4v91j","t3_3lajil","3lajil","science","scientific","Is it true that Newfoundland, Canada (being in the middle of the arctic current and the gulf stream current) will actually get colder as the climate changes? My geography teacher had said that a few years back and I'm skeptical","2015-09-17 17:07:54","2","vensmith93","1747747379.25524","climate data","scientific"
"cv4v9h2","t3_3lajil","3lajil","science","scientific","Are there any resources (e.g. popular science websites, blogs, twitter accounts etc) that you would recommend to people?

The audience I have in mind might include people who had an interest in meterology but haven't kept current and would like an easy way to catch up or stay current (e.g. me), teachers, students, people looking at meterology for the first time who want an easy, interesting news source, etc.

Obviously Reddit would come to mind first ;-) but maybe any additional places we could look?","2015-09-17 17:08:12","2","davidkscot","1747747379.256334","climate data","scientific"
"cv4vdi2","t3_3lajil","3lajil","science","scientific","I trust current research, but what are the future effects in the next 50
, 100 years? What will our children and grandchildren will experience?","2015-09-17 17:11:01","2","Original_moisture","1747747379.257182","climate data","scientific"
"cv4vej3","t3_3lajil","3lajil","science","scientific","In Oregon it was hotter, longer this summer than I ever remember it being. What the heck happened? Is California's drought ""contagious"" or something?","2015-09-17 17:11:46","2","PrinceAspen","1747747379.258026","climate data","scientific"
"cv4m2kj","t3_3lajil","3lajil","science","scientific","I live in the midwest.  In the last couple of years our summers seem to have become more mild (temperature wise) and our winters seem to have more precipitation.  Is this a symptom of something long term like climate change, or is it short term and coincidental/anecdotal?","2015-09-17 12:52:25","1","thread_killer","1747747379.259012","climate data","scientific"
