"id","parent_id","post_id","subreddit","tone","text","created_utc","score","author","scraped_utc","query_used","query_category"
"cv82sd7","t3_3loz1t","3loz1t","science","scientific","Hello, thank you for doing this AMA.
I was wondering how mental health issues were dealt with when you're out in the field. I understand you're out there for a long time, with little outside contact. Do you have mental health professionals etc?","2015-09-20 17:57:40","15","madiechan","1747747362.559336","climate data","scientific"
"cv816li","t3_3loz1t","3loz1t","science","scientific","This AMA is being permanently archived by *The Winnower*, a publishing platform that offers traditional scholarly publishing tools to traditional *and* non-traditional scholarly outputs—because scholarly communication doesn’t just happen in journals.

To cite this AMA please use: [https://doi.org/10.15200/winn.144276.69446](https://www.thewinnower.com/papers/2671-science-ama-series-we-are-the-association-of-polar-early-career-scientists-ask-us-anything-about-polar-science)

You can learn more and start contributing at [*thewinnower.com*](https://thewinnower.com)
","2015-09-20 17:17:39","11","redditWinnower","1747747362.561339","climate data","scientific"
"cv82pzk","t3_3loz1t","3loz1t","science","scientific","I have two (maybe related?) questions!

Are the poles shifting?

Have we reached a genuine point of no return in terms of rising ocean levels? (Should everyone on the Florida coast for example move within the next 30-50 years..)","2015-09-20 17:56:01","6","Synaptic_testical","1747747362.562867","climate data","scientific"
"cv823yz","t3_3loz1t","3loz1t","science","scientific","Welcome,

Bit of an operational question here -- aside from the obvious cold weather, what is the biggest difficulty in conducting research in Arctic and Antarctic environments?","2015-09-20 17:41:09","4","adenovato","1747747362.5645819","climate data","scientific"
"cv82suv","t3_3loz1t","3loz1t","science","scientific","Someone asked about polar bears and then deleted their comment, but here's info anyways:

I'm not sure we have any bear experts today, so I'll try to answer as best as I can. While you might see other bears above the Arctic Circle, Polar bears (*Ursus maritimus*) are the species most known for living in this region. Specifically, you can find them in Alaska (USA), Canada, Russia, Greenland, and Svalbard (Norway). Contrary to popular belief, they do not live in Antarctica. :)

They like to live in areas with good annual sea ice extent and near the seals they eat. Given their behavior within the environment, they're considered marine mammals (the same classification for dolphins, for example). They're quite big, with males around 1,000 lbs (~450kg) and you should have a healthy respect for them given their impressive predation!

Polar bears are definitely being affected by climate change as they rely on sea ice extent to hunt. You can learn more about this here (including basics on global climate change): http://www.polarbearsinternational.org/about-polar-bears/climate-change

Polar Bears International is also a great resource for everything about these amazing animals: http://www.polarbearsinternational.org/about-polar-bears

A fun note, scientists believe that Polar Bears may have evolved from Grizzlies: http://www.pbs.org/wnet/nature/arctic-bears-how-grizzlies-evolved-into-polar-bears/777/

If anyone is an educator, here's a great resource to teach students about Polar Bears: https://www.nwf.org/pdf/NWF-Movies/Polar_Bear_Artic_Ed_Guide.pdf

-Alex Thornton","2015-09-20 17:58:00","4","Polar_Scientists","1747747362.56764","climate data","scientific"
"cv83q4r","t3_3loz1t","3loz1t","science","scientific","Thanks again,

I am also curious if any of you are interested in using deep submergence assets, such as the newly built [Nereid Under Ice](https://www.whoi.edu/main/nereid-under-ice) ROV?

If so, there is still time to apply for the [DeSSC New User Symposium](https://www.unols.org/dessc-early-career-programs) at the upcoming Fall AGU meeting, deadline September 30, and there is funding.","2015-09-20 18:19:56","4","Wrathchilde","1747747362.569278","climate data","scientific"
"cv81ug0","t3_3loz1t","3loz1t","science","scientific","Hey all, I just graduated with an mph in epidemiology and would love to get to either arctic circle. Do you have any need for young health researchers?","2015-09-20 17:34:35","3","[deleted]","1747747362.5704908","climate data","scientific"
"cv87bjk","t3_3loz1t","3loz1t","science","scientific","Hey guys great work out there!


I'm a young mathematician hopefully just about to start graduate school next year. I'm passionate about climate change and especially how it effects the Arctic. 


What do you recommend to someone wanting to get involved in the kind of research all of you do? ","2015-09-20 19:47:39","3","obsessivelyfoldpaper","1747747362.57182","climate data","scientific"
"cv8bsn4","t3_3loz1t","3loz1t","science","scientific","First of all, thank you for this AMA! As someone that is unlikely to enter this field of research, how contested are other, supportive or logistical, positions surrounding the research in the arctics? For example, a helicopter pilot?
Second question - How many hours of movies and series do you take with you! And ","2015-09-20 21:39:59","3","[deleted]","1747747362.572999","climate data","scientific"
"cv8lbai","t3_3loz1t","3loz1t","science","scientific","i know this one is a bit late to the party, but it's something I've been curious about for quite some time.  

Admiral Byrd's 1939 polar expedition abandoned a purpose built vehicle called the snow cruiser at their camp ""little America"". 

I know that the Ross ice shelf broke in that region sometime during the 1960's, but I've never been able to determine whether their camp was disturbed or not.   

Do you know of any resources where this information could be found? ","2015-09-21 02:04:41","3","Fromanderson","1747747362.5743492","climate data","scientific"
"cv8pkfl","t3_3loz1t","3loz1t","science","scientific","you seem to be living in a very cold place....how is it being there....my small question is the have you ever come across an interesting marine sea creature with a some immaculate ability to be more evolved in terms.","2015-09-21 04:11:22","3","etimejumper","1747747362.575788","climate data","scientific"
"cv83bbb","t3_3loz1t","3loz1t","science","scientific","Hi everyone, thanks for doing this AMA today! I have never heard of your association before, but I will definitely be checking it out after this!

I was wondering if anyone in your group had thoughts about the recent work from the American Museum of Natural History, suggesting that polar bears may be able to sustain themselves on a terrestrial based diet in the face of climate change and sea ice loss? http://www.amnh.org/explore/news-blogs/research-posts/polar-bears-may-survive-the-ice-melt-with-or-without-seals
Journal article: http://journals.plos.org/plosone/article?id=10.1371/journal.pone.0128520

Cheers","2015-09-20 18:10:16","2","hard_n_sloppy","1747747362.577236","climate data","scientific"
"cv8w58m","t3_3loz1t","3loz1t","science","scientific","Thanks for doing this AMA! Related to the question on whether we can participate in a supporting role, any doctors in your group who can speak to being an MD in a group on one of these research trips, and what it takes to become involved as a doctor? ","2015-09-21 11:12:36","2","[deleted]","1747747362.578458","climate data","scientific"
"cv9985n","t3_3loz1t","3loz1t","science","scientific","Hi,

I see on the APECS' website that the sponsors are exclusively Norwegian. How come you guys are all (affilited with) yankees and brits? :)","2015-09-21 18:13:09","2","farao-no","1747747362.5795012","climate data","scientific"
"cv80rxn","t3_3loz1t","3loz1t","science","scientific","Science AMAs are posted early to give readers a chance to ask questions and vote on the questions of others before the AMA starts.
 

Guests of /r/science have volunteered to answer questions; please treat them with due respect. Comment rules will be strictly enforced, and uncivil or rude behavior will result in a loss of privileges in /r/science.


If you have scientific expertise, please verify this with our moderators by getting your account flaired with the appropriate title.  Instructions for obtaining flair are here: [reddit Science Flair Instructions](http://www.reddit.com/r/science/wiki/flair) (Flair is automatically synced with /r/EverythingScience as well.)
","2015-09-20 17:07:04","1","Doomhammer458","1747747362.581074","climate data","scientific"
"cv81vlh","t3_3loz1t","3loz1t","science","scientific","Is polar science concerned with all scientific aspects of earth's poles?  What are a couple of the most important questions polar science is concerned with now?","2015-09-20 17:35:22","1","archetech","1747747362.5821052","climate data","scientific"
"cv8306s","t3_3loz1t","3loz1t","science","scientific","Dont think that my question is really appropriate. I am totally ignorant about whats happening in the Antarctic and Arctic regions. But I can't stop thinking about a SF book from a French writer, René Barjaval, which talked about archeology in those area. Are some of you leading archeology research in those places, is there some ? Thanks","2015-09-20 18:02:58","1","ikemen38","1747747362.583113","climate data","scientific"
"cv83jmc","t3_3loz1t","3loz1t","science","scientific","Thanks for taking time to answer questions.

Would any of you care to comment on the potential benefits or detrimental impacts on your ability to conduct sea-going polar science as a result of the recently implemented [""Polar Code""](http://www.imo.org/en/MediaCentre/HotTopics/polar/Pages/default.aspx).  This is the international code of safety for ships operating in polar waters for those not familiar.","2015-09-20 18:15:44","1","Wrathchilde","1747747362.5844128","climate data","scientific"
"cv84ea5","t3_3loz1t","3loz1t","science","scientific","http://www.takepart.com/article/2015/09/16/starving-polar-bear-climate-change-arctic-sea-ice-low?cmpid=tpenviro-eml-2015-09-19-sealevel

What can we as individuals, do about these situations?","2015-09-20 18:36:02","1","StonerMeditation","1747747362.585427","climate data","scientific"
"cv84gav","t3_3loz1t","3loz1t","science","scientific","Thank you for doing this AMA.
Do you have anyone on your research team conducting active acoustic research? If so, what is your research about? 

Also, I am excited to see this group. As an early career marine scientist looking to do some research in polar regions, I'm glad to find this resource. Cheers!","2015-09-20 18:37:32","1","foodfishsci","1747747362.586455","climate data","scientific"
"cv84mie","t3_3loz1t","3loz1t","science","scientific","Thanks for doing this AMA. A few dozen years back, just after acid rain was the environmental buzz du jour, and before co2 came into vogue, ozone depletion at the poles was a major concern. Is it still, and does it affect your health, and the health of the animals you study?","2015-09-20 18:42:11","1","DropAdigit","1747747362.58746","climate data","scientific"
"cv84xjv","t3_3loz1t","3loz1t","science","scientific","I'm a fan of Google Earth and love to look at remote parts of our planet. 

Unfortunately, Antarctica is a bit of a strange place in some way and many of the photos of the middle of the continent seem smeared by the satellite imagery. I don't know why this seems so and is there any chance it will be fixed in the future. 

Also, why not more photos at interesting sites? I know they have been explored, but I would like to see more photos. I'm much interested in the dry valleys where no snow is found. Also I am interested in any large bodies of water under the ice and what is down there. Has any group drilled down through the ice and taken video?","2015-09-20 18:50:12","1","johnknoefler","1747747362.588754","climate data","scientific"
"cv8509e","t3_3loz1t","3loz1t","science","scientific","This may or may not be relevant...Do you have any idea of how soon it will be that the North Pole magnetic field shifts to the South Pole?  I remember hearing in geology class years back that the shift was overdue.","2015-09-20 18:52:05","1","[deleted]","1747747362.589622","climate data","scientific"
"cv85c01","t3_3loz1t","3loz1t","science","scientific","Is the snow at the poles different? Which pole is more ""scenic""?","2015-09-20 19:00:11","1","87612446F7","1747747362.590566","climate data","scientific"
"cv85zlm","t3_3loz1t","3loz1t","science","scientific","How large are artic teams on average?","2015-09-20 19:15:58","1","aquib99","1747747362.591462","climate data","scientific"
"cv86e9v","t3_3loz1t","3loz1t","science","scientific","Thanks for doing this AMA - I love the cold and I am working towards my wildlife biology degree. Questions: 


How have the native communities received your science teams? 


What quality of life improvements have been made by working with and among the locals, if any?


Thanks! ","2015-09-20 19:25:59","1","fruntbuttt","1747747362.5923882","climate data","scientific"
"cv87bup","t3_3loz1t","3loz1t","science","scientific","How competitive is it to become a researcher with you guys?  As an aspiring geologist I've always thought it would be cool to do a few months of research in an icy climate.

I'd love to hear about a day to day of what you guys do and what I can do to increase my chances of doing research with you.","2015-09-20 19:47:52","1","kuavi","1747747362.593216","climate data","scientific"
"cv87ply","t3_3loz1t","3loz1t","science","scientific","Such a variety of fields represented in this AMA! Awesome! 

Two quick questions:  

1) What kinds of [natural products](https://en.wikipedia.org/wiki/Natural_product) are coming out of the polar regions? The only one I really know about (from molecular bio) is antarctic shrimp phosphatase. 

2) What are the big drivers of weather in polar regions? In lower latitudes, we're kinda at the mercy of [atmospheric circulation](https://en.wikipedia.org/wiki/Atmospheric_circulation) patterns. 

Thanks!","2015-09-20 19:57:00","1","dcmelc","1747747362.594265","climate data","scientific"
"cv88ep7","t3_3loz1t","3loz1t","science","scientific","Hi, so I'll just ask some questions that came to mind:  
  
1. Why go to the poles in the first place? What kinds of data can you get, what kinds of experiments can you do, you can't do anywhere else?  
  
2. What has polar science been most successful at, as in: What do you think was one of the best experiments/projects in terms of findings/insight?  
  
3. What do you think is the most important polar project right now?  
  
4. What could your field of science do with more money? What project do you wish you could do?  
  
Don't feel obligated to answer all questions, it would be nice, but some or any one will do.","2015-09-20 20:13:27","1","mcymo","1747747362.5957818","climate data","scientific"
"cv88or1","t3_3loz1t","3loz1t","science","scientific","This is pretty broad, but: What are some of the biggest/most interesting unanswered questions relating to the polar regions?
","2015-09-20 20:20:08","1","atallcostsky","1747747362.596985","climate data","scientific"
"cv898n4","t3_3loz1t","3loz1t","science","scientific","Thanks for doing this AMA. I'm an undergrad Molecular/Cell Bio student. Long story short, what would I have to do to get to Antarctica as a grad student?","2015-09-20 20:33:16","1","Terraneaux","1747747362.598088","climate data","scientific"
"cv89fua","t3_3loz1t","3loz1t","science","scientific","I'd just like to respectfully note that the poles don't have 12 hours of daylight/12 hours of night during the equinox.... it's just a 24 hour constant state of twilight/sunrise. (Source: I'm looking outside right now and I'm wintering at the South Pole)","2015-09-20 20:38:29","1","Toasty321","1747747362.599318","climate data","scientific"
"cv8afvl","t3_3loz1t","3loz1t","science","scientific","Hello, thanks for this AMA. 
I am interested to know how Antartica ice sheets respond to climate change, compared to Arctic ice sheets. I have done some statistical analysis for large Siberian rivers that drain into the Arctic. We see rising sea level, warmer water temperature, change in flow seasonality, significant increased winter precipitation and overall increase in precipitation due to northern moisture transport. How does the Antartica respond, in contrast with the Arctic? 
Also, I would love to get involved and contribute to the group. I come mainly from a Hydrologic and Applied Mathematics background. 
","2015-09-20 21:04:05","1","harshberia93","1747747362.600681","climate data","scientific"
"cv8asn6","t3_3loz1t","3loz1t","science","scientific","Hello! Thanks for doing the AMA! This is so niche I just HAVE to ask. I am a PhD student looking to do qualitative social research on workers in Antarctica. I have found minimal opportunities of travel, and do not quite know who to network with in order for this to become a feasible working project.   
1.  So, what advice can you give to a PhD student interested in doing research in Antarctica on the social behaviors of the worker there?   
2.  Where should I research for travel opportunities/cost?  
3.  How did the younger researchers get involved in these projects?  
4.  How frequently is your research actually conducted on site in the polar regions?   
5.  Who should I want to get to know to create working partnerships with researchers?  
  
Thanks for doing this, again! If it's not too forward and creepy, I'd love to PM you to discuss how to get a start in this line of work. Cheers! ","2015-09-20 21:13:16","1","tah_infity_n_beyarnd","1747747362.602297","climate data","scientific"
"cv8atmp","t3_3loz1t","3loz1t","science","scientific","How often does someone freeze their tongue to the south pole?","2015-09-20 21:14:01","1","[deleted]","1747747362.603009","climate data","scientific"
"cv8b2jh","t3_3loz1t","3loz1t","science","scientific","There is a lot of crazy talk about Admiral Byrd and Operation Highjump, what is the consensus about these stories among people who actually spend time at these places? (Don't reply if a shadowy organization prevents you from revealing the truth)","2015-09-20 21:20:22","1","rageling","1747747362.6038861","climate data","scientific"
"cv8c72p","t3_3loz1t","3loz1t","science","scientific","How many different north and south poles does Earth have? ","2015-09-20 21:50:54","1","SoulWager","1747747362.604828","climate data","scientific"
"cv8c9rv","t3_3loz1t","3loz1t","science","scientific","I plan on filling Lake Meade and ending the USWest drought by constructing a string of desalination plants along the coast.

As salt will be a major byproduct of this reaction, I have been looking for things to do with it that, preferably that don't involve dumping supersaturated brine back into the environment.

That said however, it had been suggested to me that the rate at which the Artic is melting is causing a large influx of fresh water into the system and disrupting current marine ecosystems in the process, and that diverting salt from my operations into this fresh water might help restore the balance in the area.

Is the fresh water influx from the melting of the Artic really as bad as I've been led to believe it is, and would mixing salt from the desalination operation into it be of benefit for the local environment there?","2015-09-20 21:52:57","1","Epyon214","1747747362.6061969","climate data","scientific"
"cv8chq9","t3_3loz1t","3loz1t","science","scientific","Hello. How does one typically get around on the poles and why did top gear not convince you it should be by car driven by grumpy old men. ","2015-09-20 21:58:52","1","scotscott","1747747362.606987","climate data","scientific"
"cv8cu10","t3_3loz1t","3loz1t","science","scientific","I'm a polar scientist and I've never heard of you. Of course, my research is focused on mars. You ever consider branching out to other planets? There's tons of crazy cryosphere stuff going on out there!","2015-09-20 22:08:35","1","[deleted]","1747747362.607908","climate data","scientific"
"cv8cvjx","t3_3loz1t","3loz1t","science","scientific","Recent decades have seen a fairly precipitous decline in Arctic sea ice cover during summer, reaching an unprecedented low of 3.6 million km^2 in 2012.

What are your views on when we could start seeing the first nearly ice-free Arctic summers (i.e. <1 million km^(2)), and how is this expected to affect both subsequent sea ice formation as well as the local ecosystem?","2015-09-20 22:09:50","1","guebja","1747747362.6089668","climate data","scientific"
"cv8d2bs","t3_3loz1t","3loz1t","science","scientific","Thanks for doing this AMA. I am in my final phase to become a Bachelor in Environmental Computer Science. During the following half year I will be researching on smart-clustering large satallite imagery at the German Space Agency. After that I would like to stay in the field of satellite imagery and combine that with arctic or preferable antarctic studies related to climate change. Is there any chance for an IT guy with low knowledge in Antarctic Science (compared to a Bachelor of Antarctic Studies) to start working/switch into this field? How did you find out about where you would study these fantastic fields?","2015-09-20 22:14:47","1","_fancy_pancy","1747747362.610092","climate data","scientific"
"cv8d2c9","t3_3loz1t","3loz1t","science","scientific","I'm a licensed municipal drinking water and waste water plant operator. Who do I contact to contract as a polar base plant operator? I can find all the info I want on those neat little reverse osmosis modular plants the bases use, but not how to get a job running one.","2015-09-20 22:14:47","1","browwiw","1747747362.611254","climate data","scientific"
"cv8imev","t3_3loz1t","3loz1t","science","scientific","Specifically for T.J. Young have you seen any high melting rate localities that may be the result near surface geologic processes; Any phreatomagmatics?","2015-09-21 00:49:25","1","Greentreevor","1747747362.612055","climate data","scientific"
"cv8ktpy","t3_3loz1t","3loz1t","science","scientific","Do you stay in Weatherhaven units in the Arctic? Concerning sleep pattern problems due to increase dark or light, I just go to bed at a set time and find that keeps my sleep pattern normal when in the Arctic. ","2015-09-21 01:51:10","1","[deleted]","1747747362.6132329","climate data","scientific"
"cv4lhwt","t3_3lajil","3lajil","science","scientific","Is the upcoming El Niño expected to fully relieve the four-year California drought?  Or is it more likely to be merely a refreshing drop in a deep and hollow bucket?","2015-09-17 12:29:08","37","weaselword","1747747379.207243","climate data","scientific"
"cv4llbv","t3_3lajil","3lajil","science","scientific","We always hear about the devastating effects of climate change through droughts, sea level rise, etc. are there any regions where climate change is predicted to improve the region to where it's more habitable and hospitable to people?  Will any arid regions become more fertile due to increased rainfall?   ","2015-09-17 12:33:08","30","shiny_brine","1747747379.209256","climate data","scientific"
"cv4l6tk","t3_3lajil","3lajil","science","scientific","What is your opinion on nuclear powerplants? Considering that these could drastically reduce CO2 emisson.","2015-09-17 12:15:36","23","BamLee700","1747747379.2107751","climate data","scientific"
"cv4l09t","t3_3lajil","3lajil","science","scientific","This AMA is being permanently archived by *The Winnower*, a publishing platform that offers traditional scholarly publishing tools to traditional *and* non-traditional scholarly outputs—because scholarly communication doesn’t just happen in journals.

To cite this AMA please use: [https://doi.org/10.15200/winn.144249.91591](https://www.thewinnower.com/papers/2653-science-ama-series-i-m-bernadette-woods-placky-chief-meteorologist-at-climate-central-who-launched-wxshift-this-week-ask-me-anything-about-climate-change-how-it-s-affecting-your-weather)

You can learn more and start contributing at [*thewinnower.com*](https://thewinnower.com)
","2015-09-17 12:06:49","12","redditWinnower","1747747379.212448","climate data","scientific"
"cv4l3s6","t3_3lajil","3lajil","science","scientific","What effect does/will climate change have on the world's ability to grow food and sustain its population?","2015-09-17 12:11:36","12","[deleted]","1747747379.213665","climate data","scientific"
"cv4lf9a","t3_3lajil","3lajil","science","scientific","How much of a role does animal agriculture play in climate change? Is there enough data on this specific cause?","2015-09-17 12:26:01","10","[deleted]","1747747379.2152588","climate data","scientific"
"cv4ltrt","t3_3lajil","3lajil","science","scientific","I live in Ontario, I've noticed over the past few years that fall seems to be a lot warmer and winter seems to get much colder.

How can we expect these extremes to continue to develop over say the next lifetime or 50 years?

Do you think what is happening is Earth's natural cycles (ie. heating and cooling) and we are just speeding up the rate at which they occur or is something else at play?

Based on what you know now, what will be some of the first major changes due to our shifting climate that will affect our lifestyles?","2015-09-17 12:42:42","9","jbuckfuck","1747747379.21684","climate data","scientific"
