"id","parent_id","post_id","subreddit","tone","text","created_utc","score","author","scraped_utc","query_used","query_category"
"d9ut5e4","t3_5c9468","5c9468","climate","scientific","Write your representatives. Federal, state, and city council. Educate yourself and do your best to convey your concerns to others. 

Encourage conservation groups to unite and pressure federal government. Particularly with respect to science funding, the Paris Climate Agreement, and renewables.   


A wave of letters and calls now might get a response.","2016-11-10 20:13:49","3","Jim_Nebna","1747925472.938323","climate alarmism","manual"
"d9upihb","t3_5c9468","5c9468","climate","scientific","I'm with you.

Although I also have no idea where to start. 
I've considered hunger strikes. 
Although my mother hates that idea. ","2016-11-10 19:02:58","2","garbage_monst3r","1747925472.941994","climate alarmism","manual"
"d9v3tub","t3_5c9468","5c9468","climate","scientific","At this point, I firmly believe that civil disobedience is the only pathway to change.  The way that society is functioning is the problem, and we're not going to stop anything until we force our way in front of and disrupt that functioning.  No one will give you anything except lip service and slow, incremental change instead.  We're way past the time for that.  The progressive left in this country needs to form a coalition among many different interest groups and agree to support their causes as one.","2016-11-10 23:53:57","2","DrTreeMan","1747925472.945544","climate alarmism","manual"
