"id","parent_id","post_id","subreddit","tone","text","created_utc","score","author","scraped_utc","query_used","query_category"
"cu0gtic","t3_3gporh","3gporh","science","scientific","Nuclear power seems to me to be a viable current option to replace fossil fuels. I.e. something we can implement immediately while pursuing research on more sustainable options.

Do you agree that replacing fossil fuels with nuclear for power generation in some cases is a good idea?","2015-08-12 15:45:32","6","superflippy","1747904490.7241101","climate alarmism","manual"
"cu0k1q0","t3_3gporh","3gporh","science","scientific","Professor Hansen, thanks so much for this very important work. 

I've seen many mainstream news articles about the latest dire climate science that report the findings accurately, and then conclude by suggesting (often by citing a quote from you) that a carbon price will be enough to prevent the worst.

A carbon fee-and-dividend, as Citizens' Climate Lobby proposes, seems like a great first step, but it seems clear that much more is needed, very soon, to draw down emissions as rapidly as necessary to prevent a rise of 2C or more (and even more to avoid 1.5C, as you advocate).

Other climate scientists like Michael Mann have advocated for an [economic mobilization on the scale of the American World War II mobilization](http://www.theclimatemobilization.org) to eliminate and withdraw excess greenhouse gas emissions, and a growing number of people, including CCL founder Marshall Saunders, are [signing a pledge](http://www.theclimatemobilization.org/notable_pledge_signers) to endorse this platform and build toward the massive political will necessary to achieve it in the U.S.

Do you agree with their assessment that such a mobilization is necessary?
If not, what kind of large-scale action could feasibly prevent the worst of the impacts you describe in your studies?","2015-08-12 17:03:52","7","crackulates","1747904490.725811","climate alarmism","manual"
"cu0rxt2","t3_3gporh","3gporh","science","scientific","Given that quitting meat can reduce your carbon footprint significantly more than quitting driving, why haven't environmental scientists championed this relatively simple way for us to halt climate change? Many respected studies and organizations now recognise animal agriculture as one of the top greenhouse gas producers (studies range between 18-51% - Guardian http://www.theguardian.com/commentisfree/2014/aug/04/climate-change-impact-vegetarian) but the message doesn't seem to have changed from ""don't drive as much"". Really grateful for your thoughts!","2015-08-12 20:09:00","4","PotatoOfDefiance","1747904490.7269068","climate alarmism","manual"
"cu0edds","t3_3gporh","3gporh","science","scientific","Where can I find the raw temperature data unadjusted demonstrating the climate change effect?  How do you answer critics who say that the lack of warming - cited for many years now - has suddenly been re-adjusted to show warming? It would be awesome to show myself and my friends the warming trend from the raw data. I'm sure it's problematic for layman data lovers like myself to run the numbers but I want the data regardless. Where can I find that data? ","2015-08-12 14:42:23","4","daddyhart","1747904490.727786","climate alarmism","manual"
"cu0fgpg","t3_3gporh","3gporh","science","scientific","Evan Oswald here from UCAR and the Vermont State Climate Office.  As you know, all the science in the world falls on deaf ears to many congressmen in the United States. Which presidential candidate is most in tune with climate scientists - in your opinion?  In case, you haven't heard of him before here is a website I worked on describing Bernie Sanders positions on climate change. http://feelthebern.org/bernie-sanders-on-climate-change/","2015-08-12 15:11:19","5","eoswald","1747904490.729182","climate alarmism","manual"
"cu0gcz8","t3_3gporh","3gporh","science","scientific","What do you all think of the criticisms from the ""lukewarmer's"", like Matt Ridley? I don't know much about this stuff, only from an [interview of his I heard on EconTalk](http://www.econtalk.org/archives/_featuring/matt_ridley/).

His argument is compelling to me: essentially that impacts will be (and have already been) lower than the worst scenarios, and that the cost of reducing CO2 emissions would be very high, and that is money that would be better spent on poverty, education, and health improvements for the 6 billion impoverished people on the planet.

Also - and worse, I find the cultural brigading of diverse opinions on climate change a scary thing. Science should be an open dialogue where multiple opinions are not just considered but encouraged. My impression of the climate change debate is that this is far from reality.","2015-08-12 15:34:08","6","theycallhimhellcat","1747904490.7304718","climate alarmism","manual"
"cu0kn4t","t3_3gporh","3gporh","science","scientific","Thanks so much for taking the time to answer these questions, it's always appreciated in this community.

I've been feeling conflicted lately, so I just have a quick question. It's true we need to start taking action, and with all of this attention drawn to needing an **urgent** reduction in GHG, I find it frustrating that some drivers get ignored. I recently came upon a number of studies that put animal agriculture as a very major driver of climate change,^[1](http://www.fao.org/ag/magazine/0612sp1.htm),[2](http://www.fao.org/docrep/010/a0701e/a0701e00.htm)  and that they will only get worse^[3](http://www.nature.com/nature/journal/v515/n7528/full/nature13959.html). How can we tackle the contributions to carbon dioxide emissions due to animal agriculture, and should this be something we deal with as a nation? Livestock and their byproducts account for at least 32,000 million tons of carbon dioxide (CO2) per year, or 51% of all worldwide greenhouse gas emissions.^[4](http://www.worldwatch.org/node/6294) As a very politicized topic, is it ever possible for our government to endorse a slow reduction of consumption of animal products, or a similar initiative? How can we ardently push for reduction in transportation and reorganization of our energy sources (which I completely agree with) but willingly ignore this very integral part of climate change?

Thank you for all your work and dedication, Professors!","2015-08-12 17:17:48","3","ShokubutsuNingen","1747904490.7319639","climate alarmism","manual"
"cu0ambg","t3_3gporh","3gporh","science","scientific","As a Dutch guy living in a country partly lower then the sealevel, I’m , like most of my countrymen, a little worried, we have a fine working government, who is building nice dikes, but somehow I still have the feeling that they’re  not doing enough. Or maybe we are. 
But I don’t really have a clue about possible risks and the developing story. 
I really appreciate the time you  take to answer specific questions,  but the question I really want to ask is quite simple. What is the single best website to visit for the general public which has information from the impact of global warming visualized.

What can I expect next week, next month, next year, etc","2015-08-12 12:40:31","5","dalenn","1747904490.733171","climate alarmism","manual"
"cu0auw7","t3_3gporh","3gporh","science","scientific","What are your opinions about using iron to ""fertilize"" the oceans as a way of drawing carbon dioxide out of the atmosphere? This was debated in one of my classes as a way to counteract emissions but I fear it will just cause oceanic ecosystems to simply re-release that CO2 during respiration or upwelling after the initial photosynthetic surge. ","2015-08-12 12:49:58","5","[deleted]","1747904490.7341728","climate alarmism","manual"
"cu0bk93","t3_3gporh","3gporh","science","scientific","1.  Do you support the US EPA's Clean Power Plan (CPP)?

2.  Do you see the CPP having any significant long term effect on US carbon emissions?

3.  Is the CPP an acceptable alternative to a carbon tax in the US?","2015-08-12 13:16:23","3","jLionhart","1747904490.7352","climate alarmism","manual"
"cu0bo9y","t3_3gporh","3gporh","science","scientific","What would be the most compelling argument to convince a friend who doesn't believe global warming is being caused by us? (In laymans terms)","2015-08-12 13:20:29","6","Zhurial","1747904490.736166","climate alarmism","manual"
"cu0cmvd","t3_3gporh","3gporh","science","scientific","A multi-meter rise in ocean levels seems beyond the usual claims, so to what extent would a multi-meter rise in ocean levels mitigate ocean acidification?

It's scientifically clear that anthropogenic warming is happening, but it seems less clear to me that the consequences will be a global cataclysm for humans. By which I mean, possibly many areas will experience increased drought, possibly many areas will experience increased storm frequency and intensity, possibly many species in the oceans would die from increased acidification, and consequently we would probably see drastically reduced biodiversity.

However, none of the above necessarily entails that *many human lives would be lost* due to climate change, which is what most people care about. Drought is handled by transportation or relocation, storms are handled by construction or relocation, and loss of biodiversity is handled by our reliance on agriculture. So even if climate engineering were to fail, our other means of mitigating the problems aren't necessarily inapplicable simply because the climate changes. Would you agree with this assessment? I think this belief that humans aren't really at risk may hold many people back from endorsing swift and immediate change.

I endorse change simply because tens of thousands of people per year *already die* from air pollution in the US alone, which is a *real and quantifiable cost* we're paying right now. The costs of anthropogenic warming seem less clear by comparison, and if you can't quantify it in real terms as being *even more costly* than the tens of thousands of lives per year we're clearly already willing to sacrifice, then convincing such people would be difficult indeed.","2015-08-12 13:52:01","5","naasking","1747904490.738048","climate alarmism","manual"
"cu0co2z","t3_3gporh","3gporh","science","scientific","Regarding documentation of the risk of abrupt sea level rise in your recent draft paper; would you consider adding any of the following to your list of references?

(1) Pollard, D., R.M. DeConto and R.B. Alley (2015) ""Potential Antarctic Ice Sheet retreat driven by hydrofracturing and ice cliff failure"", Earth Plan. Sci. Lett., 412, 112-121.
(2) Alley, R.B., S. Anandakrishnan. K. Christianson, H.J. Horgan, A. Muto, B.R. Parizek, D. Pollard and R.T. Walker (2015) ""Oceanic forcing of ice-sheet retreat: West Antarctica and more"", Ann. Rev. Earth Plan. Sci., 43, 7.1-7.25
(3) David Pollard, Robert DeConto, Won Chang, Patrick Applegate, and Murali Haran (2015), ""Large-Ensemble modeling of last deglacial and future variations of the Antarctic Ice Sheet"", Geophysical Research Abstracts, Vol. 17, EGU2015-5717, EGU General Assembly 2015.
(4)Johannes Sutter, Malte Thoma, Klaus Grosfeld, Paul Gierz, and Gerrit Lohmann (2015), ""Learning from the past: Antarctic Eemian ice sheet dynamics as an analogy for future warming"", Geophysical Research Abstracts, Vol. 17, EGU2015-13255-2, EGU General Assembly 2015.
(5) Coletti, A. J., DeConto, R. M., Brigham-Grette, J., and Melles, M.: A GCM comparison of Pleistocene super-interglacial periods in relation to Lake El'gygytgyn, NE Arctic Russia, Clim. Past, 11, 979-989, doi:10.5194/cp-11-979-2015, 2015.
(6) DeConto R, and Pollard D., (2014), ""Antarctica's potential contribution to future sea-level rise"", SCAR - COMNAP Symposium
(7) Bassis, J.N., and Jacobs,S., (2013), ""Diverse calving patterns linked to glacier geometry"", Nature Geoscience, 6, 833–836, doi:10.1038/ngeo1887.
","2015-08-12 13:53:06","4","AbruptSLR","1747904490.7399921","climate alarmism","manual"
"cu0d432","t3_3gporh","3gporh","science","scientific","Hey guys, thanks for doing this AMA.  I apologize if this is too much of a general, unscientific question.  I am kind of at my wits' end with my father and his attitude toward global warming.  He believes that carbon emissions are damaging and that global warming is happening, but that it isn't as bad as people say it is.  He says that we have recently come out of an ice age, therefore it is somewhat expected that the earth is going to warm up a bit.  We may be damaging the environment, but a lot of the symptoms of carbon emissions can be attributed to natural causes.

Is there any article that you know of that I can use as a counter-argument?  His argument is so specific that I find it difficult to quickly and easily trump it.  I am not trying to get in a fight with him, I just want him to stop trying to convince people that global warming isn't an issue.","2015-08-12 14:06:38","4","dannimatrix","1747904490.7412522","climate alarmism","manual"
"cu0dn8g","t3_3gporh","3gporh","science","scientific","Isn't sea level-rise the least of our worries regarding climate change?
What happens when enough methane hydrates melt on the ocean floor and goes into the atmosphere?  Didn't the last time the Earth have large quantities of methane in the atmosphere, 95% of all life on Earth died? How soon do you think that'll happen, if at all?  I've heard an estimate of 30 years.","2015-08-12 14:22:08","5","zzupdown","1747904490.742167","climate alarmism","manual"
"cu0eo75","t3_3gporh","3gporh","science","scientific","How do you mentally cope with the worst case scenario you find probable? For me such a scenario would involve unrecoverable collapse leading to extinction. In this scenario humans aren't able to generate the collective intelligence needed to mitigate the major issues facing us. This leads to a state where technology can never develop to the point to mitigate extinction-level risks such as asteroid strikes or  nasty pandemics hitting the remaining population.

I cope with this by understanding that while we not be able to survive in the long-term, evolution is embodied in the Universe. The Universe *is* evolution in a sense, and this means that somewhere a species might have the collective intelligence to make it to the stars. In other words, we might be failures as a species, but that doesn't mean the Universe is a failure. Realizing this makes me feel better.","2015-08-12 14:50:28","4","Pfeffa","1747904490.743386","climate alarmism","manual"
