"id","parent_id","post_id","subreddit","tone","text","created_utc","score","author","scraped_utc","query_used","query_category"
"cu0xh76","t3_3grv9p","3grv9p","climate","scientific","I do think big. That's why I'm more on /r/collapse.","2015-08-12 22:31:27","13","rrohbeck","1747904325.6473222","climate alarmism","manual"
"cu109eo","t3_3grv9p","3grv9p","climate","scientific","I think that many activists are just part of the economy. They sell people an outlet for their indignation in the form of ""activism."" Since activism has a history of making change, people truly believe in the effectiveness of it. 

The problem with global warming is that it's caused by Capitalism. Capitalism is so entrenched into the global structure of power it seems almost impossible to change at this point. Can we really get 7 billion people to change how we produce and consume? Can we expect activism to champion the changes that are necessary to combat a problem on the global scale? I don't think so.

","2015-08-12 23:51:26","9","CrazyLegs88","1747904325.650641","climate alarmism","manual"
"cu11xcf","t3_3grv9p","3grv9p","climate","scientific","In my experience on campus, all the social justice groups band together and support one another. In fact pushing for actions to curb climate change is what got me initially involved with ""the left"" on my campus.","2015-08-13 00:40:50","7","DarkAvenger12","1747904325.652506","climate alarmism","manual"
"cu12xfy","t3_3grv9p","3grv9p","climate","scientific","I am involved with a lot of different aspects of climate politics and science, and I'm currently in the process of setting up a nonprofit that aims to do something similar to this. 

So the answer to your question (really) is twofold: 
1. Getting people to present a cohesive front is quite difficult. There's a reason that, even within the divisions of the major political parties, you get two candidates like Clinton and Sanders that could very well be different parties. 
2. People are already trying. But that kind of unity is only helpful when it also had direction and interdisciplinary support. 

For instance, after the publication of the most recent IPCC and NCA, everyone I know that was a contributing author/lead scientist was gathered to create a list of take-aways and essential points. They were then schooled on how to present these points and sent out to various radio stations, local news channels, etc. to spread the same message. This was of course very useful in terms of presenting a united front, but it made only a small impact given that they were essentially preaching to the choir or talking to the deaf, depending on which side their audience already affiliated themselves with. ","2015-08-13 01:11:00","4","[deleted]","1747904325.655998","climate alarmism","manual"
"cu1p72v","t3_3grv9p","3grv9p","climate","scientific","But cooperate to do what?

There is still no clear idea of what is the solution to the climate crisis.  Asking people, or even countries, to cut back on fossil fuel usage is a weak answer.  Because other people (or countries) will continue to burn fossil fuels.  All that conservation does is to make fossil fuel a bit cheaper for someone else.  See [Jevons paradox](https://en.wikipedia.org/wiki/Jevons_paradox).

How about **restricting the supply** instead?  Seek rigorous government action to restrict the amounts of fossil fuel extraction, reducing it each year.  Then let people and markets freely make creative decisions about how to adapt.

Anything that is extracted is burned.  The theory behind emission reductions is that reducing demand will result in less fossil fuel extraction.  But unexpected results can occur like shifting production to countries that are not limiting their emissions.","2015-08-13 16:09:54","3","limit2012","1747904325.658717","climate alarmism","manual"
"cu14u1i","t3_3grv9p","3grv9p","climate","scientific","Occupy was the beginning of these movements and organizations beginning to embrace the many commonalities of each other's cause, but that was marginalized and crushed by the system it was trying to change.","2015-08-13 02:07:55","2","DrTreeMan","1747904325.6599848","climate alarmism","manual"
"cu19hjt","t3_3grv9p","3grv9p","climate","scientific","Progressives are no more willing to give up their privileged lifestyles than anyone else. Just take a good look at how they live and see if it resembles sustainable. How about Naomi Klein jet setting all over the globe to shop her books and give speeches to other privileged high consuming white folks? Talking birth control and then having a kid? Look where the front money comes from for these organizations. 350.org? The Rockefeller foundation? WTF. These are gate keeper organizations whose purpose is to keep hope alive while nothing ever changes and to keep those in power right where they are.  Want to learn more? A Wrong Kind of Green is a good place to start.
...

The road to hell is paved with corporate profits and compromised NGOs

...


http://www.wrongkindofgreen.org/

....


Here's one that features Hollywood progressives preaching how YOU should live while exposing how they actually do.

....
The Endocene 

...

"" This brings us to the absurdly ignorant, painfully ironic campaign to save nature AND humanity, concocted by the group known as Conservation International which debuted at the beginning of the week.  M. Sanjayan, an executive vice president and senior scientist at CI, describes the project as an attempt to ""rebrand"" environmentalism to be less about preserving wildlife and more about preserving humans, by emphasizing that people are dependent upon nature.  Like the World Wildlife Fund, also founded by royalty and other elites, the leadership is so steeped in privilege that they have no clue at all what a bitter taste emanates from their efforts.""

....

http://witsendnj.blogspot.ca/2014/10/the-endocene.html","2015-08-13 04:42:25","0","[deleted]","1747904325.663221","climate alarmism","manual"
"cu1bjn4","t3_3grv9p","3grv9p","climate","scientific","Because the kind of changes that need to be made would radically change the lives of almost every person on the planet. Simply recycling and eating less meat isn't going to do a damn thing. Also the vast majority of progressives are Capitalist and that is the first thing that has to go.","2015-08-13 06:10:11","2","[deleted]","1747904325.664681","climate alarmism","manual"
"cu0wgpt","t3_3grv9p","3grv9p","climate","scientific","Because they've come to learn that aiming there gets nothing done. We don't believe. ","2015-08-12 22:03:51","0","acusticthoughts","1747904325.665814","climate alarmism","manual"
"cu0akuf","t3_3gporh","3gporh","science","scientific","I've looked at Tim Wise's paper [here](http://steadystate.org/wp-content/uploads/Jackson_2009_Beyond_the_Growth_Economy.pdf), about how much grams of CO2 per dollar of GDP produced has to decline, if we want to continue to grow our economy.

According to Wise's calculations linked to above, if we want to stop climate change, but also want 9 billion people by 2050 to have the standard of living the EU has in 2007, CO2 per dollar of GDP will have to decline from 768 in 2007, to just 14 grams per dollar by 2050.

That looks really difficult to me on first sight, so I have the following questions:

Is it really possible to reconcile the desire for economic growth with the desire to address climate change?

Should we look at a steady-state economy, that no longer grows, as a solution to climate change?

Why does the IPCC seem to assume in all its scenarios that the economy will keep growing?","2015-08-12 12:38:52","292","achjapuntdrie","1747904490.685822","climate alarmism","manual"
"cu09znh","t3_3gporh","3gporh","science","scientific","Thanks very much for answering a few questions here, Prof. Hansen and Prof. Hearty. EDIT: And Dr. Tselioudis and Dr. Kharecha!

As both a moderator here and somebody who frequently spends (perhaps ""wastes"") a lot of timing debating with climate change deniers online, it's clear to see that many of the online commenters are just the tip of a mass media effort to redefine climate change as a political argument in order to detract from the science and make the implications of climate change something to dismiss as socialist/liberal alarmism. Many popular mass media publications regularly ridicule the scientists and science of climate change, and anyone that accepts the science in general, all the while driving home the point that it's a political issue, not a scientific or even societal one. Then reaching further up the ladder, we see entire political parties express almost venomous hate toward anything climate science, while even the governments that claim to believe the science are still mostly allowing and often encouraging fossil fuel explorations.

The plan to *prevent* meaningful action on climate change does appear to have been an enormous success.

So, my main question is, what will it take to change this?

Protesting and writing letters to our representatives doesn't appear to have done enough so far. Often it seems that people are even more politically entrenched in their opposition to climate change actions nowadays than a decade ago. Almost every national and international scientific institution has declared that climate change is real and caused by human activities, thousands of scientific reports and papers are published every year, evidence is constantly accumulating to show that we are the cause and things are already becoming unstable, yet here we still are, applying all this work and effort only for our wheels to continue spinning in the mud.

What can we do?","2015-08-12 12:12:52","114","IceBean","1747904490.689168","climate alarmism","manual"
"cu0blq3","t3_3gporh","3gporh","science","scientific","Do you feel nuclear power is the best short-term option to cut greenhouse emissions? Also, what is your suggestion as to the extreme emissions output of unregulated international shipping running on bunker fuel?","2015-08-12 13:17:54","55","[deleted]","1747904490.690502","climate alarmism","manual"
"cu0au2a","t3_3gporh","3gporh","science","scientific","You have previously stated that one of the most effective ways for individuals to reduce their environmental impact is to reduce meat consumption or adopt a plant based diet. One of the constant debates within vegan and vegetarian communities is whether it is more beneficial to utilize small, sustainable, organic agriculture, or to embrace the efficiency large scale agriculture and GMOs in our fight against climate change. What do you believe is the ideal model for the future of human agriculture, and is one of these paths generally superior to the other, or is the best solution some combination of both practices?","2015-08-12 12:49:03","35","satosaison","1747904490.692393","climate alarmism","manual"
"cu0af0i","t3_3gporh","3gporh","science","scientific","Is there anything we can use to extract the carbon currently in the atmosphere? If so would it be viable as to have a positive  impact on the situation?","2015-08-12 12:32:03","32","danihendrix","1747904490.693283","climate alarmism","manual"
"cu0eet5","t3_3gporh","3gporh","science","scientific","This AMA is being permanently archived by *The Winnower*, a scholarly publishing platform that offers traditional scholarly publishing tools to traditional *and* non-traditional scholarly outputs—because scholarly communication doesn’t just happen in scholarly journals.

To cite this AMA please use: [https://doi.org/10.15200/winn.143939.90597](https://www.thewinnower.com/papers/1650-plos-science-wednesday-we-re-jim-hansen-a-professor-at-columbia-s-earth-institute-and-paul-hearty-a-professor-at-unc-wilmington-here-to-make-the-case-for-urgent-action-to-reduce-carbon-dioxide-emi)

You can learn more and start contributing at [*thewinnower.com*](https://www.thewinnower.com)
","2015-08-12 14:43:27","27","redditWinnower","1747904490.694644","climate alarmism","manual"
"cu0byh6","t3_3gporh","3gporh","science","scientific","Professors,

As a recent grad who studied environmental policies, I'm curious as to how each of you feel about the view that ""anything we do is too little, too late."" as I vividly remember seeing a similarly worded line as the foreword to one of my textbooks circa 2013. 

An additional example of what I am referring to is [this clip from the tv show The Newsroom](http://youtu.be/6CXRaTnKDXA) where they interview a high level EPA administrator. ","2015-08-12 13:30:14","23","mustbeyang","1747904490.695921","climate alarmism","manual"
"cu0bbz3","t3_3gporh","3gporh","science","scientific","Everyday Americans like me who would like to live car free have our hands tied. Urban apartments and houses are too expensive to rent so we live in the suburbs and drive everywhere. The streets and intersections in America are unsafe for bicycles while wealthy people drive Chevy Tahoes and F-350s carelessly all over town. Also landlords do not like gardens on rental property. Do you have any idea how we can restructure the USA so average people can live carfree and grow a lot of their own food without risking their lives on the road and handing over half of their income over to landlords?

","2015-08-12 13:08:03","23","saibernaut","1747904490.697448","climate alarmism","manual"
"cu0bsir","t3_3gporh","3gporh","science","scientific","What is the effect of meat consumption on CO2 emissions? Would eating less meat (as well as other animal products) significantly reduce CO2 emissions? To what extent would we need to reduce our meat consumption in order to see a significant improvement? Say if everyone in the US stops eating meat on 2 days a week, will the change be significant?","2015-08-12 13:24:38","22","mockturtlestory","1747904490.698671","climate alarmism","manual"
"cu0c3kd","t3_3gporh","3gporh","science","scientific","Do you have any comments on veganism, given how its the lifestyle with the lowest carbon footprint (that one can have without neglecting modern society of course)? ","2015-08-12 13:34:54","19","[deleted]","1747904490.699687","climate alarmism","manual"
"cu0a37q","t3_3gporh","3gporh","science","scientific","Thanks for doing an AMA. Just wondering who you think in terms of political candidates has the best and most comprehensive rhetoric on climate change? (Not trying to start a debate here, but clearly that is a factor if we don't want our future to be like the movie idiocracy).","2015-08-12 12:17:27","18","Mowyourdamnlawn","1747904490.7008672","climate alarmism","manual"
"cu0bbkn","t3_3gporh","3gporh","science","scientific","What's a way to reduce emissions that is:

1) big enough to make the necessary difference
2) controllable with regulations (individual consumer behavior is hard to regulate but perhaps industrial emissions are more easily targeted)
3) doesn't require everyone on earth to go vegetarian, live in the dark, and buy electric vehicles tomorrow

?","2015-08-12 13:07:40","16","scarabic","1747904490.702108","climate alarmism","manual"
"cu0buye","t3_3gporh","3gporh","science","scientific","Reading through a chemistry book's section on enthalpy, I noticed that the amount of energy it takes to melt 1kg of ice at 0°C is the same amount of energy it takes to raise 1 kg of water from 0°C to 80°C (if I'm understanding it correctly).  This implies that an enormous amount of surplus incoming energy is going into melting the ice caps, and once those are gone that is energy that will be going into rapidly heating the ocean waters (not to mention the loss of albedo).  Aside from the problems of the rising sea levels, won't we also see the temperatures skyrocket once the ice caps are gone?","2015-08-12 13:26:56","17","Despondent_in_WI","1747904490.7034082","climate alarmism","manual"
"cu0al1t","t3_3gporh","3gporh","science","scientific","Is there a sustainable level of CO2 emissions from fossil fuels (in other words: do we need to work on total indepence from fossil fuels)? If there is a sustainable level, what is that level and how much are current global CO2 emissions above that?","2015-08-12 12:39:07","13","TakaIta","1747904490.704494","climate alarmism","manual"
"cu0d4uq","t3_3gporh","3gporh","science","scientific","Your recent draft paper has been criticized by Trenberth as not adequately addressing the risk posed by the interaction between the Tropical Pacific / ENSO and ice sheet mass loss from West Antarctica.  Given that recent images from the Sentinel 1a satellite show both a major calving event for the Pine Island Ice Shelf and rapid degradation of the Thwaites Ice Shelf; both of which are most likely associated with the advection of warm circumpolar deep water beneath these ice shelves due to the current strong El Nino event; do you believe that you should revise your draft paper to address Trenberth's concerns?","2015-08-12 14:07:21","11","AbruptSLR","1747904490.705917","climate alarmism","manual"
"cu0do2v","t3_3gporh","3gporh","science","scientific","If I'm not interested in debating people, or politicizing my views, what is the most effective way I can impact climate change as a normal 9-5 guy trying to take care of his family?

edit: Thank you, btw, for doing this AMA. Climate change is something I'm very concerned about, but I don't know where to start on making a difference.","2015-08-12 14:22:48","11","slackwalker","1747904490.706989","climate alarmism","manual"
"cu0g7cx","t3_3gporh","3gporh","science","scientific","Thanks for taking your time guys. My question is for Jim. How did you find the time to become a scientist and still make all of those adorable little muppets?

Thank again!","2015-08-12 15:30:11","14","SkanksForTheMemories","1747904490.70802","climate alarmism","manual"
"cu0ahj0","t3_3gporh","3gporh","science","scientific","Do you think that we'll have to entertain the various geo-engineering ideas that have been proposed to avert some of the consequences of global warming?  How realistic do you think any of them are?","2015-08-12 12:35:03","10","supercheetah","1747904490.7090502","climate alarmism","manual"
"cu0br5b","t3_3gporh","3gporh","science","scientific","I've only had a chance to glance over your Atmos. Chem. & Phys. Discussions paper (I had not seen it before today); are you saying that the future over the next 200 or so years looks somewhat more like the Pleistocene than the Holocene?  If so, what does that mean for agricultural productivity in the future?  There's a view in archaeology that agriculture was not a successful strategy in the Pleistocene (see Richardson et al 2001 ""Was Agriculture Impossible during the Pleistocene but Mandatory during the Holocene? A Climate Change Hypothesis.""  American Antiquity 66:387-411).  

To what degree would climate variability over the next couple hundred years interfere with agriculture, and do you think that our agricultural technology (from fertilizer and irrigation to GM) will be able to cope with those changes?

Edit: Grammar","2015-08-12 13:23:20","11","hansn","1747904490.710631","climate alarmism","manual"
"cu0c1fk","t3_3gporh","3gporh","science","scientific","One of my father's friends is a climate scientist, specifically, climate changes over hundreds of thousands (millions?) of years. Somehow he convinced my dad that ""there is not enough data"" to show that we are not on a ""normal"" cycle. 

My question: how do I convince my dad that he needs to be aware about climate change?  It's his generation's fault anyway, least he could do would be admit fault! 

Follow up question: what specifically can I do to help the situation? There is a lot of mis-information regarding CO2 emissions and the impact you have. Should i give up gas cars? Protest cow farms? Fight to remove tanker ships from the ocean? Where is the best place to start action?! ","2015-08-12 13:32:56","11","bidwellpark","1747904490.7118342","climate alarmism","manual"
"cu0hoeb","t3_3gporh","3gporh","science","scientific","Hello Jim , I am interested in what your thoughts are regarding the idea of [basic income](http://www.reddit.com/r/basicincome) for all and more specifically , providing free VEGAN food for all people and how these two ideas could be used to slow down our consumption and what effect this would have on population. Because if the basic income is not vegan then we would be making the problem bigger , but if we can create a system that incentives a plant-based diet and begin growing food locally where possible and build permaculture systems and a massive reforestation campaign using the land that is now growing corn and soy to feed farmed animals etc, We can also create a job program whereby each community has vocational training to grow food for their communities and learn to prepare meals.

Also, I have noticed that you started much earlier than 1 PM and I made a post on r/vegan announcing your AMA here so if you would like to some day do a AMA on r/vegan you are welcome to do so and we would love to talk and help you as we have been educating ourselves of the effects Animal Agriculture is having on our environment and we now have 55,000 subscribers with so many people passionate and wanting to do more.

Here is the post on r/vegan

https://www.reddit.com/r/vegan/comments/3gppkx/jim_hansen_climatologist_is_doing_a_ama_on/

thank you!","2015-08-12 16:06:34","10","thetimeisnow","1747904490.713714","climate alarmism","manual"
"cu09qiy","t3_3gporh","3gporh","science","scientific","Science AMAs are posted early to give readers a chance to ask questions and vote on the questions of others before the AMA starts.
 

Guests of /r/science have volunteered to answer questions; please treat them with due respect. Comment rules will be strictly enforced, and uncivil or rude behavior will result in a loss of privileges in /r/science.


If you have scientific expertise, please verify this with our moderators by getting your account flaired with the appropriate title.  Instructions for obtaining flair are here: [reddit Science Flair Instructions](http://www.reddit.com/r/science/wiki/flair) (Flair is automatically synced with /r/EverythingScience as well.)
","2015-08-12 12:00:36","7","Doomhammer458","1747904490.7151842","climate alarmism","manual"
"cu0alnm","t3_3gporh","3gporh","science","scientific","How the hell do you intend to convince major manufacturing countries who are still looking for ways to be in the money during their critical industrial revolution stages to just simply stop and make things more expensive to manufacture? They care about maintaining solvency, not the polar bear (and I understand the consequences are far more dire...they still don't give a shit). 1st world consumers will not spend more than they already do. 

","2015-08-12 12:39:47","5","Irishguy317","1747904490.716358","climate alarmism","manual"
"cu0b0jt","t3_3gporh","3gporh","science","scientific","Hi there! I've been hearing a lot lately about animal agriculture and it's contributions of CO2, methane, and NO2. How do you feel our food system contributes to the problem, if at all? ","2015-08-12 12:56:08","7","ShrimpyPimpy","1747904490.717428","climate alarmism","manual"
"cu0b3io","t3_3gporh","3gporh","science","scientific","Hi Professors Hansen and Hearty. I am an Ontario graduate student working on biomass research utilizing crops such as willow, poplar, switchgrass, and miscanthus grown on marginal lands. I am wondering how big of a role you think bioenergy will play in reducing net GHG emissions in North America and worldwide? A lack of government policy friendly to the production and utilization of biofuels (I.e. carbon tax, payment for ecosystem services, polluter pays systems, etc.) is a major obstacle to all aspects of bioenergy here in Canada. Which misconceptions surrounding biofuels and bioenergy do you think are hindering public support the most?","2015-08-12 12:59:17","7","[deleted]","1747904490.71882","climate alarmism","manual"
"cu0dsl7","t3_3gporh","3gporh","science","scientific","Sorry if this comes off as rude, but do you get a lot of confusion about people mistaking you for Jim Henson, the muppet  master?

Serious question: What sort of outlook does the climate of Canada have? There's a lot of land in the north and a very small population. Do you see major farming moving more northerly?","2015-08-12 14:26:19","6","XSplain","1747904490.719866","climate alarmism","manual"
"cu0dyze","t3_3gporh","3gporh","science","scientific","What mechanism did the IPCC models fail to account for? Why did they underestimate sea level changes?","2015-08-12 14:31:15","7","ImOversimplifying","1747904490.720787","climate alarmism","manual"
"cu0eh4u","t3_3gporh","3gporh","science","scientific","Jim , Paul, It really seems as if you guys are shouting at a hurricane. Nothing is going to be done until it really is too late. So, for a young person like me, what do I do? I'm not asking how to call my senators, I'm asking where do I put my family? I'm not asking how to reduce my footprint, I'm asking how do I prepare for these mega storms? I'm not asking what bike to ride or model of Prius to drive, I'm asking what kind of beans and fuel is best to stock up on? In effect, we all know it's too late. So my question is, how do I live in a post-'point of no return' world? Thank you. ","2015-08-12 14:45:12","6","[deleted]","1747904490.721916","climate alarmism","manual"
"cu0fetb","t3_3gporh","3gporh","science","scientific","What are these ""highly undesirable"" consequences?  

What is the timeline we're looking at that if we don't act, the damage will be irreversible and make the earth potentially uninhabitable?  Or is this scenario even realistic?

Can any of this be realistically accomplished when we're breeding 120 million + people a year?","2015-08-12 15:09:59","7","pottyglot","1747904490.722795","climate alarmism","manual"
