"id","parent_id","post_id","subreddit","tone","text","created_utc","score","author","scraped_utc","query_used","query_category"
"emh84on","t3_bkfqga","bkfqga","collapse","skeptical","I'm glad to know or read of anyone who stands firm about not bringing another one into the almost 8 billion. That's all I can offer you.","2019-05-04 11:47:06","3","[deleted]","1747910824.1725373","CO2 is good","manual"
"emha2yd","t3_bkfqga","bkfqga","collapse","skeptical","My guess is that are more men who don't want kids than women. To most women its sort of an emotional crime against nature. 

I'm male, and I was perpetually rejected by women because I didn't want them. A master deal breaker if there ever was one.

I think your odds, as a woman, are better. Start out every new potential relationship by making no bones about your intentions. Accept the verdicts. Good luck.","2019-05-04 12:16:32","3","EmbarrassedPlate8","1747910824.1765673","CO2 is good","manual"
"emglgb8","t3_bkfqga","bkfqga","collapse","skeptical","Take a step back and think on it for a bit. A time of flux in your life can be a fantastic opportunity, or an easy way to make mistakes, so relax and consider your options. I know nothing about boats, sorry. Regarding your anxiety, eat well, sleep well, take a walk in the forest and examine what it is you really want out of life. The trouble is that nobody knows what you should do, that needs to come from within, so look after yourself and give yourself time, space and the mental energy to make some decisions......in the meantime research boats?","2019-05-04 03:09:57","2","happygloaming","1747910824.1799748","CO2 is good","manual"
"emgslt9","t3_bkfqga","bkfqga","collapse","skeptical","Have you met u/helios1234? Maybe hit it off.

https://old.reddit.com/r/collapse/comments/bk7k8g/why_i_am_a_misanthrope/","2019-05-04 05:15:49","2","[deleted]","1747910824.1849418","CO2 is good","manual"
"emh2rq5","t3_bkfqga","bkfqga","collapse","skeptical","Transitions like a change in jobs or the end of a relationship are most always difficult. Eating fresh and spending time outdoors can be positive for mental health. Please remember there is a caring community at r/CollapseSupport. Standing by your decision about offspring is the right thing to do.","2019-05-04 09:33:03","2","bosnian_spartan","1747910824.1879418","CO2 is good","manual"
"emgzzav","t3_bkfqga","bkfqga","collapse","skeptical","Check r/vagabond and the posts by CallMeTall. It may be useful to you.","2019-05-04 08:08:34","1","[deleted]","1747910824.1899421","CO2 is good","manual"
"emhqz3c","t3_bkfqga","bkfqga","collapse","skeptical","Are you me? I'm the same except the money part of which I have plenty but does not make me happy","2019-05-04 15:46:56","1","Jerryeleceng","1747910824.192454","CO2 is good","manual"
"emhrtmt","t3_bkfqga","bkfqga","collapse","skeptical","Relatives?","2019-05-04 15:56:01","1","[deleted]","1747910824.1979635","CO2 is good","manual"
"emijpe7","t3_bkfqga","bkfqga","collapse","skeptical","Go for a section hike and get your head together. If you want to be alone you can be alone and if you want company you will most likely be able to find company on the trail.","2019-05-04 20:56:09","1","alwaysZenryoku","1747910824.200429","CO2 is good","manual"
"emj5tai","t3_bkfqga","bkfqga","collapse","skeptical","I am going to work on a guide to how to survive all of this, if you choose to.

I'm a lot older than you, probably, but I can tell you right now that the FIRST thing you need is the mental fortitude/attitude that you're going to survive, NO MATTER WHAT, and that the ONLY person responsible for your own happiness while you're getting ready is:  you.

Regarding finding others of like minds:  I recommend [meetup.com](https://meetup.com).  Hiker groups, survivalists, homesteaders... anyone you can learn with and from.  Might meet a like mind.

Regarding reading materiel:  Have you ever heard of ""The Law of One?""  This is a psychological read, and is - in my opinion - something a Being needs to know before this all comes down.  


EDIT: I completely understand your desire to not have children, and respect that decision.","2019-05-05 01:32:52","1","SG_StrayKat","1747910824.204135","CO2 is good","manual"
"emmnmdo","t3_bkfqga","bkfqga","collapse","skeptical","Hey girl (woman), fuck it, take a break and chill for a moment. It's not end of the world (yet).","2019-05-06 08:10:31","1","Bubis20","1747910824.2071478","CO2 is good","manual"
"emnrp43","t3_bkfqga","bkfqga","collapse","skeptical","I say, do the sailboat thing.","2019-05-06 17:00:40","1","climate_throwaway234","1747910824.210413","CO2 is good","manual"
"emh2hke","t3_bkfqga","bkfqga","collapse","skeptical","For what it's worth, I never wanted a child but ended up getting one anyway, and I love her more than anything and I'm very happy to have her.

As for your various ideas of what you want to do with your life, I think the important thing is not whether you succeed, but that you try. Years from now you want to be able to look back and say that you did your best. Success is great, but even failure can feel liberating and be very educational, not even trying just builds anxiety. Start with small steps if you have to.","2019-05-04 09:24:25","-1","Volcanic-Penguin","1747910824.2157414","CO2 is good","manual"
"enyx488","t3_bpxvtp","bpxvtp","collapse","skeptical","I study environmental science, the lecturers all seem pretty down in the dumps about ecological collapse, and so do many of the students.

but they keep reiterating for us students to not give up and have hope that we can still do some goods and try to minimise the impacts of the world falling apart. This is true but to achieve this we need rapid, radical long term changes to the way humans live. And what makes it worse is that all of us know it’s not really possible deep down. The elite have successfully been able to distract and preoccupy the hearts and minds of the masses, with technology, drama and consumerism. Not to mention that the elite keep the masses on a very short leash via capitalism, not many people have the time or focus to take time off to protest, let alone think about climate change.  You could ask the average person on the street and they’re either clueless entirely aside from “the ice is melting” and “it’s getting hotter” . It genuinely wouldn’t surprise me if most people would just assume by 2050 that days will be hotter and the sea level will rise a bit. They won’t don’t know about the mass extinctions, or crop failures, drought, mass climate change migrations and refugees, lack of jobs and economy, most likely a long term global financial crisis, mass suicides and death and so on. Anyway rant over, the masses need to be educated, although I doubt many will care to listen or comprehend the significance of the next 30 or so years","2019-05-17 23:51:24","57","Godly_Shrek","1747910830.8044462","CO2 is good","manual"
"enyx9qe","t3_bpxvtp","bpxvtp","collapse","skeptical","I'm an engineer for a B2B company that works with pretty much every industry out there, we work with some customers that are doing some potentulially great stuff for a future society, but out biggest customers are still in the military, aero, and semiconductor industr (oil and gas not far behind), so despite any good our job does, it is still enabling all of that shit.

While it doesnt make me happy and it can be discouraging, I'm past caring as we are past the point of doing something, and that is extremely clear to me when I talk with engineers in all of those areas and it becomes very clear non of those balls are gonna stop rolling anytime soon.

On a small bright side a surprising number of my immediate colleagues are pretty accepting, if somewhat ignorant, of the upcoming collapse, so even though it is something I try to avoid mentioning at work, it has come up ocasionally to surprising results.","2019-05-17 23:53:15","23","bard91R","1747910830.807453","CO2 is good","manual"
"enyw38v","t3_bpxvtp","bpxvtp","collapse","skeptical","I have worked in tech jobs for many years, and I've also been collapse aware for about 15 years now starting with the ""peak oil"" meme when it was booming back in the day. I have also volunteered for various STEM education activities over the years, things like ""maker"" fairs and robotics competitions, and that's in addition to hanging out at maker spaces and computer labs just for fun.

Here is a recent example:

[Port Orford Chess Club Debuts Plywood Dinosaur](https://www.youtube.com/watch?v=lTGkN7J3o_s)

Anyway, I rarely talk about collapse or the climate crisis. I avoid politics and religion like the plague. When I do feel compelled to join a conversation I try to keep it simple. Don't get hung up in the weeds, in other words.

For example, whenever someone starts getting too excited about the potential of technology to solve all our problems at no apparent cost, I just smile and nod.

""Yes,"" I say ""there is a lot to be said for human ingenuity!""

This usually gets a smile or an enthusiastic nod.

""But,"" I intone in my best David Attenborough voice ""then there are the laws of thermodynamics...""

This almost always gets a glass-eyed stare or a shrug.

""And,"" I smile ""if I had to bet between the two...""

Pause for effect.

""I will take thermodynamics for the win. Every time!""

That usually shuts them up.","2019-05-17 23:39:29","19","[deleted]","1747910830.8104498","CO2 is good","manual"
"enyrmbr","t3_bpxvtp","bpxvtp","collapse","skeptical","I feel. Almost done with my bachelor's. Studying chem. Everyone says that sort of stuff to me as it is. It will only get worse as I move to my masters. 

I do find joy in confusing them by talking about what I am doing/learning though. So, I guess that helps.","2019-05-17 22:54:25","16","guywhoismttoowitty","1747910830.8139212","CO2 is good","manual"
"enyy853","t3_bpxvtp","bpxvtp","collapse","skeptical","Remember when fullerenes were going to save the world...lol...","2019-05-18 00:04:37","8","[deleted]","1747910830.8159206","CO2 is good","manual"
"enz3yg3","t3_bpxvtp","bpxvtp","collapse","skeptical","A little over a decade ago, I was doing research with the University of Pittsburgh, interning at the McGowan Institute of Regenerative Medicine, all while concurrently going to school to finish my degree.

&#x200B;

Things I witnessed but have never spoken about until now;  99% regeneration of limbs/organs in mammals using stem cells and other tricks, 99% regrowth of skin on burn victims (also using a stem-cell ""gun"" that looked like a paint sprayer), and a 1-shot cure for type 2 diabetes.  


All of that was 13ish years ago.  


And then(!), DARPA started flushing McGowan with monies... and I stopped interning around the same time due to a personality conflict with a Muslim researcher.  Nothing to do with his or my faith personally, but apparently catching one researching how to get a divorce is frowned upon, and of course he had seniority...  


[https://www.eurekalert.org/pub\_releases/2006-05/uopm-dgs050206.php](https://www.eurekalert.org/pub_releases/2006-05/uopm-dgs050206.php)","2019-05-18 01:03:54","6","SG_StrayKat","1747910830.8189206","CO2 is good","manual"
"eo0vxt0","t3_bpxvtp","bpxvtp","collapse","skeptical","I work in wildlife research and I’m starting to really hate it. So much of it is a waste of time and money. I’m currently working on a project study a game species (meaning an animal people like to hunt). This species is declining slightly so the state is spending millions of dollars, hired 40 people, 20 trucks, tons of electronics and we drive around for 12 hours every day. Why do we need to do this? We can easily guess what is causing the decline and just spend the resources solving problems like habitat degradation and whatnot. It’s so fucking stupid.","2019-05-18 13:19:23","8","ogretronz","1747910830.821925","CO2 is good","manual"
"eo0nt8e","t3_bpxvtp","bpxvtp","collapse","skeptical","I got out of research a while ago, mostly because it was boring and consisted of wasting too much time writing grants and papers that didn't really need to be written. The other big reason is how utterly dependent most research is on long and complicated supply lines. Without a constant stream of high quality consumables everything would grind to a halt, and it would only take one critical ingredient to be missing to derail everything. Throw in a climate of economic contraction (worse than is currently causing higher education and R&D to be starved back to bare bones) and it looks even worse. Academic research is a pernicious pyramid scheme anyway so most people are forced to realise it leads nowhere and get out before their investment is rewarded. 

The upside is that your ability to research the literature (viva sci-hub!) and do your own experiments is valuable in other aspects of life. I love plants so I am now running my own experimental farm. It is great not having to beg for funding 2/3 of my time or being forced to only do things that are either flavour of the month or possible to sell to a corporation. It also means I am setting my own small business up that should be able to actually take advantage of any upcoming collapse as people normally get more interested in growing their own food during economic downturns.","2019-05-18 11:31:52","8","[deleted]","1747910830.8259206","CO2 is good","manual"
"eo1c4a1","t3_bpxvtp","bpxvtp","collapse","skeptical"," Sucks to hear.  Maybe look for a real passion and shoot for it?  Painting maybe? You may or may not have the skills but you know with discipline, patience, good info, and imagination you could surprise yourself.  You will have the money to mine good teaching or sources of info, good supplies which can matter in this case, good paint, time, and I like classical music to listen to.  Expression can be a form of therapy, learning and achieving levels of understanding will build confidence as you understand Primary colors, Complimentary colors, Secondary, Tertiary, The Golden scale and it's reflection of the spiral within nature grand and small.  Confidence will allow you to express more and more of your imagination and emotion with clarity and some understanding from those you show it to.  It's relaxing and frustrating but that's life, you probably understand that.  Or not, just a suggestion. 

&#x200B;

P.S. If you paint naked listening to classical music too loud.  Lock the door so you don't creep out any potential visitors.   Trust me on this.","2019-05-18 16:14:36","6","CurryWIndaloo","1747910830.8299205","CO2 is good","manual"
"eo0yuje","t3_bpxvtp","bpxvtp","collapse","skeptical","I hear big developer guys talk about NYC development constantly and its honestly hilarious. Your $25 mill investment will be useless within your lifetime, now what?","2019-05-18 13:55:21","3","invenereveritas","1747910830.8329206","CO2 is good","manual"
"eo19pe2","t3_bpxvtp","bpxvtp","collapse","skeptical","I used to be in Computer Science, specializing in 3d simulations afterwards, worked in games, and burned out.  My colleagues saw tech as the answer to everything, but we were pretty divorced from the natural world as a whole.  I don't think there was much hopium of collapse, as collapse itself was pretty unknown, as we pretty much regarded the modern world as the norm.

Anyway, in my specific fields, we were pretty much so overworked to give any of that much thought.

>I work in drug R&D, finishing my doctorate soon.

I wonder, how much of that is to treat diseases other than chronic, aka diseases of western civilization spurred on by overconsumption (of calories and fat) which is what western doctors see most?  Those tend to be the biggest markets too.","2019-05-18 15:50:29","3","[deleted]","1747910830.8359241","CO2 is good","manual"
"eo1a95s","t3_bpxvtp","bpxvtp","collapse","skeptical","I am reminded of this video. The ability to grow at 3% should not be taken for granted.

>You take out a calculator and calculate. Growing at 3% per year-- a modest growth in energy-- how long before we become type three? In 100 years, we'll be type one. In a few thousand years, we'll be type two. In about 100,000 years, we'll be type three. And 100,000 years is nothing, nothing on a cosmic scale...  
>  
>[Michio Kaku: ""The Future of Humanity"" | Talks at Google](https://www.youtube.com/watch?v=eMxmDPDyQ7o&t=35m39s)","2019-05-18 15:55:59","3","DieSystem","1747910830.8389232","CO2 is good","manual"
"enzi4lu","t3_bpxvtp","bpxvtp","collapse","skeptical","People don’t seem to realize how little the energy that humans have as usable compared to the energy that is trapped on the earth by the effects of CO2 and the total of positive feedbacks from that. The change in energy in a year on earth due to the CO2 problem is greater than all energy used plus all the waste energy ever derived in the entire human experience, that includes food. You see we have this  star feeding the energy in and we have change the ability to discharge it by a very small fraction but that is still more energy than humans have ever had use of by a incredible magnitude.","2019-05-18 02:38:13","1","iamamiserablebastard","1747910830.8419218","CO2 is good","manual"
"eo04777","t3_bpxvtp","bpxvtp","collapse","skeptical","Soil ecologist here. People in my field know full well we can’t keep feeding everyone, with a lot of data to show this fact. It’s the shadow on us all the time. There’s also a lot of talk of sequestering carbon in soil to mitigate climate change, but anyone with a calculator and a map can find that it’d only slow things down maybe by a few years.","2019-05-18 04:25:48","1","[deleted]","1747910830.8539212","CO2 is good","manual"
"eo0973g","t3_bpxvtp","bpxvtp","collapse","skeptical","I work in software. I think that it's easy for people in this field to believe in fantasy because they live in man-made abstractions at all times. There is no familiarity with the texture of nature. Neither it's life-affirming flows nor it's transformation into toxic desert under our ministrations.

Babble is the correct term. There is very little ""mind"" behind such talk. They are running a subprocess installed by the surrounding culture. It continually prints to the screen ""from the caves to the stars."" They mean no harm. Something happened to them earlier in life that caused them to retreat from the world. The identity of ""technologist"" is a salve to that defeat, and the mindset requires little in the way of introspection.

Undisturbed, rarely awake, they live out their lives.","2019-05-18 05:31:46","1","[deleted]","1747910830.8589213","CO2 is good","manual"
"eo0zqct","t3_bpxvtp","bpxvtp","collapse","skeptical"," I'm sorry you're miserable, mate. I've been there too, but I've moved on to full-blown lunacy. I know it seems like a Gordian knot, I know the human condition is MADDENING, but that's just because the smartest ppl on the planet are pulling on the wrong thread. 

We need to look at the planet as a whole. Earth doesn't have too many antelope, or too many grizzly bears, or too many elephants - it has too many people - each of whom needs water, food and air - the same resources I myself require. Earth contains plenty of food, water and air - there's just too many ppl  here at the same time. It really is as simple as that. Scarcity is the real problem. It's the Reason we build all our machines in the first place.

You seem to be looking at the problem through your own livelihood - which is itself the problem. Your're concerned both with your own survival/success and that of the whole, and they are diametrically opposed. There's nothing we can do for ourselves, but if we weren't so concerned with ourselves we could potentially spare future generations by taking the appropriate action during our lifetimes. Will we? Doubtful since our attention has been so abused and misdirected our intelligence and potential are turned against each other when we could be creatively working together against a non-terrestrial threat. How cool would that be? Sadly, I'm not talking about aliens.  

We need to modify the global environment in a way that would allow all human organs to work they way they're supposed to - the way they were 'designed' to. One of them is currently malfunctioning - tweaked into a state of hyperactivity by a force we can barely comprehend, so we've taught ourselves to ignore it. We don't even have the words to effectively describe 'infection' or 'contamination' by an inorganic agent of particulate size - how could we be expected to understand one that's 2,000 miles wide?  

So what if we can't understand it? That doesn't mean we can't break it. Considering what's at stake here - we owe it to our descendants to at least try, but that's unlikely to happen because of the social structure - the segmented STEM structure which has made a mystery out of the obvious is largely responsible for that. The malleability of our self-reflection, giving rise to the ego, is responsible for the rest. The emotional response you're feeling is a manufactured one, and although it only works upon the ego, it's strong enough to support the moon.","2019-05-18 14:05:56","1","ReasonBear","1747910830.8819308","CO2 is good","manual"
"eo8e3jx","t3_bpxvtp","bpxvtp","collapse","skeptical","> how I am entering this field at 'the right time' because they think it will be booming for the next 50 years.

I thought everybody knew that drug pipelines were empty, and the industry as a whole was in crisis.

There's one counterexample, though: AstraZeneca had the problem, and threw a lot of resources at it for a few years, and are now doing quite well.

So there is still *some* future in drug R&D, though as a whole I expect the industry to shrink, as we're running out of wealth to pay for the R&D via enough markets.","2019-05-20 14:59:11","1","eleitl","1747910830.8859313","CO2 is good","manual"
"eo8f9ag","t3_bpxvtp","bpxvtp","collapse","skeptical","I work for a small cheminformatics shop that was until recently owned by a major scientific publisher (no, not the #1 evil one). Most of the staff are chemistry PhDs, or equivalent degrees.

These are older people, so they're not the bright-eyed bushy-tailed ones, though I'm probably the single realist in the whole 20-odd people shop. We just don't talk about such topics, so I have to infer their position from cues.

My experience is that it takes a particular kind (rare, weird) of person to be able to understand the whole problem set, and the process still typically takes years. Such types of people are very rare in practice, and it's pretty much impossible to transfer the whole set of knowledge within the course of a few conversations, even including excessive citation of sources.

So, I would just grit your teeth and try to ignore it. At some point you can explain the source of the cracks on the apparently pristine porcelain, if they bother to ask you. Or, not. Try to maintain your sanity, whatever it takes.","2019-05-20 15:12:14","1","eleitl","1747910830.89046","CO2 is good","manual"
