"id","parent_id","post_id","subreddit","tone","text","created_utc","score","author","scraped_utc","query_used","query_category"
"dmf7arh","t3_6xe6qq","6xe6qq","science","scientific","Thank you for your time and dedication. People like yourself have better our lives and humanity in general. 

Was wondering if there is any evidence of a bigger island that maybe Maori people have lived on before migrating to New Zealand? Something that could explain the homeland of Maori people? 

My apologies if the question is silly :) ","2017-09-01 12:51:39","1","ArmedProphet88","1747864630.5364573","sea level projections","manual"
"dmf7aw6","t3_6xe6qq","6xe6qq","science","scientific","This AMA is being permanently archived by *The Winnower*, a publishing platform that offers traditional scholarly publishing tools to traditional *and* non-traditional scholarly outputs—because scholarly communication doesn’t just happen in journals.

To cite this AMA please use: [https://doi.org/10.15200/winn.150427.70292](https://www.thewinnower.com/papers/7592-science-ama-series-hi-reddit-this-is-jerry-dickens-an-oceanographer-and-professor-at-rice-university-i-have-been-studying-mud-and-water-beneath-the-seafloor-for-over-25-years-to-understand-topics-such-as-the-migration-of-natural-gas-variations-in-sea-level-and-past-climate-change-ama)

You can learn more and start contributing at [*authorea.com*](https://authorea.com)
","2017-09-01 12:51:45","1","redditWinnower","1747864630.5383823","sea level projections","manual"
"dmf7e5o","t3_6xe6qq","6xe6qq","science","scientific","What is the weirdest or most interesting thing you've found?","2017-09-01 12:53:55","1","iEbutters","1747864630.539387","sea level projections","manual"
"dmf8i36","t3_6xe6qq","6xe6qq","science","scientific","Find evidence for a global flood?","2017-09-01 13:19:24","1","weswilliamson","1747864630.545387","sea level projections","manual"
"dmfckk6","t3_6xe6qq","6xe6qq","science","scientific","Is the natural gas that seeps into the ocean primarily methane? is it thermogenic? has the local wildlife adapted to it's presence. does it make it to the surface or degrade in the ocean?","2017-09-01 14:42:44","1","flies_kite","1747864630.546387","sea level projections","manual"
"dmfi4u4","t3_6xe6qq","6xe6qq","science","scientific","what is the best thing about being an oceanographer?","2017-09-01 16:24:32","1","terry10101001","1747864630.5473871","sea level projections","manual"
"dmfmqr7","t3_6xe6qq","6xe6qq","science","scientific","Is Zealandia considered as a continent at present by the UN? Along with the fascinating science associated with it, do you think there could be any societal significance in that regard (in terms of policy changes, accessibility to resources etc.) if there is a scientific consensus to consider it as a continent?","2017-09-01 17:47:52","1","methanologist","1747864630.5493867","sea level projections","manual"
"dmfot4n","t3_6xe6qq","6xe6qq","science","scientific","How do you obtain data from the cores? Do you send slices of cores to xray microscopy labs for tomographic imaging and spectroscopy? What are some of the hypotheses you are testing when you obtain fossil data?","2017-09-01 18:25:33","1","Uncle_Charnia","1747864630.5513866","sea level projections","manual"
"dmfqr83","t3_6xe6qq","6xe6qq","science","scientific","Thanks for taking time to answer questions.

How long did it take to get this expedition proposed, funded and scheduled?

How much support do you receive to participate in the expedition?","2017-09-01 19:01:12","1","Wrathchilde","1747864630.553387","sea level projections","manual"
"dmg3v1a","t3_6xe6qq","6xe6qq","science","scientific","Thanks for the reply! I hope your home in Houston is ok!!","2017-09-01 23:25:24","1","asbruckman","1747864630.5543866","sea level projections","manual"
"dmg4z3j","t3_6xe6qq","6xe6qq","science","scientific","Thanks for the questions and interest. Always fun to share.

To see where we are and follow Expedition 371 see:
<https://iodp.tamu.edu/scienceops/expeditions/tasman_frontier_subduction_climate.html>

Since yesterday, we have transited to a new site on the eastern edge of the Lord Howe Rise. We have just stopped the ship and placed in dynamic position mode. Should be getting material from an area never drilled before in about 8 hours -- always exiting to see the unknown appear. 

Till next time ... Jerry","2017-09-01 23:50:37","1","Jerry_Dickens","1747864630.5563908","sea level projections","manual"
"dmivon1","t3_6xe6qq","6xe6qq","science","scientific","Hi Jerry, sorry if I'm too late on this but I hope you can answer my question.

I've been looking into the Clathrate Gun Hypothesis and I noticed something. We used to have far warmer environments that didn't seem to set off the Clathrate gun, example being during the [Pliocene climate](https://en.wikipedia.org/wiki/Pliocene_climate) the Earth was 2-3 °C higher than today. Since we're on a path to surpassing the 2 °C mark, it's reasonable to assume that the Earth will be very similar to the way it was 5-2 mya. In that case, then shouldn't the Clathrate Gun Hypothesis be proven false since the conditions for which it would have occurred have existed before but didn't set it off?","2017-09-03 22:10:25","1","[deleted]","1747864630.5583906","sea level projections","manual"
