"id","parent_id","post_id","subreddit","tone","text","created_utc","score","author","scraped_utc","query_used","query_category"
"dnaaek1","t3_71dykj","71dykj","climate","scientific","These two have some of that:

http://regclim.coas.oregonstate.edu/visualization/gccv/cmip5-global-climate-change-viewer/index.html

http://sdwebx.worldbank.org/climateportal/index.cfm?page=country_future_climate&ThisRegion=North%20America&ThisCcode=USA

I've never seen super-local ones. You can get limited areas (e.g., continental US) down to fractions of a degree lat/lon, but that's about it.","2017-09-20 23:47:50","2","hammertime84","1747864439.8129559","sea level projections","manual"
"dnaadgs","t3_71dykj","71dykj","climate","scientific","I'm not educated enough about this to be able to offer you any information. However, I would like to wish you the best as I am highly interested such a climate model, possibly to put on my site LifesVitalSigns.com , or at least link outbound to wherever you may put it.","2017-09-20 23:47:12","1","LifesVitalSigns","1747864439.8129559","sea level projections","manual"
"dno675v","t3_737klj","737klj","science","scientific","Is there a particular food type (e.g. beef, fish, etc) that has proven to be more complicated to accurately create, or that you all think may be more difficult to create? If so, is there any particular reason for this?","2017-09-29 13:04:50","757","DnDYetti","1747864558.6791697","sea level projections","manual"
"dno6c12","t3_737klj","737klj","science","scientific","What are the biggest limits to making cellular agriculture affordable?","2017-09-29 13:08:08","709","Eunile","1747864558.6791697","sea level projections","manual"
"dno6dpd","t3_737klj","737klj","science","scientific","My burning question is when will this be available commercially, if you had to give a rough estimate?","2017-09-29 13:09:15","659","gardenfey","1747864558.6791697","sea level projections","manual"
"dno6epm","t3_737klj","737klj","science","scientific","As a huge meat lover, I am excitingly looking forward to artificially grown meat to hit the market.  
  
1. What would you say are the greatest challenges in creating a product that tastes close to the real thing? I've heard things about the texture being wrong due to the fact that grown tissue is not the same as the animal that gets some exercise.  
2. How scalable are current methods of meat growth? Is it something that can be done on industrial scale?","2017-09-29 13:09:55","515","Tanagashi","1747864558.6791697","sea level projections","manual"
"dno6cj1","t3_737klj","737klj","science","scientific","What is likely to be the first type (white fish, dark fish, red meat, poultry, etc) of synthetic meat to be indistinguishable from animal meat? Are there any specific meat types that have specific challenges unlikely to be overcome soon?","2017-09-29 13:08:28","425","taushet","1747864558.6791697","sea level projections","manual"
"dno6cvp","t3_737klj","737klj","science","scientific","Hello, I'm curious about the size of the individual samples of meat/fish grown. Will the labs of the future grow a portion-sized chunk of meat/fish, or will it grow a huge slab of meat/fish and chop it up into portion sizes once it's grown?","2017-09-29 13:08:42","259","Captchca_ca_KA","1747864558.694815","sea level projections","manual"
"dno6bt3","t3_737klj","737klj","science","scientific","What are some of the ""ethical"" backlashes you've seen from people who say it's ""not natural""? ","2017-09-29 13:08:00","225","mabillin","1747864558.694815","sea level projections","manual"
"dno7vik","t3_737klj","737klj","science","scientific","Does cell ag have applications beyond food products? I.e. could you grow a functional human liver/hear/lung for transplant?

That also makes me wonder...could you grow human muscle tissue, and if so would eating it be cannibalism?","2017-09-29 13:43:01","228","petertmcqueeny","1747864558.694815","sea level projections","manual"
"dno6a8m","t3_737klj","737klj","science","scientific","I'm going to assume that nutritionally it is nearbouts identical to the animal. How does it compare in taste? ","2017-09-29 13:06:56","219","MeatBallsdeep","1747864558.694815","sea level projections","manual"
"dno6r3u","t3_737klj","737klj","science","scientific","How do you keep it from being just another unhealthy processed food once it's in the hands of corporations?","2017-09-29 13:17:58","157","Sirgeeeo","1747864558.694815","sea level projections","manual"
"dno6gi7","t3_737klj","737klj","science","scientific","Best guess: How long do you think it will take before lab grown food is the norm, and makes up the majority of animal protein that we buy at the supermarket?","2017-09-29 13:11:06","117","SwampWTFox","1747864558.694815","sea level projections","manual"
"dno6xoy","t3_737klj","737klj","science","scientific","Many cuts of meat are useful for making specific dishes - such as ribs, or how different areas of the cow have different fat content and marbling. Do specific cuts of meat have a place in the future of cellular agriculture, or just lump meats?","2017-09-29 13:22:13","99","SeaMenOnTheRocks","1747864558.694815","sea level projections","manual"
"dno5mcz","t3_737klj","737klj","science","scientific","Science AMAs are posted early to give readers a chance to ask questions and vote on the questions of others before the AMA starts.
 

Guests of /r/science have volunteered to answer questions; please treat them with due respect. Comment rules will be strictly enforced, and uncivil or rude behavior will result in a loss of privileges in /r/science.


If you have scientific expertise, please verify this with our moderators by getting your account flaired with the appropriate title.  Instructions for obtaining flair are here: [reddit Science Flair Instructions](http://www.reddit.com/r/science/wiki/flair) (Flair is automatically synced with /r/EverythingScience as well.)
","2017-09-29 12:50:23","1","Doomhammer458","1747864558.694815","sea level projections","manual"
"dno7871","t3_737klj","737klj","science","scientific","As an adult, I have developed several serious food allergies. We know now that it’s not only the protein in foods that can cause allergic reactions but researchers aren’t sure exactly what the trigger is for some people. Do you have any worries that these technologies can cause more allergies for people? Or is there hope that they could help decrease the incidences of reactions? ","2017-09-29 13:28:48","74","kombatk","1747864558.694815","sea level projections","manual"
"dno62tv","t3_737klj","737klj","science","scientific","I absolutely believe this is the future and that we are in the very beginning stages of this. So tell me.. where should I invest my money?","2017-09-29 13:01:53","55","Hmluker","1747864558.694815","sea level projections","manual"
"dno7kmx","t3_737klj","737klj","science","scientific","Is all meat grown in the ""likeness"" of existing animal meats? Has there been considerations towards growing a whole new, ""original"", meat product; superior in taste, smell, etc - or are there dangers involved with that? ","2017-09-29 13:36:25","54","HungryEdward","1747864558.7104385","sea level projections","manual"
"dno6e0c","t3_737klj","737klj","science","scientific","Is there anyone working on growing meat in micro gravity for space travel? How far away do you all think we are from seeing lab meat in a grocery store and/or leather made in the lab?","2017-09-29 13:09:28","42","hungryhippo2013","1747864558.7104385","sea level projections","manual"
"dno6lj3","t3_737klj","737klj","science","scientific","Should this truly be the future of how we get our food, how do you think this will impact the animal populations?  What then becomes the purpose of cow and chickens?

Second question.  How long before people start messing with the cellular properties of the products and start creating cheef(that's what I imagine a chicken/beef hybrid would be called) or maybe blueberry bacon, or saltless bacon, or lean protein that resembles/tastes like prime rib.  ","2017-09-29 13:14:23","40","Variant_Zero","1747864558.7104385","sea level projections","manual"
"dno703n","t3_737klj","737klj","science","scientific","First of all, I'd like to thank you for doing this work, as both a meat lover and an animal lover who is transitioning to vegetarian. I am grateful that someday I will be able to actually eat meat again.
As for my question, do you think it will be possible to someday emulate the structure of the meat as well as the cells? iirc, so far artificially grown beef has only been shown in ground beef because you can only recreate the cells, not the structure, correct me if I'm wrong. Will I someday be able to eat an artificially grown skirt steak instead of just meatballs?","2017-09-29 13:23:45","39","roqueofspades","1747864558.7104385","sea level projections","manual"
"dno6g6m","t3_737klj","737klj","science","scientific","Can you grow lab meat without hurting animals? I know that fewer animals would get killed, but can it get done without keeping animals in perpetuity?","2017-09-29 13:10:53","40","worfox2","1747864558.7104385","sea level projections","manual"
"dno7b1x","t3_737klj","737klj","science","scientific","I'm curious about the energy usage....how much electricity per kilogram of synthetic product is required?  How many kilowatt-hours of power, for instance, would be required to sustain a moonbase population of 100 people for a year?

Brilliant and disconcerting concept?","2017-09-29 13:30:36","37","el_dave00","1747864558.7104385","sea level projections","manual"
"dno6dhd","t3_737klj","737klj","science","scientific","Hi and thanks for joining us! 

When can I expect a customized transplant pig heart or liver?

Where are we in terms of bio-fuel from cell ag?","2017-09-29 13:09:06","30","PHealthy","1747864558.7104385","sea level projections","manual"
"dno736m","t3_737klj","737klj","science","scientific","Can you grow the next batch from donations of the last?

Or will you require some livestock to server as donors, and if so what samples are harvested from them?

","2017-09-29 13:25:39","33","Reoh","1747864558.7104385","sea level projections","manual"
"dno769r","t3_737klj","737klj","science","scientific","Next to animal cruelty etc, one of the biggest problems that I know of with the animal industry is its inefficiency. Don't pin me down on the exact numbers, but I believe that in order to produce 1 kilogram of beef you need north of 20 kilogram of organic matter. These ratios are different for chicken, fish and dairy products, but all these products are very inefficient.

Instead of producing beef, it would be much more efficient to produce 20 kg of organic matter suitable for humans to eat instead (i.e. vegetables etc).

Would cellular agriculture be (much) more efficient, if these processes are developed into industrial scale? 

Can we, the population of the entire Earth, feed everybody without widespread veganism?
","2017-09-29 13:27:34","32","Reinoud-","1747864558.7260625","sea level projections","manual"
"dno7k7c","t3_737klj","737klj","science","scientific","How much interest have big fast food operations shown in this endeavour? Have any of them provided funds to support lab-grown meat? Basically, when can I expect McD's to start selling lab-grown beef patties?","2017-09-29 13:36:09","31","ChangingHats","1747864558.7260625","sea level projections","manual"
"dno7qvl","t3_737klj","737klj","science","scientific","What are the health risks compared to real meat and milk?","2017-09-29 13:40:12","33","KingTutenkhamen","1747864558.7260625","sea level projections","manual"
"dno9u2i","t3_737klj","737klj","science","scientific","I'm curious to hear your thoughts about the ""clean meat"" approach versus the ""meatless meat"" approach (such as the [""Impossible Burger""](https://www.cloverfoodlab.com/2017/09/21/introducing-impossible-burger/), which my roommate recently tried and said tasted more like a burger than most actual burgers). My impression is that vegetable-based products will always be cheaper and require less water / energy than meat-based products. Thoughts?","2017-09-29 14:23:22","30","[deleted]","1747864558.7260625","sea level projections","manual"
"dno81vr","t3_737klj","737klj","science","scientific","The good thing about animals is that they convert grass or grain into meat. What do you grow your meat on? Do you think growing meat could become more efficient than the current farms and slaughterhouses?

edit: Can you make dinosaurs?","2017-09-29 13:46:46","20","EscobarMendez","1747864558.7260625","sea level projections","manual"
"dno7sym","t3_737klj","737klj","science","scientific","Since nobody else is asking the obvious:

Can you please give dates for when ""clean meat"" will be CHEAPER than the cheapest farmed meat for each type (beef, pork, chicken, turkey, salmon, tuna, shrimp, etc, etc.).

Unless it's actually *cheaper*, it will remain a niche market competing with Boca burgers for a relative handful of vegan dollars.","2017-09-29 13:41:27","18","[deleted]","1747864558.7260625","sea level projections","manual"
"dno990z","t3_737klj","737klj","science","scientific","This may be a dumb question, feel free to ignore:  

First, emulating meat products as a way to wean society off of the unhealthy, cruel and environmentally catastrophic real thing will be a fantastic accomplishment, like you people are literally saving the world and everyone on it!

Here's my dumb question:  Are you guys also inventing new foods, not an emulation of anything, just some great new thing(s) with a unique taste, texture and properties of their own?

I guess I'm asking because as a vegan who has come to find eating fake meat to be... weird, I'm really interested in trying other foods besides all the vegetables (which I love!) and the fake meats and fake cheeses, etc.  Just that it would be cool to have NEW NEW things to try.

Hope that made sense, thanks for the work you're doing, and thanks for doing this AMA!","2017-09-29 14:11:45","19","thistangleofthorns","1747864558.7260625","sea level projections","manual"
"dno6h9n","t3_737klj","737klj","science","scientific","If I understand the process correctly, cells are transfected so that they produce the protein of interest. How is the protein collected so that the culture medium is not retained?","2017-09-29 13:11:34","19","shadywhere","1747864558.7260625","sea level projections","manual"
"dno7o2s","t3_737klj","737klj","science","scientific","I have a health question. Since the meat is grown can you control the trans-fat content in the product? Is it possible to enrich the meat with vitamins for example b12? Second part of the question. what are your ressources? Is the meat free of agricultural chemicals like fungicides? Are there hormones involved in the process and therefore in the finished product? Edit: To sum it up is your meat healthier than regular meat.","2017-09-29 13:38:30","17","Headbangert","1747864558.7260625","sea level projections","manual"
"dno7t22","t3_737klj","737klj","science","scientific","I do not know much about lab grown meat but I find the idea very interesting as I'm a chef by trade. My question is, will we have the ability to grow specific cuts like brisket and beef ribs or will it just be more of a ground beef product? If so will they be able to get to the point of being marbled like a cut of wagyu and if so  do you see it increasing the overall quality of beef available?","2017-09-29 13:41:30","17","abgonzo7588","1747864558.7260625","sea level projections","manual"
"dno72je","t3_737klj","737klj","science","scientific","Hi guys and gals! Thanks for answering our questions today. In your field, what inspires you? What technical or social changes are you afraid of?","2017-09-29 13:25:15","14","Serious_Senator","1747864558.7416878","sea level projections","manual"
"dno7dp5","t3_737klj","737klj","science","scientific","Hi there. I'm going to ask you a holistic question on the field as a whole, since you suggested it. 

What is the intended use case for cellular agriculture? What is your ultimate objective and how do you think it would work in the society? 

Western societies eat more meat than ever in history and it's so cheap it doesn't even make sense. Also, many people, including me, are moving away from processed food and paying a premium price to eat locally grown food from responsible farms (even if I don't buy ""full"" organic, as I think it's unscientific). How would cellular agriculture products fit into this consumer preferences shift?

For background, in europe you can get ground **beef** for prices lower than 5€/kg!!!! Such a low price doesn't even make sense. From a policy perspective it would make sense to try to make meat production more difficult, so that prices could rise back to levels when families ate beef once a week. 
I'm poor, I decided to buy exclusively unprocessed locally produced food. And I still can afford much more food and meat than it would be healthy!!

","2017-09-29 13:32:11","14","lucaxx85","1747864558.7416878","sea level projections","manual"
"dno9laq","t3_737klj","737klj","science","scientific","I am interested in sustainable agriculture.  Traditional farming uses more water and land than any other industry, and has had a huge impact on natural ecosystems globally.  Can cellular agriculture use significantly less resources to provide a similar product?","2017-09-29 14:18:35","14","insomniaddict91","1747864558.7416878","sea level projections","manual"
"dno8gto","t3_737klj","737klj","science","scientific","For something that is just being developed, how can we know for sure lab grown meat is safe to consume? Just like with cigarettes when they first hit the market nobody knew what they were smoking was literally killing them, until decades later. How can we be sure that 10 or 20 years down the line lab grown meat, wont have the same negative connotation that cigarettes do now?","2017-09-29 13:55:39","13","bwylie7215","1747864558.7416878","sea level projections","manual"
"dno8kot","t3_737klj","737klj","science","scientific","Protein is uninteresting without fat.  Fat provides a great deal of flavor and mouth feel.  What are the prospects of ""growing"" fat alongside protein for a fuller, richer experience?","2017-09-29 13:57:53","12","Montgomery0","1747864558.7416878","sea level projections","manual"
"dno7ui5","t3_737klj","737klj","science","scientific","What measures would your organization take, to prevent cultured cells production from becoming monopoly ","2017-09-29 13:42:24","11","maniana123","1747864558.7416878","sea level projections","manual"
"dno66yb","t3_737klj","737klj","science","scientific","How much progress has been made into making this stuff taste the same?","2017-09-29 13:04:44","13","goooseJuice","1747864558.7416878","sea level projections","manual"
"dno6xo1","t3_737klj","737klj","science","scientific","What is the current price per pound of non-animal protein ""meat""?  What price point does it need to break to become competitive with animal protein? ","2017-09-29 13:22:12","10","deadflamingos","1747864558.7416878","sea level projections","manual"
"dnol3pi","t3_737klj","737klj","science","scientific","From what I understand, cell culture requires the use of FBS which makes it not animal-free. While there are substitutes out there that claim to be animal free, they are not as efficient or unsuitable for the intricate and sensitive process that is growing mammalian cells in vitro. How then are you going to overcome this and yet be able to produce lab grown meat efficiently at an economically viable scale?

In other words, as a researcher who does cell culture everyday as a career, I am not convinced that lab grown meat can truly be animal free. Can you convince me otherwise?","2017-09-29 17:43:31","10","veryfascinating","1747864558.7573128","sea level projections","manual"
"dnoc5h4","t3_737klj","737klj","science","scientific","Those are some impressive bios, congratulations to all of you on your successes.

“Milk without cows” as someone who is lactose intolerant these words are music to my ears. How can this help people like me with food/dairy allergies? Will it be lactose free, or I’m curious what kind of options will be available. Almond milk is a fine substitute but it’s not cows milk which I sometimes crave.","2017-09-29 15:06:12","9","TBones0072","1747864558.7573128","sea level projections","manual"
"dno9zvx","t3_737klj","737klj","science","scientific","Hi! Thank you for doing this. I have 2 questions.

From my understanding, current lab grown meat and bioreactor set ups require the use of calf fetal serum. What is the progress getting away from this as a requirement? I suspect the industrial production of sufficient calf serum will pose its own ethical issues.

Secondly, how much carry over is there between the advancing technology behind lab grown meat and the growth of artificial or new human organs?

","2017-09-29 14:26:25","8","Bo_Buoy_Bandito_Bu","1747864558.7573128","sea level projections","manual"
"dno6uq9","t3_737klj","737klj","science","scientific","Were any of you at all inspired to enter the field of cellular agriculture by science fiction, such as Chicken Little in Pohl and Kornbluth's *The Space Merchants*?","2017-09-29 13:20:17","7","drsjsmith","1747864558.7573128","sea level projections","manual"
"dno8dro","t3_737klj","737klj","science","scientific","Y'all should probably answer a few questions","2017-09-29 13:53:51","8","[deleted]","1747864558.7573128","sea level projections","manual"
"dno8fe5","t3_737klj","737klj","science","scientific","Hi, I work as a research assistant in a precision medicine lab, primarily doing stem cell culture. Obviously this work is quite different from what you're doing, but stem cell work and a lot of tissue and cell culture work requires adding a number of antibiotics, hormones, growth factors, cytokines, etc. directly to cell media to promote the growth of the correct cell/tissue type and to prevent infection. A lot of people currently take issue with the use of hormones and antibiotics in commercial meat and dairy - do you think it would be possible to circumvent this problem when creating meat in a dish, or is it unavoidable? Are there certain components of cell media that you are looking to avoid or replace to commercialize these meats? Though I'm sure it's a pretty small amount, I would be particularly concerned because the small molecules, hormones, etc. and all are being added directly to tissue in this case, rather than going through the first-pass metabolism in a live animal. I am also curious if you think there is any potential for using stem cell technologies to creat certain types of tissue/meat? 

Thanks, and best of luck with all future endeavors! Your work sounds really cool and impactful! ","2017-09-29 13:54:48","8","RetroOwl","1747864558.7573128","sea level projections","manual"
"dmf746v","t3_6xe6qq","6xe6qq","science","scientific","Hi and thanks for joining us today! 

I've always wondered if there is any concern of exotic pathogens contained within core samples among oceanographers?","2017-09-01 12:47:06","9","PHealthy","1747864630.520572","sea level projections","manual"
"dmf81wo","t3_6xe6qq","6xe6qq","science","scientific","Hi Jerry,

Is Zealandia expected to one day rise to the surface world, or will it continue to sink as time goes by?","2017-09-01 13:09:25","5","[deleted]","1747864630.522452","sea level projections","manual"
"dmf72ky","t3_6xe6qq","6xe6qq","science","scientific","What made you interested in this career?","2017-09-01 12:45:54","3","adolfus293","1747864630.5244575","sea level projections","manual"
"dmf95vf","t3_6xe6qq","6xe6qq","science","scientific","Why haven't we developed something to use waves for energy yet? The waves never stop coming in and with all that residual motion something should have been developed to harness that energy by now.","2017-09-01 13:34:06","3","Endless_Vanity","1747864630.526457","sea level projections","manual"
"dmfbykk","t3_6xe6qq","6xe6qq","science","scientific","What do paleoclimate records you've studied tell us that might inform our ideas about what's to come? ","2017-09-01 14:31:04","2","Splenda","1747864630.5284572","sea level projections","manual"
"dmfcmdr","t3_6xe6qq","6xe6qq","science","scientific","Thanks for coming to talk with us! I'm curious about what it's like to be away from home for so long. How often are you out of communications range, and how do you adjust your personal and work life? What do people on the ship do for fun and relaxation?","2017-09-01 14:43:41","2","asbruckman","1747864630.530457","sea level projections","manual"
"dmfhavn","t3_6xe6qq","6xe6qq","science","scientific","Hey i've got two questions for you:

1. What kind of challenges do/have you face/d working with an international team that you wouldn't necessarily with a less diverse crew?

2. What's your opinion of ghosts?","2017-09-01 16:09:17","2","tenorelevencoins","1747864630.5314572","sea level projections","manual"
"dmf6d92","t3_6xe6qq","6xe6qq","science","scientific","Science AMAs are posted early to give readers a chance to ask questions and vote on the questions of others before the AMA starts.
 

Guests of /r/science have volunteered to answer questions; please treat them with due respect. Comment rules will be strictly enforced, and uncivil or rude behavior will result in a loss of privileges in /r/science.


If you have scientific expertise, please verify this with our moderators by getting your account flaired with the appropriate title.  Instructions for obtaining flair are here: [reddit Science Flair Instructions](http://www.reddit.com/r/science/wiki/flair) (Flair is automatically synced with /r/EverythingScience as well.)
","2017-09-01 12:27:16","1","Doomhammer458","1747864630.5344572","sea level projections","manual"
