"id","parent_id","post_id","subreddit","tone","text","created_utc","score","author","scraped_utc","query_used","query_category"
"e3z0fum","t3_963tmw","963tmw","environment","emotional","I don't think they thought twice about people with disabilities but more on bottom line profits. 

Metal or glass straws are not viable (great way to hurt yourself).  There is washable heavy duty staws, but really do I want to drink from a reusable straw provided in a restaurant?

I like being social and joining friends, but it is much better when I had a cold drink that I used a tight lid and a stray.   A friend joked ""you need a sippy cup like my...   ""   She caught herself and looked very embarrassed. 

This oped  summed it up nicely:
https://www.huffingtonpost.com/entry/opinion-powell-straw-ban_us_5b1e76ade4b0bbb7a0df9303




","2018-08-10 20:41:35","1","ParkieDude","1747882690.5076191","zero waste","manual"
