"id","parent_id","post_id","subreddit","tone","text","created_utc","score","author","scraped_utc","query_used","query_category"
"cy3bv0z","t3_3xc5tg","3xc5tg","science","scientific","Hi Prof. Moomaw, thanks for doing this ama. I'm also glad we have people like yourself who dedicate their professional careers to areas that are so important to us all. I have two questions that I'd love to know more about.

1. In your opinion, are the results from the recent Paris talks a promising road to reduction in climate change or is it a backside-covering exercise by governments with no intention to of complying... or I guess is it both, depending on the government?
2. The IPCC has fairly consistently called for the need for nuclear power to reduce carbon emissions. Do you think the IPCC and climate scientists are being realistic here given the political opposition to nuclear power all over the world and the very conservative approach of the nuclear industry from a regulatory and technological perspective? I.e., can the world do what the IPCC is calling for?","2015-12-18 12:44:41","26","biledemon85","1747605862.956928","climate science","scientific"
"cy3bu6v","t3_3xc5tg","3xc5tg","science","scientific","What are some of the biggest misconceptions about climate change that even environmentalists don't realize?","2015-12-18 12:43:26","22","black_fire","1747605862.9604092","climate science","scientific"
"cy3bugd","t3_3xc5tg","3xc5tg","science","scientific","Hi, Dr. Moomaw! Thank you for doing this AMA. 

What's the biggest omission in the Paris negotiations, in your opinion? 

Also, what's something that every individual should be doing/not doing to make the biggest difference in slowing climate change?","2015-12-18 12:43:50","17","weezerluva369","1747605862.962911","climate science","scientific"
"cy3bu1u","t3_3xc5tg","3xc5tg","science","scientific","Mr. Moomaw,

From a humble world citizen's perspective, what efforts aside from reducing our own impact on the environment can we undertake to help aid the cause of spreading/raising awareness about climate change and it's consequences?

What would you say is the most effective thing or things we can do to help if you could only pick a couple?","2015-12-18 12:43:13","14","fall3nang3l","1747605862.964979","climate science","scientific"
"cy3c8cj","t3_3xc5tg","3xc5tg","science","scientific","Hi Dr Moomaw, thanks for doing this and for all the work you do. I'm curious about the personal side of being a leading climate change scientist. Have you ever felt harassed or threatened because of your work on climate change?","2015-12-18 13:04:09","11","anonzilla","1747605862.966718","climate science","scientific"
"cy3bftg","t3_3xc5tg","3xc5tg","science","scientific","Science AMAs are posted early to give readers a chance to ask questions and vote on the questions of others before the AMA starts.
 

Guests of /r/science have volunteered to answer questions; please treat them with due respect. Comment rules will be strictly enforced, and uncivil or rude behavior will result in a loss of privileges in /r/science.


If you have scientific expertise, please verify this with our moderators by getting your account flaired with the appropriate title.  Instructions for obtaining flair are here: [reddit Science Flair Instructions](http://www.reddit.com/r/science/wiki/flair) (Flair is automatically synced with /r/EverythingScience as well.)
","2015-12-18 12:21:24","1","Doomhammer458","1747605862.969619","climate science","scientific"
"cy3cfif","t3_3xc5tg","3xc5tg","science","scientific","Hi Bill. Thank you for doing this.

Here's the question.

Regarding ocean levels, are we just delaying the inevitable?","2015-12-18 13:13:38","9","[deleted]","1747605862.971043","climate science","scientific"
"cy3fgf5","t3_3xc5tg","3xc5tg","science","scientific","Hello Dr. Moomaw. Thank you for doing this AMA. I have recently watched the documentary [Cowspiracy](http://www.cowspiracy.com/) in which it is argued that animal husbandry (animal agriculture) is the primary drive/cause of climate change (relating to cycles of impacts from deforestation to ocean dead zones) yet no environmental organization really addresses this issue. What is your take on it and how do you see this addressed at an international level in the context of climate change? Thanks!","2015-12-18 15:03:47","8","mistabeo","1747605862.972621","climate science","scientific"
"cy3cqrm","t3_3xc5tg","3xc5tg","science","scientific","Hello Dr. Moomaw. Thanks for the AMA. I've read many of your pubs, but most recently your quantification of intensity for water consumption in energy production (with Spang et al.) Not surprising in that paper, you identified biofuels as being water intensive. I've worked a bit with some LCA studies for cellulosic biofuels (switchgrass, in particular, but I wasn't too impressed with the it's potential for anything). It seems to me your metrics could be valuable to life-cycle inventories addressing water consumption for biofuels. I digress.. on to my question. 

I'm wondering, since you're a chemist and have some prior work that I see in LCA, what is your true opinion of LCA as a tool in environmental science? I think it has it's place, but can be a bit weak. Will we ever be data-rich and have good enough quality data for it to be significantly valuable?

Thanks!","2015-12-18 13:27:47","7","DrDueSs","1747605862.974858","climate science","scientific"
"cy3c6fz","t3_3xc5tg","3xc5tg","science","scientific","'Climate change' sounds like a much more neutral, less urgent term to a layperson. Not better or worse, just different. 

In the 1990s, I seem to remember the much scarier term 'global warming' being used more often but it dropped off in the last 15 years or so. 

Is there an important difference between the two terms that makes climate change more accurate, or are they interchangeable?","2015-12-18 13:01:30","6","ADavidJohnson","1747605862.97663","climate science","scientific"
"cy3chmw","t3_3xc5tg","3xc5tg","science","scientific","I am not a climate change denier but when I look at political involvement on the issue I fear that politicians will selectively choose data to support their agenda and thus climate change becomes a tool of control much like religion has in past centuries. Politicians would gain politically yet never effect the real problem. Would you comment on this concern? Thanks for all your work. ","2015-12-18 13:16:24","4","GumGatherer","1747605862.9785411","climate science","scientific"
"cy3faxr","t3_3xc5tg","3xc5tg","science","scientific","I think that many people believe global warming exists, but do not fully appreciate the consequences as you've described them.   Do you have a good simple response to this sentiment : **""We've had global warming and global cooling in the past, ice ages, etc., this is just the same thing, only faster.  What is the big deal?""**","2015-12-18 14:59:03","6","ThunderBuss","1747605862.980185","climate science","scientific"
"cy3bvkv","t3_3xc5tg","3xc5tg","science","scientific","What was specifically accomplished at the Paris talks, and do you feel like the conclusions reached are satisfactory to avoid the 2^o C limit?","2015-12-18 12:45:29","5","[deleted]","1747605862.9812832","climate science","scientific"
"cy3co89","t3_3xc5tg","3xc5tg","science","scientific","What are the most promising ways to cut down emissions? Is alternative energy at a point of efficiency where it can compete with coal yet?

Would a fusion reactor like the w7x be an environment friendly way to produce energy?","2015-12-18 13:24:36","5","Internet_Is_God","1747605862.982783","climate science","scientific"
"cy3dr7k","t3_3xc5tg","3xc5tg","science","scientific","Hello Bill. Thanks for doing this AMA. Really glad to see dialogues like this taking place.

I have always been slightly confused as to why there is no sustainability/climate change equivalent to, for example, the World Health Organisation. I understand the role the IPCC plays, however, I feel it is primarily an advisory council rather than an active organisation which takes a hands-on role in promoting/advancing sustainability and climate change globally.

All I mean by this is it seems for most other global crises we are undergoing at the moment there is a recognisable/well-known/household name organisation to coordinate global efforts. For example, everyone knows the UN (global peace-keeping), or the WHO (for world health), or Amnesty International (fighting for human rights) or the Red Cross (for politically neutral humanitarian relief)/oxfam, or WWF (for animal conservation) - and even at a stretch the World Bank (aiming to reduce poverty), or Nato or G8 etc. etc. 

However for global sustainability or 'action against climate change' there doesn't seem to be similar coherent, commonly known organisation that tries to address all the issues involved and to make a concerted effort to produce change. The IPCC is great, don't get me wrong, it's just it doesn't really do anything other than inform other governments/the UN. I think we can all agree this is the slowest route to success, especially considering we require many different countries to agree on some level. The Red Cross or WWF or WHO take active roles in their fields, regardless (ideally) of political motivations/tensions by supplying funding to institutions/research/education, having accessible volunteer programmes for the public to engage with, raising awareness (by having a logo/organisation attached to the concept, particularly helpful for educating children in the long-term), having charity status, as well as all the informing of governments and looking at all the statistics etc. etc.

The IPCC is an organisation within the UN. Rather than an organisation in it's own right, with it's own policies and own motive. It is too driven by the UN and therefore means it has to bow to the member states rather than ploughing on through regardless like many other institutions I have mentioned above do in their respective fields.

I'm just surprised there's no World Environment Agency or something similar which is a household name. So I suppose my question is, why isn't there such an organisation? Or equally, is there one and I'm just being stupendously ignorant? :)

Thank you for your time!","2015-12-18 14:07:41","5","arandombritishguy","1747605862.986485","climate science","scientific"
"cy3bpzx","t3_3xc5tg","3xc5tg","science","scientific","This AMA is being permanently archived by *The Winnower*, a publishing platform that offers traditional scholarly publishing tools to traditional *and* non-traditional scholarly outputs—because scholarly communication doesn’t just happen in journals.

To cite this AMA please use: [https://doi.org/10.15200/winn.145044.42220](https://www.thewinnower.com/papers/3125-science-ama-series-i-am-bill-moomaw-professor-emeritus-of-international-environmental-policy-at-tufts-university-and-chair-of-the-science-committee-at-earthwatch-institute-i-have-worked-on-solution)

You can learn more and start contributing at [*thewinnower.com*](https://thewinnower.com)
","2015-12-18 12:37:09","4","redditWinnower","1747605862.9878871","climate science","scientific"
"cy3c5eh","t3_3xc5tg","3xc5tg","science","scientific","If we successfully reduce our carbon emissions to a minimal level over the next 10-15-25 years what policy steps need to be taken now and at that point to manage climate change?","2015-12-18 13:00:07","3","[deleted]","1747605862.988977","climate science","scientific"
"cy3djwc","t3_3xc5tg","3xc5tg","science","scientific"," There is considerable effort by politicians in the U.S. to severely undermine climate change research.  See for example Lamar Smith and James Inhofe.  Nearly every GOP presidential candidate has deeply troubling beliefs on what we should do as a society to combat this problem (nothing).  Fossil fuel interests have spent millions upon millions of dollars over the last 40 years trying to spread false or misleading information about the damaging effects of climate change that are a direct result of their core business (Koch brothers, Exxon).  With such a concerted, anti-science based policy agenda from an entire political party, do you believe there is any chance that impactful action could be undertaken in time to thwart a major environmental catastrophe?  What, in your opinion, can be done to reverse the current trend of corporate influence over public policy discourse, and how can we as citizens assist in that effort?","2015-12-18 14:00:09","3","[deleted]","1747605862.990745","climate science","scientific"
"cy3eoq5","t3_3xc5tg","3xc5tg","science","scientific","Thank you for doing this!

A bit of a personal question, especially since I don't know anything about your personal life. In regards exclusively to the situation pertaining to climate change, the COP21 accord and the current state of affairs, what would you recommend to someone wondering if they should have kids? Do you think the world in 30-40 years will be a better one - again, only in terms of climate change - or will the situation only have worsened?","2015-12-18 14:39:49","3","_Raggart_","1747605862.9920042","climate science","scientific"
"cy3bs7d","t3_3xc5tg","3xc5tg","science","scientific","Do you feel that the media accurately represents climate change?  ","2015-12-18 12:40:30","2","GumGatherer","1747605862.9946072","climate science","scientific"
"cy3c807","t3_3xc5tg","3xc5tg","science","scientific","Thank you so much for doing this!

Sorry to be a pessimist, but what flaws of the agreements in Paris do you forsee? 

For example, some countries simply withdrew from the Kyoto Protocol, limiting its effectiveness.","2015-12-18 13:03:39","3","Stealthstriker","1747605862.99558","climate science","scientific"
"cy3c87e","t3_3xc5tg","3xc5tg","science","scientific","Could you give us some quick thoughts on the commercial feasibility of carbon capture and storage? ","2015-12-18 13:03:57","3","robinblue15","1747605862.9965131","climate science","scientific"
"cy3ct0z","t3_3xc5tg","3xc5tg","science","scientific","How much are the diseases, syndromes and modern maladies facing humans a result of climate changes? Is it possible climate change will force extinction of life or adaptation? ","2015-12-18 13:30:30","3","WalkTheMoons","1747605862.998076","climate science","scientific"
"cy3d6fi","t3_3xc5tg","3xc5tg","science","scientific","What do you think of the film Cowspiracy and the points it makes? Why aren't environmental organisations stressing the importance of reducing meat and dairy consumption?","2015-12-18 13:45:46","2","kemla","1747605862.999022","climate science","scientific"
"cy3d9b9","t3_3xc5tg","3xc5tg","science","scientific","Hello from Porter Square!

I am currently applying to climate system dynamics PhD programs and am really interested in entering the policy realm after completing my PhD, whether through academia or actually working in the government. 

What types of opportunities during or after my doctorate do you think would put me in the best position to work in the coupled area of climate science and policy? One of my future career goals is to serve as Chief Scientist for a group like the Earthwatch Institute so I was wondering if you could speak from your experience about the path to getting to a position like that.

Thanks!","2015-12-18 13:48:53","3","alexjt","1747605863.000315","climate science","scientific"
"cy3dep0","t3_3xc5tg","3xc5tg","science","scientific","What do you think about some EU countries moving away from nuclear power?  Do you think renewables are a viable option at this time.  Also, do you believe projects like ITER will yield fruitful results or will it be too late by the time ITER begins to produce?","2015-12-18 13:54:39","3","newnamerookiebiotch","1747605863.00128","climate science","scientific"
"cy3dsgv","t3_3xc5tg","3xc5tg","science","scientific","I read once that one of the problems with the melting of the polar ice caps was that they would no longer be reflecting sun light and heat away from the Earth. Is this true and would painting roof tops white or with reflective material help offset this effect? Also, do solar panels which absorb heat exacerbate the problem or is the trade off in carbon reduction make this a better option long term?","2015-12-18 14:09:02","3","superbuttcheek2000","1747605863.00224","climate science","scientific"
"cy3e05z","t3_3xc5tg","3xc5tg","science","scientific","If you could force all countries to agree on one thing and one thing only, what would it be?","2015-12-18 14:16:38","3","arandombritishguy","1747605863.0028632","climate science","scientific"
"cy3f2is","t3_3xc5tg","3xc5tg","science","scientific","Hi Dr. Moomaw thank you for doing this AMA. I don't have any questions myself but I do have two on behalf of my mother who is a agricultural scientist who focuses on climate change and development in developing countries.

1. Do you feel like this Paris agreement is a good outcome.

2. Do you think the goal of 1.5 is attainable.","2015-12-18 14:51:54","3","Truthfull","1747605863.003916","climate science","scientific"
"cy3f5nd","t3_3xc5tg","3xc5tg","science","scientific","Hope you are enjoying retirement Prof. Moomaw! I always enjoyed your classes and miss you all in Medford. Re: the Paris Agreement, I was heartened by the emergence of the high ambition coalition but it seems really daunting to get to 2 degrees and impossible to get to 1.5. Was it rhetorically important to have near impossible goals?

Also I'm fairly optimistic that we'll get off coal soon but the agreement seems to have broken down when it comes to diffuse CO2 sources like cars, ships and planes. What sort of policy tools do you see being used to adress those?","2015-12-18 14:54:35","3","purplearmored","1747605863.0050838","climate science","scientific"
"cy3iizb","t3_3xc5tg","3xc5tg","science","scientific","Hi Dr. Mooma,

Thanks for taking the time do this AMA. I am actually attending Tufts next fall, so I'm unfortunately a little late to see you on campus, but hopefully you can answer my question today.  When talking to one of my friends, they said that most likely in our lifetime there will be wars fought over clean water (even if we take preventative measures now). What are your thoughts on this? Also, what do you think is the most influential aspect of the Paris deal?","2015-12-18 16:29:08","3","Barbsss","1747605863.006182","climate science","scientific"
"cy3cfdm","t3_3xc5tg","3xc5tg","science","scientific","What do you think are the best resources for someone to research or passively try and understand climate change? (essays, videos, novels).","2015-12-18 13:13:27","2","[deleted]","1747605863.007273","climate science","scientific"
"cy3d50y","t3_3xc5tg","3xc5tg","science","scientific","Are we going to pay for kicking the can down the road with much, much nastier regulation (even international bullying to enforce it) later to play catchup?","2015-12-18 13:44:12","2","bea_bear","1747605863.007987","climate science","scientific"
"cy3d9yg","t3_3xc5tg","3xc5tg","science","scientific","What's the best way to overcome the misinformation about the science of global warming?

Is there any way policy efforts could help?","2015-12-18 13:49:32","2","walterhannah","1747605863.008611","climate science","scientific"
"cy3egj8","t3_3xc5tg","3xc5tg","science","scientific","what's your opinion on carbon credits? To me they just seem a sham system so poorer less developed countries, can get a bit of cash by selling their allocation which they don't use anyway, to richer countries. So they can carry on as usual and in some cases even increase the amount of carbon the are producing. ","2015-12-18 14:32:17","2","mrcatfunt","1747605863.009535","climate science","scientific"
"cy3ejry","t3_3xc5tg","3xc5tg","science","scientific","What steps need to be taken (politically) to ensure sustainable clean water sources globally? Do you think water will be a flashpoint of future conflict?","2015-12-18 14:35:16","2","confusingphilosopher","1747605863.010438","climate science","scientific"
"cy3f0g5","t3_3xc5tg","3xc5tg","science","scientific","Thanks for taking the time to answer some of our questions. 

I would like to know your opinion on the apparent dissonance between the Paris agreement's assertion that climate change should be limited to between 1.5 and 2 degrees of global average warming and the (non-binding) commitments that nations have made putting us closer to 3 degrees. What do you think can or will be done to rectify this? ","2015-12-18 14:50:07","2","EelHovercraft","1747605863.0116322","climate science","scientific"
"cy3g22j","t3_3xc5tg","3xc5tg","science","scientific","How can we retrofit our current infrastructure and retrain our current workforce to reduce CO2, while preserving jobs and making the public excited to be a part of it?","2015-12-18 15:21:37","2","[deleted]","1747605863.012457","climate science","scientific"
"cy3gkfw","t3_3xc5tg","3xc5tg","science","scientific","What is the most promising field of alternative energy at the moment, in your opinion? Are there any geoengineering projects that you believe could work well without negatively disrupting the  biosphere?

Thank you for taking the time to address the r/science community and for the vitally important work you've continued to do, even in the face of such legislative apathy!","2015-12-18 15:36:00","2","Gonzo_Rick","1747605863.013403","climate science","scientific"
"cy3ogoh","t3_3xc5tg","3xc5tg","science","scientific","You've stated several times in this AMA that we need to both restore forests, and move towards more renewable energy sources... but these would seem to be at conflict.

I live in the south-west UK, where government subsidies have caused a huge proliferation of solar panels and wind turbines... but they take up a HUGE amount of land. Especially the solar panels - while the wind turbines are scattered across farmland easily enough (while being incredibly controversial due to being ""eyesores"" in a typically rural and beautiful part of the country), the solar farms cover acres and acres of land with no room for anything else... And somehow I think putting wind turbines in the middle of a forest isn't a terribly good idea either...

So which would you say is of higher priority? More forests to increase CO2 uptake, or more renewable energy sources to reduce CO2 output?More forests would certainly look a lot nicer...","2015-12-18 19:00:10","2","Ktrenal","1747605863.014709","climate science","scientific"
"cy3c8f7","t3_3xc5tg","3xc5tg","science","scientific","I just started into *Terra* by Michael Novacek. My question is this, when you close your eyes and let your mind wander across the mindbogglingly large expanses of time before ours; through the countless iterations of drastically 'other' climate conditions and lifeforms that adapted to them, do you find peace with the idea that our epoch will end just as all of them have? Or do you think we can beat this thing forever? Does the answer to that question have implications for science, or do you think the best path forward is to continue operating under the mandate that science must do everything it can preclude or avert the climate shift with technological and cultural solutions? I realize that this might come off as a philosophical or 'religious' question but I mean it as a challenge to the shortsightedness of our strategies, not only the nearly unprecedented release of carbon in to the atmosphere but also the hubris (as I see it) that we are still in a position control the effects it will have on the biosphere, given the records we have so far interpreted.","2015-12-18 13:04:15","1","happyrock","1747605863.016265","climate science","scientific"
"cy3dvgo","t3_3xc5tg","3xc5tg","science","scientific","Since the 1950's the superpowers have tested 10,000 nuclear bombs. In your professional opinion, do these tests represent a source of pollution not spoken about which may have effected global weather patterns? 

thanks. 
","2015-12-18 14:12:00","1","[deleted]","1747605863.0172448","climate science","scientific"
"cy3qw1w","t3_3xc5tg","3xc5tg","science","scientific","Do you think we can realistically make the changes we need to make?  I just feel like there is so much inertia on this issue.","2015-12-18 20:02:35","1","Raufaello","1747605863.0179992","climate science","scientific"
"cy3sy7q","t3_3xc5tg","3xc5tg","science","scientific","I love your name, Mr. Moomaw.","2015-12-18 20:56:49","1","jonahewell","1747605863.019428","climate science","scientific"
"cy3z32d","t3_3xc5tg","3xc5tg","science","scientific","Thanks for your persistence.","2015-12-18 23:49:42","1","spacemanatee","1747605863.020791","climate science","scientific"
"cy27xws","t3_3x7hi3","3x7hi3","science","scientific","Do you believe Mars is atmosphericly rare, or is there evidence that there are many more planets like Mars (or is it simply too hard to tell without a spacecraft like MAVEN)?","2015-12-17 14:28:32","3","p1percub","1747605937.337887","climate science","scientific"
"cy28xnn","t3_3x7hi3","3x7hi3","science","scientific","Over what kind of timescale did Mars lose it's atmosphere? Have ye discovered anything new about the large scale atmospheric circulation patterns on Mars?","2015-12-17 14:59:24","3","IceBean","1747605937.3409011","climate science","scientific"
"cy2ie2v","t3_3x7hi3","3x7hi3","science","scientific","Hi everyone, we're going to get started. Ask your questions now!","2015-12-17 19:03:30","3","AmGeophysicalU-AMA","1747605937.3442738","climate science","scientific"
"cy25p6n","t3_3x7hi3","3x7hi3","science","scientific","Bacteria and algae had and continue to have a measurable effect on our atmosphere,

have you been looking for the same indicators of life to see if they explain atmosphere composition?","2015-12-17 12:59:15","2","Monster_Claire","1747605937.346292","climate science","scientific"
