"id","parent_id","post_id","subreddit","tone","text","created_utc","score","author","scraped_utc","query_used","query_category"
"cy25rpf","t3_3x7hi3","3x7hi3","science","scientific","I think someone misspelt the flair.  

Also, what cool things can the orbiter do, or have?","2015-12-17 13:02:37","2","Tactical_Wolf","1747605937.347853","climate science","scientific"
"cy26176","t3_3x7hi3","3x7hi3","science","scientific","If you were in charge of the national budget, would you increase funding for NASA? If so, how would you want to pay for it (raise taxes, cut certain programs etc.)?","2015-12-17 13:15:03","2","QueenofDrogo","1747605937.3495412","climate science","scientific"
"cy26aej","t3_3x7hi3","3x7hi3","science","scientific","How do you tell what gasses are in the atmosphere? By color?","2015-12-17 13:26:17","2","ManicFrizz","1747605937.350997","climate science","scientific"
"cy27udo","t3_3x7hi3","3x7hi3","science","scientific","Is is possible to use the models you're developing for understanding dramatic climatic changes in Mars to better understand how climates can change on other planets such as Earth? Or vice versa - do climate change models for Earth inform your analysis of what happened on Mars?","2015-12-17 14:25:12","2","firedrops","1747605937.353185","climate science","scientific"
"cy2a2vm","t3_3x7hi3","3x7hi3","science","scientific","Do you think it would ever be possible to put the atmospheric gas back on Mars? If so (Maybe even if not) would it be possible to colonise Mars at any point and how do you feel this would effect people on the Earth?","2015-12-17 15:31:55","2","RavenTa","1747605937.354699","climate science","scientific"
"cy2b5cx","t3_3x7hi3","3x7hi3","science","scientific","Has the atmospheric loss been constant, or do you think it has accelerated/decelerated at some point?

What is the range of instrumentation available to the MAVEN Orbiter?  And are they any tools that it doesn't have that you would love to have on another orbiter?

","2015-12-17 16:00:41","2","kerovon","1747605937.356087","climate science","scientific"
"cy2br2t","t3_3x7hi3","3x7hi3","science","scientific","The work your team does is incredible.  
Is the Martian atmosphere suitable for our current solar farming structures?  I'm curious to understand if the weather is too volatile for your current designs?","2015-12-17 16:16:38","2","jasontroyhimself","1747605937.357843","climate science","scientific"
"cy2c35h","t3_3x7hi3","3x7hi3","science","scientific","Other than CO2 being frozen and thawed at the poles, are there other interactions of atmosphere and the ground?","2015-12-17 16:25:20","2","DigiMagic","1747605937.358801","climate science","scientific"
"cy2c8kl","t3_3x7hi3","3x7hi3","science","scientific","This is really interesting to know. What's the future application of this knowledge? How might this play into a crewed Mars mission or (stretching here) a colony?","2015-12-17 16:29:17","2","frostedturkeypanini","1747605937.360009","climate science","scientific"
"cy2c8ue","t3_3x7hi3","3x7hi3","science","scientific","When people on the internet (and /r/space specifically) speculate about transforming Mars, an argument about the atmosphere commonly ensues. People's intuitions about how much atmosphere Mars can hold onto and for how long tend to be all over the place. 

If you could magic a breathable atmosphere onto Mars right now, how long would the various mass loss mechanisms take to strip the atmosphere into something not breathable? ","2015-12-17 16:29:30","2","viliamklein","1747605937.361553","climate science","scientific"
"cy2ee2t","t3_3x7hi3","3x7hi3","science","scientific","Loss to space was the most popular process for forming Mars' atmosphere before the MAVEN mission. Has there been any unexpected learning to come out of the MAVEN mission? Do you think a probe similar to MAVEN would be valuable on future missions to gaseous planets, Venus, Gas giants, Titan? Venus, in particular, probably having similar loss to space processes?","2015-12-17 17:24:03","2","siliconlife","1747605937.363115","climate science","scientific"
"cy2ijkk","t3_3x7hi3","3x7hi3","science","scientific","I'd like to hear about the what a typical ""day at work"" is like working on a mission like this. I imagine there are lots of slow days.","2015-12-17 19:07:22","2","A_Suvorov","1747605937.364172","climate science","scientific"
"cy2iw64","t3_3x7hi3","3x7hi3","science","scientific","Do your analyses help to explain what caused the loss of gases, or the root or the demagnetization? Along lines of the the terraforming theories, do you think it would be possible to one day re-form a habitable atmosphere?","2015-12-17 19:16:00","2","gingertrees","1747605937.365182","climate science","scientific"
"cy2j5a4","t3_3x7hi3","3x7hi3","science","scientific","I know that dust accumulation on solar panels is an issue, but I have always wondered why they don't have something similar to a windshield wiper. Is it a design feasibility issue, or would wipers just not remove enough dust? ","2015-12-17 19:22:15","2","quietsamurai98","1747605937.366505","climate science","scientific"
"cy2jpfv","t3_3x7hi3","3x7hi3","science","scientific","If you could personally decide the specs on a new probe to arrive at Mars tomorrow - and you had unlimited funding - what instruments would it carry? Why? And how would they compare to those on MAVEN?","2015-12-17 19:35:46","2","HyenaCheeseHeads","1747605937.3674629","climate science","scientific"
"cy2khqj","t3_3x7hi3","3x7hi3","science","scientific","Thanks to everybody for asking questions and participating in our Ask Us Anything!  It's a real pleasure to be able to share our excitement and our scientific results.  We'll look forward to doing this again!

Bruce Jakosky
David Brain
Rob Lillis","2015-12-17 19:55:10","2","AmGeophysicalU-AMA","1747605937.3688169","climate science","scientific"
"cy25gf3","t3_3x7hi3","3x7hi3","science","scientific","This AMA is being permanently archived by *The Winnower*, a publishing platform that offers traditional scholarly publishing tools to traditional *and* non-traditional scholarly outputs—because scholarly communication doesn’t just happen in journals.

To cite this AMA please use: [https://doi.org/10.15200/winn.145035.56415](https://www.thewinnower.com/papers/3120-science-ama-series-we-re-bruce-jakosky-dave-brain-and-rob-lillis-science-investigators-on-the-maven-mission-that-is-orbiting-mars-and-studying-the-planet-s-upper-atmosphere-the-team-s-first-result)

You can learn more and start contributing at [*thewinnower.com*](https://thewinnower.com)
","2015-12-17 12:47:14","1","redditWinnower","1747605937.370234","climate science","scientific"
"cy2irhw","t3_3x7hi3","3x7hi3","science","scientific","Thanks for what you're doing!  I get excited whenever a new probe is gathering data and helping us understand other planetary systems better.  

Many people don't realize the ramifications this has for understanding our own system.  Can you explain it to them?","2015-12-17 19:12:51","1","3literz3","1747605937.371714","climate science","scientific"
"cy2j0u7","t3_3x7hi3","3x7hi3","science","scientific","is this mission an info-gathering one...or are there images involved? :)","2015-12-17 19:19:17","1","3rdCoastal","1747605937.3726342","climate science","scientific"
"cy2jbpf","t3_3x7hi3","3x7hi3","science","scientific","How much more  do you hope to get out of MAVEN? What will be the limiting factor? ","2015-12-17 19:26:32","1","HyenaCheeseHeads","1747605937.373546","climate science","scientific"
"cy2jci2","t3_3x7hi3","3x7hi3","science","scientific","I'm not sure if this still falls within your specific areas of expertise, but could there be any ground-based (on Mars, of course) indicators that could stretch back enough in time to tell something about the evolution of Mars atmosphere? I'm thinking of something like old rocks with characteristic mineral compositions, that could have been measurably affected by the very old Martian atmosphere.

Also, what kinds of things would you look for with a future, improved, MAVEN-like mission?","2015-12-17 19:27:02","1","forthnighter","1747605937.374818","climate science","scientific"
"cy2jpq7","t3_3x7hi3","3x7hi3","science","scientific","Regarding loss of the atmosphere, you mention the primary reason being the loss of a magnetic field. Is there any reason to think this wouldn't also happen to any similar mass planet, and if so does this imply that any habitable planet must be closer to Earth's mass than that of Mars?
","2015-12-17 19:35:58","1","Cynthereon","1747605937.375863","climate science","scientific"
"cy2kgpv","t3_3x7hi3","3x7hi3","science","scientific","What is the up/down-link speed like for MAVEN? How much data is stored, sent and received for a normal week of operations?  Is it any different during deep dips? 
Is everything downlinked in order or do you have to fight your colleagues to get priority? ","2015-12-17 19:54:28","1","HyenaCheeseHeads","1747605937.377183","climate science","scientific"
"cy2ngwh","t3_3x7hi3","3x7hi3","science","scientific","Can you compare the Martian atmosphere to Pluto's? What are the dominant processes affecting each?","2015-12-17 21:09:18","1","iamportal","1747605937.37824","climate science","scientific"
"cy2olc8","t3_3x7hi3","3x7hi3","science","scientific","How realistic is it to terraform a planet that does not have a magnetosphere? My understanding is that solar wind stripped the atmosphere of Mars of many of the lighter particles,  leaving only heavy carbon dioxide and others. ","2015-12-17 21:36:49","1","das_masterful","1747605937.379454","climate science","scientific"
"cy36g7n","t3_3x7hi3","3x7hi3","science","scientific","What do you hope for in the future of Martian atmosphere observations?  And how did the discoveries from Maven match with previous theories?","2015-12-18 07:09:16","1","SpartanJack17","1747605937.3803918","climate science","scientific"
"cy2jkuo","t3_3x7hi3","3x7hi3","science","scientific","What are our chances of getting high resolution photos of phobo's monolith anytime soon? Or will they always be airbrushed","2015-12-17 19:32:37","-1","Piffdolla1337","1747605937.381223","climate science","scientific"
